[
  {
    "type": "3D Linear Motion",
    "question": "\nAn object starts at (0,0,0) with an initial velocity of [13.15, 1.48, 6.23] m/s and an acceleration of [-2.77, 2.36, 1.77] m/s\u00b2.\nWhat are its velocity (vx, vy, vz) and displacement (dx, dy, dz) after 9.03 seconds?\n",
    "parameters": {
      "v0": [
        13.15,
        1.48,
        6.23
      ],
      "a": [
        -2.77,
        2.36,
        1.77
      ],
      "t": 9.03
    },
    "answer_json": {
      "velocity_x": "",
      "velocity_y": "",
      "velocity_z": "",
      "displacement_x": "",
      "displacement_y": "",
      "displacement_z": ""
    }
  },
  {
    "type": "3D Linear Motion",
    "question": "\nAn object starts at (0,0,0) with an initial velocity of [2.65, 9.02, 1.57] m/s and an acceleration of [-2.81, 0.05, -4.73] m/s\u00b2.\nWhat are its velocity (vx, vy, vz) and displacement (dx, dy, dz) after 2.79 seconds?\n",
    "parameters": {
      "v0": [
        2.65,
        9.02,
        1.57
      ],
      "a": [
        -2.81,
        0.05,
        -4.73
      ],
      "t": 2.79
    },
    "answer_json": {
      "velocity_x": "",
      "velocity_y": "",
      "velocity_z": "",
      "displacement_x": "",
      "displacement_y": "",
      "displacement_z": ""
    }
  },
  {
    "type": "3D Linear Motion",
    "question": "\nAn object starts at (0,0,0) with an initial velocity of [13.35, 11.35, 5.19] m/s and an acceleration of [0.89, 3.09, -4.94] m/s\u00b2.\nWhat are its velocity (vx, vy, vz) and displacement (dx, dy, dz) after 8.25 seconds?\n",
    "parameters": {
      "v0": [
        13.35,
        11.35,
        5.19
      ],
      "a": [
        0.89,
        3.09,
        -4.94
      ],
      "t": 8.25
    },
    "answer_json": {
      "velocity_x": "",
      "velocity_y": "",
      "velocity_z": "",
      "displacement_x": "",
      "displacement_y": "",
      "displacement_z": ""
    }
  },
  {
    "type": "3D Linear Motion",
    "question": "\nAn object starts at (0,0,0) with an initial velocity of [14.26, 7.46, 3.95] m/s and an acceleration of [4.57, -1.63, -4.07] m/s\u00b2.\nWhat are its velocity (vx, vy, vz) and displacement (dx, dy, dz) after 1.87 seconds?\n",
    "parameters": {
      "v0": [
        14.26,
        7.46,
        3.95
      ],
      "a": [
        4.57,
        -1.63,
        -4.07
      ],
      "t": 1.87
    },
    "answer_json": {
      "velocity_x": "",
      "velocity_y": "",
      "velocity_z": "",
      "displacement_x": "",
      "displacement_y": "",
      "displacement_z": ""
    }
  },
  {
    "type": "3D Linear Motion",
    "question": "\nAn object starts at (0,0,0) with an initial velocity of [17.1, 12.47, 16.34] m/s and an acceleration of [2.3, 0.36, 4.73] m/s\u00b2.\nWhat are its velocity (vx, vy, vz) and displacement (dx, dy, dz) after 4.41 seconds?\n",
    "parameters": {
      "v0": [
        17.1,
        12.47,
        16.34
      ],
      "a": [
        2.3,
        0.36,
        4.73
      ],
      "t": 4.41
    },
    "answer_json": {
      "velocity_x": "",
      "velocity_y": "",
      "velocity_z": "",
      "displacement_x": "",
      "displacement_y": "",
      "displacement_z": ""
    }
  },
  {
    "type": "3D Linear Motion",
    "question": "\nAn object starts at (0,0,0) with an initial velocity of [11.49, 16.76, 12.75] m/s and an acceleration of [3.62, 0.77, 2.05] m/s\u00b2.\nWhat are its velocity (vx, vy, vz) and displacement (dx, dy, dz) after 1.41 seconds?\n",
    "parameters": {
      "v0": [
        11.49,
        16.76,
        12.75
      ],
      "a": [
        3.62,
        0.77,
        2.05
      ],
      "t": 1.41
    },
    "answer_json": {
      "velocity_x": "",
      "velocity_y": "",
      "velocity_z": "",
      "displacement_x": "",
      "displacement_y": "",
      "displacement_z": ""
    }
  },
  {
    "type": "3D Linear Motion",
    "question": "\nAn object starts at (0,0,0) with an initial velocity of [5.33, 6.5, 2.52] m/s and an acceleration of [-2.67, -3.99, -2.22] m/s\u00b2.\nWhat are its velocity (vx, vy, vz) and displacement (dx, dy, dz) after 6.72 seconds?\n",
    "parameters": {
      "v0": [
        5.33,
        6.5,
        2.52
      ],
      "a": [
        -2.67,
        -3.99,
        -2.22
      ],
      "t": 6.72
    },
    "answer_json": {
      "velocity_x": "",
      "velocity_y": "",
      "velocity_z": "",
      "displacement_x": "",
      "displacement_y": "",
      "displacement_z": ""
    }
  },
  {
    "type": "3D Linear Motion",
    "question": "\nAn object starts at (0,0,0) with an initial velocity of [7.93, 8.03, 4.98] m/s and an acceleration of [-2.33, 4.37, 1.48] m/s\u00b2.\nWhat are its velocity (vx, vy, vz) and displacement (dx, dy, dz) after 6.48 seconds?\n",
    "parameters": {
      "v0": [
        7.93,
        8.03,
        4.98
      ],
      "a": [
        -2.33,
        4.37,
        1.48
      ],
      "t": 6.48
    },
    "answer_json": {
      "velocity_x": "",
      "velocity_y": "",
      "velocity_z": "",
      "displacement_x": "",
      "displacement_y": "",
      "displacement_z": ""
    }
  },
  {
    "type": "3D Linear Motion",
    "question": "\nAn object starts at (0,0,0) with an initial velocity of [4.25, 14.85, 4.1] m/s and an acceleration of [-1.21, 4.9, 1.4] m/s\u00b2.\nWhat are its velocity (vx, vy, vz) and displacement (dx, dy, dz) after 6.01 seconds?\n",
    "parameters": {
      "v0": [
        4.25,
        14.85,
        4.1
      ],
      "a": [
        -1.21,
        4.9,
        1.4
      ],
      "t": 6.01
    },
    "answer_json": {
      "velocity_x": "",
      "velocity_y": "",
      "velocity_z": "",
      "displacement_x": "",
      "displacement_y": "",
      "displacement_z": ""
    }
  },
  {
    "type": "3D Linear Motion",
    "question": "\nAn object starts at (0,0,0) with an initial velocity of [14.01, 17.01, 15.74] m/s and an acceleration of [-2.71, -4.68, -1.85] m/s\u00b2.\nWhat are its velocity (vx, vy, vz) and displacement (dx, dy, dz) after 3.41 seconds?\n",
    "parameters": {
      "v0": [
        14.01,
        17.01,
        15.74
      ],
      "a": [
        -2.71,
        -4.68,
        -1.85
      ],
      "t": 3.41
    },
    "answer_json": {
      "velocity_x": "",
      "velocity_y": "",
      "velocity_z": "",
      "displacement_x": "",
      "displacement_y": "",
      "displacement_z": ""
    }
  },
  {
    "type": "3D Linear Motion",
    "question": "\nAn object starts at (0,0,0) with an initial velocity of [5.01, 18.92, 17.65] m/s and an acceleration of [-1.85, 1.55, -1.04] m/s\u00b2.\nWhat are its velocity (vx, vy, vz) and displacement (dx, dy, dz) after 9.23 seconds?\n",
    "parameters": {
      "v0": [
        5.01,
        18.92,
        17.65
      ],
      "a": [
        -1.85,
        1.55,
        -1.04
      ],
      "t": 9.23
    },
    "answer_json": {
      "velocity_x": "",
      "velocity_y": "",
      "velocity_z": "",
      "displacement_x": "",
      "displacement_y": "",
      "displacement_z": ""
    }
  },
  {
    "type": "3D Linear Motion",
    "question": "\nAn object starts at (0,0,0) with an initial velocity of [9.72, 6.03, 5.69] m/s and an acceleration of [0.61, -2.37, 0.85] m/s\u00b2.\nWhat are its velocity (vx, vy, vz) and displacement (dx, dy, dz) after 9.08 seconds?\n",
    "parameters": {
      "v0": [
        9.72,
        6.03,
        5.69
      ],
      "a": [
        0.61,
        -2.37,
        0.85
      ],
      "t": 9.08
    },
    "answer_json": {
      "velocity_x": "",
      "velocity_y": "",
      "velocity_z": "",
      "displacement_x": "",
      "displacement_y": "",
      "displacement_z": ""
    }
  },
  {
    "type": "3D Linear Motion",
    "question": "\nAn object starts at (0,0,0) with an initial velocity of [8.59, 5.17, 19.95] m/s and an acceleration of [0.1, -4.09, -4.53] m/s\u00b2.\nWhat are its velocity (vx, vy, vz) and displacement (dx, dy, dz) after 1.99 seconds?\n",
    "parameters": {
      "v0": [
        8.59,
        5.17,
        19.95
      ],
      "a": [
        0.1,
        -4.09,
        -4.53
      ],
      "t": 1.99
    },
    "answer_json": {
      "velocity_x": "",
      "velocity_y": "",
      "velocity_z": "",
      "displacement_x": "",
      "displacement_y": "",
      "displacement_z": ""
    }
  },
  {
    "type": "3D Linear Motion",
    "question": "\nAn object starts at (0,0,0) with an initial velocity of [12.92, 16.05, 9.02] m/s and an acceleration of [-4.36, -1.18, 4.96] m/s\u00b2.\nWhat are its velocity (vx, vy, vz) and displacement (dx, dy, dz) after 5.76 seconds?\n",
    "parameters": {
      "v0": [
        12.92,
        16.05,
        9.02
      ],
      "a": [
        -4.36,
        -1.18,
        4.96
      ],
      "t": 5.76
    },
    "answer_json": {
      "velocity_x": "",
      "velocity_y": "",
      "velocity_z": "",
      "displacement_x": "",
      "displacement_y": "",
      "displacement_z": ""
    }
  },
  {
    "type": "3D Linear Motion",
    "question": "\nAn object starts at (0,0,0) with an initial velocity of [19.45, 17.35, 1.22] m/s and an acceleration of [2.21, 1.82, 0.37] m/s\u00b2.\nWhat are its velocity (vx, vy, vz) and displacement (dx, dy, dz) after 3.4 seconds?\n",
    "parameters": {
      "v0": [
        19.45,
        17.35,
        1.22
      ],
      "a": [
        2.21,
        1.82,
        0.37
      ],
      "t": 3.4
    },
    "answer_json": {
      "velocity_x": "",
      "velocity_y": "",
      "velocity_z": "",
      "displacement_x": "",
      "displacement_y": "",
      "displacement_z": ""
    }
  },
  {
    "type": "3D Linear Motion",
    "question": "\nAn object starts at (0,0,0) with an initial velocity of [13.18, 3.12, 9.26] m/s and an acceleration of [-0.46, 4.54, 3.76] m/s\u00b2.\nWhat are its velocity (vx, vy, vz) and displacement (dx, dy, dz) after 3.37 seconds?\n",
    "parameters": {
      "v0": [
        13.18,
        3.12,
        9.26
      ],
      "a": [
        -0.46,
        4.54,
        3.76
      ],
      "t": 3.37
    },
    "answer_json": {
      "velocity_x": "",
      "velocity_y": "",
      "velocity_z": "",
      "displacement_x": "",
      "displacement_y": "",
      "displacement_z": ""
    }
  },
  {
    "type": "3D Linear Motion",
    "question": "\nAn object starts at (0,0,0) with an initial velocity of [10.51, 4.39, 18.34] m/s and an acceleration of [3.71, -2.02, 1.39] m/s\u00b2.\nWhat are its velocity (vx, vy, vz) and displacement (dx, dy, dz) after 6.48 seconds?\n",
    "parameters": {
      "v0": [
        10.51,
        4.39,
        18.34
      ],
      "a": [
        3.71,
        -2.02,
        1.39
      ],
      "t": 6.48
    },
    "answer_json": {
      "velocity_x": "",
      "velocity_y": "",
      "velocity_z": "",
      "displacement_x": "",
      "displacement_y": "",
      "displacement_z": ""
    }
  },
  {
    "type": "3D Linear Motion",
    "question": "\nAn object starts at (0,0,0) with an initial velocity of [3.9, 15.49, 11.25] m/s and an acceleration of [2.79, 0.3, -4.99] m/s\u00b2.\nWhat are its velocity (vx, vy, vz) and displacement (dx, dy, dz) after 3.92 seconds?\n",
    "parameters": {
      "v0": [
        3.9,
        15.49,
        11.25
      ],
      "a": [
        2.79,
        0.3,
        -4.99
      ],
      "t": 3.92
    },
    "answer_json": {
      "velocity_x": "",
      "velocity_y": "",
      "velocity_z": "",
      "displacement_x": "",
      "displacement_y": "",
      "displacement_z": ""
    }
  },
  {
    "type": "3D Linear Motion",
    "question": "\nAn object starts at (0,0,0) with an initial velocity of [1.37, 18.65, 17.7] m/s and an acceleration of [3.32, -1.92, -4.42] m/s\u00b2.\nWhat are its velocity (vx, vy, vz) and displacement (dx, dy, dz) after 8.9 seconds?\n",
    "parameters": {
      "v0": [
        1.37,
        18.65,
        17.7
      ],
      "a": [
        3.32,
        -1.92,
        -4.42
      ],
      "t": 8.9
    },
    "answer_json": {
      "velocity_x": "",
      "velocity_y": "",
      "velocity_z": "",
      "displacement_x": "",
      "displacement_y": "",
      "displacement_z": ""
    }
  },
  {
    "type": "3D Linear Motion",
    "question": "\nAn object starts at (0,0,0) with an initial velocity of [18.99, 2.63, 10.23] m/s and an acceleration of [-4.31, 2.61, 2.66] m/s\u00b2.\nWhat are its velocity (vx, vy, vz) and displacement (dx, dy, dz) after 2.16 seconds?\n",
    "parameters": {
      "v0": [
        18.99,
        2.63,
        10.23
      ],
      "a": [
        -4.31,
        2.61,
        2.66
      ],
      "t": 2.16
    },
    "answer_json": {
      "velocity_x": "",
      "velocity_y": "",
      "velocity_z": "",
      "displacement_x": "",
      "displacement_y": "",
      "displacement_z": ""
    }
  },
  {
    "type": "3D Linear Motion",
    "question": "\nAn object starts at (0,0,0) with an initial velocity of [10.03, 11.45, 6.04] m/s and an acceleration of [3.72, -0.77, -2.88] m/s\u00b2.\nWhat are its velocity (vx, vy, vz) and displacement (dx, dy, dz) after 5.85 seconds?\n",
    "parameters": {
      "v0": [
        10.03,
        11.45,
        6.04
      ],
      "a": [
        3.72,
        -0.77,
        -2.88
      ],
      "t": 5.85
    },
    "answer_json": {
      "velocity_x": "",
      "velocity_y": "",
      "velocity_z": "",
      "displacement_x": "",
      "displacement_y": "",
      "displacement_z": ""
    }
  },
  {
    "type": "3D Linear Motion",
    "question": "\nAn object starts at (0,0,0) with an initial velocity of [14.87, 4.82, 6.92] m/s and an acceleration of [4.95, 1.5, -0.62] m/s\u00b2.\nWhat are its velocity (vx, vy, vz) and displacement (dx, dy, dz) after 5.66 seconds?\n",
    "parameters": {
      "v0": [
        14.87,
        4.82,
        6.92
      ],
      "a": [
        4.95,
        1.5,
        -0.62
      ],
      "t": 5.66
    },
    "answer_json": {
      "velocity_x": "",
      "velocity_y": "",
      "velocity_z": "",
      "displacement_x": "",
      "displacement_y": "",
      "displacement_z": ""
    }
  },
  {
    "type": "3D Linear Motion",
    "question": "\nAn object starts at (0,0,0) with an initial velocity of [3.3, 5.27, 7.42] m/s and an acceleration of [0.88, -2.7, -2.8] m/s\u00b2.\nWhat are its velocity (vx, vy, vz) and displacement (dx, dy, dz) after 1.64 seconds?\n",
    "parameters": {
      "v0": [
        3.3,
        5.27,
        7.42
      ],
      "a": [
        0.88,
        -2.7,
        -2.8
      ],
      "t": 1.64
    },
    "answer_json": {
      "velocity_x": "",
      "velocity_y": "",
      "velocity_z": "",
      "displacement_x": "",
      "displacement_y": "",
      "displacement_z": ""
    }
  },
  {
    "type": "3D Linear Motion",
    "question": "\nAn object starts at (0,0,0) with an initial velocity of [12.99, 5.35, 18.2] m/s and an acceleration of [3.6, -4.29, -2.62] m/s\u00b2.\nWhat are its velocity (vx, vy, vz) and displacement (dx, dy, dz) after 7.02 seconds?\n",
    "parameters": {
      "v0": [
        12.99,
        5.35,
        18.2
      ],
      "a": [
        3.6,
        -4.29,
        -2.62
      ],
      "t": 7.02
    },
    "answer_json": {
      "velocity_x": "",
      "velocity_y": "",
      "velocity_z": "",
      "displacement_x": "",
      "displacement_y": "",
      "displacement_z": ""
    }
  },
  {
    "type": "3D Linear Motion",
    "question": "\nAn object starts at (0,0,0) with an initial velocity of [5.07, 3.51, 18.77] m/s and an acceleration of [0.71, -0.27, 2.85] m/s\u00b2.\nWhat are its velocity (vx, vy, vz) and displacement (dx, dy, dz) after 8.27 seconds?\n",
    "parameters": {
      "v0": [
        5.07,
        3.51,
        18.77
      ],
      "a": [
        0.71,
        -0.27,
        2.85
      ],
      "t": 8.27
    },
    "answer_json": {
      "velocity_x": "",
      "velocity_y": "",
      "velocity_z": "",
      "displacement_x": "",
      "displacement_y": "",
      "displacement_z": ""
    }
  },
  {
    "type": "3D Circular Motion",
    "question": "\n        Object  (Circular Motion)  \n           - Radius: 3.38 meters  \n           - Speed: 1.23 m/s  \n           - Angular velocity: 0.36 rad/s  \n           - Time: 3.48 s  \n           - Rotating in the xy-plane  \n           - Compute its position (x_B, y_B, z_B), assuming it starts at (r, 0, 0).\n        ",
    "parameters": {
      "r": 3.38,
      "v": 1.23,
      "omega": 0.36,
      "t": 3.48,
      "rotation_plane": "xy-plane"
    },
    "answer_json": {
      "x_B": "",
      "y_B": "",
      "z_B": ""
    }
  },
  {
    "type": "3D Circular Motion",
    "question": "\n        Object  (Circular Motion)  \n           - Radius: 1.13 meters  \n           - Speed: 1.92 m/s  \n           - Angular velocity: 1.7 rad/s  \n           - Time: 7.67 s  \n           - Rotating in the yz-plane  \n           - Compute its position (x_B, y_B, z_B), assuming it starts at (r, 0, 0).\n        ",
    "parameters": {
      "r": 1.13,
      "v": 1.92,
      "omega": 1.7,
      "t": 7.67,
      "rotation_plane": "yz-plane"
    },
    "answer_json": {
      "x_B": "",
      "y_B": "",
      "z_B": ""
    }
  },
  {
    "type": "3D Circular Motion",
    "question": "\n        Object  (Circular Motion)  \n           - Radius: 0.89 meters  \n           - Speed: 4.8 m/s  \n           - Angular velocity: 5.39 rad/s  \n           - Time: 1.27 s  \n           - Rotating in the xy-plane  \n           - Compute its position (x_B, y_B, z_B), assuming it starts at (r, 0, 0).\n        ",
    "parameters": {
      "r": 0.89,
      "v": 4.8,
      "omega": 5.39,
      "t": 1.27,
      "rotation_plane": "xy-plane"
    },
    "answer_json": {
      "x_B": "",
      "y_B": "",
      "z_B": ""
    }
  },
  {
    "type": "3D Circular Motion",
    "question": "\n        Object  (Circular Motion)  \n           - Radius: 1.55 meters  \n           - Speed: 6.42 m/s  \n           - Angular velocity: 4.14 rad/s  \n           - Time: 6.05 s  \n           - Rotating in the yz-plane  \n           - Compute its position (x_B, y_B, z_B), assuming it starts at (r, 0, 0).\n        ",
    "parameters": {
      "r": 1.55,
      "v": 6.42,
      "omega": 4.14,
      "t": 6.05,
      "rotation_plane": "yz-plane"
    },
    "answer_json": {
      "x_B": "",
      "y_B": "",
      "z_B": ""
    }
  },
  {
    "type": "3D Circular Motion",
    "question": "\n        Object  (Circular Motion)  \n           - Radius: 3.42 meters  \n           - Speed: 5.9 m/s  \n           - Angular velocity: 1.73 rad/s  \n           - Time: 2.98 s  \n           - Rotating in the yz-plane  \n           - Compute its position (x_B, y_B, z_B), assuming it starts at (r, 0, 0).\n        ",
    "parameters": {
      "r": 3.42,
      "v": 5.9,
      "omega": 1.73,
      "t": 2.98,
      "rotation_plane": "yz-plane"
    },
    "answer_json": {
      "x_B": "",
      "y_B": "",
      "z_B": ""
    }
  },
  {
    "type": "3D Circular Motion",
    "question": "\n        Object  (Circular Motion)  \n           - Radius: 1.75 meters  \n           - Speed: 8.82 m/s  \n           - Angular velocity: 5.04 rad/s  \n           - Time: 7.83 s  \n           - Rotating in the xy-plane  \n           - Compute its position (x_B, y_B, z_B), assuming it starts at (r, 0, 0).\n        ",
    "parameters": {
      "r": 1.75,
      "v": 8.82,
      "omega": 5.04,
      "t": 7.83,
      "rotation_plane": "xy-plane"
    },
    "answer_json": {
      "x_B": "",
      "y_B": "",
      "z_B": ""
    }
  },
  {
    "type": "3D Circular Motion",
    "question": "\n        Object  (Circular Motion)  \n           - Radius: 3.64 meters  \n           - Speed: 4.06 m/s  \n           - Angular velocity: 1.12 rad/s  \n           - Time: 2.4 s  \n           - Rotating in the xz-plane  \n           - Compute its position (x_B, y_B, z_B), assuming it starts at (r, 0, 0).\n        ",
    "parameters": {
      "r": 3.64,
      "v": 4.06,
      "omega": 1.12,
      "t": 2.4,
      "rotation_plane": "xz-plane"
    },
    "answer_json": {
      "x_B": "",
      "y_B": "",
      "z_B": ""
    }
  },
  {
    "type": "3D Circular Motion",
    "question": "\n        Object  (Circular Motion)  \n           - Radius: 0.96 meters  \n           - Speed: 4.42 m/s  \n           - Angular velocity: 4.6 rad/s  \n           - Time: 4.23 s  \n           - Rotating in the xz-plane  \n           - Compute its position (x_B, y_B, z_B), assuming it starts at (r, 0, 0).\n        ",
    "parameters": {
      "r": 0.96,
      "v": 4.42,
      "omega": 4.6,
      "t": 4.23,
      "rotation_plane": "xz-plane"
    },
    "answer_json": {
      "x_B": "",
      "y_B": "",
      "z_B": ""
    }
  },
  {
    "type": "3D Circular Motion",
    "question": "\n        Object  (Circular Motion)  \n           - Radius: 3.22 meters  \n           - Speed: 8.26 m/s  \n           - Angular velocity: 2.57 rad/s  \n           - Time: 7.57 s  \n           - Rotating in the yz-plane  \n           - Compute its position (x_B, y_B, z_B), assuming it starts at (r, 0, 0).\n        ",
    "parameters": {
      "r": 3.22,
      "v": 8.26,
      "omega": 2.57,
      "t": 7.57,
      "rotation_plane": "yz-plane"
    },
    "answer_json": {
      "x_B": "",
      "y_B": "",
      "z_B": ""
    }
  },
  {
    "type": "3D Circular Motion",
    "question": "\n        Object  (Circular Motion)  \n           - Radius: 1.06 meters  \n           - Speed: 9.3 m/s  \n           - Angular velocity: 8.77 rad/s  \n           - Time: 1.71 s  \n           - Rotating in the xz-plane  \n           - Compute its position (x_B, y_B, z_B), assuming it starts at (r, 0, 0).\n        ",
    "parameters": {
      "r": 1.06,
      "v": 9.3,
      "omega": 8.77,
      "t": 1.71,
      "rotation_plane": "xz-plane"
    },
    "answer_json": {
      "x_B": "",
      "y_B": "",
      "z_B": ""
    }
  },
  {
    "type": "3D Circular Motion",
    "question": "\n        Object  (Circular Motion)  \n           - Radius: 4.23 meters  \n           - Speed: 6.57 m/s  \n           - Angular velocity: 1.55 rad/s  \n           - Time: 8.76 s  \n           - Rotating in the yz-plane  \n           - Compute its position (x_B, y_B, z_B), assuming it starts at (r, 0, 0).\n        ",
    "parameters": {
      "r": 4.23,
      "v": 6.57,
      "omega": 1.55,
      "t": 8.76,
      "rotation_plane": "yz-plane"
    },
    "answer_json": {
      "x_B": "",
      "y_B": "",
      "z_B": ""
    }
  },
  {
    "type": "3D Circular Motion",
    "question": "\n        Object  (Circular Motion)  \n           - Radius: 1.37 meters  \n           - Speed: 1.63 m/s  \n           - Angular velocity: 1.19 rad/s  \n           - Time: 6.95 s  \n           - Rotating in the xz-plane  \n           - Compute its position (x_B, y_B, z_B), assuming it starts at (r, 0, 0).\n        ",
    "parameters": {
      "r": 1.37,
      "v": 1.63,
      "omega": 1.19,
      "t": 6.95,
      "rotation_plane": "xz-plane"
    },
    "answer_json": {
      "x_B": "",
      "y_B": "",
      "z_B": ""
    }
  },
  {
    "type": "3D Circular Motion",
    "question": "\n        Object  (Circular Motion)  \n           - Radius: 4.93 meters  \n           - Speed: 8.7 m/s  \n           - Angular velocity: 1.76 rad/s  \n           - Time: 8.8 s  \n           - Rotating in the xz-plane  \n           - Compute its position (x_B, y_B, z_B), assuming it starts at (r, 0, 0).\n        ",
    "parameters": {
      "r": 4.93,
      "v": 8.7,
      "omega": 1.76,
      "t": 8.8,
      "rotation_plane": "xz-plane"
    },
    "answer_json": {
      "x_B": "",
      "y_B": "",
      "z_B": ""
    }
  },
  {
    "type": "3D Circular Motion",
    "question": "\n        Object  (Circular Motion)  \n           - Radius: 1.75 meters  \n           - Speed: 6.72 m/s  \n           - Angular velocity: 3.84 rad/s  \n           - Time: 4.28 s  \n           - Rotating in the xz-plane  \n           - Compute its position (x_B, y_B, z_B), assuming it starts at (r, 0, 0).\n        ",
    "parameters": {
      "r": 1.75,
      "v": 6.72,
      "omega": 3.84,
      "t": 4.28,
      "rotation_plane": "xz-plane"
    },
    "answer_json": {
      "x_B": "",
      "y_B": "",
      "z_B": ""
    }
  },
  {
    "type": "3D Circular Motion",
    "question": "\n        Object  (Circular Motion)  \n           - Radius: 2.1 meters  \n           - Speed: 7.03 m/s  \n           - Angular velocity: 3.35 rad/s  \n           - Time: 7.32 s  \n           - Rotating in the yz-plane  \n           - Compute its position (x_B, y_B, z_B), assuming it starts at (r, 0, 0).\n        ",
    "parameters": {
      "r": 2.1,
      "v": 7.03,
      "omega": 3.35,
      "t": 7.32,
      "rotation_plane": "yz-plane"
    },
    "answer_json": {
      "x_B": "",
      "y_B": "",
      "z_B": ""
    }
  },
  {
    "type": "3D Circular Motion",
    "question": "\n        Object  (Circular Motion)  \n           - Radius: 3.42 meters  \n           - Speed: 6.48 m/s  \n           - Angular velocity: 1.89 rad/s  \n           - Time: 2.54 s  \n           - Rotating in the yz-plane  \n           - Compute its position (x_B, y_B, z_B), assuming it starts at (r, 0, 0).\n        ",
    "parameters": {
      "r": 3.42,
      "v": 6.48,
      "omega": 1.89,
      "t": 2.54,
      "rotation_plane": "yz-plane"
    },
    "answer_json": {
      "x_B": "",
      "y_B": "",
      "z_B": ""
    }
  },
  {
    "type": "3D Circular Motion",
    "question": "\n        Object  (Circular Motion)  \n           - Radius: 1.6 meters  \n           - Speed: 5.16 m/s  \n           - Angular velocity: 3.23 rad/s  \n           - Time: 3.43 s  \n           - Rotating in the yz-plane  \n           - Compute its position (x_B, y_B, z_B), assuming it starts at (r, 0, 0).\n        ",
    "parameters": {
      "r": 1.6,
      "v": 5.16,
      "omega": 3.23,
      "t": 3.43,
      "rotation_plane": "yz-plane"
    },
    "answer_json": {
      "x_B": "",
      "y_B": "",
      "z_B": ""
    }
  },
  {
    "type": "3D Circular Motion",
    "question": "\n        Object  (Circular Motion)  \n           - Radius: 3.6 meters  \n           - Speed: 2.98 m/s  \n           - Angular velocity: 0.83 rad/s  \n           - Time: 3.92 s  \n           - Rotating in the xy-plane  \n           - Compute its position (x_B, y_B, z_B), assuming it starts at (r, 0, 0).\n        ",
    "parameters": {
      "r": 3.6,
      "v": 2.98,
      "omega": 0.83,
      "t": 3.92,
      "rotation_plane": "xy-plane"
    },
    "answer_json": {
      "x_B": "",
      "y_B": "",
      "z_B": ""
    }
  },
  {
    "type": "3D Circular Motion",
    "question": "\n        Object  (Circular Motion)  \n           - Radius: 1.53 meters  \n           - Speed: 1.29 m/s  \n           - Angular velocity: 0.84 rad/s  \n           - Time: 3.84 s  \n           - Rotating in the xz-plane  \n           - Compute its position (x_B, y_B, z_B), assuming it starts at (r, 0, 0).\n        ",
    "parameters": {
      "r": 1.53,
      "v": 1.29,
      "omega": 0.84,
      "t": 3.84,
      "rotation_plane": "xz-plane"
    },
    "answer_json": {
      "x_B": "",
      "y_B": "",
      "z_B": ""
    }
  },
  {
    "type": "3D Circular Motion",
    "question": "\n        Object  (Circular Motion)  \n           - Radius: 0.8 meters  \n           - Speed: 9.22 m/s  \n           - Angular velocity: 11.53 rad/s  \n           - Time: 6.1 s  \n           - Rotating in the yz-plane  \n           - Compute its position (x_B, y_B, z_B), assuming it starts at (r, 0, 0).\n        ",
    "parameters": {
      "r": 0.8,
      "v": 9.22,
      "omega": 11.53,
      "t": 6.1,
      "rotation_plane": "yz-plane"
    },
    "answer_json": {
      "x_B": "",
      "y_B": "",
      "z_B": ""
    }
  },
  {
    "type": "3D Circular Motion",
    "question": "\n        Object  (Circular Motion)  \n           - Radius: 1.92 meters  \n           - Speed: 6.9 m/s  \n           - Angular velocity: 3.59 rad/s  \n           - Time: 4.56 s  \n           - Rotating in the yz-plane  \n           - Compute its position (x_B, y_B, z_B), assuming it starts at (r, 0, 0).\n        ",
    "parameters": {
      "r": 1.92,
      "v": 6.9,
      "omega": 3.59,
      "t": 4.56,
      "rotation_plane": "yz-plane"
    },
    "answer_json": {
      "x_B": "",
      "y_B": "",
      "z_B": ""
    }
  },
  {
    "type": "3D Circular Motion",
    "question": "\n        Object  (Circular Motion)  \n           - Radius: 2.56 meters  \n           - Speed: 3.38 m/s  \n           - Angular velocity: 1.32 rad/s  \n           - Time: 3.22 s  \n           - Rotating in the yz-plane  \n           - Compute its position (x_B, y_B, z_B), assuming it starts at (r, 0, 0).\n        ",
    "parameters": {
      "r": 2.56,
      "v": 3.38,
      "omega": 1.32,
      "t": 3.22,
      "rotation_plane": "yz-plane"
    },
    "answer_json": {
      "x_B": "",
      "y_B": "",
      "z_B": ""
    }
  },
  {
    "type": "3D Circular Motion",
    "question": "\n        Object  (Circular Motion)  \n           - Radius: 2.93 meters  \n           - Speed: 7.72 m/s  \n           - Angular velocity: 2.63 rad/s  \n           - Time: 4.86 s  \n           - Rotating in the yz-plane  \n           - Compute its position (x_B, y_B, z_B), assuming it starts at (r, 0, 0).\n        ",
    "parameters": {
      "r": 2.93,
      "v": 7.72,
      "omega": 2.63,
      "t": 4.86,
      "rotation_plane": "yz-plane"
    },
    "answer_json": {
      "x_B": "",
      "y_B": "",
      "z_B": ""
    }
  },
  {
    "type": "3D Circular Motion",
    "question": "\n        Object  (Circular Motion)  \n           - Radius: 2.3 meters  \n           - Speed: 2.97 m/s  \n           - Angular velocity: 1.29 rad/s  \n           - Time: 9.98 s  \n           - Rotating in the yz-plane  \n           - Compute its position (x_B, y_B, z_B), assuming it starts at (r, 0, 0).\n        ",
    "parameters": {
      "r": 2.3,
      "v": 2.97,
      "omega": 1.29,
      "t": 9.98,
      "rotation_plane": "yz-plane"
    },
    "answer_json": {
      "x_B": "",
      "y_B": "",
      "z_B": ""
    }
  },
  {
    "type": "3D Circular Motion",
    "question": "\n        Object  (Circular Motion)  \n           - Radius: 2.72 meters  \n           - Speed: 7.8 m/s  \n           - Angular velocity: 2.87 rad/s  \n           - Time: 8.75 s  \n           - Rotating in the xy-plane  \n           - Compute its position (x_B, y_B, z_B), assuming it starts at (r, 0, 0).\n        ",
    "parameters": {
      "r": 2.72,
      "v": 7.8,
      "omega": 2.87,
      "t": 8.75,
      "rotation_plane": "xy-plane"
    },
    "answer_json": {
      "x_B": "",
      "y_B": "",
      "z_B": ""
    }
  },
  {
    "type": "3D Projectile Motion",
    "question": "\nA projectile is launched from (0,0,0) with an initial velocity of [6.1, 13.34, 8.27] m/s at an angle of 73.79 degrees.\nCalculate its flight time, maximum height (h), and range (dx, dy, dz).\n",
    "parameters": {
      "v0": [
        6.1,
        13.34,
        8.27
      ],
      "angle": 73.79
    },
    "answer_json": {
      "flight_time": "",
      "maximum_height": "",
      "range_x": "",
      "range_y": "",
      "range_z": ""
    }
  },
  {
    "type": "3D Projectile Motion",
    "question": "\nA projectile is launched from (0,0,0) with an initial velocity of [9.04, 16.05, 22.64] m/s at an angle of 48.65 degrees.\nCalculate its flight time, maximum height (h), and range (dx, dy, dz).\n",
    "parameters": {
      "v0": [
        9.04,
        16.05,
        22.64
      ],
      "angle": 48.65
    },
    "answer_json": {
      "flight_time": "",
      "maximum_height": "",
      "range_x": "",
      "range_y": "",
      "range_z": ""
    }
  },
  {
    "type": "3D Projectile Motion",
    "question": "\nA projectile is launched from (0,0,0) with an initial velocity of [7.8, 28.63, 22.28] m/s at an angle of 23.94 degrees.\nCalculate its flight time, maximum height (h), and range (dx, dy, dz).\n",
    "parameters": {
      "v0": [
        7.8,
        28.63,
        22.28
      ],
      "angle": 23.94
    },
    "answer_json": {
      "flight_time": "",
      "maximum_height": "",
      "range_x": "",
      "range_y": "",
      "range_z": ""
    }
  },
  {
    "type": "3D Projectile Motion",
    "question": "\nA projectile is launched from (0,0,0) with an initial velocity of [5.9, 14.23, 18.81] m/s at an angle of 40.79 degrees.\nCalculate its flight time, maximum height (h), and range (dx, dy, dz).\n",
    "parameters": {
      "v0": [
        5.9,
        14.23,
        18.81
      ],
      "angle": 40.79
    },
    "answer_json": {
      "flight_time": "",
      "maximum_height": "",
      "range_x": "",
      "range_y": "",
      "range_z": ""
    }
  },
  {
    "type": "3D Projectile Motion",
    "question": "\nA projectile is launched from (0,0,0) with an initial velocity of [6.05, 14.12, 28.33] m/s at an angle of 73.33 degrees.\nCalculate its flight time, maximum height (h), and range (dx, dy, dz).\n",
    "parameters": {
      "v0": [
        6.05,
        14.12,
        28.33
      ],
      "angle": 73.33
    },
    "answer_json": {
      "flight_time": "",
      "maximum_height": "",
      "range_x": "",
      "range_y": "",
      "range_z": ""
    }
  },
  {
    "type": "3D Projectile Motion",
    "question": "\nA projectile is launched from (0,0,0) with an initial velocity of [6.0, 13.95, 22.05] m/s at an angle of 55.02 degrees.\nCalculate its flight time, maximum height (h), and range (dx, dy, dz).\n",
    "parameters": {
      "v0": [
        6.0,
        13.95,
        22.05
      ],
      "angle": 55.02
    },
    "answer_json": {
      "flight_time": "",
      "maximum_height": "",
      "range_x": "",
      "range_y": "",
      "range_z": ""
    }
  },
  {
    "type": "3D Projectile Motion",
    "question": "\nA projectile is launched from (0,0,0) with an initial velocity of [13.84, 19.0, 26.87] m/s at an angle of 73.43 degrees.\nCalculate its flight time, maximum height (h), and range (dx, dy, dz).\n",
    "parameters": {
      "v0": [
        13.84,
        19.0,
        26.87
      ],
      "angle": 73.43
    },
    "answer_json": {
      "flight_time": "",
      "maximum_height": "",
      "range_x": "",
      "range_y": "",
      "range_z": ""
    }
  },
  {
    "type": "3D Projectile Motion",
    "question": "\nA projectile is launched from (0,0,0) with an initial velocity of [23.74, 28.14, 10.92] m/s at an angle of 24.75 degrees.\nCalculate its flight time, maximum height (h), and range (dx, dy, dz).\n",
    "parameters": {
      "v0": [
        23.74,
        28.14,
        10.92
      ],
      "angle": 24.75
    },
    "answer_json": {
      "flight_time": "",
      "maximum_height": "",
      "range_x": "",
      "range_y": "",
      "range_z": ""
    }
  },
  {
    "type": "3D Projectile Motion",
    "question": "\nA projectile is launched from (0,0,0) with an initial velocity of [25.0, 9.43, 15.31] m/s at an angle of 25.76 degrees.\nCalculate its flight time, maximum height (h), and range (dx, dy, dz).\n",
    "parameters": {
      "v0": [
        25.0,
        9.43,
        15.31
      ],
      "angle": 25.76
    },
    "answer_json": {
      "flight_time": "",
      "maximum_height": "",
      "range_x": "",
      "range_y": "",
      "range_z": ""
    }
  },
  {
    "type": "3D Projectile Motion",
    "question": "\nA projectile is launched from (0,0,0) with an initial velocity of [28.11, 24.56, 15.29] m/s at an angle of 55.19 degrees.\nCalculate its flight time, maximum height (h), and range (dx, dy, dz).\n",
    "parameters": {
      "v0": [
        28.11,
        24.56,
        15.29
      ],
      "angle": 55.19
    },
    "answer_json": {
      "flight_time": "",
      "maximum_height": "",
      "range_x": "",
      "range_y": "",
      "range_z": ""
    }
  },
  {
    "type": "3D Projectile Motion",
    "question": "\nA projectile is launched from (0,0,0) with an initial velocity of [23.38, 11.2, 8.98] m/s at an angle of 57.08 degrees.\nCalculate its flight time, maximum height (h), and range (dx, dy, dz).\n",
    "parameters": {
      "v0": [
        23.38,
        11.2,
        8.98
      ],
      "angle": 57.08
    },
    "answer_json": {
      "flight_time": "",
      "maximum_height": "",
      "range_x": "",
      "range_y": "",
      "range_z": ""
    }
  },
  {
    "type": "3D Projectile Motion",
    "question": "\nA projectile is launched from (0,0,0) with an initial velocity of [14.56, 5.97, 16.77] m/s at an angle of 26.97 degrees.\nCalculate its flight time, maximum height (h), and range (dx, dy, dz).\n",
    "parameters": {
      "v0": [
        14.56,
        5.97,
        16.77
      ],
      "angle": 26.97
    },
    "answer_json": {
      "flight_time": "",
      "maximum_height": "",
      "range_x": "",
      "range_y": "",
      "range_z": ""
    }
  },
  {
    "type": "3D Projectile Motion",
    "question": "\nA projectile is launched from (0,0,0) with an initial velocity of [27.96, 13.74, 25.51] m/s at an angle of 67.28 degrees.\nCalculate its flight time, maximum height (h), and range (dx, dy, dz).\n",
    "parameters": {
      "v0": [
        27.96,
        13.74,
        25.51
      ],
      "angle": 67.28
    },
    "answer_json": {
      "flight_time": "",
      "maximum_height": "",
      "range_x": "",
      "range_y": "",
      "range_z": ""
    }
  },
  {
    "type": "3D Projectile Motion",
    "question": "\nA projectile is launched from (0,0,0) with an initial velocity of [10.57, 21.5, 14.96] m/s at an angle of 31.72 degrees.\nCalculate its flight time, maximum height (h), and range (dx, dy, dz).\n",
    "parameters": {
      "v0": [
        10.57,
        21.5,
        14.96
      ],
      "angle": 31.72
    },
    "answer_json": {
      "flight_time": "",
      "maximum_height": "",
      "range_x": "",
      "range_y": "",
      "range_z": ""
    }
  },
  {
    "type": "3D Projectile Motion",
    "question": "\nA projectile is launched from (0,0,0) with an initial velocity of [6.74, 24.33, 13.78] m/s at an angle of 45.56 degrees.\nCalculate its flight time, maximum height (h), and range (dx, dy, dz).\n",
    "parameters": {
      "v0": [
        6.74,
        24.33,
        13.78
      ],
      "angle": 45.56
    },
    "answer_json": {
      "flight_time": "",
      "maximum_height": "",
      "range_x": "",
      "range_y": "",
      "range_z": ""
    }
  },
  {
    "type": "3D Projectile Motion",
    "question": "\nA projectile is launched from (0,0,0) with an initial velocity of [21.99, 26.09, 13.28] m/s at an angle of 16.66 degrees.\nCalculate its flight time, maximum height (h), and range (dx, dy, dz).\n",
    "parameters": {
      "v0": [
        21.99,
        26.09,
        13.28
      ],
      "angle": 16.66
    },
    "answer_json": {
      "flight_time": "",
      "maximum_height": "",
      "range_x": "",
      "range_y": "",
      "range_z": ""
    }
  },
  {
    "type": "3D Projectile Motion",
    "question": "\nA projectile is launched from (0,0,0) with an initial velocity of [26.93, 11.53, 19.51] m/s at an angle of 74.01 degrees.\nCalculate its flight time, maximum height (h), and range (dx, dy, dz).\n",
    "parameters": {
      "v0": [
        26.93,
        11.53,
        19.51
      ],
      "angle": 74.01
    },
    "answer_json": {
      "flight_time": "",
      "maximum_height": "",
      "range_x": "",
      "range_y": "",
      "range_z": ""
    }
  },
  {
    "type": "3D Projectile Motion",
    "question": "\nA projectile is launched from (0,0,0) with an initial velocity of [5.96, 19.91, 13.64] m/s at an angle of 62.19 degrees.\nCalculate its flight time, maximum height (h), and range (dx, dy, dz).\n",
    "parameters": {
      "v0": [
        5.96,
        19.91,
        13.64
      ],
      "angle": 62.19
    },
    "answer_json": {
      "flight_time": "",
      "maximum_height": "",
      "range_x": "",
      "range_y": "",
      "range_z": ""
    }
  },
  {
    "type": "3D Projectile Motion",
    "question": "\nA projectile is launched from (0,0,0) with an initial velocity of [15.91, 29.61, 7.89] m/s at an angle of 68.97 degrees.\nCalculate its flight time, maximum height (h), and range (dx, dy, dz).\n",
    "parameters": {
      "v0": [
        15.91,
        29.61,
        7.89
      ],
      "angle": 68.97
    },
    "answer_json": {
      "flight_time": "",
      "maximum_height": "",
      "range_x": "",
      "range_y": "",
      "range_z": ""
    }
  },
  {
    "type": "3D Projectile Motion",
    "question": "\nA projectile is launched from (0,0,0) with an initial velocity of [9.75, 6.11, 15.9] m/s at an angle of 46.2 degrees.\nCalculate its flight time, maximum height (h), and range (dx, dy, dz).\n",
    "parameters": {
      "v0": [
        9.75,
        6.11,
        15.9
      ],
      "angle": 46.2
    },
    "answer_json": {
      "flight_time": "",
      "maximum_height": "",
      "range_x": "",
      "range_y": "",
      "range_z": ""
    }
  },
  {
    "type": "3D Projectile Motion",
    "question": "\nA projectile is launched from (0,0,0) with an initial velocity of [25.16, 22.17, 28.51] m/s at an angle of 59.22 degrees.\nCalculate its flight time, maximum height (h), and range (dx, dy, dz).\n",
    "parameters": {
      "v0": [
        25.16,
        22.17,
        28.51
      ],
      "angle": 59.22
    },
    "answer_json": {
      "flight_time": "",
      "maximum_height": "",
      "range_x": "",
      "range_y": "",
      "range_z": ""
    }
  },
  {
    "type": "3D Projectile Motion",
    "question": "\nA projectile is launched from (0,0,0) with an initial velocity of [9.93, 15.78, 28.72] m/s at an angle of 70.25 degrees.\nCalculate its flight time, maximum height (h), and range (dx, dy, dz).\n",
    "parameters": {
      "v0": [
        9.93,
        15.78,
        28.72
      ],
      "angle": 70.25
    },
    "answer_json": {
      "flight_time": "",
      "maximum_height": "",
      "range_x": "",
      "range_y": "",
      "range_z": ""
    }
  },
  {
    "type": "3D Projectile Motion",
    "question": "\nA projectile is launched from (0,0,0) with an initial velocity of [20.58, 21.58, 8.12] m/s at an angle of 69.0 degrees.\nCalculate its flight time, maximum height (h), and range (dx, dy, dz).\n",
    "parameters": {
      "v0": [
        20.58,
        21.58,
        8.12
      ],
      "angle": 69.0
    },
    "answer_json": {
      "flight_time": "",
      "maximum_height": "",
      "range_x": "",
      "range_y": "",
      "range_z": ""
    }
  },
  {
    "type": "3D Projectile Motion",
    "question": "\nA projectile is launched from (0,0,0) with an initial velocity of [17.68, 21.67, 13.15] m/s at an angle of 56.83 degrees.\nCalculate its flight time, maximum height (h), and range (dx, dy, dz).\n",
    "parameters": {
      "v0": [
        17.68,
        21.67,
        13.15
      ],
      "angle": 56.83
    },
    "answer_json": {
      "flight_time": "",
      "maximum_height": "",
      "range_x": "",
      "range_y": "",
      "range_z": ""
    }
  },
  {
    "type": "3D Projectile Motion",
    "question": "\nA projectile is launched from (0,0,0) with an initial velocity of [18.86, 9.8, 21.62] m/s at an angle of 37.75 degrees.\nCalculate its flight time, maximum height (h), and range (dx, dy, dz).\n",
    "parameters": {
      "v0": [
        18.86,
        9.8,
        21.62
      ],
      "angle": 37.75
    },
    "answer_json": {
      "flight_time": "",
      "maximum_height": "",
      "range_x": "",
      "range_y": "",
      "range_z": ""
    }
  },
  {
    "type": "3D Multi-Object Motion",
    "question": "\nThree objects move in different types of motion in 3D space:\n1. Object A (Linear Motion)  \n   - Initial velocity: [15.21, 4.31, 11.81] m/s  \n   - Acceleration: [-0.94, 3.34, -1.96] m/s\u00b2  \n   - Time: 2.89 s  \n   - Compute its final position (x_A, y_A, z_A). Assume it starts at (0, 0, 0).\n\n2. Object B (Circular Motion)  \n   - Radius: 4.04 meters  \n   - Speed: 6.46 m/s  \n   - Angular velocity: 1.6 rad/s  \n   - Time: 3.9 s  \n   - Rotating in the xz-plane  \n   - Compute its position (x_B, y_B, z_B), assuming it starts at (r_B, 0, 0).\n\n3. Object C (Projectile Motion)  \n   - Initial speed: [16.05, 10.34, 16.83] m/s  \n   - Launch angle: 69.07 degrees  \n   - Time: 8.16 s  \n   - Compute its position (x_C, y_C, z_C), assuming it starts from (0,0,0).\n",
    "parameters": {
      "object_A": {
        "v0": [
          15.21,
          4.31,
          11.81
        ],
        "a": [
          -0.94,
          3.34,
          -1.96
        ],
        "t": 2.89
      },
      "object_B": {
        "r": 4.04,
        "v": 6.46,
        "omega": 1.6,
        "t": 3.9,
        "rotation_plane": "xz-plane"
      },
      "object_C": {
        "v0": [
          16.05,
          10.34,
          16.83
        ],
        "angle": 69.07,
        "t": 8.16
      }
    },
    "answer_json": {
      "pos_A": {
        "x_A": "",
        "y_A": "",
        "z_A": ""
      },
      "pos_B": {
        "x_B": "",
        "y_B": "",
        "z_B": ""
      },
      "pos_C": {
        "x_C": "",
        "y_C": "",
        "z_C": ""
      }
    }
  },
  {
    "type": "3D Multi-Object Motion",
    "question": "\nThree objects move in different types of motion in 3D space:\n1. Object A (Linear Motion)  \n   - Initial velocity: [4.22, 2.61, 10.79] m/s  \n   - Acceleration: [1.33, -1.65, 3.18] m/s\u00b2  \n   - Time: 7.76 s  \n   - Compute its final position (x_A, y_A, z_A). Assume it starts at (0, 0, 0).\n\n2. Object B (Circular Motion)  \n   - Radius: 3.53 meters  \n   - Speed: 3.02 m/s  \n   - Angular velocity: 0.86 rad/s  \n   - Time: 2.79 s  \n   - Rotating in the xy-plane  \n   - Compute its position (x_B, y_B, z_B), assuming it starts at (r_B, 0, 0).\n\n3. Object C (Projectile Motion)  \n   - Initial speed: [6.16, 29.6, 20.28] m/s  \n   - Launch angle: 61.11 degrees  \n   - Time: 5.1 s  \n   - Compute its position (x_C, y_C, z_C), assuming it starts from (0,0,0).\n",
    "parameters": {
      "object_A": {
        "v0": [
          4.22,
          2.61,
          10.79
        ],
        "a": [
          1.33,
          -1.65,
          3.18
        ],
        "t": 7.76
      },
      "object_B": {
        "r": 3.53,
        "v": 3.02,
        "omega": 0.86,
        "t": 2.79,
        "rotation_plane": "xy-plane"
      },
      "object_C": {
        "v0": [
          6.16,
          29.6,
          20.28
        ],
        "angle": 61.11,
        "t": 5.1
      }
    },
    "answer_json": {
      "pos_A": {
        "x_A": "",
        "y_A": "",
        "z_A": ""
      },
      "pos_B": {
        "x_B": "",
        "y_B": "",
        "z_B": ""
      },
      "pos_C": {
        "x_C": "",
        "y_C": "",
        "z_C": ""
      }
    }
  },
  {
    "type": "3D Multi-Object Motion",
    "question": "\nThree objects move in different types of motion in 3D space:\n1. Object A (Linear Motion)  \n   - Initial velocity: [17.84, 11.94, 14.65] m/s  \n   - Acceleration: [-1.16, -1.0, -3.52] m/s\u00b2  \n   - Time: 7.19 s  \n   - Compute its final position (x_A, y_A, z_A). Assume it starts at (0, 0, 0).\n\n2. Object B (Circular Motion)  \n   - Radius: 4.52 meters  \n   - Speed: 8.74 m/s  \n   - Angular velocity: 1.93 rad/s  \n   - Time: 8.97 s  \n   - Rotating in the xz-plane  \n   - Compute its position (x_B, y_B, z_B), assuming it starts at (r_B, 0, 0).\n\n3. Object C (Projectile Motion)  \n   - Initial speed: [10.47, 25.1, 22.4] m/s  \n   - Launch angle: 42.87 degrees  \n   - Time: 6.02 s  \n   - Compute its position (x_C, y_C, z_C), assuming it starts from (0,0,0).\n",
    "parameters": {
      "object_A": {
        "v0": [
          17.84,
          11.94,
          14.65
        ],
        "a": [
          -1.16,
          -1.0,
          -3.52
        ],
        "t": 7.19
      },
      "object_B": {
        "r": 4.52,
        "v": 8.74,
        "omega": 1.93,
        "t": 8.97,
        "rotation_plane": "xz-plane"
      },
      "object_C": {
        "v0": [
          10.47,
          25.1,
          22.4
        ],
        "angle": 42.87,
        "t": 6.02
      }
    },
    "answer_json": {
      "pos_A": {
        "x_A": "",
        "y_A": "",
        "z_A": ""
      },
      "pos_B": {
        "x_B": "",
        "y_B": "",
        "z_B": ""
      },
      "pos_C": {
        "x_C": "",
        "y_C": "",
        "z_C": ""
      }
    }
  },
  {
    "type": "3D Multi-Object Motion",
    "question": "\nThree objects move in different types of motion in 3D space:\n1. Object A (Linear Motion)  \n   - Initial velocity: [18.43, 3.31, 3.53] m/s  \n   - Acceleration: [-0.35, 0.31, 0.59] m/s\u00b2  \n   - Time: 3.86 s  \n   - Compute its final position (x_A, y_A, z_A). Assume it starts at (0, 0, 0).\n\n2. Object B (Circular Motion)  \n   - Radius: 3.9 meters  \n   - Speed: 4.98 m/s  \n   - Angular velocity: 1.28 rad/s  \n   - Time: 8.34 s  \n   - Rotating in the yz-plane  \n   - Compute its position (x_B, y_B, z_B), assuming it starts at (r_B, 0, 0).\n\n3. Object C (Projectile Motion)  \n   - Initial speed: [15.67, 27.67, 16.15] m/s  \n   - Launch angle: 24.55 degrees  \n   - Time: 8.75 s  \n   - Compute its position (x_C, y_C, z_C), assuming it starts from (0,0,0).\n",
    "parameters": {
      "object_A": {
        "v0": [
          18.43,
          3.31,
          3.53
        ],
        "a": [
          -0.35,
          0.31,
          0.59
        ],
        "t": 3.86
      },
      "object_B": {
        "r": 3.9,
        "v": 4.98,
        "omega": 1.28,
        "t": 8.34,
        "rotation_plane": "yz-plane"
      },
      "object_C": {
        "v0": [
          15.67,
          27.67,
          16.15
        ],
        "angle": 24.55,
        "t": 8.75
      }
    },
    "answer_json": {
      "pos_A": {
        "x_A": "",
        "y_A": "",
        "z_A": ""
      },
      "pos_B": {
        "x_B": "",
        "y_B": "",
        "z_B": ""
      },
      "pos_C": {
        "x_C": "",
        "y_C": "",
        "z_C": ""
      }
    }
  },
  {
    "type": "3D Multi-Object Motion",
    "question": "\nThree objects move in different types of motion in 3D space:\n1. Object A (Linear Motion)  \n   - Initial velocity: [9.55, 15.28, 16.96] m/s  \n   - Acceleration: [-2.23, 2.78, -0.15] m/s\u00b2  \n   - Time: 3.15 s  \n   - Compute its final position (x_A, y_A, z_A). Assume it starts at (0, 0, 0).\n\n2. Object B (Circular Motion)  \n   - Radius: 2.48 meters  \n   - Speed: 7.42 m/s  \n   - Angular velocity: 2.99 rad/s  \n   - Time: 3.11 s  \n   - Rotating in the xz-plane  \n   - Compute its position (x_B, y_B, z_B), assuming it starts at (r_B, 0, 0).\n\n3. Object C (Projectile Motion)  \n   - Initial speed: [12.99, 18.5, 8.46] m/s  \n   - Launch angle: 28.88 degrees  \n   - Time: 7.25 s  \n   - Compute its position (x_C, y_C, z_C), assuming it starts from (0,0,0).\n",
    "parameters": {
      "object_A": {
        "v0": [
          9.55,
          15.28,
          16.96
        ],
        "a": [
          -2.23,
          2.78,
          -0.15
        ],
        "t": 3.15
      },
      "object_B": {
        "r": 2.48,
        "v": 7.42,
        "omega": 2.99,
        "t": 3.11,
        "rotation_plane": "xz-plane"
      },
      "object_C": {
        "v0": [
          12.99,
          18.5,
          8.46
        ],
        "angle": 28.88,
        "t": 7.25
      }
    },
    "answer_json": {
      "pos_A": {
        "x_A": "",
        "y_A": "",
        "z_A": ""
      },
      "pos_B": {
        "x_B": "",
        "y_B": "",
        "z_B": ""
      },
      "pos_C": {
        "x_C": "",
        "y_C": "",
        "z_C": ""
      }
    }
  },
  {
    "type": "3D Multi-Object Motion",
    "question": "\nThree objects move in different types of motion in 3D space:\n1. Object A (Linear Motion)  \n   - Initial velocity: [14.42, 2.22, 8.74] m/s  \n   - Acceleration: [0.43, -0.84, -2.93] m/s\u00b2  \n   - Time: 4.78 s  \n   - Compute its final position (x_A, y_A, z_A). Assume it starts at (0, 0, 0).\n\n2. Object B (Circular Motion)  \n   - Radius: 4.57 meters  \n   - Speed: 6.26 m/s  \n   - Angular velocity: 1.37 rad/s  \n   - Time: 7.26 s  \n   - Rotating in the yz-plane  \n   - Compute its position (x_B, y_B, z_B), assuming it starts at (r_B, 0, 0).\n\n3. Object C (Projectile Motion)  \n   - Initial speed: [14.51, 5.15, 13.79] m/s  \n   - Launch angle: 60.21 degrees  \n   - Time: 8.68 s  \n   - Compute its position (x_C, y_C, z_C), assuming it starts from (0,0,0).\n",
    "parameters": {
      "object_A": {
        "v0": [
          14.42,
          2.22,
          8.74
        ],
        "a": [
          0.43,
          -0.84,
          -2.93
        ],
        "t": 4.78
      },
      "object_B": {
        "r": 4.57,
        "v": 6.26,
        "omega": 1.37,
        "t": 7.26,
        "rotation_plane": "yz-plane"
      },
      "object_C": {
        "v0": [
          14.51,
          5.15,
          13.79
        ],
        "angle": 60.21,
        "t": 8.68
      }
    },
    "answer_json": {
      "pos_A": {
        "x_A": "",
        "y_A": "",
        "z_A": ""
      },
      "pos_B": {
        "x_B": "",
        "y_B": "",
        "z_B": ""
      },
      "pos_C": {
        "x_C": "",
        "y_C": "",
        "z_C": ""
      }
    }
  },
  {
    "type": "3D Multi-Object Motion",
    "question": "\nThree objects move in different types of motion in 3D space:\n1. Object A (Linear Motion)  \n   - Initial velocity: [19.12, 8.96, 15.2] m/s  \n   - Acceleration: [0.46, 1.03, -2.79] m/s\u00b2  \n   - Time: 2.97 s  \n   - Compute its final position (x_A, y_A, z_A). Assume it starts at (0, 0, 0).\n\n2. Object B (Circular Motion)  \n   - Radius: 2.46 meters  \n   - Speed: 1.26 m/s  \n   - Angular velocity: 0.51 rad/s  \n   - Time: 4.03 s  \n   - Rotating in the yz-plane  \n   - Compute its position (x_B, y_B, z_B), assuming it starts at (r_B, 0, 0).\n\n3. Object C (Projectile Motion)  \n   - Initial speed: [24.95, 23.1, 26.01] m/s  \n   - Launch angle: 70.17 degrees  \n   - Time: 9.83 s  \n   - Compute its position (x_C, y_C, z_C), assuming it starts from (0,0,0).\n",
    "parameters": {
      "object_A": {
        "v0": [
          19.12,
          8.96,
          15.2
        ],
        "a": [
          0.46,
          1.03,
          -2.79
        ],
        "t": 2.97
      },
      "object_B": {
        "r": 2.46,
        "v": 1.26,
        "omega": 0.51,
        "t": 4.03,
        "rotation_plane": "yz-plane"
      },
      "object_C": {
        "v0": [
          24.95,
          23.1,
          26.01
        ],
        "angle": 70.17,
        "t": 9.83
      }
    },
    "answer_json": {
      "pos_A": {
        "x_A": "",
        "y_A": "",
        "z_A": ""
      },
      "pos_B": {
        "x_B": "",
        "y_B": "",
        "z_B": ""
      },
      "pos_C": {
        "x_C": "",
        "y_C": "",
        "z_C": ""
      }
    }
  },
  {
    "type": "3D Multi-Object Motion",
    "question": "\nThree objects move in different types of motion in 3D space:\n1. Object A (Linear Motion)  \n   - Initial velocity: [11.15, 18.23, 12.25] m/s  \n   - Acceleration: [1.63, -4.16, -0.71] m/s\u00b2  \n   - Time: 8.8 s  \n   - Compute its final position (x_A, y_A, z_A). Assume it starts at (0, 0, 0).\n\n2. Object B (Circular Motion)  \n   - Radius: 1.32 meters  \n   - Speed: 3.34 m/s  \n   - Angular velocity: 2.53 rad/s  \n   - Time: 3.95 s  \n   - Rotating in the xz-plane  \n   - Compute its position (x_B, y_B, z_B), assuming it starts at (r_B, 0, 0).\n\n3. Object C (Projectile Motion)  \n   - Initial speed: [13.17, 24.03, 14.48] m/s  \n   - Launch angle: 60.12 degrees  \n   - Time: 8.49 s  \n   - Compute its position (x_C, y_C, z_C), assuming it starts from (0,0,0).\n",
    "parameters": {
      "object_A": {
        "v0": [
          11.15,
          18.23,
          12.25
        ],
        "a": [
          1.63,
          -4.16,
          -0.71
        ],
        "t": 8.8
      },
      "object_B": {
        "r": 1.32,
        "v": 3.34,
        "omega": 2.53,
        "t": 3.95,
        "rotation_plane": "xz-plane"
      },
      "object_C": {
        "v0": [
          13.17,
          24.03,
          14.48
        ],
        "angle": 60.12,
        "t": 8.49
      }
    },
    "answer_json": {
      "pos_A": {
        "x_A": "",
        "y_A": "",
        "z_A": ""
      },
      "pos_B": {
        "x_B": "",
        "y_B": "",
        "z_B": ""
      },
      "pos_C": {
        "x_C": "",
        "y_C": "",
        "z_C": ""
      }
    }
  },
  {
    "type": "3D Multi-Object Motion",
    "question": "\nThree objects move in different types of motion in 3D space:\n1. Object A (Linear Motion)  \n   - Initial velocity: [5.79, 2.56, 1.37] m/s  \n   - Acceleration: [0.39, 5.0, -1.5] m/s\u00b2  \n   - Time: 6.85 s  \n   - Compute its final position (x_A, y_A, z_A). Assume it starts at (0, 0, 0).\n\n2. Object B (Circular Motion)  \n   - Radius: 4.02 meters  \n   - Speed: 6.87 m/s  \n   - Angular velocity: 1.71 rad/s  \n   - Time: 7.79 s  \n   - Rotating in the xy-plane  \n   - Compute its position (x_B, y_B, z_B), assuming it starts at (r_B, 0, 0).\n\n3. Object C (Projectile Motion)  \n   - Initial speed: [9.98, 5.51, 8.81] m/s  \n   - Launch angle: 22.57 degrees  \n   - Time: 7.03 s  \n   - Compute its position (x_C, y_C, z_C), assuming it starts from (0,0,0).\n",
    "parameters": {
      "object_A": {
        "v0": [
          5.79,
          2.56,
          1.37
        ],
        "a": [
          0.39,
          5.0,
          -1.5
        ],
        "t": 6.85
      },
      "object_B": {
        "r": 4.02,
        "v": 6.87,
        "omega": 1.71,
        "t": 7.79,
        "rotation_plane": "xy-plane"
      },
      "object_C": {
        "v0": [
          9.98,
          5.51,
          8.81
        ],
        "angle": 22.57,
        "t": 7.03
      }
    },
    "answer_json": {
      "pos_A": {
        "x_A": "",
        "y_A": "",
        "z_A": ""
      },
      "pos_B": {
        "x_B": "",
        "y_B": "",
        "z_B": ""
      },
      "pos_C": {
        "x_C": "",
        "y_C": "",
        "z_C": ""
      }
    }
  },
  {
    "type": "3D Multi-Object Motion",
    "question": "\nThree objects move in different types of motion in 3D space:\n1. Object A (Linear Motion)  \n   - Initial velocity: [11.72, 5.14, 14.29] m/s  \n   - Acceleration: [2.67, -3.32, 1.07] m/s\u00b2  \n   - Time: 7.73 s  \n   - Compute its final position (x_A, y_A, z_A). Assume it starts at (0, 0, 0).\n\n2. Object B (Circular Motion)  \n   - Radius: 1.02 meters  \n   - Speed: 8.37 m/s  \n   - Angular velocity: 8.21 rad/s  \n   - Time: 9.68 s  \n   - Rotating in the xy-plane  \n   - Compute its position (x_B, y_B, z_B), assuming it starts at (r_B, 0, 0).\n\n3. Object C (Projectile Motion)  \n   - Initial speed: [19.47, 28.22, 19.39] m/s  \n   - Launch angle: 69.48 degrees  \n   - Time: 4.38 s  \n   - Compute its position (x_C, y_C, z_C), assuming it starts from (0,0,0).\n",
    "parameters": {
      "object_A": {
        "v0": [
          11.72,
          5.14,
          14.29
        ],
        "a": [
          2.67,
          -3.32,
          1.07
        ],
        "t": 7.73
      },
      "object_B": {
        "r": 1.02,
        "v": 8.37,
        "omega": 8.21,
        "t": 9.68,
        "rotation_plane": "xy-plane"
      },
      "object_C": {
        "v0": [
          19.47,
          28.22,
          19.39
        ],
        "angle": 69.48,
        "t": 4.38
      }
    },
    "answer_json": {
      "pos_A": {
        "x_A": "",
        "y_A": "",
        "z_A": ""
      },
      "pos_B": {
        "x_B": "",
        "y_B": "",
        "z_B": ""
      },
      "pos_C": {
        "x_C": "",
        "y_C": "",
        "z_C": ""
      }
    }
  },
  {
    "type": "3D Multi-Object Motion",
    "question": "\nThree objects move in different types of motion in 3D space:\n1. Object A (Linear Motion)  \n   - Initial velocity: [18.89, 4.77, 12.25] m/s  \n   - Acceleration: [3.31, -2.57, 1.97] m/s\u00b2  \n   - Time: 3.71 s  \n   - Compute its final position (x_A, y_A, z_A). Assume it starts at (0, 0, 0).\n\n2. Object B (Circular Motion)  \n   - Radius: 3.58 meters  \n   - Speed: 8.25 m/s  \n   - Angular velocity: 2.3 rad/s  \n   - Time: 8.17 s  \n   - Rotating in the yz-plane  \n   - Compute its position (x_B, y_B, z_B), assuming it starts at (r_B, 0, 0).\n\n3. Object C (Projectile Motion)  \n   - Initial speed: [24.57, 13.68, 15.71] m/s  \n   - Launch angle: 37.23 degrees  \n   - Time: 5.55 s  \n   - Compute its position (x_C, y_C, z_C), assuming it starts from (0,0,0).\n",
    "parameters": {
      "object_A": {
        "v0": [
          18.89,
          4.77,
          12.25
        ],
        "a": [
          3.31,
          -2.57,
          1.97
        ],
        "t": 3.71
      },
      "object_B": {
        "r": 3.58,
        "v": 8.25,
        "omega": 2.3,
        "t": 8.17,
        "rotation_plane": "yz-plane"
      },
      "object_C": {
        "v0": [
          24.57,
          13.68,
          15.71
        ],
        "angle": 37.23,
        "t": 5.55
      }
    },
    "answer_json": {
      "pos_A": {
        "x_A": "",
        "y_A": "",
        "z_A": ""
      },
      "pos_B": {
        "x_B": "",
        "y_B": "",
        "z_B": ""
      },
      "pos_C": {
        "x_C": "",
        "y_C": "",
        "z_C": ""
      }
    }
  },
  {
    "type": "3D Multi-Object Motion",
    "question": "\nThree objects move in different types of motion in 3D space:\n1. Object A (Linear Motion)  \n   - Initial velocity: [7.48, 17.14, 16.62] m/s  \n   - Acceleration: [-3.94, 4.61, 1.36] m/s\u00b2  \n   - Time: 8.46 s  \n   - Compute its final position (x_A, y_A, z_A). Assume it starts at (0, 0, 0).\n\n2. Object B (Circular Motion)  \n   - Radius: 3.68 meters  \n   - Speed: 4.92 m/s  \n   - Angular velocity: 1.34 rad/s  \n   - Time: 7.6 s  \n   - Rotating in the yz-plane  \n   - Compute its position (x_B, y_B, z_B), assuming it starts at (r_B, 0, 0).\n\n3. Object C (Projectile Motion)  \n   - Initial speed: [11.75, 25.2, 18.45] m/s  \n   - Launch angle: 44.01 degrees  \n   - Time: 4.92 s  \n   - Compute its position (x_C, y_C, z_C), assuming it starts from (0,0,0).\n",
    "parameters": {
      "object_A": {
        "v0": [
          7.48,
          17.14,
          16.62
        ],
        "a": [
          -3.94,
          4.61,
          1.36
        ],
        "t": 8.46
      },
      "object_B": {
        "r": 3.68,
        "v": 4.92,
        "omega": 1.34,
        "t": 7.6,
        "rotation_plane": "yz-plane"
      },
      "object_C": {
        "v0": [
          11.75,
          25.2,
          18.45
        ],
        "angle": 44.01,
        "t": 4.92
      }
    },
    "answer_json": {
      "pos_A": {
        "x_A": "",
        "y_A": "",
        "z_A": ""
      },
      "pos_B": {
        "x_B": "",
        "y_B": "",
        "z_B": ""
      },
      "pos_C": {
        "x_C": "",
        "y_C": "",
        "z_C": ""
      }
    }
  },
  {
    "type": "3D Multi-Object Motion",
    "question": "\nThree objects move in different types of motion in 3D space:\n1. Object A (Linear Motion)  \n   - Initial velocity: [14.89, 6.1, 17.18] m/s  \n   - Acceleration: [3.31, -4.13, 3.82] m/s\u00b2  \n   - Time: 3.19 s  \n   - Compute its final position (x_A, y_A, z_A). Assume it starts at (0, 0, 0).\n\n2. Object B (Circular Motion)  \n   - Radius: 2.59 meters  \n   - Speed: 6.49 m/s  \n   - Angular velocity: 2.51 rad/s  \n   - Time: 4.41 s  \n   - Rotating in the xy-plane  \n   - Compute its position (x_B, y_B, z_B), assuming it starts at (r_B, 0, 0).\n\n3. Object C (Projectile Motion)  \n   - Initial speed: [17.36, 13.13, 17.19] m/s  \n   - Launch angle: 36.29 degrees  \n   - Time: 3.33 s  \n   - Compute its position (x_C, y_C, z_C), assuming it starts from (0,0,0).\n",
    "parameters": {
      "object_A": {
        "v0": [
          14.89,
          6.1,
          17.18
        ],
        "a": [
          3.31,
          -4.13,
          3.82
        ],
        "t": 3.19
      },
      "object_B": {
        "r": 2.59,
        "v": 6.49,
        "omega": 2.51,
        "t": 4.41,
        "rotation_plane": "xy-plane"
      },
      "object_C": {
        "v0": [
          17.36,
          13.13,
          17.19
        ],
        "angle": 36.29,
        "t": 3.33
      }
    },
    "answer_json": {
      "pos_A": {
        "x_A": "",
        "y_A": "",
        "z_A": ""
      },
      "pos_B": {
        "x_B": "",
        "y_B": "",
        "z_B": ""
      },
      "pos_C": {
        "x_C": "",
        "y_C": "",
        "z_C": ""
      }
    }
  },
  {
    "type": "3D Multi-Object Motion",
    "question": "\nThree objects move in different types of motion in 3D space:\n1. Object A (Linear Motion)  \n   - Initial velocity: [6.31, 12.33, 17.72] m/s  \n   - Acceleration: [0.56, 0.17, -3.09] m/s\u00b2  \n   - Time: 3.17 s  \n   - Compute its final position (x_A, y_A, z_A). Assume it starts at (0, 0, 0).\n\n2. Object B (Circular Motion)  \n   - Radius: 2.33 meters  \n   - Speed: 6.0 m/s  \n   - Angular velocity: 2.58 rad/s  \n   - Time: 3.16 s  \n   - Rotating in the xz-plane  \n   - Compute its position (x_B, y_B, z_B), assuming it starts at (r_B, 0, 0).\n\n3. Object C (Projectile Motion)  \n   - Initial speed: [21.15, 17.27, 24.82] m/s  \n   - Launch angle: 20.58 degrees  \n   - Time: 2.99 s  \n   - Compute its position (x_C, y_C, z_C), assuming it starts from (0,0,0).\n",
    "parameters": {
      "object_A": {
        "v0": [
          6.31,
          12.33,
          17.72
        ],
        "a": [
          0.56,
          0.17,
          -3.09
        ],
        "t": 3.17
      },
      "object_B": {
        "r": 2.33,
        "v": 6.0,
        "omega": 2.58,
        "t": 3.16,
        "rotation_plane": "xz-plane"
      },
      "object_C": {
        "v0": [
          21.15,
          17.27,
          24.82
        ],
        "angle": 20.58,
        "t": 2.99
      }
    },
    "answer_json": {
      "pos_A": {
        "x_A": "",
        "y_A": "",
        "z_A": ""
      },
      "pos_B": {
        "x_B": "",
        "y_B": "",
        "z_B": ""
      },
      "pos_C": {
        "x_C": "",
        "y_C": "",
        "z_C": ""
      }
    }
  },
  {
    "type": "3D Multi-Object Motion",
    "question": "\nThree objects move in different types of motion in 3D space:\n1. Object A (Linear Motion)  \n   - Initial velocity: [14.14, 6.82, 12.05] m/s  \n   - Acceleration: [-0.27, 0.31, -0.74] m/s\u00b2  \n   - Time: 7.71 s  \n   - Compute its final position (x_A, y_A, z_A). Assume it starts at (0, 0, 0).\n\n2. Object B (Circular Motion)  \n   - Radius: 1.99 meters  \n   - Speed: 7.33 m/s  \n   - Angular velocity: 3.68 rad/s  \n   - Time: 3.44 s  \n   - Rotating in the xz-plane  \n   - Compute its position (x_B, y_B, z_B), assuming it starts at (r_B, 0, 0).\n\n3. Object C (Projectile Motion)  \n   - Initial speed: [10.76, 23.03, 12.89] m/s  \n   - Launch angle: 59.57 degrees  \n   - Time: 9.56 s  \n   - Compute its position (x_C, y_C, z_C), assuming it starts from (0,0,0).\n",
    "parameters": {
      "object_A": {
        "v0": [
          14.14,
          6.82,
          12.05
        ],
        "a": [
          -0.27,
          0.31,
          -0.74
        ],
        "t": 7.71
      },
      "object_B": {
        "r": 1.99,
        "v": 7.33,
        "omega": 3.68,
        "t": 3.44,
        "rotation_plane": "xz-plane"
      },
      "object_C": {
        "v0": [
          10.76,
          23.03,
          12.89
        ],
        "angle": 59.57,
        "t": 9.56
      }
    },
    "answer_json": {
      "pos_A": {
        "x_A": "",
        "y_A": "",
        "z_A": ""
      },
      "pos_B": {
        "x_B": "",
        "y_B": "",
        "z_B": ""
      },
      "pos_C": {
        "x_C": "",
        "y_C": "",
        "z_C": ""
      }
    }
  },
  {
    "type": "3D Multi-Object Motion",
    "question": "\nThree objects move in different types of motion in 3D space:\n1. Object A (Linear Motion)  \n   - Initial velocity: [14.11, 4.64, 15.03] m/s  \n   - Acceleration: [-2.24, 0.9, 2.6] m/s\u00b2  \n   - Time: 6.37 s  \n   - Compute its final position (x_A, y_A, z_A). Assume it starts at (0, 0, 0).\n\n2. Object B (Circular Motion)  \n   - Radius: 4.91 meters  \n   - Speed: 8.49 m/s  \n   - Angular velocity: 1.73 rad/s  \n   - Time: 3.67 s  \n   - Rotating in the xz-plane  \n   - Compute its position (x_B, y_B, z_B), assuming it starts at (r_B, 0, 0).\n\n3. Object C (Projectile Motion)  \n   - Initial speed: [9.49, 5.35, 18.35] m/s  \n   - Launch angle: 31.46 degrees  \n   - Time: 9.77 s  \n   - Compute its position (x_C, y_C, z_C), assuming it starts from (0,0,0).\n",
    "parameters": {
      "object_A": {
        "v0": [
          14.11,
          4.64,
          15.03
        ],
        "a": [
          -2.24,
          0.9,
          2.6
        ],
        "t": 6.37
      },
      "object_B": {
        "r": 4.91,
        "v": 8.49,
        "omega": 1.73,
        "t": 3.67,
        "rotation_plane": "xz-plane"
      },
      "object_C": {
        "v0": [
          9.49,
          5.35,
          18.35
        ],
        "angle": 31.46,
        "t": 9.77
      }
    },
    "answer_json": {
      "pos_A": {
        "x_A": "",
        "y_A": "",
        "z_A": ""
      },
      "pos_B": {
        "x_B": "",
        "y_B": "",
        "z_B": ""
      },
      "pos_C": {
        "x_C": "",
        "y_C": "",
        "z_C": ""
      }
    }
  },
  {
    "type": "3D Multi-Object Motion",
    "question": "\nThree objects move in different types of motion in 3D space:\n1. Object A (Linear Motion)  \n   - Initial velocity: [11.51, 14.25, 3.4] m/s  \n   - Acceleration: [3.68, -0.09, 3.73] m/s\u00b2  \n   - Time: 6.17 s  \n   - Compute its final position (x_A, y_A, z_A). Assume it starts at (0, 0, 0).\n\n2. Object B (Circular Motion)  \n   - Radius: 2.61 meters  \n   - Speed: 4.96 m/s  \n   - Angular velocity: 1.9 rad/s  \n   - Time: 2.66 s  \n   - Rotating in the xy-plane  \n   - Compute its position (x_B, y_B, z_B), assuming it starts at (r_B, 0, 0).\n\n3. Object C (Projectile Motion)  \n   - Initial speed: [11.31, 26.54, 7.85] m/s  \n   - Launch angle: 18.92 degrees  \n   - Time: 5.43 s  \n   - Compute its position (x_C, y_C, z_C), assuming it starts from (0,0,0).\n",
    "parameters": {
      "object_A": {
        "v0": [
          11.51,
          14.25,
          3.4
        ],
        "a": [
          3.68,
          -0.09,
          3.73
        ],
        "t": 6.17
      },
      "object_B": {
        "r": 2.61,
        "v": 4.96,
        "omega": 1.9,
        "t": 2.66,
        "rotation_plane": "xy-plane"
      },
      "object_C": {
        "v0": [
          11.31,
          26.54,
          7.85
        ],
        "angle": 18.92,
        "t": 5.43
      }
    },
    "answer_json": {
      "pos_A": {
        "x_A": "",
        "y_A": "",
        "z_A": ""
      },
      "pos_B": {
        "x_B": "",
        "y_B": "",
        "z_B": ""
      },
      "pos_C": {
        "x_C": "",
        "y_C": "",
        "z_C": ""
      }
    }
  },
  {
    "type": "3D Multi-Object Motion",
    "question": "\nThree objects move in different types of motion in 3D space:\n1. Object A (Linear Motion)  \n   - Initial velocity: [11.96, 14.04, 3.88] m/s  \n   - Acceleration: [3.11, 4.49, -4.15] m/s\u00b2  \n   - Time: 3.23 s  \n   - Compute its final position (x_A, y_A, z_A). Assume it starts at (0, 0, 0).\n\n2. Object B (Circular Motion)  \n   - Radius: 3.01 meters  \n   - Speed: 4.75 m/s  \n   - Angular velocity: 1.58 rad/s  \n   - Time: 6.37 s  \n   - Rotating in the yz-plane  \n   - Compute its position (x_B, y_B, z_B), assuming it starts at (r_B, 0, 0).\n\n3. Object C (Projectile Motion)  \n   - Initial speed: [10.64, 18.06, 16.26] m/s  \n   - Launch angle: 41.56 degrees  \n   - Time: 8.74 s  \n   - Compute its position (x_C, y_C, z_C), assuming it starts from (0,0,0).\n",
    "parameters": {
      "object_A": {
        "v0": [
          11.96,
          14.04,
          3.88
        ],
        "a": [
          3.11,
          4.49,
          -4.15
        ],
        "t": 3.23
      },
      "object_B": {
        "r": 3.01,
        "v": 4.75,
        "omega": 1.58,
        "t": 6.37,
        "rotation_plane": "yz-plane"
      },
      "object_C": {
        "v0": [
          10.64,
          18.06,
          16.26
        ],
        "angle": 41.56,
        "t": 8.74
      }
    },
    "answer_json": {
      "pos_A": {
        "x_A": "",
        "y_A": "",
        "z_A": ""
      },
      "pos_B": {
        "x_B": "",
        "y_B": "",
        "z_B": ""
      },
      "pos_C": {
        "x_C": "",
        "y_C": "",
        "z_C": ""
      }
    }
  },
  {
    "type": "3D Multi-Object Motion",
    "question": "\nThree objects move in different types of motion in 3D space:\n1. Object A (Linear Motion)  \n   - Initial velocity: [19.81, 6.8, 12.8] m/s  \n   - Acceleration: [1.1, 2.4, 4.48] m/s\u00b2  \n   - Time: 2.87 s  \n   - Compute its final position (x_A, y_A, z_A). Assume it starts at (0, 0, 0).\n\n2. Object B (Circular Motion)  \n   - Radius: 1.45 meters  \n   - Speed: 6.94 m/s  \n   - Angular velocity: 4.79 rad/s  \n   - Time: 2.41 s  \n   - Rotating in the xy-plane  \n   - Compute its position (x_B, y_B, z_B), assuming it starts at (r_B, 0, 0).\n\n3. Object C (Projectile Motion)  \n   - Initial speed: [18.8, 8.91, 15.21] m/s  \n   - Launch angle: 56.36 degrees  \n   - Time: 5.23 s  \n   - Compute its position (x_C, y_C, z_C), assuming it starts from (0,0,0).\n",
    "parameters": {
      "object_A": {
        "v0": [
          19.81,
          6.8,
          12.8
        ],
        "a": [
          1.1,
          2.4,
          4.48
        ],
        "t": 2.87
      },
      "object_B": {
        "r": 1.45,
        "v": 6.94,
        "omega": 4.79,
        "t": 2.41,
        "rotation_plane": "xy-plane"
      },
      "object_C": {
        "v0": [
          18.8,
          8.91,
          15.21
        ],
        "angle": 56.36,
        "t": 5.23
      }
    },
    "answer_json": {
      "pos_A": {
        "x_A": "",
        "y_A": "",
        "z_A": ""
      },
      "pos_B": {
        "x_B": "",
        "y_B": "",
        "z_B": ""
      },
      "pos_C": {
        "x_C": "",
        "y_C": "",
        "z_C": ""
      }
    }
  },
  {
    "type": "3D Multi-Object Motion",
    "question": "\nThree objects move in different types of motion in 3D space:\n1. Object A (Linear Motion)  \n   - Initial velocity: [1.62, 6.47, 6.37] m/s  \n   - Acceleration: [3.6, -4.29, -2.67] m/s\u00b2  \n   - Time: 3.38 s  \n   - Compute its final position (x_A, y_A, z_A). Assume it starts at (0, 0, 0).\n\n2. Object B (Circular Motion)  \n   - Radius: 4.06 meters  \n   - Speed: 6.31 m/s  \n   - Angular velocity: 1.55 rad/s  \n   - Time: 8.24 s  \n   - Rotating in the xy-plane  \n   - Compute its position (x_B, y_B, z_B), assuming it starts at (r_B, 0, 0).\n\n3. Object C (Projectile Motion)  \n   - Initial speed: [15.63, 18.61, 21.19] m/s  \n   - Launch angle: 69.5 degrees  \n   - Time: 8.44 s  \n   - Compute its position (x_C, y_C, z_C), assuming it starts from (0,0,0).\n",
    "parameters": {
      "object_A": {
        "v0": [
          1.62,
          6.47,
          6.37
        ],
        "a": [
          3.6,
          -4.29,
          -2.67
        ],
        "t": 3.38
      },
      "object_B": {
        "r": 4.06,
        "v": 6.31,
        "omega": 1.55,
        "t": 8.24,
        "rotation_plane": "xy-plane"
      },
      "object_C": {
        "v0": [
          15.63,
          18.61,
          21.19
        ],
        "angle": 69.5,
        "t": 8.44
      }
    },
    "answer_json": {
      "pos_A": {
        "x_A": "",
        "y_A": "",
        "z_A": ""
      },
      "pos_B": {
        "x_B": "",
        "y_B": "",
        "z_B": ""
      },
      "pos_C": {
        "x_C": "",
        "y_C": "",
        "z_C": ""
      }
    }
  },
  {
    "type": "3D Multi-Object Motion",
    "question": "\nThree objects move in different types of motion in 3D space:\n1. Object A (Linear Motion)  \n   - Initial velocity: [2.36, 4.15, 6.84] m/s  \n   - Acceleration: [2.49, 0.69, -2.11] m/s\u00b2  \n   - Time: 2.12 s  \n   - Compute its final position (x_A, y_A, z_A). Assume it starts at (0, 0, 0).\n\n2. Object B (Circular Motion)  \n   - Radius: 3.6 meters  \n   - Speed: 7.3 m/s  \n   - Angular velocity: 2.03 rad/s  \n   - Time: 9.48 s  \n   - Rotating in the yz-plane  \n   - Compute its position (x_B, y_B, z_B), assuming it starts at (r_B, 0, 0).\n\n3. Object C (Projectile Motion)  \n   - Initial speed: [18.5, 15.94, 19.95] m/s  \n   - Launch angle: 68.37 degrees  \n   - Time: 7.61 s  \n   - Compute its position (x_C, y_C, z_C), assuming it starts from (0,0,0).\n",
    "parameters": {
      "object_A": {
        "v0": [
          2.36,
          4.15,
          6.84
        ],
        "a": [
          2.49,
          0.69,
          -2.11
        ],
        "t": 2.12
      },
      "object_B": {
        "r": 3.6,
        "v": 7.3,
        "omega": 2.03,
        "t": 9.48,
        "rotation_plane": "yz-plane"
      },
      "object_C": {
        "v0": [
          18.5,
          15.94,
          19.95
        ],
        "angle": 68.37,
        "t": 7.61
      }
    },
    "answer_json": {
      "pos_A": {
        "x_A": "",
        "y_A": "",
        "z_A": ""
      },
      "pos_B": {
        "x_B": "",
        "y_B": "",
        "z_B": ""
      },
      "pos_C": {
        "x_C": "",
        "y_C": "",
        "z_C": ""
      }
    }
  },
  {
    "type": "3D Multi-Object Motion",
    "question": "\nThree objects move in different types of motion in 3D space:\n1. Object A (Linear Motion)  \n   - Initial velocity: [12.47, 1.49, 5.35] m/s  \n   - Acceleration: [1.74, 3.61, 0.87] m/s\u00b2  \n   - Time: 1.19 s  \n   - Compute its final position (x_A, y_A, z_A). Assume it starts at (0, 0, 0).\n\n2. Object B (Circular Motion)  \n   - Radius: 3.94 meters  \n   - Speed: 8.39 m/s  \n   - Angular velocity: 2.13 rad/s  \n   - Time: 6.19 s  \n   - Rotating in the xy-plane  \n   - Compute its position (x_B, y_B, z_B), assuming it starts at (r_B, 0, 0).\n\n3. Object C (Projectile Motion)  \n   - Initial speed: [16.76, 21.29, 27.9] m/s  \n   - Launch angle: 25.89 degrees  \n   - Time: 6.27 s  \n   - Compute its position (x_C, y_C, z_C), assuming it starts from (0,0,0).\n",
    "parameters": {
      "object_A": {
        "v0": [
          12.47,
          1.49,
          5.35
        ],
        "a": [
          1.74,
          3.61,
          0.87
        ],
        "t": 1.19
      },
      "object_B": {
        "r": 3.94,
        "v": 8.39,
        "omega": 2.13,
        "t": 6.19,
        "rotation_plane": "xy-plane"
      },
      "object_C": {
        "v0": [
          16.76,
          21.29,
          27.9
        ],
        "angle": 25.89,
        "t": 6.27
      }
    },
    "answer_json": {
      "pos_A": {
        "x_A": "",
        "y_A": "",
        "z_A": ""
      },
      "pos_B": {
        "x_B": "",
        "y_B": "",
        "z_B": ""
      },
      "pos_C": {
        "x_C": "",
        "y_C": "",
        "z_C": ""
      }
    }
  },
  {
    "type": "3D Multi-Object Motion",
    "question": "\nThree objects move in different types of motion in 3D space:\n1. Object A (Linear Motion)  \n   - Initial velocity: [13.06, 10.34, 2.73] m/s  \n   - Acceleration: [-1.52, -1.67, 1.7] m/s\u00b2  \n   - Time: 8.72 s  \n   - Compute its final position (x_A, y_A, z_A). Assume it starts at (0, 0, 0).\n\n2. Object B (Circular Motion)  \n   - Radius: 1.98 meters  \n   - Speed: 7.24 m/s  \n   - Angular velocity: 3.66 rad/s  \n   - Time: 3.59 s  \n   - Rotating in the xz-plane  \n   - Compute its position (x_B, y_B, z_B), assuming it starts at (r_B, 0, 0).\n\n3. Object C (Projectile Motion)  \n   - Initial speed: [25.34, 18.75, 16.37] m/s  \n   - Launch angle: 33.87 degrees  \n   - Time: 3.91 s  \n   - Compute its position (x_C, y_C, z_C), assuming it starts from (0,0,0).\n",
    "parameters": {
      "object_A": {
        "v0": [
          13.06,
          10.34,
          2.73
        ],
        "a": [
          -1.52,
          -1.67,
          1.7
        ],
        "t": 8.72
      },
      "object_B": {
        "r": 1.98,
        "v": 7.24,
        "omega": 3.66,
        "t": 3.59,
        "rotation_plane": "xz-plane"
      },
      "object_C": {
        "v0": [
          25.34,
          18.75,
          16.37
        ],
        "angle": 33.87,
        "t": 3.91
      }
    },
    "answer_json": {
      "pos_A": {
        "x_A": "",
        "y_A": "",
        "z_A": ""
      },
      "pos_B": {
        "x_B": "",
        "y_B": "",
        "z_B": ""
      },
      "pos_C": {
        "x_C": "",
        "y_C": "",
        "z_C": ""
      }
    }
  },
  {
    "type": "3D Multi-Object Motion",
    "question": "\nThree objects move in different types of motion in 3D space:\n1. Object A (Linear Motion)  \n   - Initial velocity: [19.43, 8.68, 10.78] m/s  \n   - Acceleration: [4.88, 1.58, 0.43] m/s\u00b2  \n   - Time: 4.72 s  \n   - Compute its final position (x_A, y_A, z_A). Assume it starts at (0, 0, 0).\n\n2. Object B (Circular Motion)  \n   - Radius: 1.34 meters  \n   - Speed: 4.26 m/s  \n   - Angular velocity: 3.18 rad/s  \n   - Time: 7.81 s  \n   - Rotating in the yz-plane  \n   - Compute its position (x_B, y_B, z_B), assuming it starts at (r_B, 0, 0).\n\n3. Object C (Projectile Motion)  \n   - Initial speed: [16.05, 6.29, 11.68] m/s  \n   - Launch angle: 22.86 degrees  \n   - Time: 3.59 s  \n   - Compute its position (x_C, y_C, z_C), assuming it starts from (0,0,0).\n",
    "parameters": {
      "object_A": {
        "v0": [
          19.43,
          8.68,
          10.78
        ],
        "a": [
          4.88,
          1.58,
          0.43
        ],
        "t": 4.72
      },
      "object_B": {
        "r": 1.34,
        "v": 4.26,
        "omega": 3.18,
        "t": 7.81,
        "rotation_plane": "yz-plane"
      },
      "object_C": {
        "v0": [
          16.05,
          6.29,
          11.68
        ],
        "angle": 22.86,
        "t": 3.59
      }
    },
    "answer_json": {
      "pos_A": {
        "x_A": "",
        "y_A": "",
        "z_A": ""
      },
      "pos_B": {
        "x_B": "",
        "y_B": "",
        "z_B": ""
      },
      "pos_C": {
        "x_C": "",
        "y_C": "",
        "z_C": ""
      }
    }
  },
  {
    "type": "3D Multi-Object Motion",
    "question": "\nThree objects move in different types of motion in 3D space:\n1. Object A (Linear Motion)  \n   - Initial velocity: [17.74, 10.21, 1.55] m/s  \n   - Acceleration: [1.3, 2.99, 2.1] m/s\u00b2  \n   - Time: 3.8 s  \n   - Compute its final position (x_A, y_A, z_A). Assume it starts at (0, 0, 0).\n\n2. Object B (Circular Motion)  \n   - Radius: 0.56 meters  \n   - Speed: 4.67 m/s  \n   - Angular velocity: 8.34 rad/s  \n   - Time: 3.02 s  \n   - Rotating in the xy-plane  \n   - Compute its position (x_B, y_B, z_B), assuming it starts at (r_B, 0, 0).\n\n3. Object C (Projectile Motion)  \n   - Initial speed: [16.54, 7.94, 25.8] m/s  \n   - Launch angle: 44.9 degrees  \n   - Time: 7.45 s  \n   - Compute its position (x_C, y_C, z_C), assuming it starts from (0,0,0).\n",
    "parameters": {
      "object_A": {
        "v0": [
          17.74,
          10.21,
          1.55
        ],
        "a": [
          1.3,
          2.99,
          2.1
        ],
        "t": 3.8
      },
      "object_B": {
        "r": 0.56,
        "v": 4.67,
        "omega": 8.34,
        "t": 3.02,
        "rotation_plane": "xy-plane"
      },
      "object_C": {
        "v0": [
          16.54,
          7.94,
          25.8
        ],
        "angle": 44.9,
        "t": 7.45
      }
    },
    "answer_json": {
      "pos_A": {
        "x_A": "",
        "y_A": "",
        "z_A": ""
      },
      "pos_B": {
        "x_B": "",
        "y_B": "",
        "z_B": ""
      },
      "pos_C": {
        "x_C": "",
        "y_C": "",
        "z_C": ""
      }
    }
  },
  {
    "type": "3D Multi-Object Motion",
    "question": "\nThree objects move in different types of motion in 3D space:\n1. Object A (Linear Motion)  \n   - Initial velocity: [10.67, 6.2, 16.86] m/s  \n   - Acceleration: [4.8, -2.56, 0.51] m/s\u00b2  \n   - Time: 4.45 s  \n   - Compute its final position (x_A, y_A, z_A). Assume it starts at (0, 0, 0).\n\n2. Object B (Circular Motion)  \n   - Radius: 4.65 meters  \n   - Speed: 5.57 m/s  \n   - Angular velocity: 1.2 rad/s  \n   - Time: 8.91 s  \n   - Rotating in the xy-plane  \n   - Compute its position (x_B, y_B, z_B), assuming it starts at (r_B, 0, 0).\n\n3. Object C (Projectile Motion)  \n   - Initial speed: [11.91, 24.75, 15.37] m/s  \n   - Launch angle: 71.05 degrees  \n   - Time: 5.57 s  \n   - Compute its position (x_C, y_C, z_C), assuming it starts from (0,0,0).\n",
    "parameters": {
      "object_A": {
        "v0": [
          10.67,
          6.2,
          16.86
        ],
        "a": [
          4.8,
          -2.56,
          0.51
        ],
        "t": 4.45
      },
      "object_B": {
        "r": 4.65,
        "v": 5.57,
        "omega": 1.2,
        "t": 8.91,
        "rotation_plane": "xy-plane"
      },
      "object_C": {
        "v0": [
          11.91,
          24.75,
          15.37
        ],
        "angle": 71.05,
        "t": 5.57
      }
    },
    "answer_json": {
      "pos_A": {
        "x_A": "",
        "y_A": "",
        "z_A": ""
      },
      "pos_B": {
        "x_B": "",
        "y_B": "",
        "z_B": ""
      },
      "pos_C": {
        "x_C": "",
        "y_C": "",
        "z_C": ""
      }
    }
  },
  {
    "type": "3D Multi-Object Motion",
    "question": "\nThree objects move in different types of motion in 3D space:\n1. Object A (Linear Motion)  \n   - Initial velocity: [16.59, 6.37, 6.67] m/s  \n   - Acceleration: [0.87, 4.99, -0.1] m/s\u00b2  \n   - Time: 2.34 s  \n   - Compute its final position (x_A, y_A, z_A). Assume it starts at (0, 0, 0).\n\n2. Object B (Circular Motion)  \n   - Radius: 2.92 meters  \n   - Speed: 4.11 m/s  \n   - Angular velocity: 1.41 rad/s  \n   - Time: 5.97 s  \n   - Rotating in the yz-plane  \n   - Compute its position (x_B, y_B, z_B), assuming it starts at (r_B, 0, 0).\n\n3. Object C (Projectile Motion)  \n   - Initial speed: [14.43, 28.32, 26.74] m/s  \n   - Launch angle: 73.85 degrees  \n   - Time: 3.15 s  \n   - Compute its position (x_C, y_C, z_C), assuming it starts from (0,0,0).\n",
    "parameters": {
      "object_A": {
        "v0": [
          16.59,
          6.37,
          6.67
        ],
        "a": [
          0.87,
          4.99,
          -0.1
        ],
        "t": 2.34
      },
      "object_B": {
        "r": 2.92,
        "v": 4.11,
        "omega": 1.41,
        "t": 5.97,
        "rotation_plane": "yz-plane"
      },
      "object_C": {
        "v0": [
          14.43,
          28.32,
          26.74
        ],
        "angle": 73.85,
        "t": 3.15
      }
    },
    "answer_json": {
      "pos_A": {
        "x_A": "",
        "y_A": "",
        "z_A": ""
      },
      "pos_B": {
        "x_B": "",
        "y_B": "",
        "z_B": ""
      },
      "pos_C": {
        "x_C": "",
        "y_C": "",
        "z_C": ""
      }
    }
  },
  {
    "type": "3D Multi-Object Motion",
    "question": "\nThree objects move in different types of motion in 3D space:\n1. Object A (Linear Motion)  \n   - Initial velocity: [8.28, 17.26, 8.8] m/s  \n   - Acceleration: [-1.82, -0.27, 4.13] m/s\u00b2  \n   - Time: 4.43 s  \n   - Compute its final position (x_A, y_A, z_A). Assume it starts at (0, 0, 0).\n\n2. Object B (Circular Motion)  \n   - Radius: 4.95 meters  \n   - Speed: 8.13 m/s  \n   - Angular velocity: 1.64 rad/s  \n   - Time: 6.87 s  \n   - Rotating in the xy-plane  \n   - Compute its position (x_B, y_B, z_B), assuming it starts at (r_B, 0, 0).\n\n3. Object C (Projectile Motion)  \n   - Initial speed: [17.38, 5.93, 17.56] m/s  \n   - Launch angle: 50.41 degrees  \n   - Time: 8.83 s  \n   - Compute its position (x_C, y_C, z_C), assuming it starts from (0,0,0).\n",
    "parameters": {
      "object_A": {
        "v0": [
          8.28,
          17.26,
          8.8
        ],
        "a": [
          -1.82,
          -0.27,
          4.13
        ],
        "t": 4.43
      },
      "object_B": {
        "r": 4.95,
        "v": 8.13,
        "omega": 1.64,
        "t": 6.87,
        "rotation_plane": "xy-plane"
      },
      "object_C": {
        "v0": [
          17.38,
          5.93,
          17.56
        ],
        "angle": 50.41,
        "t": 8.83
      }
    },
    "answer_json": {
      "pos_A": {
        "x_A": "",
        "y_A": "",
        "z_A": ""
      },
      "pos_B": {
        "x_B": "",
        "y_B": "",
        "z_B": ""
      },
      "pos_C": {
        "x_C": "",
        "y_C": "",
        "z_C": ""
      }
    }
  },
  {
    "type": "3D Multi-Object Motion",
    "question": "\nThree objects move in different types of motion in 3D space:\n1. Object A (Linear Motion)  \n   - Initial velocity: [17.61, 9.37, 10.99] m/s  \n   - Acceleration: [-0.43, 2.22, -0.9] m/s\u00b2  \n   - Time: 6.89 s  \n   - Compute its final position (x_A, y_A, z_A). Assume it starts at (0, 0, 0).\n\n2. Object B (Circular Motion)  \n   - Radius: 1.19 meters  \n   - Speed: 5.23 m/s  \n   - Angular velocity: 4.39 rad/s  \n   - Time: 9.72 s  \n   - Rotating in the xz-plane  \n   - Compute its position (x_B, y_B, z_B), assuming it starts at (r_B, 0, 0).\n\n3. Object C (Projectile Motion)  \n   - Initial speed: [20.58, 14.94, 7.01] m/s  \n   - Launch angle: 34.71 degrees  \n   - Time: 7.07 s  \n   - Compute its position (x_C, y_C, z_C), assuming it starts from (0,0,0).\n",
    "parameters": {
      "object_A": {
        "v0": [
          17.61,
          9.37,
          10.99
        ],
        "a": [
          -0.43,
          2.22,
          -0.9
        ],
        "t": 6.89
      },
      "object_B": {
        "r": 1.19,
        "v": 5.23,
        "omega": 4.39,
        "t": 9.72,
        "rotation_plane": "xz-plane"
      },
      "object_C": {
        "v0": [
          20.58,
          14.94,
          7.01
        ],
        "angle": 34.71,
        "t": 7.07
      }
    },
    "answer_json": {
      "pos_A": {
        "x_A": "",
        "y_A": "",
        "z_A": ""
      },
      "pos_B": {
        "x_B": "",
        "y_B": "",
        "z_B": ""
      },
      "pos_C": {
        "x_C": "",
        "y_C": "",
        "z_C": ""
      }
    }
  },
  {
    "type": "3D Multi-Object Motion",
    "question": "\nThree objects move in different types of motion in 3D space:\n1. Object A (Linear Motion)  \n   - Initial velocity: [11.14, 19.13, 12.91] m/s  \n   - Acceleration: [3.87, -0.12, 0.41] m/s\u00b2  \n   - Time: 6.56 s  \n   - Compute its final position (x_A, y_A, z_A). Assume it starts at (0, 0, 0).\n\n2. Object B (Circular Motion)  \n   - Radius: 1.56 meters  \n   - Speed: 7.16 m/s  \n   - Angular velocity: 4.59 rad/s  \n   - Time: 3.59 s  \n   - Rotating in the xy-plane  \n   - Compute its position (x_B, y_B, z_B), assuming it starts at (r_B, 0, 0).\n\n3. Object C (Projectile Motion)  \n   - Initial speed: [23.67, 15.85, 7.46] m/s  \n   - Launch angle: 53.02 degrees  \n   - Time: 8.85 s  \n   - Compute its position (x_C, y_C, z_C), assuming it starts from (0,0,0).\n",
    "parameters": {
      "object_A": {
        "v0": [
          11.14,
          19.13,
          12.91
        ],
        "a": [
          3.87,
          -0.12,
          0.41
        ],
        "t": 6.56
      },
      "object_B": {
        "r": 1.56,
        "v": 7.16,
        "omega": 4.59,
        "t": 3.59,
        "rotation_plane": "xy-plane"
      },
      "object_C": {
        "v0": [
          23.67,
          15.85,
          7.46
        ],
        "angle": 53.02,
        "t": 8.85
      }
    },
    "answer_json": {
      "pos_A": {
        "x_A": "",
        "y_A": "",
        "z_A": ""
      },
      "pos_B": {
        "x_B": "",
        "y_B": "",
        "z_B": ""
      },
      "pos_C": {
        "x_C": "",
        "y_C": "",
        "z_C": ""
      }
    }
  },
  {
    "type": "3D Multi-Object Motion",
    "question": "\nThree objects move in different types of motion in 3D space:\n1. Object A (Linear Motion)  \n   - Initial velocity: [9.43, 14.19, 18.17] m/s  \n   - Acceleration: [-4.54, 2.96, -2.07] m/s\u00b2  \n   - Time: 4.37 s  \n   - Compute its final position (x_A, y_A, z_A). Assume it starts at (0, 0, 0).\n\n2. Object B (Circular Motion)  \n   - Radius: 1.16 meters  \n   - Speed: 5.78 m/s  \n   - Angular velocity: 4.98 rad/s  \n   - Time: 6.09 s  \n   - Rotating in the xy-plane  \n   - Compute its position (x_B, y_B, z_B), assuming it starts at (r_B, 0, 0).\n\n3. Object C (Projectile Motion)  \n   - Initial speed: [9.25, 6.97, 26.77] m/s  \n   - Launch angle: 52.18 degrees  \n   - Time: 3.17 s  \n   - Compute its position (x_C, y_C, z_C), assuming it starts from (0,0,0).\n",
    "parameters": {
      "object_A": {
        "v0": [
          9.43,
          14.19,
          18.17
        ],
        "a": [
          -4.54,
          2.96,
          -2.07
        ],
        "t": 4.37
      },
      "object_B": {
        "r": 1.16,
        "v": 5.78,
        "omega": 4.98,
        "t": 6.09,
        "rotation_plane": "xy-plane"
      },
      "object_C": {
        "v0": [
          9.25,
          6.97,
          26.77
        ],
        "angle": 52.18,
        "t": 3.17
      }
    },
    "answer_json": {
      "pos_A": {
        "x_A": "",
        "y_A": "",
        "z_A": ""
      },
      "pos_B": {
        "x_B": "",
        "y_B": "",
        "z_B": ""
      },
      "pos_C": {
        "x_C": "",
        "y_C": "",
        "z_C": ""
      }
    }
  },
  {
    "type": "3D Multi-Object Motion",
    "question": "\nThree objects move in different types of motion in 3D space:\n1. Object A (Linear Motion)  \n   - Initial velocity: [18.34, 3.72, 9.76] m/s  \n   - Acceleration: [-2.46, -2.45, -4.91] m/s\u00b2  \n   - Time: 8.24 s  \n   - Compute its final position (x_A, y_A, z_A). Assume it starts at (0, 0, 0).\n\n2. Object B (Circular Motion)  \n   - Radius: 4.56 meters  \n   - Speed: 7.1 m/s  \n   - Angular velocity: 1.56 rad/s  \n   - Time: 2.42 s  \n   - Rotating in the xz-plane  \n   - Compute its position (x_B, y_B, z_B), assuming it starts at (r_B, 0, 0).\n\n3. Object C (Projectile Motion)  \n   - Initial speed: [28.63, 29.69, 12.48] m/s  \n   - Launch angle: 72.72 degrees  \n   - Time: 7.21 s  \n   - Compute its position (x_C, y_C, z_C), assuming it starts from (0,0,0).\n",
    "parameters": {
      "object_A": {
        "v0": [
          18.34,
          3.72,
          9.76
        ],
        "a": [
          -2.46,
          -2.45,
          -4.91
        ],
        "t": 8.24
      },
      "object_B": {
        "r": 4.56,
        "v": 7.1,
        "omega": 1.56,
        "t": 2.42,
        "rotation_plane": "xz-plane"
      },
      "object_C": {
        "v0": [
          28.63,
          29.69,
          12.48
        ],
        "angle": 72.72,
        "t": 7.21
      }
    },
    "answer_json": {
      "pos_A": {
        "x_A": "",
        "y_A": "",
        "z_A": ""
      },
      "pos_B": {
        "x_B": "",
        "y_B": "",
        "z_B": ""
      },
      "pos_C": {
        "x_C": "",
        "y_C": "",
        "z_C": ""
      }
    }
  },
  {
    "type": "3D Multi-Object Motion",
    "question": "\nThree objects move in different types of motion in 3D space:\n1. Object A (Linear Motion)  \n   - Initial velocity: [9.68, 6.74, 19.99] m/s  \n   - Acceleration: [3.53, -3.93, -1.19] m/s\u00b2  \n   - Time: 4.23 s  \n   - Compute its final position (x_A, y_A, z_A). Assume it starts at (0, 0, 0).\n\n2. Object B (Circular Motion)  \n   - Radius: 1.83 meters  \n   - Speed: 7.29 m/s  \n   - Angular velocity: 3.98 rad/s  \n   - Time: 1.2 s  \n   - Rotating in the yz-plane  \n   - Compute its position (x_B, y_B, z_B), assuming it starts at (r_B, 0, 0).\n\n3. Object C (Projectile Motion)  \n   - Initial speed: [14.9, 5.2, 26.63] m/s  \n   - Launch angle: 61.7 degrees  \n   - Time: 9.76 s  \n   - Compute its position (x_C, y_C, z_C), assuming it starts from (0,0,0).\n",
    "parameters": {
      "object_A": {
        "v0": [
          9.68,
          6.74,
          19.99
        ],
        "a": [
          3.53,
          -3.93,
          -1.19
        ],
        "t": 4.23
      },
      "object_B": {
        "r": 1.83,
        "v": 7.29,
        "omega": 3.98,
        "t": 1.2,
        "rotation_plane": "yz-plane"
      },
      "object_C": {
        "v0": [
          14.9,
          5.2,
          26.63
        ],
        "angle": 61.7,
        "t": 9.76
      }
    },
    "answer_json": {
      "pos_A": {
        "x_A": "",
        "y_A": "",
        "z_A": ""
      },
      "pos_B": {
        "x_B": "",
        "y_B": "",
        "z_B": ""
      },
      "pos_C": {
        "x_C": "",
        "y_C": "",
        "z_C": ""
      }
    }
  },
  {
    "type": "3D Multi-Object Motion",
    "question": "\nThree objects move in different types of motion in 3D space:\n1. Object A (Linear Motion)  \n   - Initial velocity: [18.3, 15.16, 16.82] m/s  \n   - Acceleration: [4.03, 2.76, -2.7] m/s\u00b2  \n   - Time: 8.22 s  \n   - Compute its final position (x_A, y_A, z_A). Assume it starts at (0, 0, 0).\n\n2. Object B (Circular Motion)  \n   - Radius: 1.49 meters  \n   - Speed: 2.71 m/s  \n   - Angular velocity: 1.82 rad/s  \n   - Time: 3.26 s  \n   - Rotating in the yz-plane  \n   - Compute its position (x_B, y_B, z_B), assuming it starts at (r_B, 0, 0).\n\n3. Object C (Projectile Motion)  \n   - Initial speed: [24.19, 22.02, 8.42] m/s  \n   - Launch angle: 20.83 degrees  \n   - Time: 6.65 s  \n   - Compute its position (x_C, y_C, z_C), assuming it starts from (0,0,0).\n",
    "parameters": {
      "object_A": {
        "v0": [
          18.3,
          15.16,
          16.82
        ],
        "a": [
          4.03,
          2.76,
          -2.7
        ],
        "t": 8.22
      },
      "object_B": {
        "r": 1.49,
        "v": 2.71,
        "omega": 1.82,
        "t": 3.26,
        "rotation_plane": "yz-plane"
      },
      "object_C": {
        "v0": [
          24.19,
          22.02,
          8.42
        ],
        "angle": 20.83,
        "t": 6.65
      }
    },
    "answer_json": {
      "pos_A": {
        "x_A": "",
        "y_A": "",
        "z_A": ""
      },
      "pos_B": {
        "x_B": "",
        "y_B": "",
        "z_B": ""
      },
      "pos_C": {
        "x_C": "",
        "y_C": "",
        "z_C": ""
      }
    }
  },
  {
    "type": "3D Multi-Object Motion",
    "question": "\nThree objects move in different types of motion in 3D space:\n1. Object A (Linear Motion)  \n   - Initial velocity: [1.75, 15.98, 1.63] m/s  \n   - Acceleration: [-1.35, -3.69, 4.1] m/s\u00b2  \n   - Time: 3.94 s  \n   - Compute its final position (x_A, y_A, z_A). Assume it starts at (0, 0, 0).\n\n2. Object B (Circular Motion)  \n   - Radius: 2.37 meters  \n   - Speed: 2.81 m/s  \n   - Angular velocity: 1.19 rad/s  \n   - Time: 8.08 s  \n   - Rotating in the xz-plane  \n   - Compute its position (x_B, y_B, z_B), assuming it starts at (r_B, 0, 0).\n\n3. Object C (Projectile Motion)  \n   - Initial speed: [18.27, 27.84, 25.76] m/s  \n   - Launch angle: 30.42 degrees  \n   - Time: 8.42 s  \n   - Compute its position (x_C, y_C, z_C), assuming it starts from (0,0,0).\n",
    "parameters": {
      "object_A": {
        "v0": [
          1.75,
          15.98,
          1.63
        ],
        "a": [
          -1.35,
          -3.69,
          4.1
        ],
        "t": 3.94
      },
      "object_B": {
        "r": 2.37,
        "v": 2.81,
        "omega": 1.19,
        "t": 8.08,
        "rotation_plane": "xz-plane"
      },
      "object_C": {
        "v0": [
          18.27,
          27.84,
          25.76
        ],
        "angle": 30.42,
        "t": 8.42
      }
    },
    "answer_json": {
      "pos_A": {
        "x_A": "",
        "y_A": "",
        "z_A": ""
      },
      "pos_B": {
        "x_B": "",
        "y_B": "",
        "z_B": ""
      },
      "pos_C": {
        "x_C": "",
        "y_C": "",
        "z_C": ""
      }
    }
  },
  {
    "type": "3D Multi-Object Motion",
    "question": "\nThree objects move in different types of motion in 3D space:\n1. Object A (Linear Motion)  \n   - Initial velocity: [10.16, 16.32, 15.18] m/s  \n   - Acceleration: [-1.61, -3.85, 4.63] m/s\u00b2  \n   - Time: 2.27 s  \n   - Compute its final position (x_A, y_A, z_A). Assume it starts at (0, 0, 0).\n\n2. Object B (Circular Motion)  \n   - Radius: 4.85 meters  \n   - Speed: 8.74 m/s  \n   - Angular velocity: 1.8 rad/s  \n   - Time: 7.52 s  \n   - Rotating in the xz-plane  \n   - Compute its position (x_B, y_B, z_B), assuming it starts at (r_B, 0, 0).\n\n3. Object C (Projectile Motion)  \n   - Initial speed: [29.18, 25.11, 14.14] m/s  \n   - Launch angle: 62.44 degrees  \n   - Time: 1.13 s  \n   - Compute its position (x_C, y_C, z_C), assuming it starts from (0,0,0).\n",
    "parameters": {
      "object_A": {
        "v0": [
          10.16,
          16.32,
          15.18
        ],
        "a": [
          -1.61,
          -3.85,
          4.63
        ],
        "t": 2.27
      },
      "object_B": {
        "r": 4.85,
        "v": 8.74,
        "omega": 1.8,
        "t": 7.52,
        "rotation_plane": "xz-plane"
      },
      "object_C": {
        "v0": [
          29.18,
          25.11,
          14.14
        ],
        "angle": 62.44,
        "t": 1.13
      }
    },
    "answer_json": {
      "pos_A": {
        "x_A": "",
        "y_A": "",
        "z_A": ""
      },
      "pos_B": {
        "x_B": "",
        "y_B": "",
        "z_B": ""
      },
      "pos_C": {
        "x_C": "",
        "y_C": "",
        "z_C": ""
      }
    }
  },
  {
    "type": "3D Multi-Object Motion",
    "question": "\nThree objects move in different types of motion in 3D space:\n1. Object A (Linear Motion)  \n   - Initial velocity: [11.19, 9.64, 13.78] m/s  \n   - Acceleration: [1.72, 0.85, 3.22] m/s\u00b2  \n   - Time: 9.46 s  \n   - Compute its final position (x_A, y_A, z_A). Assume it starts at (0, 0, 0).\n\n2. Object B (Circular Motion)  \n   - Radius: 0.99 meters  \n   - Speed: 3.1 m/s  \n   - Angular velocity: 3.13 rad/s  \n   - Time: 1.23 s  \n   - Rotating in the yz-plane  \n   - Compute its position (x_B, y_B, z_B), assuming it starts at (r_B, 0, 0).\n\n3. Object C (Projectile Motion)  \n   - Initial speed: [13.2, 20.25, 21.19] m/s  \n   - Launch angle: 53.12 degrees  \n   - Time: 5.18 s  \n   - Compute its position (x_C, y_C, z_C), assuming it starts from (0,0,0).\n",
    "parameters": {
      "object_A": {
        "v0": [
          11.19,
          9.64,
          13.78
        ],
        "a": [
          1.72,
          0.85,
          3.22
        ],
        "t": 9.46
      },
      "object_B": {
        "r": 0.99,
        "v": 3.1,
        "omega": 3.13,
        "t": 1.23,
        "rotation_plane": "yz-plane"
      },
      "object_C": {
        "v0": [
          13.2,
          20.25,
          21.19
        ],
        "angle": 53.12,
        "t": 5.18
      }
    },
    "answer_json": {
      "pos_A": {
        "x_A": "",
        "y_A": "",
        "z_A": ""
      },
      "pos_B": {
        "x_B": "",
        "y_B": "",
        "z_B": ""
      },
      "pos_C": {
        "x_C": "",
        "y_C": "",
        "z_C": ""
      }
    }
  },
  {
    "type": "3D Multi-Object Motion",
    "question": "\nThree objects move in different types of motion in 3D space:\n1. Object A (Linear Motion)  \n   - Initial velocity: [14.32, 13.34, 3.22] m/s  \n   - Acceleration: [-4.55, -4.63, 4.96] m/s\u00b2  \n   - Time: 2.05 s  \n   - Compute its final position (x_A, y_A, z_A). Assume it starts at (0, 0, 0).\n\n2. Object B (Circular Motion)  \n   - Radius: 1.56 meters  \n   - Speed: 5.84 m/s  \n   - Angular velocity: 3.74 rad/s  \n   - Time: 4.5 s  \n   - Rotating in the xz-plane  \n   - Compute its position (x_B, y_B, z_B), assuming it starts at (r_B, 0, 0).\n\n3. Object C (Projectile Motion)  \n   - Initial speed: [21.76, 23.58, 28.65] m/s  \n   - Launch angle: 40.15 degrees  \n   - Time: 7.68 s  \n   - Compute its position (x_C, y_C, z_C), assuming it starts from (0,0,0).\n",
    "parameters": {
      "object_A": {
        "v0": [
          14.32,
          13.34,
          3.22
        ],
        "a": [
          -4.55,
          -4.63,
          4.96
        ],
        "t": 2.05
      },
      "object_B": {
        "r": 1.56,
        "v": 5.84,
        "omega": 3.74,
        "t": 4.5,
        "rotation_plane": "xz-plane"
      },
      "object_C": {
        "v0": [
          21.76,
          23.58,
          28.65
        ],
        "angle": 40.15,
        "t": 7.68
      }
    },
    "answer_json": {
      "pos_A": {
        "x_A": "",
        "y_A": "",
        "z_A": ""
      },
      "pos_B": {
        "x_B": "",
        "y_B": "",
        "z_B": ""
      },
      "pos_C": {
        "x_C": "",
        "y_C": "",
        "z_C": ""
      }
    }
  },
  {
    "type": "3D Multi-Object Motion",
    "question": "\nThree objects move in different types of motion in 3D space:\n1. Object A (Linear Motion)  \n   - Initial velocity: [3.94, 8.88, 2.88] m/s  \n   - Acceleration: [-0.11, -0.92, 4.52] m/s\u00b2  \n   - Time: 1.29 s  \n   - Compute its final position (x_A, y_A, z_A). Assume it starts at (0, 0, 0).\n\n2. Object B (Circular Motion)  \n   - Radius: 2.17 meters  \n   - Speed: 4.99 m/s  \n   - Angular velocity: 2.3 rad/s  \n   - Time: 9.55 s  \n   - Rotating in the xz-plane  \n   - Compute its position (x_B, y_B, z_B), assuming it starts at (r_B, 0, 0).\n\n3. Object C (Projectile Motion)  \n   - Initial speed: [7.48, 22.14, 18.61] m/s  \n   - Launch angle: 73.67 degrees  \n   - Time: 4.23 s  \n   - Compute its position (x_C, y_C, z_C), assuming it starts from (0,0,0).\n",
    "parameters": {
      "object_A": {
        "v0": [
          3.94,
          8.88,
          2.88
        ],
        "a": [
          -0.11,
          -0.92,
          4.52
        ],
        "t": 1.29
      },
      "object_B": {
        "r": 2.17,
        "v": 4.99,
        "omega": 2.3,
        "t": 9.55,
        "rotation_plane": "xz-plane"
      },
      "object_C": {
        "v0": [
          7.48,
          22.14,
          18.61
        ],
        "angle": 73.67,
        "t": 4.23
      }
    },
    "answer_json": {
      "pos_A": {
        "x_A": "",
        "y_A": "",
        "z_A": ""
      },
      "pos_B": {
        "x_B": "",
        "y_B": "",
        "z_B": ""
      },
      "pos_C": {
        "x_C": "",
        "y_C": "",
        "z_C": ""
      }
    }
  },
  {
    "type": "3D Multi-Object Motion",
    "question": "\nThree objects move in different types of motion in 3D space:\n1. Object A (Linear Motion)  \n   - Initial velocity: [8.56, 4.61, 3.32] m/s  \n   - Acceleration: [3.48, -0.45, 1.63] m/s\u00b2  \n   - Time: 6.78 s  \n   - Compute its final position (x_A, y_A, z_A). Assume it starts at (0, 0, 0).\n\n2. Object B (Circular Motion)  \n   - Radius: 3.19 meters  \n   - Speed: 1.19 m/s  \n   - Angular velocity: 0.37 rad/s  \n   - Time: 8.08 s  \n   - Rotating in the xy-plane  \n   - Compute its position (x_B, y_B, z_B), assuming it starts at (r_B, 0, 0).\n\n3. Object C (Projectile Motion)  \n   - Initial speed: [29.72, 24.67, 10.13] m/s  \n   - Launch angle: 64.79 degrees  \n   - Time: 5.99 s  \n   - Compute its position (x_C, y_C, z_C), assuming it starts from (0,0,0).\n",
    "parameters": {
      "object_A": {
        "v0": [
          8.56,
          4.61,
          3.32
        ],
        "a": [
          3.48,
          -0.45,
          1.63
        ],
        "t": 6.78
      },
      "object_B": {
        "r": 3.19,
        "v": 1.19,
        "omega": 0.37,
        "t": 8.08,
        "rotation_plane": "xy-plane"
      },
      "object_C": {
        "v0": [
          29.72,
          24.67,
          10.13
        ],
        "angle": 64.79,
        "t": 5.99
      }
    },
    "answer_json": {
      "pos_A": {
        "x_A": "",
        "y_A": "",
        "z_A": ""
      },
      "pos_B": {
        "x_B": "",
        "y_B": "",
        "z_B": ""
      },
      "pos_C": {
        "x_C": "",
        "y_C": "",
        "z_C": ""
      }
    }
  },
  {
    "type": "3D Multi-Object Motion",
    "question": "\nThree objects move in different types of motion in 3D space:\n1. Object A (Linear Motion)  \n   - Initial velocity: [12.14, 16.45, 5.43] m/s  \n   - Acceleration: [2.74, 2.89, 0.96] m/s\u00b2  \n   - Time: 3.5 s  \n   - Compute its final position (x_A, y_A, z_A). Assume it starts at (0, 0, 0).\n\n2. Object B (Circular Motion)  \n   - Radius: 4.93 meters  \n   - Speed: 9.89 m/s  \n   - Angular velocity: 2.01 rad/s  \n   - Time: 5.86 s  \n   - Rotating in the xy-plane  \n   - Compute its position (x_B, y_B, z_B), assuming it starts at (r_B, 0, 0).\n\n3. Object C (Projectile Motion)  \n   - Initial speed: [7.75, 26.66, 8.3] m/s  \n   - Launch angle: 36.49 degrees  \n   - Time: 8.1 s  \n   - Compute its position (x_C, y_C, z_C), assuming it starts from (0,0,0).\n",
    "parameters": {
      "object_A": {
        "v0": [
          12.14,
          16.45,
          5.43
        ],
        "a": [
          2.74,
          2.89,
          0.96
        ],
        "t": 3.5
      },
      "object_B": {
        "r": 4.93,
        "v": 9.89,
        "omega": 2.01,
        "t": 5.86,
        "rotation_plane": "xy-plane"
      },
      "object_C": {
        "v0": [
          7.75,
          26.66,
          8.3
        ],
        "angle": 36.49,
        "t": 8.1
      }
    },
    "answer_json": {
      "pos_A": {
        "x_A": "",
        "y_A": "",
        "z_A": ""
      },
      "pos_B": {
        "x_B": "",
        "y_B": "",
        "z_B": ""
      },
      "pos_C": {
        "x_C": "",
        "y_C": "",
        "z_C": ""
      }
    }
  },
  {
    "type": "3D Multi-Object Motion",
    "question": "\nThree objects move in different types of motion in 3D space:\n1. Object A (Linear Motion)  \n   - Initial velocity: [12.19, 1.3, 6.04] m/s  \n   - Acceleration: [-3.73, -0.79, -3.86] m/s\u00b2  \n   - Time: 1.57 s  \n   - Compute its final position (x_A, y_A, z_A). Assume it starts at (0, 0, 0).\n\n2. Object B (Circular Motion)  \n   - Radius: 2.52 meters  \n   - Speed: 4.26 m/s  \n   - Angular velocity: 1.69 rad/s  \n   - Time: 6.34 s  \n   - Rotating in the xz-plane  \n   - Compute its position (x_B, y_B, z_B), assuming it starts at (r_B, 0, 0).\n\n3. Object C (Projectile Motion)  \n   - Initial speed: [17.6, 28.64, 6.08] m/s  \n   - Launch angle: 61.99 degrees  \n   - Time: 8.8 s  \n   - Compute its position (x_C, y_C, z_C), assuming it starts from (0,0,0).\n",
    "parameters": {
      "object_A": {
        "v0": [
          12.19,
          1.3,
          6.04
        ],
        "a": [
          -3.73,
          -0.79,
          -3.86
        ],
        "t": 1.57
      },
      "object_B": {
        "r": 2.52,
        "v": 4.26,
        "omega": 1.69,
        "t": 6.34,
        "rotation_plane": "xz-plane"
      },
      "object_C": {
        "v0": [
          17.6,
          28.64,
          6.08
        ],
        "angle": 61.99,
        "t": 8.8
      }
    },
    "answer_json": {
      "pos_A": {
        "x_A": "",
        "y_A": "",
        "z_A": ""
      },
      "pos_B": {
        "x_B": "",
        "y_B": "",
        "z_B": ""
      },
      "pos_C": {
        "x_C": "",
        "y_C": "",
        "z_C": ""
      }
    }
  },
  {
    "type": "3D Multi-Object Motion",
    "question": "\nThree objects move in different types of motion in 3D space:\n1. Object A (Linear Motion)  \n   - Initial velocity: [10.91, 9.7, 19.32] m/s  \n   - Acceleration: [-4.39, -0.21, -0.98] m/s\u00b2  \n   - Time: 7.17 s  \n   - Compute its final position (x_A, y_A, z_A). Assume it starts at (0, 0, 0).\n\n2. Object B (Circular Motion)  \n   - Radius: 2.71 meters  \n   - Speed: 9.19 m/s  \n   - Angular velocity: 3.39 rad/s  \n   - Time: 1.66 s  \n   - Rotating in the xy-plane  \n   - Compute its position (x_B, y_B, z_B), assuming it starts at (r_B, 0, 0).\n\n3. Object C (Projectile Motion)  \n   - Initial speed: [13.05, 8.71, 8.15] m/s  \n   - Launch angle: 52.46 degrees  \n   - Time: 6.27 s  \n   - Compute its position (x_C, y_C, z_C), assuming it starts from (0,0,0).\n",
    "parameters": {
      "object_A": {
        "v0": [
          10.91,
          9.7,
          19.32
        ],
        "a": [
          -4.39,
          -0.21,
          -0.98
        ],
        "t": 7.17
      },
      "object_B": {
        "r": 2.71,
        "v": 9.19,
        "omega": 3.39,
        "t": 1.66,
        "rotation_plane": "xy-plane"
      },
      "object_C": {
        "v0": [
          13.05,
          8.71,
          8.15
        ],
        "angle": 52.46,
        "t": 6.27
      }
    },
    "answer_json": {
      "pos_A": {
        "x_A": "",
        "y_A": "",
        "z_A": ""
      },
      "pos_B": {
        "x_B": "",
        "y_B": "",
        "z_B": ""
      },
      "pos_C": {
        "x_C": "",
        "y_C": "",
        "z_C": ""
      }
    }
  },
  {
    "type": "3D Multi-Object Motion",
    "question": "\nThree objects move in different types of motion in 3D space:\n1. Object A (Linear Motion)  \n   - Initial velocity: [14.53, 8.24, 12.35] m/s  \n   - Acceleration: [-2.05, 0.06, -0.7] m/s\u00b2  \n   - Time: 8.14 s  \n   - Compute its final position (x_A, y_A, z_A). Assume it starts at (0, 0, 0).\n\n2. Object B (Circular Motion)  \n   - Radius: 1.01 meters  \n   - Speed: 6.89 m/s  \n   - Angular velocity: 6.82 rad/s  \n   - Time: 8.9 s  \n   - Rotating in the yz-plane  \n   - Compute its position (x_B, y_B, z_B), assuming it starts at (r_B, 0, 0).\n\n3. Object C (Projectile Motion)  \n   - Initial speed: [23.02, 10.38, 16.29] m/s  \n   - Launch angle: 28.71 degrees  \n   - Time: 4.05 s  \n   - Compute its position (x_C, y_C, z_C), assuming it starts from (0,0,0).\n",
    "parameters": {
      "object_A": {
        "v0": [
          14.53,
          8.24,
          12.35
        ],
        "a": [
          -2.05,
          0.06,
          -0.7
        ],
        "t": 8.14
      },
      "object_B": {
        "r": 1.01,
        "v": 6.89,
        "omega": 6.82,
        "t": 8.9,
        "rotation_plane": "yz-plane"
      },
      "object_C": {
        "v0": [
          23.02,
          10.38,
          16.29
        ],
        "angle": 28.71,
        "t": 4.05
      }
    },
    "answer_json": {
      "pos_A": {
        "x_A": "",
        "y_A": "",
        "z_A": ""
      },
      "pos_B": {
        "x_B": "",
        "y_B": "",
        "z_B": ""
      },
      "pos_C": {
        "x_C": "",
        "y_C": "",
        "z_C": ""
      }
    }
  },
  {
    "type": "3D Multi-Object Motion",
    "question": "\nThree objects move in different types of motion in 3D space:\n1. Object A (Linear Motion)  \n   - Initial velocity: [9.62, 8.9, 2.81] m/s  \n   - Acceleration: [-0.73, 1.65, -1.26] m/s\u00b2  \n   - Time: 2.37 s  \n   - Compute its final position (x_A, y_A, z_A). Assume it starts at (0, 0, 0).\n\n2. Object B (Circular Motion)  \n   - Radius: 4.65 meters  \n   - Speed: 1.6 m/s  \n   - Angular velocity: 0.34 rad/s  \n   - Time: 8.49 s  \n   - Rotating in the xy-plane  \n   - Compute its position (x_B, y_B, z_B), assuming it starts at (r_B, 0, 0).\n\n3. Object C (Projectile Motion)  \n   - Initial speed: [15.8, 23.61, 14.32] m/s  \n   - Launch angle: 22.81 degrees  \n   - Time: 1.54 s  \n   - Compute its position (x_C, y_C, z_C), assuming it starts from (0,0,0).\n",
    "parameters": {
      "object_A": {
        "v0": [
          9.62,
          8.9,
          2.81
        ],
        "a": [
          -0.73,
          1.65,
          -1.26
        ],
        "t": 2.37
      },
      "object_B": {
        "r": 4.65,
        "v": 1.6,
        "omega": 0.34,
        "t": 8.49,
        "rotation_plane": "xy-plane"
      },
      "object_C": {
        "v0": [
          15.8,
          23.61,
          14.32
        ],
        "angle": 22.81,
        "t": 1.54
      }
    },
    "answer_json": {
      "pos_A": {
        "x_A": "",
        "y_A": "",
        "z_A": ""
      },
      "pos_B": {
        "x_B": "",
        "y_B": "",
        "z_B": ""
      },
      "pos_C": {
        "x_C": "",
        "y_C": "",
        "z_C": ""
      }
    }
  },
  {
    "type": "3D Multi-Object Motion",
    "question": "\nThree objects move in different types of motion in 3D space:\n1. Object A (Linear Motion)  \n   - Initial velocity: [19.18, 11.67, 13.73] m/s  \n   - Acceleration: [-0.89, 3.74, 4.41] m/s\u00b2  \n   - Time: 4.81 s  \n   - Compute its final position (x_A, y_A, z_A). Assume it starts at (0, 0, 0).\n\n2. Object B (Circular Motion)  \n   - Radius: 4.62 meters  \n   - Speed: 1.46 m/s  \n   - Angular velocity: 0.32 rad/s  \n   - Time: 3.59 s  \n   - Rotating in the xz-plane  \n   - Compute its position (x_B, y_B, z_B), assuming it starts at (r_B, 0, 0).\n\n3. Object C (Projectile Motion)  \n   - Initial speed: [13.79, 19.45, 10.32] m/s  \n   - Launch angle: 54.4 degrees  \n   - Time: 3.02 s  \n   - Compute its position (x_C, y_C, z_C), assuming it starts from (0,0,0).\n",
    "parameters": {
      "object_A": {
        "v0": [
          19.18,
          11.67,
          13.73
        ],
        "a": [
          -0.89,
          3.74,
          4.41
        ],
        "t": 4.81
      },
      "object_B": {
        "r": 4.62,
        "v": 1.46,
        "omega": 0.32,
        "t": 3.59,
        "rotation_plane": "xz-plane"
      },
      "object_C": {
        "v0": [
          13.79,
          19.45,
          10.32
        ],
        "angle": 54.4,
        "t": 3.02
      }
    },
    "answer_json": {
      "pos_A": {
        "x_A": "",
        "y_A": "",
        "z_A": ""
      },
      "pos_B": {
        "x_B": "",
        "y_B": "",
        "z_B": ""
      },
      "pos_C": {
        "x_C": "",
        "y_C": "",
        "z_C": ""
      }
    }
  },
  {
    "type": "3D Multi-Object Motion",
    "question": "\nThree objects move in different types of motion in 3D space:\n1. Object A (Linear Motion)  \n   - Initial velocity: [3.06, 17.06, 7.98] m/s  \n   - Acceleration: [2.63, 0.74, 3.07] m/s\u00b2  \n   - Time: 8.61 s  \n   - Compute its final position (x_A, y_A, z_A). Assume it starts at (0, 0, 0).\n\n2. Object B (Circular Motion)  \n   - Radius: 4.89 meters  \n   - Speed: 8.37 m/s  \n   - Angular velocity: 1.71 rad/s  \n   - Time: 6.52 s  \n   - Rotating in the yz-plane  \n   - Compute its position (x_B, y_B, z_B), assuming it starts at (r_B, 0, 0).\n\n3. Object C (Projectile Motion)  \n   - Initial speed: [18.92, 20.22, 21.45] m/s  \n   - Launch angle: 56.61 degrees  \n   - Time: 1.26 s  \n   - Compute its position (x_C, y_C, z_C), assuming it starts from (0,0,0).\n",
    "parameters": {
      "object_A": {
        "v0": [
          3.06,
          17.06,
          7.98
        ],
        "a": [
          2.63,
          0.74,
          3.07
        ],
        "t": 8.61
      },
      "object_B": {
        "r": 4.89,
        "v": 8.37,
        "omega": 1.71,
        "t": 6.52,
        "rotation_plane": "yz-plane"
      },
      "object_C": {
        "v0": [
          18.92,
          20.22,
          21.45
        ],
        "angle": 56.61,
        "t": 1.26
      }
    },
    "answer_json": {
      "pos_A": {
        "x_A": "",
        "y_A": "",
        "z_A": ""
      },
      "pos_B": {
        "x_B": "",
        "y_B": "",
        "z_B": ""
      },
      "pos_C": {
        "x_C": "",
        "y_C": "",
        "z_C": ""
      }
    }
  },
  {
    "type": "3D Multi-Object Motion",
    "question": "\nThree objects move in different types of motion in 3D space:\n1. Object A (Linear Motion)  \n   - Initial velocity: [6.19, 15.49, 18.51] m/s  \n   - Acceleration: [-1.49, -3.19, -3.57] m/s\u00b2  \n   - Time: 6.92 s  \n   - Compute its final position (x_A, y_A, z_A). Assume it starts at (0, 0, 0).\n\n2. Object B (Circular Motion)  \n   - Radius: 0.81 meters  \n   - Speed: 7.67 m/s  \n   - Angular velocity: 9.47 rad/s  \n   - Time: 9.75 s  \n   - Rotating in the xy-plane  \n   - Compute its position (x_B, y_B, z_B), assuming it starts at (r_B, 0, 0).\n\n3. Object C (Projectile Motion)  \n   - Initial speed: [23.65, 10.38, 15.5] m/s  \n   - Launch angle: 35.45 degrees  \n   - Time: 4.33 s  \n   - Compute its position (x_C, y_C, z_C), assuming it starts from (0,0,0).\n",
    "parameters": {
      "object_A": {
        "v0": [
          6.19,
          15.49,
          18.51
        ],
        "a": [
          -1.49,
          -3.19,
          -3.57
        ],
        "t": 6.92
      },
      "object_B": {
        "r": 0.81,
        "v": 7.67,
        "omega": 9.47,
        "t": 9.75,
        "rotation_plane": "xy-plane"
      },
      "object_C": {
        "v0": [
          23.65,
          10.38,
          15.5
        ],
        "angle": 35.45,
        "t": 4.33
      }
    },
    "answer_json": {
      "pos_A": {
        "x_A": "",
        "y_A": "",
        "z_A": ""
      },
      "pos_B": {
        "x_B": "",
        "y_B": "",
        "z_B": ""
      },
      "pos_C": {
        "x_C": "",
        "y_C": "",
        "z_C": ""
      }
    }
  },
  {
    "type": "3D Multi-Object Motion",
    "question": "\nThree objects move in different types of motion in 3D space:\n1. Object A (Linear Motion)  \n   - Initial velocity: [14.71, 15.76, 11.78] m/s  \n   - Acceleration: [-4.15, -4.47, -3.43] m/s\u00b2  \n   - Time: 6.56 s  \n   - Compute its final position (x_A, y_A, z_A). Assume it starts at (0, 0, 0).\n\n2. Object B (Circular Motion)  \n   - Radius: 3.53 meters  \n   - Speed: 3.45 m/s  \n   - Angular velocity: 0.98 rad/s  \n   - Time: 6.96 s  \n   - Rotating in the xz-plane  \n   - Compute its position (x_B, y_B, z_B), assuming it starts at (r_B, 0, 0).\n\n3. Object C (Projectile Motion)  \n   - Initial speed: [20.18, 15.35, 10.39] m/s  \n   - Launch angle: 45.74 degrees  \n   - Time: 4.11 s  \n   - Compute its position (x_C, y_C, z_C), assuming it starts from (0,0,0).\n",
    "parameters": {
      "object_A": {
        "v0": [
          14.71,
          15.76,
          11.78
        ],
        "a": [
          -4.15,
          -4.47,
          -3.43
        ],
        "t": 6.56
      },
      "object_B": {
        "r": 3.53,
        "v": 3.45,
        "omega": 0.98,
        "t": 6.96,
        "rotation_plane": "xz-plane"
      },
      "object_C": {
        "v0": [
          20.18,
          15.35,
          10.39
        ],
        "angle": 45.74,
        "t": 4.11
      }
    },
    "answer_json": {
      "pos_A": {
        "x_A": "",
        "y_A": "",
        "z_A": ""
      },
      "pos_B": {
        "x_B": "",
        "y_B": "",
        "z_B": ""
      },
      "pos_C": {
        "x_C": "",
        "y_C": "",
        "z_C": ""
      }
    }
  },
  {
    "type": "3D Multi-Object Motion",
    "question": "\nThree objects move in different types of motion in 3D space:\n1. Object A (Linear Motion)  \n   - Initial velocity: [3.11, 13.89, 12.27] m/s  \n   - Acceleration: [0.27, -1.92, -2.79] m/s\u00b2  \n   - Time: 9.86 s  \n   - Compute its final position (x_A, y_A, z_A). Assume it starts at (0, 0, 0).\n\n2. Object B (Circular Motion)  \n   - Radius: 0.75 meters  \n   - Speed: 2.84 m/s  \n   - Angular velocity: 3.79 rad/s  \n   - Time: 9.51 s  \n   - Rotating in the xy-plane  \n   - Compute its position (x_B, y_B, z_B), assuming it starts at (r_B, 0, 0).\n\n3. Object C (Projectile Motion)  \n   - Initial speed: [24.1, 12.24, 8.0] m/s  \n   - Launch angle: 44.84 degrees  \n   - Time: 4.88 s  \n   - Compute its position (x_C, y_C, z_C), assuming it starts from (0,0,0).\n",
    "parameters": {
      "object_A": {
        "v0": [
          3.11,
          13.89,
          12.27
        ],
        "a": [
          0.27,
          -1.92,
          -2.79
        ],
        "t": 9.86
      },
      "object_B": {
        "r": 0.75,
        "v": 2.84,
        "omega": 3.79,
        "t": 9.51,
        "rotation_plane": "xy-plane"
      },
      "object_C": {
        "v0": [
          24.1,
          12.24,
          8.0
        ],
        "angle": 44.84,
        "t": 4.88
      }
    },
    "answer_json": {
      "pos_A": {
        "x_A": "",
        "y_A": "",
        "z_A": ""
      },
      "pos_B": {
        "x_B": "",
        "y_B": "",
        "z_B": ""
      },
      "pos_C": {
        "x_C": "",
        "y_C": "",
        "z_C": ""
      }
    }
  },
  {
    "type": "3D Multi-Object Motion",
    "question": "\nThree objects move in different types of motion in 3D space:\n1. Object A (Linear Motion)  \n   - Initial velocity: [3.45, 11.12, 5.37] m/s  \n   - Acceleration: [0.59, 1.68, -1.46] m/s\u00b2  \n   - Time: 4.57 s  \n   - Compute its final position (x_A, y_A, z_A). Assume it starts at (0, 0, 0).\n\n2. Object B (Circular Motion)  \n   - Radius: 3.84 meters  \n   - Speed: 4.93 m/s  \n   - Angular velocity: 1.28 rad/s  \n   - Time: 5.14 s  \n   - Rotating in the xy-plane  \n   - Compute its position (x_B, y_B, z_B), assuming it starts at (r_B, 0, 0).\n\n3. Object C (Projectile Motion)  \n   - Initial speed: [26.55, 19.39, 19.33] m/s  \n   - Launch angle: 57.57 degrees  \n   - Time: 4.76 s  \n   - Compute its position (x_C, y_C, z_C), assuming it starts from (0,0,0).\n",
    "parameters": {
      "object_A": {
        "v0": [
          3.45,
          11.12,
          5.37
        ],
        "a": [
          0.59,
          1.68,
          -1.46
        ],
        "t": 4.57
      },
      "object_B": {
        "r": 3.84,
        "v": 4.93,
        "omega": 1.28,
        "t": 5.14,
        "rotation_plane": "xy-plane"
      },
      "object_C": {
        "v0": [
          26.55,
          19.39,
          19.33
        ],
        "angle": 57.57,
        "t": 4.76
      }
    },
    "answer_json": {
      "pos_A": {
        "x_A": "",
        "y_A": "",
        "z_A": ""
      },
      "pos_B": {
        "x_B": "",
        "y_B": "",
        "z_B": ""
      },
      "pos_C": {
        "x_C": "",
        "y_C": "",
        "z_C": ""
      }
    }
  },
  {
    "type": "3D Multi-Object Motion",
    "question": "\nThree objects move in different types of motion in 3D space:\n1. Object A (Linear Motion)  \n   - Initial velocity: [3.19, 1.4, 7.17] m/s  \n   - Acceleration: [3.01, 1.18, 3.32] m/s\u00b2  \n   - Time: 9.28 s  \n   - Compute its final position (x_A, y_A, z_A). Assume it starts at (0, 0, 0).\n\n2. Object B (Circular Motion)  \n   - Radius: 0.9 meters  \n   - Speed: 8.6 m/s  \n   - Angular velocity: 9.56 rad/s  \n   - Time: 3.19 s  \n   - Rotating in the yz-plane  \n   - Compute its position (x_B, y_B, z_B), assuming it starts at (r_B, 0, 0).\n\n3. Object C (Projectile Motion)  \n   - Initial speed: [15.01, 6.97, 26.76] m/s  \n   - Launch angle: 59.75 degrees  \n   - Time: 2.99 s  \n   - Compute its position (x_C, y_C, z_C), assuming it starts from (0,0,0).\n",
    "parameters": {
      "object_A": {
        "v0": [
          3.19,
          1.4,
          7.17
        ],
        "a": [
          3.01,
          1.18,
          3.32
        ],
        "t": 9.28
      },
      "object_B": {
        "r": 0.9,
        "v": 8.6,
        "omega": 9.56,
        "t": 3.19,
        "rotation_plane": "yz-plane"
      },
      "object_C": {
        "v0": [
          15.01,
          6.97,
          26.76
        ],
        "angle": 59.75,
        "t": 2.99
      }
    },
    "answer_json": {
      "pos_A": {
        "x_A": "",
        "y_A": "",
        "z_A": ""
      },
      "pos_B": {
        "x_B": "",
        "y_B": "",
        "z_B": ""
      },
      "pos_C": {
        "x_C": "",
        "y_C": "",
        "z_C": ""
      }
    }
  },
  {
    "type": "3D Multi-Object Motion",
    "question": "\nThree objects move in different types of motion in 3D space:\n1. Object A (Linear Motion)  \n   - Initial velocity: [15.8, 2.45, 13.03] m/s  \n   - Acceleration: [0.31, -3.06, 2.76] m/s\u00b2  \n   - Time: 4.16 s  \n   - Compute its final position (x_A, y_A, z_A). Assume it starts at (0, 0, 0).\n\n2. Object B (Circular Motion)  \n   - Radius: 4.81 meters  \n   - Speed: 6.81 m/s  \n   - Angular velocity: 1.42 rad/s  \n   - Time: 2.33 s  \n   - Rotating in the xy-plane  \n   - Compute its position (x_B, y_B, z_B), assuming it starts at (r_B, 0, 0).\n\n3. Object C (Projectile Motion)  \n   - Initial speed: [8.66, 9.93, 20.06] m/s  \n   - Launch angle: 60.61 degrees  \n   - Time: 6.9 s  \n   - Compute its position (x_C, y_C, z_C), assuming it starts from (0,0,0).\n",
    "parameters": {
      "object_A": {
        "v0": [
          15.8,
          2.45,
          13.03
        ],
        "a": [
          0.31,
          -3.06,
          2.76
        ],
        "t": 4.16
      },
      "object_B": {
        "r": 4.81,
        "v": 6.81,
        "omega": 1.42,
        "t": 2.33,
        "rotation_plane": "xy-plane"
      },
      "object_C": {
        "v0": [
          8.66,
          9.93,
          20.06
        ],
        "angle": 60.61,
        "t": 6.9
      }
    },
    "answer_json": {
      "pos_A": {
        "x_A": "",
        "y_A": "",
        "z_A": ""
      },
      "pos_B": {
        "x_B": "",
        "y_B": "",
        "z_B": ""
      },
      "pos_C": {
        "x_C": "",
        "y_C": "",
        "z_C": ""
      }
    }
  },
  {
    "type": "3D Multi-Object Motion",
    "question": "\nThree objects move in different types of motion in 3D space:\n1. Object A (Linear Motion)  \n   - Initial velocity: [4.37, 15.68, 10.39] m/s  \n   - Acceleration: [2.54, 2.6, -0.51] m/s\u00b2  \n   - Time: 9.32 s  \n   - Compute its final position (x_A, y_A, z_A). Assume it starts at (0, 0, 0).\n\n2. Object B (Circular Motion)  \n   - Radius: 3.04 meters  \n   - Speed: 6.72 m/s  \n   - Angular velocity: 2.21 rad/s  \n   - Time: 6.62 s  \n   - Rotating in the yz-plane  \n   - Compute its position (x_B, y_B, z_B), assuming it starts at (r_B, 0, 0).\n\n3. Object C (Projectile Motion)  \n   - Initial speed: [12.9, 15.99, 16.72] m/s  \n   - Launch angle: 52.88 degrees  \n   - Time: 8.17 s  \n   - Compute its position (x_C, y_C, z_C), assuming it starts from (0,0,0).\n",
    "parameters": {
      "object_A": {
        "v0": [
          4.37,
          15.68,
          10.39
        ],
        "a": [
          2.54,
          2.6,
          -0.51
        ],
        "t": 9.32
      },
      "object_B": {
        "r": 3.04,
        "v": 6.72,
        "omega": 2.21,
        "t": 6.62,
        "rotation_plane": "yz-plane"
      },
      "object_C": {
        "v0": [
          12.9,
          15.99,
          16.72
        ],
        "angle": 52.88,
        "t": 8.17
      }
    },
    "answer_json": {
      "pos_A": {
        "x_A": "",
        "y_A": "",
        "z_A": ""
      },
      "pos_B": {
        "x_B": "",
        "y_B": "",
        "z_B": ""
      },
      "pos_C": {
        "x_C": "",
        "y_C": "",
        "z_C": ""
      }
    }
  },
  {
    "type": "3D Multi-Object Motion",
    "question": "\nThree objects move in different types of motion in 3D space:\n1. Object A (Linear Motion)  \n   - Initial velocity: [12.24, 7.69, 2.41] m/s  \n   - Acceleration: [-0.38, -4.62, -1.31] m/s\u00b2  \n   - Time: 3.58 s  \n   - Compute its final position (x_A, y_A, z_A). Assume it starts at (0, 0, 0).\n\n2. Object B (Circular Motion)  \n   - Radius: 3.4 meters  \n   - Speed: 9.8 m/s  \n   - Angular velocity: 2.88 rad/s  \n   - Time: 1.81 s  \n   - Rotating in the yz-plane  \n   - Compute its position (x_B, y_B, z_B), assuming it starts at (r_B, 0, 0).\n\n3. Object C (Projectile Motion)  \n   - Initial speed: [17.68, 16.57, 18.86] m/s  \n   - Launch angle: 62.51 degrees  \n   - Time: 9.06 s  \n   - Compute its position (x_C, y_C, z_C), assuming it starts from (0,0,0).\n",
    "parameters": {
      "object_A": {
        "v0": [
          12.24,
          7.69,
          2.41
        ],
        "a": [
          -0.38,
          -4.62,
          -1.31
        ],
        "t": 3.58
      },
      "object_B": {
        "r": 3.4,
        "v": 9.8,
        "omega": 2.88,
        "t": 1.81,
        "rotation_plane": "yz-plane"
      },
      "object_C": {
        "v0": [
          17.68,
          16.57,
          18.86
        ],
        "angle": 62.51,
        "t": 9.06
      }
    },
    "answer_json": {
      "pos_A": {
        "x_A": "",
        "y_A": "",
        "z_A": ""
      },
      "pos_B": {
        "x_B": "",
        "y_B": "",
        "z_B": ""
      },
      "pos_C": {
        "x_C": "",
        "y_C": "",
        "z_C": ""
      }
    }
  },
  {
    "type": "3D Multi-Object Motion",
    "question": "\nThree objects move in different types of motion in 3D space:\n1. Object A (Linear Motion)  \n   - Initial velocity: [9.54, 16.39, 13.38] m/s  \n   - Acceleration: [-1.78, -0.24, -3.49] m/s\u00b2  \n   - Time: 1.56 s  \n   - Compute its final position (x_A, y_A, z_A). Assume it starts at (0, 0, 0).\n\n2. Object B (Circular Motion)  \n   - Radius: 0.97 meters  \n   - Speed: 9.09 m/s  \n   - Angular velocity: 9.37 rad/s  \n   - Time: 4.09 s  \n   - Rotating in the yz-plane  \n   - Compute its position (x_B, y_B, z_B), assuming it starts at (r_B, 0, 0).\n\n3. Object C (Projectile Motion)  \n   - Initial speed: [7.11, 21.15, 5.98] m/s  \n   - Launch angle: 57.46 degrees  \n   - Time: 9.92 s  \n   - Compute its position (x_C, y_C, z_C), assuming it starts from (0,0,0).\n",
    "parameters": {
      "object_A": {
        "v0": [
          9.54,
          16.39,
          13.38
        ],
        "a": [
          -1.78,
          -0.24,
          -3.49
        ],
        "t": 1.56
      },
      "object_B": {
        "r": 0.97,
        "v": 9.09,
        "omega": 9.37,
        "t": 4.09,
        "rotation_plane": "yz-plane"
      },
      "object_C": {
        "v0": [
          7.11,
          21.15,
          5.98
        ],
        "angle": 57.46,
        "t": 9.92
      }
    },
    "answer_json": {
      "pos_A": {
        "x_A": "",
        "y_A": "",
        "z_A": ""
      },
      "pos_B": {
        "x_B": "",
        "y_B": "",
        "z_B": ""
      },
      "pos_C": {
        "x_C": "",
        "y_C": "",
        "z_C": ""
      }
    }
  },
  {
    "type": "3D Multi-Object Motion",
    "question": "\nThree objects move in different types of motion in 3D space:\n1. Object A (Linear Motion)  \n   - Initial velocity: [10.96, 12.59, 7.91] m/s  \n   - Acceleration: [4.18, -1.13, 2.74] m/s\u00b2  \n   - Time: 7.11 s  \n   - Compute its final position (x_A, y_A, z_A). Assume it starts at (0, 0, 0).\n\n2. Object B (Circular Motion)  \n   - Radius: 0.74 meters  \n   - Speed: 6.68 m/s  \n   - Angular velocity: 9.03 rad/s  \n   - Time: 4.01 s  \n   - Rotating in the xz-plane  \n   - Compute its position (x_B, y_B, z_B), assuming it starts at (r_B, 0, 0).\n\n3. Object C (Projectile Motion)  \n   - Initial speed: [7.36, 21.96, 12.1] m/s  \n   - Launch angle: 58.42 degrees  \n   - Time: 6.91 s  \n   - Compute its position (x_C, y_C, z_C), assuming it starts from (0,0,0).\n",
    "parameters": {
      "object_A": {
        "v0": [
          10.96,
          12.59,
          7.91
        ],
        "a": [
          4.18,
          -1.13,
          2.74
        ],
        "t": 7.11
      },
      "object_B": {
        "r": 0.74,
        "v": 6.68,
        "omega": 9.03,
        "t": 4.01,
        "rotation_plane": "xz-plane"
      },
      "object_C": {
        "v0": [
          7.36,
          21.96,
          12.1
        ],
        "angle": 58.42,
        "t": 6.91
      }
    },
    "answer_json": {
      "pos_A": {
        "x_A": "",
        "y_A": "",
        "z_A": ""
      },
      "pos_B": {
        "x_B": "",
        "y_B": "",
        "z_B": ""
      },
      "pos_C": {
        "x_C": "",
        "y_C": "",
        "z_C": ""
      }
    }
  },
  {
    "type": "3D Multi-Object Motion",
    "question": "\nThree objects move in different types of motion in 3D space:\n1. Object A (Linear Motion)  \n   - Initial velocity: [18.22, 17.59, 7.33] m/s  \n   - Acceleration: [0.83, -3.59, -1.5] m/s\u00b2  \n   - Time: 9.71 s  \n   - Compute its final position (x_A, y_A, z_A). Assume it starts at (0, 0, 0).\n\n2. Object B (Circular Motion)  \n   - Radius: 3.64 meters  \n   - Speed: 4.53 m/s  \n   - Angular velocity: 1.24 rad/s  \n   - Time: 6.36 s  \n   - Rotating in the xy-plane  \n   - Compute its position (x_B, y_B, z_B), assuming it starts at (r_B, 0, 0).\n\n3. Object C (Projectile Motion)  \n   - Initial speed: [12.74, 14.42, 24.79] m/s  \n   - Launch angle: 63.79 degrees  \n   - Time: 7.03 s  \n   - Compute its position (x_C, y_C, z_C), assuming it starts from (0,0,0).\n",
    "parameters": {
      "object_A": {
        "v0": [
          18.22,
          17.59,
          7.33
        ],
        "a": [
          0.83,
          -3.59,
          -1.5
        ],
        "t": 9.71
      },
      "object_B": {
        "r": 3.64,
        "v": 4.53,
        "omega": 1.24,
        "t": 6.36,
        "rotation_plane": "xy-plane"
      },
      "object_C": {
        "v0": [
          12.74,
          14.42,
          24.79
        ],
        "angle": 63.79,
        "t": 7.03
      }
    },
    "answer_json": {
      "pos_A": {
        "x_A": "",
        "y_A": "",
        "z_A": ""
      },
      "pos_B": {
        "x_B": "",
        "y_B": "",
        "z_B": ""
      },
      "pos_C": {
        "x_C": "",
        "y_C": "",
        "z_C": ""
      }
    }
  },
  {
    "type": "3D Multi-Object Motion",
    "question": "\nThree objects move in different types of motion in 3D space:\n1. Object A (Linear Motion)  \n   - Initial velocity: [16.75, 15.04, 14.02] m/s  \n   - Acceleration: [0.26, 1.46, -0.77] m/s\u00b2  \n   - Time: 4.26 s  \n   - Compute its final position (x_A, y_A, z_A). Assume it starts at (0, 0, 0).\n\n2. Object B (Circular Motion)  \n   - Radius: 2.13 meters  \n   - Speed: 2.62 m/s  \n   - Angular velocity: 1.23 rad/s  \n   - Time: 2.93 s  \n   - Rotating in the xz-plane  \n   - Compute its position (x_B, y_B, z_B), assuming it starts at (r_B, 0, 0).\n\n3. Object C (Projectile Motion)  \n   - Initial speed: [9.8, 30.0, 8.87] m/s  \n   - Launch angle: 32.75 degrees  \n   - Time: 8.09 s  \n   - Compute its position (x_C, y_C, z_C), assuming it starts from (0,0,0).\n",
    "parameters": {
      "object_A": {
        "v0": [
          16.75,
          15.04,
          14.02
        ],
        "a": [
          0.26,
          1.46,
          -0.77
        ],
        "t": 4.26
      },
      "object_B": {
        "r": 2.13,
        "v": 2.62,
        "omega": 1.23,
        "t": 2.93,
        "rotation_plane": "xz-plane"
      },
      "object_C": {
        "v0": [
          9.8,
          30.0,
          8.87
        ],
        "angle": 32.75,
        "t": 8.09
      }
    },
    "answer_json": {
      "pos_A": {
        "x_A": "",
        "y_A": "",
        "z_A": ""
      },
      "pos_B": {
        "x_B": "",
        "y_B": "",
        "z_B": ""
      },
      "pos_C": {
        "x_C": "",
        "y_C": "",
        "z_C": ""
      }
    }
  },
  {
    "type": "3D Multi-Object Motion",
    "question": "\nThree objects move in different types of motion in 3D space:\n1. Object A (Linear Motion)  \n   - Initial velocity: [10.65, 11.26, 15.03] m/s  \n   - Acceleration: [0.27, 1.62, 3.76] m/s\u00b2  \n   - Time: 6.56 s  \n   - Compute its final position (x_A, y_A, z_A). Assume it starts at (0, 0, 0).\n\n2. Object B (Circular Motion)  \n   - Radius: 3.19 meters  \n   - Speed: 2.39 m/s  \n   - Angular velocity: 0.75 rad/s  \n   - Time: 2.63 s  \n   - Rotating in the yz-plane  \n   - Compute its position (x_B, y_B, z_B), assuming it starts at (r_B, 0, 0).\n\n3. Object C (Projectile Motion)  \n   - Initial speed: [24.28, 25.23, 9.14] m/s  \n   - Launch angle: 41.26 degrees  \n   - Time: 4.7 s  \n   - Compute its position (x_C, y_C, z_C), assuming it starts from (0,0,0).\n",
    "parameters": {
      "object_A": {
        "v0": [
          10.65,
          11.26,
          15.03
        ],
        "a": [
          0.27,
          1.62,
          3.76
        ],
        "t": 6.56
      },
      "object_B": {
        "r": 3.19,
        "v": 2.39,
        "omega": 0.75,
        "t": 2.63,
        "rotation_plane": "yz-plane"
      },
      "object_C": {
        "v0": [
          24.28,
          25.23,
          9.14
        ],
        "angle": 41.26,
        "t": 4.7
      }
    },
    "answer_json": {
      "pos_A": {
        "x_A": "",
        "y_A": "",
        "z_A": ""
      },
      "pos_B": {
        "x_B": "",
        "y_B": "",
        "z_B": ""
      },
      "pos_C": {
        "x_C": "",
        "y_C": "",
        "z_C": ""
      }
    }
  },
  {
    "type": "3D Multi-Object Motion",
    "question": "\nThree objects move in different types of motion in 3D space:\n1. Object A (Linear Motion)  \n   - Initial velocity: [13.85, 5.51, 9.44] m/s  \n   - Acceleration: [-2.15, 2.49, -0.51] m/s\u00b2  \n   - Time: 5.81 s  \n   - Compute its final position (x_A, y_A, z_A). Assume it starts at (0, 0, 0).\n\n2. Object B (Circular Motion)  \n   - Radius: 1.89 meters  \n   - Speed: 8.28 m/s  \n   - Angular velocity: 4.38 rad/s  \n   - Time: 5.22 s  \n   - Rotating in the xy-plane  \n   - Compute its position (x_B, y_B, z_B), assuming it starts at (r_B, 0, 0).\n\n3. Object C (Projectile Motion)  \n   - Initial speed: [14.2, 28.68, 29.61] m/s  \n   - Launch angle: 42.7 degrees  \n   - Time: 3.54 s  \n   - Compute its position (x_C, y_C, z_C), assuming it starts from (0,0,0).\n",
    "parameters": {
      "object_A": {
        "v0": [
          13.85,
          5.51,
          9.44
        ],
        "a": [
          -2.15,
          2.49,
          -0.51
        ],
        "t": 5.81
      },
      "object_B": {
        "r": 1.89,
        "v": 8.28,
        "omega": 4.38,
        "t": 5.22,
        "rotation_plane": "xy-plane"
      },
      "object_C": {
        "v0": [
          14.2,
          28.68,
          29.61
        ],
        "angle": 42.7,
        "t": 3.54
      }
    },
    "answer_json": {
      "pos_A": {
        "x_A": "",
        "y_A": "",
        "z_A": ""
      },
      "pos_B": {
        "x_B": "",
        "y_B": "",
        "z_B": ""
      },
      "pos_C": {
        "x_C": "",
        "y_C": "",
        "z_C": ""
      }
    }
  },
  {
    "type": "3D Multi-Object Motion",
    "question": "\nThree objects move in different types of motion in 3D space:\n1. Object A (Linear Motion)  \n   - Initial velocity: [8.26, 11.02, 19.36] m/s  \n   - Acceleration: [3.17, 3.01, -3.62] m/s\u00b2  \n   - Time: 3.25 s  \n   - Compute its final position (x_A, y_A, z_A). Assume it starts at (0, 0, 0).\n\n2. Object B (Circular Motion)  \n   - Radius: 3.39 meters  \n   - Speed: 8.87 m/s  \n   - Angular velocity: 2.62 rad/s  \n   - Time: 5.99 s  \n   - Rotating in the xy-plane  \n   - Compute its position (x_B, y_B, z_B), assuming it starts at (r_B, 0, 0).\n\n3. Object C (Projectile Motion)  \n   - Initial speed: [22.79, 17.9, 8.12] m/s  \n   - Launch angle: 20.03 degrees  \n   - Time: 2.44 s  \n   - Compute its position (x_C, y_C, z_C), assuming it starts from (0,0,0).\n",
    "parameters": {
      "object_A": {
        "v0": [
          8.26,
          11.02,
          19.36
        ],
        "a": [
          3.17,
          3.01,
          -3.62
        ],
        "t": 3.25
      },
      "object_B": {
        "r": 3.39,
        "v": 8.87,
        "omega": 2.62,
        "t": 5.99,
        "rotation_plane": "xy-plane"
      },
      "object_C": {
        "v0": [
          22.79,
          17.9,
          8.12
        ],
        "angle": 20.03,
        "t": 2.44
      }
    },
    "answer_json": {
      "pos_A": {
        "x_A": "",
        "y_A": "",
        "z_A": ""
      },
      "pos_B": {
        "x_B": "",
        "y_B": "",
        "z_B": ""
      },
      "pos_C": {
        "x_C": "",
        "y_C": "",
        "z_C": ""
      }
    }
  },
  {
    "type": "3D Multi-Object Motion",
    "question": "\nThree objects move in different types of motion in 3D space:\n1. Object A (Linear Motion)  \n   - Initial velocity: [9.54, 10.75, 16.79] m/s  \n   - Acceleration: [-4.08, 4.11, 3.17] m/s\u00b2  \n   - Time: 8.96 s  \n   - Compute its final position (x_A, y_A, z_A). Assume it starts at (0, 0, 0).\n\n2. Object B (Circular Motion)  \n   - Radius: 4.69 meters  \n   - Speed: 4.73 m/s  \n   - Angular velocity: 1.01 rad/s  \n   - Time: 4.57 s  \n   - Rotating in the xz-plane  \n   - Compute its position (x_B, y_B, z_B), assuming it starts at (r_B, 0, 0).\n\n3. Object C (Projectile Motion)  \n   - Initial speed: [10.89, 29.86, 14.37] m/s  \n   - Launch angle: 16.69 degrees  \n   - Time: 9.38 s  \n   - Compute its position (x_C, y_C, z_C), assuming it starts from (0,0,0).\n",
    "parameters": {
      "object_A": {
        "v0": [
          9.54,
          10.75,
          16.79
        ],
        "a": [
          -4.08,
          4.11,
          3.17
        ],
        "t": 8.96
      },
      "object_B": {
        "r": 4.69,
        "v": 4.73,
        "omega": 1.01,
        "t": 4.57,
        "rotation_plane": "xz-plane"
      },
      "object_C": {
        "v0": [
          10.89,
          29.86,
          14.37
        ],
        "angle": 16.69,
        "t": 9.38
      }
    },
    "answer_json": {
      "pos_A": {
        "x_A": "",
        "y_A": "",
        "z_A": ""
      },
      "pos_B": {
        "x_B": "",
        "y_B": "",
        "z_B": ""
      },
      "pos_C": {
        "x_C": "",
        "y_C": "",
        "z_C": ""
      }
    }
  },
  {
    "type": "3D Multi-Object Motion",
    "question": "\nThree objects move in different types of motion in 3D space:\n1. Object A (Linear Motion)  \n   - Initial velocity: [16.94, 13.35, 16.04] m/s  \n   - Acceleration: [-3.62, -2.13, 3.3] m/s\u00b2  \n   - Time: 7.26 s  \n   - Compute its final position (x_A, y_A, z_A). Assume it starts at (0, 0, 0).\n\n2. Object B (Circular Motion)  \n   - Radius: 1.12 meters  \n   - Speed: 7.35 m/s  \n   - Angular velocity: 6.56 rad/s  \n   - Time: 5.04 s  \n   - Rotating in the xy-plane  \n   - Compute its position (x_B, y_B, z_B), assuming it starts at (r_B, 0, 0).\n\n3. Object C (Projectile Motion)  \n   - Initial speed: [27.65, 5.48, 10.39] m/s  \n   - Launch angle: 23.97 degrees  \n   - Time: 9.46 s  \n   - Compute its position (x_C, y_C, z_C), assuming it starts from (0,0,0).\n",
    "parameters": {
      "object_A": {
        "v0": [
          16.94,
          13.35,
          16.04
        ],
        "a": [
          -3.62,
          -2.13,
          3.3
        ],
        "t": 7.26
      },
      "object_B": {
        "r": 1.12,
        "v": 7.35,
        "omega": 6.56,
        "t": 5.04,
        "rotation_plane": "xy-plane"
      },
      "object_C": {
        "v0": [
          27.65,
          5.48,
          10.39
        ],
        "angle": 23.97,
        "t": 9.46
      }
    },
    "answer_json": {
      "pos_A": {
        "x_A": "",
        "y_A": "",
        "z_A": ""
      },
      "pos_B": {
        "x_B": "",
        "y_B": "",
        "z_B": ""
      },
      "pos_C": {
        "x_C": "",
        "y_C": "",
        "z_C": ""
      }
    }
  },
  {
    "type": "3D Multi-Object Motion",
    "question": "\nThree objects move in different types of motion in 3D space:\n1. Object A (Linear Motion)  \n   - Initial velocity: [12.57, 9.04, 15.75] m/s  \n   - Acceleration: [-2.62, -3.78, -2.62] m/s\u00b2  \n   - Time: 6.75 s  \n   - Compute its final position (x_A, y_A, z_A). Assume it starts at (0, 0, 0).\n\n2. Object B (Circular Motion)  \n   - Radius: 3.3 meters  \n   - Speed: 1.57 m/s  \n   - Angular velocity: 0.48 rad/s  \n   - Time: 8.53 s  \n   - Rotating in the xz-plane  \n   - Compute its position (x_B, y_B, z_B), assuming it starts at (r_B, 0, 0).\n\n3. Object C (Projectile Motion)  \n   - Initial speed: [19.92, 5.41, 17.88] m/s  \n   - Launch angle: 29.52 degrees  \n   - Time: 2.29 s  \n   - Compute its position (x_C, y_C, z_C), assuming it starts from (0,0,0).\n",
    "parameters": {
      "object_A": {
        "v0": [
          12.57,
          9.04,
          15.75
        ],
        "a": [
          -2.62,
          -3.78,
          -2.62
        ],
        "t": 6.75
      },
      "object_B": {
        "r": 3.3,
        "v": 1.57,
        "omega": 0.48,
        "t": 8.53,
        "rotation_plane": "xz-plane"
      },
      "object_C": {
        "v0": [
          19.92,
          5.41,
          17.88
        ],
        "angle": 29.52,
        "t": 2.29
      }
    },
    "answer_json": {
      "pos_A": {
        "x_A": "",
        "y_A": "",
        "z_A": ""
      },
      "pos_B": {
        "x_B": "",
        "y_B": "",
        "z_B": ""
      },
      "pos_C": {
        "x_C": "",
        "y_C": "",
        "z_C": ""
      }
    }
  },
  {
    "type": "3D Multi-Object Motion",
    "question": "\nThree objects move in different types of motion in 3D space:\n1. Object A (Linear Motion)  \n   - Initial velocity: [9.16, 12.68, 5.57] m/s  \n   - Acceleration: [-0.83, 1.64, -4.14] m/s\u00b2  \n   - Time: 9.77 s  \n   - Compute its final position (x_A, y_A, z_A). Assume it starts at (0, 0, 0).\n\n2. Object B (Circular Motion)  \n   - Radius: 0.8 meters  \n   - Speed: 5.73 m/s  \n   - Angular velocity: 7.16 rad/s  \n   - Time: 5.57 s  \n   - Rotating in the yz-plane  \n   - Compute its position (x_B, y_B, z_B), assuming it starts at (r_B, 0, 0).\n\n3. Object C (Projectile Motion)  \n   - Initial speed: [18.85, 14.76, 16.75] m/s  \n   - Launch angle: 53.14 degrees  \n   - Time: 9.83 s  \n   - Compute its position (x_C, y_C, z_C), assuming it starts from (0,0,0).\n",
    "parameters": {
      "object_A": {
        "v0": [
          9.16,
          12.68,
          5.57
        ],
        "a": [
          -0.83,
          1.64,
          -4.14
        ],
        "t": 9.77
      },
      "object_B": {
        "r": 0.8,
        "v": 5.73,
        "omega": 7.16,
        "t": 5.57,
        "rotation_plane": "yz-plane"
      },
      "object_C": {
        "v0": [
          18.85,
          14.76,
          16.75
        ],
        "angle": 53.14,
        "t": 9.83
      }
    },
    "answer_json": {
      "pos_A": {
        "x_A": "",
        "y_A": "",
        "z_A": ""
      },
      "pos_B": {
        "x_B": "",
        "y_B": "",
        "z_B": ""
      },
      "pos_C": {
        "x_C": "",
        "y_C": "",
        "z_C": ""
      }
    }
  },
  {
    "type": "3D Multi-Object Motion",
    "question": "\nThree objects move in different types of motion in 3D space:\n1. Object A (Linear Motion)  \n   - Initial velocity: [5.82, 1.31, 15.98] m/s  \n   - Acceleration: [-1.55, 2.33, 1.28] m/s\u00b2  \n   - Time: 7.94 s  \n   - Compute its final position (x_A, y_A, z_A). Assume it starts at (0, 0, 0).\n\n2. Object B (Circular Motion)  \n   - Radius: 3.81 meters  \n   - Speed: 3.99 m/s  \n   - Angular velocity: 1.05 rad/s  \n   - Time: 1.4 s  \n   - Rotating in the yz-plane  \n   - Compute its position (x_B, y_B, z_B), assuming it starts at (r_B, 0, 0).\n\n3. Object C (Projectile Motion)  \n   - Initial speed: [13.46, 21.07, 25.76] m/s  \n   - Launch angle: 56.08 degrees  \n   - Time: 9.83 s  \n   - Compute its position (x_C, y_C, z_C), assuming it starts from (0,0,0).\n",
    "parameters": {
      "object_A": {
        "v0": [
          5.82,
          1.31,
          15.98
        ],
        "a": [
          -1.55,
          2.33,
          1.28
        ],
        "t": 7.94
      },
      "object_B": {
        "r": 3.81,
        "v": 3.99,
        "omega": 1.05,
        "t": 1.4,
        "rotation_plane": "yz-plane"
      },
      "object_C": {
        "v0": [
          13.46,
          21.07,
          25.76
        ],
        "angle": 56.08,
        "t": 9.83
      }
    },
    "answer_json": {
      "pos_A": {
        "x_A": "",
        "y_A": "",
        "z_A": ""
      },
      "pos_B": {
        "x_B": "",
        "y_B": "",
        "z_B": ""
      },
      "pos_C": {
        "x_C": "",
        "y_C": "",
        "z_C": ""
      }
    }
  },
  {
    "type": "3D Multi-Object Motion",
    "question": "\nThree objects move in different types of motion in 3D space:\n1. Object A (Linear Motion)  \n   - Initial velocity: [10.09, 4.46, 3.56] m/s  \n   - Acceleration: [2.16, 4.44, -4.63] m/s\u00b2  \n   - Time: 2.81 s  \n   - Compute its final position (x_A, y_A, z_A). Assume it starts at (0, 0, 0).\n\n2. Object B (Circular Motion)  \n   - Radius: 4.06 meters  \n   - Speed: 8.97 m/s  \n   - Angular velocity: 2.21 rad/s  \n   - Time: 3.84 s  \n   - Rotating in the xz-plane  \n   - Compute its position (x_B, y_B, z_B), assuming it starts at (r_B, 0, 0).\n\n3. Object C (Projectile Motion)  \n   - Initial speed: [17.88, 29.73, 18.58] m/s  \n   - Launch angle: 30.2 degrees  \n   - Time: 7.78 s  \n   - Compute its position (x_C, y_C, z_C), assuming it starts from (0,0,0).\n",
    "parameters": {
      "object_A": {
        "v0": [
          10.09,
          4.46,
          3.56
        ],
        "a": [
          2.16,
          4.44,
          -4.63
        ],
        "t": 2.81
      },
      "object_B": {
        "r": 4.06,
        "v": 8.97,
        "omega": 2.21,
        "t": 3.84,
        "rotation_plane": "xz-plane"
      },
      "object_C": {
        "v0": [
          17.88,
          29.73,
          18.58
        ],
        "angle": 30.2,
        "t": 7.78
      }
    },
    "answer_json": {
      "pos_A": {
        "x_A": "",
        "y_A": "",
        "z_A": ""
      },
      "pos_B": {
        "x_B": "",
        "y_B": "",
        "z_B": ""
      },
      "pos_C": {
        "x_C": "",
        "y_C": "",
        "z_C": ""
      }
    }
  },
  {
    "type": "3D Multi-Object Motion",
    "question": "\nThree objects move in different types of motion in 3D space:\n1. Object A (Linear Motion)  \n   - Initial velocity: [4.63, 7.78, 15.84] m/s  \n   - Acceleration: [3.66, -1.68, -3.76] m/s\u00b2  \n   - Time: 4.31 s  \n   - Compute its final position (x_A, y_A, z_A). Assume it starts at (0, 0, 0).\n\n2. Object B (Circular Motion)  \n   - Radius: 4.5 meters  \n   - Speed: 7.69 m/s  \n   - Angular velocity: 1.71 rad/s  \n   - Time: 9.05 s  \n   - Rotating in the xz-plane  \n   - Compute its position (x_B, y_B, z_B), assuming it starts at (r_B, 0, 0).\n\n3. Object C (Projectile Motion)  \n   - Initial speed: [13.48, 9.67, 22.3] m/s  \n   - Launch angle: 37.04 degrees  \n   - Time: 8.18 s  \n   - Compute its position (x_C, y_C, z_C), assuming it starts from (0,0,0).\n",
    "parameters": {
      "object_A": {
        "v0": [
          4.63,
          7.78,
          15.84
        ],
        "a": [
          3.66,
          -1.68,
          -3.76
        ],
        "t": 4.31
      },
      "object_B": {
        "r": 4.5,
        "v": 7.69,
        "omega": 1.71,
        "t": 9.05,
        "rotation_plane": "xz-plane"
      },
      "object_C": {
        "v0": [
          13.48,
          9.67,
          22.3
        ],
        "angle": 37.04,
        "t": 8.18
      }
    },
    "answer_json": {
      "pos_A": {
        "x_A": "",
        "y_A": "",
        "z_A": ""
      },
      "pos_B": {
        "x_B": "",
        "y_B": "",
        "z_B": ""
      },
      "pos_C": {
        "x_C": "",
        "y_C": "",
        "z_C": ""
      }
    }
  },
  {
    "type": "3D Multi-Object Motion",
    "question": "\nThree objects move in different types of motion in 3D space:\n1. Object A (Linear Motion)  \n   - Initial velocity: [6.07, 2.57, 9.07] m/s  \n   - Acceleration: [-0.69, 4.95, -3.2] m/s\u00b2  \n   - Time: 3.64 s  \n   - Compute its final position (x_A, y_A, z_A). Assume it starts at (0, 0, 0).\n\n2. Object B (Circular Motion)  \n   - Radius: 0.96 meters  \n   - Speed: 3.95 m/s  \n   - Angular velocity: 4.11 rad/s  \n   - Time: 3.66 s  \n   - Rotating in the xz-plane  \n   - Compute its position (x_B, y_B, z_B), assuming it starts at (r_B, 0, 0).\n\n3. Object C (Projectile Motion)  \n   - Initial speed: [20.07, 15.65, 22.24] m/s  \n   - Launch angle: 36.09 degrees  \n   - Time: 1.38 s  \n   - Compute its position (x_C, y_C, z_C), assuming it starts from (0,0,0).\n",
    "parameters": {
      "object_A": {
        "v0": [
          6.07,
          2.57,
          9.07
        ],
        "a": [
          -0.69,
          4.95,
          -3.2
        ],
        "t": 3.64
      },
      "object_B": {
        "r": 0.96,
        "v": 3.95,
        "omega": 4.11,
        "t": 3.66,
        "rotation_plane": "xz-plane"
      },
      "object_C": {
        "v0": [
          20.07,
          15.65,
          22.24
        ],
        "angle": 36.09,
        "t": 1.38
      }
    },
    "answer_json": {
      "pos_A": {
        "x_A": "",
        "y_A": "",
        "z_A": ""
      },
      "pos_B": {
        "x_B": "",
        "y_B": "",
        "z_B": ""
      },
      "pos_C": {
        "x_C": "",
        "y_C": "",
        "z_C": ""
      }
    }
  },
  {
    "type": "3D Multi-Object Motion",
    "question": "\nThree objects move in different types of motion in 3D space:\n1. Object A (Linear Motion)  \n   - Initial velocity: [17.53, 7.7, 19.96] m/s  \n   - Acceleration: [-2.25, 4.8, 4.48] m/s\u00b2  \n   - Time: 1.68 s  \n   - Compute its final position (x_A, y_A, z_A). Assume it starts at (0, 0, 0).\n\n2. Object B (Circular Motion)  \n   - Radius: 3.37 meters  \n   - Speed: 4.27 m/s  \n   - Angular velocity: 1.27 rad/s  \n   - Time: 8.21 s  \n   - Rotating in the yz-plane  \n   - Compute its position (x_B, y_B, z_B), assuming it starts at (r_B, 0, 0).\n\n3. Object C (Projectile Motion)  \n   - Initial speed: [9.0, 5.78, 26.22] m/s  \n   - Launch angle: 55.69 degrees  \n   - Time: 4.94 s  \n   - Compute its position (x_C, y_C, z_C), assuming it starts from (0,0,0).\n",
    "parameters": {
      "object_A": {
        "v0": [
          17.53,
          7.7,
          19.96
        ],
        "a": [
          -2.25,
          4.8,
          4.48
        ],
        "t": 1.68
      },
      "object_B": {
        "r": 3.37,
        "v": 4.27,
        "omega": 1.27,
        "t": 8.21,
        "rotation_plane": "yz-plane"
      },
      "object_C": {
        "v0": [
          9.0,
          5.78,
          26.22
        ],
        "angle": 55.69,
        "t": 4.94
      }
    },
    "answer_json": {
      "pos_A": {
        "x_A": "",
        "y_A": "",
        "z_A": ""
      },
      "pos_B": {
        "x_B": "",
        "y_B": "",
        "z_B": ""
      },
      "pos_C": {
        "x_C": "",
        "y_C": "",
        "z_C": ""
      }
    }
  },
  {
    "type": "3D Multi-Object Motion",
    "question": "\nThree objects move in different types of motion in 3D space:\n1. Object A (Linear Motion)  \n   - Initial velocity: [3.4, 5.48, 13.26] m/s  \n   - Acceleration: [-1.38, 4.49, -4.68] m/s\u00b2  \n   - Time: 2.38 s  \n   - Compute its final position (x_A, y_A, z_A). Assume it starts at (0, 0, 0).\n\n2. Object B (Circular Motion)  \n   - Radius: 2.52 meters  \n   - Speed: 4.34 m/s  \n   - Angular velocity: 1.72 rad/s  \n   - Time: 5.0 s  \n   - Rotating in the xy-plane  \n   - Compute its position (x_B, y_B, z_B), assuming it starts at (r_B, 0, 0).\n\n3. Object C (Projectile Motion)  \n   - Initial speed: [19.35, 18.24, 14.95] m/s  \n   - Launch angle: 53.97 degrees  \n   - Time: 3.25 s  \n   - Compute its position (x_C, y_C, z_C), assuming it starts from (0,0,0).\n",
    "parameters": {
      "object_A": {
        "v0": [
          3.4,
          5.48,
          13.26
        ],
        "a": [
          -1.38,
          4.49,
          -4.68
        ],
        "t": 2.38
      },
      "object_B": {
        "r": 2.52,
        "v": 4.34,
        "omega": 1.72,
        "t": 5.0,
        "rotation_plane": "xy-plane"
      },
      "object_C": {
        "v0": [
          19.35,
          18.24,
          14.95
        ],
        "angle": 53.97,
        "t": 3.25
      }
    },
    "answer_json": {
      "pos_A": {
        "x_A": "",
        "y_A": "",
        "z_A": ""
      },
      "pos_B": {
        "x_B": "",
        "y_B": "",
        "z_B": ""
      },
      "pos_C": {
        "x_C": "",
        "y_C": "",
        "z_C": ""
      }
    }
  },
  {
    "type": "3D Multi-Object Motion",
    "question": "\nThree objects move in different types of motion in 3D space:\n1. Object A (Linear Motion)  \n   - Initial velocity: [3.16, 14.98, 10.48] m/s  \n   - Acceleration: [-1.13, 0.62, -2.38] m/s\u00b2  \n   - Time: 3.34 s  \n   - Compute its final position (x_A, y_A, z_A). Assume it starts at (0, 0, 0).\n\n2. Object B (Circular Motion)  \n   - Radius: 2.51 meters  \n   - Speed: 9.97 m/s  \n   - Angular velocity: 3.97 rad/s  \n   - Time: 3.57 s  \n   - Rotating in the xz-plane  \n   - Compute its position (x_B, y_B, z_B), assuming it starts at (r_B, 0, 0).\n\n3. Object C (Projectile Motion)  \n   - Initial speed: [10.0, 8.39, 6.85] m/s  \n   - Launch angle: 25.36 degrees  \n   - Time: 7.42 s  \n   - Compute its position (x_C, y_C, z_C), assuming it starts from (0,0,0).\n",
    "parameters": {
      "object_A": {
        "v0": [
          3.16,
          14.98,
          10.48
        ],
        "a": [
          -1.13,
          0.62,
          -2.38
        ],
        "t": 3.34
      },
      "object_B": {
        "r": 2.51,
        "v": 9.97,
        "omega": 3.97,
        "t": 3.57,
        "rotation_plane": "xz-plane"
      },
      "object_C": {
        "v0": [
          10.0,
          8.39,
          6.85
        ],
        "angle": 25.36,
        "t": 7.42
      }
    },
    "answer_json": {
      "pos_A": {
        "x_A": "",
        "y_A": "",
        "z_A": ""
      },
      "pos_B": {
        "x_B": "",
        "y_B": "",
        "z_B": ""
      },
      "pos_C": {
        "x_C": "",
        "y_C": "",
        "z_C": ""
      }
    }
  },
  {
    "type": "3D Multi-Object Motion",
    "question": "\nThree objects move in different types of motion in 3D space:\n1. Object A (Linear Motion)  \n   - Initial velocity: [19.95, 16.4, 19.38] m/s  \n   - Acceleration: [4.87, 1.68, 2.1] m/s\u00b2  \n   - Time: 5.95 s  \n   - Compute its final position (x_A, y_A, z_A). Assume it starts at (0, 0, 0).\n\n2. Object B (Circular Motion)  \n   - Radius: 1.81 meters  \n   - Speed: 3.7 m/s  \n   - Angular velocity: 2.04 rad/s  \n   - Time: 2.42 s  \n   - Rotating in the yz-plane  \n   - Compute its position (x_B, y_B, z_B), assuming it starts at (r_B, 0, 0).\n\n3. Object C (Projectile Motion)  \n   - Initial speed: [28.18, 20.94, 24.84] m/s  \n   - Launch angle: 45.53 degrees  \n   - Time: 2.09 s  \n   - Compute its position (x_C, y_C, z_C), assuming it starts from (0,0,0).\n",
    "parameters": {
      "object_A": {
        "v0": [
          19.95,
          16.4,
          19.38
        ],
        "a": [
          4.87,
          1.68,
          2.1
        ],
        "t": 5.95
      },
      "object_B": {
        "r": 1.81,
        "v": 3.7,
        "omega": 2.04,
        "t": 2.42,
        "rotation_plane": "yz-plane"
      },
      "object_C": {
        "v0": [
          28.18,
          20.94,
          24.84
        ],
        "angle": 45.53,
        "t": 2.09
      }
    },
    "answer_json": {
      "pos_A": {
        "x_A": "",
        "y_A": "",
        "z_A": ""
      },
      "pos_B": {
        "x_B": "",
        "y_B": "",
        "z_B": ""
      },
      "pos_C": {
        "x_C": "",
        "y_C": "",
        "z_C": ""
      }
    }
  },
  {
    "type": "3D Multi-Object Motion",
    "question": "\nThree objects move in different types of motion in 3D space:\n1. Object A (Linear Motion)  \n   - Initial velocity: [4.82, 3.64, 16.02] m/s  \n   - Acceleration: [-4.74, 0.54, -1.31] m/s\u00b2  \n   - Time: 8.23 s  \n   - Compute its final position (x_A, y_A, z_A). Assume it starts at (0, 0, 0).\n\n2. Object B (Circular Motion)  \n   - Radius: 2.98 meters  \n   - Speed: 6.51 m/s  \n   - Angular velocity: 2.18 rad/s  \n   - Time: 1.78 s  \n   - Rotating in the xz-plane  \n   - Compute its position (x_B, y_B, z_B), assuming it starts at (r_B, 0, 0).\n\n3. Object C (Projectile Motion)  \n   - Initial speed: [14.95, 22.92, 16.97] m/s  \n   - Launch angle: 39.65 degrees  \n   - Time: 4.68 s  \n   - Compute its position (x_C, y_C, z_C), assuming it starts from (0,0,0).\n",
    "parameters": {
      "object_A": {
        "v0": [
          4.82,
          3.64,
          16.02
        ],
        "a": [
          -4.74,
          0.54,
          -1.31
        ],
        "t": 8.23
      },
      "object_B": {
        "r": 2.98,
        "v": 6.51,
        "omega": 2.18,
        "t": 1.78,
        "rotation_plane": "xz-plane"
      },
      "object_C": {
        "v0": [
          14.95,
          22.92,
          16.97
        ],
        "angle": 39.65,
        "t": 4.68
      }
    },
    "answer_json": {
      "pos_A": {
        "x_A": "",
        "y_A": "",
        "z_A": ""
      },
      "pos_B": {
        "x_B": "",
        "y_B": "",
        "z_B": ""
      },
      "pos_C": {
        "x_C": "",
        "y_C": "",
        "z_C": ""
      }
    }
  },
  {
    "type": "3D Collision",
    "question": "Two objects with masses 6.17 kg and 2.13 kg are located at positions [-1.83 -4.26 -0.34] and [ 0.17 -3.72  3.29], moving with velocities [1.03 1.76 5.36] m/s and [-7.42  0.06  7.36] m/s. Assuming an elastic collision, will they collide? If they collide, what are their final velocities?",
    "parameters": {
      "m1": 6.17,
      "m2": 2.13,
      "p1": [
        -1.83,
        -4.26,
        -0.34
      ],
      "p2": [
        0.17,
        -3.72,
        3.29
      ],
      "v1": [
        1.03,
        1.76,
        5.36
      ],
      "v2": [
        -7.42,
        0.06,
        7.36
      ]
    },
    "answer_json": {
      "will_collide": "true or false",
      "velocity_1": {
        "vel_1_x": "",
        "vel_1_y": "",
        "vel_1_z": ""
      },
      "velocity_2": {
        "vel_2_x": "",
        "vel_2_y": "",
        "vel_2_z": ""
      }
    }
  },
  {
    "type": "3D Collision",
    "question": "Two objects with masses 8.48 kg and 5.66 kg are located at positions [-1.96 -3.38  4.35] and [-2.75  4.47  0.19], moving with velocities [-4.32 -8.42 -6.07] m/s and [ 9.13 -4.51  2.5 ] m/s. Assuming an elastic collision, will they collide? If they collide, what are their final velocities?",
    "parameters": {
      "m1": 8.48,
      "m2": 5.66,
      "p1": [
        -1.96,
        -3.38,
        4.35
      ],
      "p2": [
        -2.75,
        4.47,
        0.19
      ],
      "v1": [
        -4.32,
        -8.42,
        -6.07
      ],
      "v2": [
        9.13,
        -4.51,
        2.5
      ]
    },
    "answer_json": {
      "will_collide": "true or false",
      "velocity_1": {
        "vel_1_x": "",
        "vel_1_y": "",
        "vel_1_z": ""
      },
      "velocity_2": {
        "vel_2_x": "",
        "vel_2_y": "",
        "vel_2_z": ""
      }
    }
  },
  {
    "type": "3D Collision",
    "question": "Two objects with masses 6.53 kg and 1.84 kg are located at positions [1.41 0.92 0.81] and [-3.29  1.24  4.02], moving with velocities [-3.25  8.48 -9.18] m/s and [ 7.28 -8.38  8.97] m/s. Assuming an elastic collision, will they collide? If they collide, what are their final velocities?",
    "parameters": {
      "m1": 6.53,
      "m2": 1.84,
      "p1": [
        1.41,
        0.92,
        0.81
      ],
      "p2": [
        -3.29,
        1.24,
        4.02
      ],
      "v1": [
        -3.25,
        8.48,
        -9.18
      ],
      "v2": [
        7.28,
        -8.38,
        8.97
      ]
    },
    "answer_json": {
      "will_collide": "true or false",
      "velocity_1": {
        "vel_1_x": "",
        "vel_1_y": "",
        "vel_1_z": ""
      },
      "velocity_2": {
        "vel_2_x": "",
        "vel_2_y": "",
        "vel_2_z": ""
      }
    }
  },
  {
    "type": "3D Collision",
    "question": "Two objects with masses 7.94 kg and 3.38 kg are located at positions [-2.89  0.72  1.18] and [-4.7   3.89  0.46], moving with velocities [ 2.84 -3.96 -5.1 ] m/s and [ 6.15 -1.88 -0.93] m/s. Assuming an elastic collision, will they collide? If they collide, what are their final velocities?",
    "parameters": {
      "m1": 7.94,
      "m2": 3.38,
      "p1": [
        -2.89,
        0.72,
        1.18
      ],
      "p2": [
        -4.7,
        3.89,
        0.46
      ],
      "v1": [
        2.84,
        -3.96,
        -5.1
      ],
      "v2": [
        6.15,
        -1.88,
        -0.93
      ]
    },
    "answer_json": {
      "will_collide": "true or false",
      "velocity_1": {
        "vel_1_x": "",
        "vel_1_y": "",
        "vel_1_z": ""
      },
      "velocity_2": {
        "vel_2_x": "",
        "vel_2_y": "",
        "vel_2_z": ""
      }
    }
  },
  {
    "type": "3D Collision",
    "question": "Two objects with masses 7.2 kg and 2.42 kg are located at positions [-0.84 -0.36 -1.6 ] and [-3.56  3.61 -1.81], moving with velocities [ 9.76 -3.09 -2.03] m/s and [ 5.21  0.3  -7.88] m/s. Assuming an elastic collision, will they collide? If they collide, what are their final velocities?",
    "parameters": {
      "m1": 7.2,
      "m2": 2.42,
      "p1": [
        -0.84,
        -0.36,
        -1.6
      ],
      "p2": [
        -3.56,
        3.61,
        -1.81
      ],
      "v1": [
        9.76,
        -3.09,
        -2.03
      ],
      "v2": [
        5.21,
        0.3,
        -7.88
      ]
    },
    "answer_json": {
      "will_collide": "true or false",
      "velocity_1": {
        "vel_1_x": "",
        "vel_1_y": "",
        "vel_1_z": ""
      },
      "velocity_2": {
        "vel_2_x": "",
        "vel_2_y": "",
        "vel_2_z": ""
      }
    }
  },
  {
    "type": "3D Collision",
    "question": "Two objects with masses 3.18 kg and 2.1 kg are located at positions [-0.5  -3.59 -4.49] and [ 4.45  3.64 -0.82], moving with velocities [9.25 8.05 6.27] m/s and [ 8.68  4.42 -6.2 ] m/s. Assuming an elastic collision, will they collide? If they collide, what are their final velocities?",
    "parameters": {
      "m1": 3.18,
      "m2": 2.1,
      "p1": [
        -0.5,
        -3.59,
        -4.49
      ],
      "p2": [
        4.45,
        3.64,
        -0.82
      ],
      "v1": [
        9.25,
        8.05,
        6.27
      ],
      "v2": [
        8.68,
        4.42,
        -6.2
      ]
    },
    "answer_json": {
      "will_collide": "true or false",
      "velocity_1": {
        "vel_1_x": "",
        "vel_1_y": "",
        "vel_1_z": ""
      },
      "velocity_2": {
        "vel_2_x": "",
        "vel_2_y": "",
        "vel_2_z": ""
      }
    }
  },
  {
    "type": "3D Collision",
    "question": "Two objects with masses 2.43 kg and 9.96 kg are located at positions [-0.33  3.79 -0.03] and [-4.1  -1.07 -0.43], moving with velocities [-5.19  1.67 -9.03] m/s and [-4.37  1.95  6.86] m/s. Assuming an elastic collision, will they collide? If they collide, what are their final velocities?",
    "parameters": {
      "m1": 2.43,
      "m2": 9.96,
      "p1": [
        -0.33,
        3.79,
        -0.03
      ],
      "p2": [
        -4.1,
        -1.07,
        -0.43
      ],
      "v1": [
        -5.19,
        1.67,
        -9.03
      ],
      "v2": [
        -4.37,
        1.95,
        6.86
      ]
    },
    "answer_json": {
      "will_collide": "true or false",
      "velocity_1": {
        "vel_1_x": "",
        "vel_1_y": "",
        "vel_1_z": ""
      },
      "velocity_2": {
        "vel_2_x": "",
        "vel_2_y": "",
        "vel_2_z": ""
      }
    }
  },
  {
    "type": "3D Collision",
    "question": "Two objects with masses 7.05 kg and 3.57 kg are located at positions [-4.92 -3.93 -3.66] and [-2.36 -1.34 -0.97], moving with velocities [-9.1  -8.98  1.24] m/s and [-2.75 -4.23 -2.27] m/s. Assuming an elastic collision, will they collide? If they collide, what are their final velocities?",
    "parameters": {
      "m1": 7.05,
      "m2": 3.57,
      "p1": [
        -4.92,
        -3.93,
        -3.66
      ],
      "p2": [
        -2.36,
        -1.34,
        -0.97
      ],
      "v1": [
        -9.1,
        -8.98,
        1.24
      ],
      "v2": [
        -2.75,
        -4.23,
        -2.27
      ]
    },
    "answer_json": {
      "will_collide": "true or false",
      "velocity_1": {
        "vel_1_x": "",
        "vel_1_y": "",
        "vel_1_z": ""
      },
      "velocity_2": {
        "vel_2_x": "",
        "vel_2_y": "",
        "vel_2_z": ""
      }
    }
  },
  {
    "type": "3D Collision",
    "question": "Two objects with masses 5.05 kg and 5.95 kg are located at positions [3.25 1.23 1.11] and [-3.71 -4.03 -1.27], moving with velocities [ 9.74  1.16 -2.69] m/s and [-7.11  2.05 -1.97] m/s. Assuming an elastic collision, will they collide? If they collide, what are their final velocities?",
    "parameters": {
      "m1": 5.05,
      "m2": 5.95,
      "p1": [
        3.25,
        1.23,
        1.11
      ],
      "p2": [
        -3.71,
        -4.03,
        -1.27
      ],
      "v1": [
        9.74,
        1.16,
        -2.69
      ],
      "v2": [
        -7.11,
        2.05,
        -1.97
      ]
    },
    "answer_json": {
      "will_collide": "true or false",
      "velocity_1": {
        "vel_1_x": "",
        "vel_1_y": "",
        "vel_1_z": ""
      },
      "velocity_2": {
        "vel_2_x": "",
        "vel_2_y": "",
        "vel_2_z": ""
      }
    }
  },
  {
    "type": "3D Collision",
    "question": "Two objects with masses 1.36 kg and 1.35 kg are located at positions [2.14 3.04 0.19] and [-3.51  3.93 -3.6 ], moving with velocities [ 8.63 -3.63 -2.14] m/s and [2.33 6.85 1.87] m/s. Assuming an elastic collision, will they collide? If they collide, what are their final velocities?",
    "parameters": {
      "m1": 1.36,
      "m2": 1.35,
      "p1": [
        2.14,
        3.04,
        0.19
      ],
      "p2": [
        -3.51,
        3.93,
        -3.6
      ],
      "v1": [
        8.63,
        -3.63,
        -2.14
      ],
      "v2": [
        2.33,
        6.85,
        1.87
      ]
    },
    "answer_json": {
      "will_collide": "true or false",
      "velocity_1": {
        "vel_1_x": "",
        "vel_1_y": "",
        "vel_1_z": ""
      },
      "velocity_2": {
        "vel_2_x": "",
        "vel_2_y": "",
        "vel_2_z": ""
      }
    }
  },
  {
    "type": "3D Collision",
    "question": "Two objects with masses 5.57 kg and 5.59 kg are located at positions [-0.1   0.63 -0.25] and [-4.83 -1.69 -3.9 ], moving with velocities [-1.67 -3.85  7.98] m/s and [7.44 2.59 1.94] m/s. Assuming an elastic collision, will they collide? If they collide, what are their final velocities?",
    "parameters": {
      "m1": 5.57,
      "m2": 5.59,
      "p1": [
        -0.1,
        0.63,
        -0.25
      ],
      "p2": [
        -4.83,
        -1.69,
        -3.9
      ],
      "v1": [
        -1.67,
        -3.85,
        7.98
      ],
      "v2": [
        7.44,
        2.59,
        1.94
      ]
    },
    "answer_json": {
      "will_collide": "true or false",
      "velocity_1": {
        "vel_1_x": "",
        "vel_1_y": "",
        "vel_1_z": ""
      },
      "velocity_2": {
        "vel_2_x": "",
        "vel_2_y": "",
        "vel_2_z": ""
      }
    }
  },
  {
    "type": "3D Collision",
    "question": "Two objects with masses 3.39 kg and 6.9 kg are located at positions [ 4.72  0.78 -2.72] and [-4.49 -0.2   0.24], moving with velocities [ 4.42  5.49 -2.4 ] m/s and [ 6.43 -5.16  1.45] m/s. Assuming an elastic collision, will they collide? If they collide, what are their final velocities?",
    "parameters": {
      "m1": 3.39,
      "m2": 6.9,
      "p1": [
        4.72,
        0.78,
        -2.72
      ],
      "p2": [
        -4.49,
        -0.2,
        0.24
      ],
      "v1": [
        4.42,
        5.49,
        -2.4
      ],
      "v2": [
        6.43,
        -5.16,
        1.45
      ]
    },
    "answer_json": {
      "will_collide": "true or false",
      "velocity_1": {
        "vel_1_x": "",
        "vel_1_y": "",
        "vel_1_z": ""
      },
      "velocity_2": {
        "vel_2_x": "",
        "vel_2_y": "",
        "vel_2_z": ""
      }
    }
  },
  {
    "type": "3D Collision",
    "question": "Two objects with masses 7.3 kg and 2.72 kg are located at positions [-0.59 -0.81 -0.87] and [-2.96  0.02  1.11], moving with velocities [-0.57  6.97  4.55] m/s and [4.12 0.37 1.22] m/s. Assuming an elastic collision, will they collide? If they collide, what are their final velocities?",
    "parameters": {
      "m1": 7.3,
      "m2": 2.72,
      "p1": [
        -0.59,
        -0.81,
        -0.87
      ],
      "p2": [
        -2.96,
        0.02,
        1.11
      ],
      "v1": [
        -0.57,
        6.97,
        4.55
      ],
      "v2": [
        4.12,
        0.37,
        1.22
      ]
    },
    "answer_json": {
      "will_collide": "true or false",
      "velocity_1": {
        "vel_1_x": "",
        "vel_1_y": "",
        "vel_1_z": ""
      },
      "velocity_2": {
        "vel_2_x": "",
        "vel_2_y": "",
        "vel_2_z": ""
      }
    }
  },
  {
    "type": "3D Collision",
    "question": "Two objects with masses 9.98 kg and 5.31 kg are located at positions [-1.23  4.57 -0.4 ] and [0.33 0.46 1.76], moving with velocities [7.35 3.61 6.07] m/s and [-4.71 -0.32  9.15] m/s. Assuming an elastic collision, will they collide? If they collide, what are their final velocities?",
    "parameters": {
      "m1": 9.98,
      "m2": 5.31,
      "p1": [
        -1.23,
        4.57,
        -0.4
      ],
      "p2": [
        0.33,
        0.46,
        1.76
      ],
      "v1": [
        7.35,
        3.61,
        6.07
      ],
      "v2": [
        -4.71,
        -0.32,
        9.15
      ]
    },
    "answer_json": {
      "will_collide": "true or false",
      "velocity_1": {
        "vel_1_x": "",
        "vel_1_y": "",
        "vel_1_z": ""
      },
      "velocity_2": {
        "vel_2_x": "",
        "vel_2_y": "",
        "vel_2_z": ""
      }
    }
  },
  {
    "type": "3D Collision",
    "question": "Two objects with masses 3.51 kg and 3.69 kg are located at positions [4.41 4.82 2.71] and [ 2.05  1.9  -0.11], moving with velocities [-0.4   1.21  8.69] m/s and [ 4.43 -4.24  1.47] m/s. Assuming an elastic collision, will they collide? If they collide, what are their final velocities?",
    "parameters": {
      "m1": 3.51,
      "m2": 3.69,
      "p1": [
        4.41,
        4.82,
        2.71
      ],
      "p2": [
        2.05,
        1.9,
        -0.11
      ],
      "v1": [
        -0.4,
        1.21,
        8.69
      ],
      "v2": [
        4.43,
        -4.24,
        1.47
      ]
    },
    "answer_json": {
      "will_collide": "true or false",
      "velocity_1": {
        "vel_1_x": "",
        "vel_1_y": "",
        "vel_1_z": ""
      },
      "velocity_2": {
        "vel_2_x": "",
        "vel_2_y": "",
        "vel_2_z": ""
      }
    }
  },
  {
    "type": "3D Collision",
    "question": "Two objects with masses 5.89 kg and 9.06 kg are located at positions [-1.05 -1.55  2.73] and [-3.54 -4.58  4.55], moving with velocities [-8.42  8.48  3.12] m/s and [ 4.95 -5.72  6.56] m/s. Assuming an elastic collision, will they collide? If they collide, what are their final velocities?",
    "parameters": {
      "m1": 5.89,
      "m2": 9.06,
      "p1": [
        -1.05,
        -1.55,
        2.73
      ],
      "p2": [
        -3.54,
        -4.58,
        4.55
      ],
      "v1": [
        -8.42,
        8.48,
        3.12
      ],
      "v2": [
        4.95,
        -5.72,
        6.56
      ]
    },
    "answer_json": {
      "will_collide": "true or false",
      "velocity_1": {
        "vel_1_x": "",
        "vel_1_y": "",
        "vel_1_z": ""
      },
      "velocity_2": {
        "vel_2_x": "",
        "vel_2_y": "",
        "vel_2_z": ""
      }
    }
  },
  {
    "type": "3D Collision",
    "question": "Two objects with masses 3.44 kg and 6.06 kg are located at positions [-2.28 -3.91  2.41] and [-2.61 -4.49  4.05], moving with velocities [-5.49 -5.34 -8.  ] m/s and [-3.39 -0.55  3.62] m/s. Assuming an elastic collision, will they collide? If they collide, what are their final velocities?",
    "parameters": {
      "m1": 3.44,
      "m2": 6.06,
      "p1": [
        -2.28,
        -3.91,
        2.41
      ],
      "p2": [
        -2.61,
        -4.49,
        4.05
      ],
      "v1": [
        -5.49,
        -5.34,
        -8.0
      ],
      "v2": [
        -3.39,
        -0.55,
        3.62
      ]
    },
    "answer_json": {
      "will_collide": "true or false",
      "velocity_1": {
        "vel_1_x": "",
        "vel_1_y": "",
        "vel_1_z": ""
      },
      "velocity_2": {
        "vel_2_x": "",
        "vel_2_y": "",
        "vel_2_z": ""
      }
    }
  },
  {
    "type": "3D Collision",
    "question": "Two objects with masses 2.24 kg and 9.68 kg are located at positions [ 4.78 -3.42  1.53] and [ 3.81 -0.24  1.51], moving with velocities [ 5.12 -4.26 -4.29] m/s and [-8.82  5.37  3.05] m/s. Assuming an elastic collision, will they collide? If they collide, what are their final velocities?",
    "parameters": {
      "m1": 2.24,
      "m2": 9.68,
      "p1": [
        4.78,
        -3.42,
        1.53
      ],
      "p2": [
        3.81,
        -0.24,
        1.51
      ],
      "v1": [
        5.12,
        -4.26,
        -4.29
      ],
      "v2": [
        -8.82,
        5.37,
        3.05
      ]
    },
    "answer_json": {
      "will_collide": "true or false",
      "velocity_1": {
        "vel_1_x": "",
        "vel_1_y": "",
        "vel_1_z": ""
      },
      "velocity_2": {
        "vel_2_x": "",
        "vel_2_y": "",
        "vel_2_z": ""
      }
    }
  },
  {
    "type": "3D Collision",
    "question": "Two objects with masses 3.09 kg and 7.65 kg are located at positions [ 3.5  -4.63  4.21] and [-0.82  3.38  4.34], moving with velocities [-9.27  6.72  5.76] m/s and [-6.27  4.98  7.45] m/s. Assuming an elastic collision, will they collide? If they collide, what are their final velocities?",
    "parameters": {
      "m1": 3.09,
      "m2": 7.65,
      "p1": [
        3.5,
        -4.63,
        4.21
      ],
      "p2": [
        -0.82,
        3.38,
        4.34
      ],
      "v1": [
        -9.27,
        6.72,
        5.76
      ],
      "v2": [
        -6.27,
        4.98,
        7.45
      ]
    },
    "answer_json": {
      "will_collide": "true or false",
      "velocity_1": {
        "vel_1_x": "",
        "vel_1_y": "",
        "vel_1_z": ""
      },
      "velocity_2": {
        "vel_2_x": "",
        "vel_2_y": "",
        "vel_2_z": ""
      }
    }
  },
  {
    "type": "3D Collision",
    "question": "Two objects with masses 3.61 kg and 1.34 kg are located at positions [-2.02  1.03  4.28] and [-1.65 -0.46  1.41], moving with velocities [ 0.49  7.79 -7.32] m/s and [ 0.08 -4.54  6.18] m/s. Assuming an elastic collision, will they collide? If they collide, what are their final velocities?",
    "parameters": {
      "m1": 3.61,
      "m2": 1.34,
      "p1": [
        -2.02,
        1.03,
        4.28
      ],
      "p2": [
        -1.65,
        -0.46,
        1.41
      ],
      "v1": [
        0.49,
        7.79,
        -7.32
      ],
      "v2": [
        0.08,
        -4.54,
        6.18
      ]
    },
    "answer_json": {
      "will_collide": "true or false",
      "velocity_1": {
        "vel_1_x": "",
        "vel_1_y": "",
        "vel_1_z": ""
      },
      "velocity_2": {
        "vel_2_x": "",
        "vel_2_y": "",
        "vel_2_z": ""
      }
    }
  },
  {
    "type": "3D Collision",
    "question": "Two objects with masses 3.98 kg and 7.58 kg are located at positions [ 1.48  2.19 -4.86] and [-1.63 -2.05  1.74], moving with velocities [-6.14  2.22  2.77] m/s and [-1.89 -1.45 -3.44] m/s. Assuming an elastic collision, will they collide? If they collide, what are their final velocities?",
    "parameters": {
      "m1": 3.98,
      "m2": 7.58,
      "p1": [
        1.48,
        2.19,
        -4.86
      ],
      "p2": [
        -1.63,
        -2.05,
        1.74
      ],
      "v1": [
        -6.14,
        2.22,
        2.77
      ],
      "v2": [
        -1.89,
        -1.45,
        -3.44
      ]
    },
    "answer_json": {
      "will_collide": "true or false",
      "velocity_1": {
        "vel_1_x": "",
        "vel_1_y": "",
        "vel_1_z": ""
      },
      "velocity_2": {
        "vel_2_x": "",
        "vel_2_y": "",
        "vel_2_z": ""
      }
    }
  },
  {
    "type": "3D Collision",
    "question": "Two objects with masses 4.61 kg and 1.86 kg are located at positions [ 4.82 -0.23  4.36] and [-4.93 -1.16 -0.53], moving with velocities [-4.66 -3.41  1.65] m/s and [ 1.46 -4.77 -2.81] m/s. Assuming an elastic collision, will they collide? If they collide, what are their final velocities?",
    "parameters": {
      "m1": 4.61,
      "m2": 1.86,
      "p1": [
        4.82,
        -0.23,
        4.36
      ],
      "p2": [
        -4.93,
        -1.16,
        -0.53
      ],
      "v1": [
        -4.66,
        -3.41,
        1.65
      ],
      "v2": [
        1.46,
        -4.77,
        -2.81
      ]
    },
    "answer_json": {
      "will_collide": "true or false",
      "velocity_1": {
        "vel_1_x": "",
        "vel_1_y": "",
        "vel_1_z": ""
      },
      "velocity_2": {
        "vel_2_x": "",
        "vel_2_y": "",
        "vel_2_z": ""
      }
    }
  },
  {
    "type": "3D Collision",
    "question": "Two objects with masses 3.13 kg and 7.01 kg are located at positions [-0.35 -3.4   1.86] and [4.23 3.88 2.7 ], moving with velocities [3.81 2.77 8.81] m/s and [-2.65 -5.58  9.15] m/s. Assuming an elastic collision, will they collide? If they collide, what are their final velocities?",
    "parameters": {
      "m1": 3.13,
      "m2": 7.01,
      "p1": [
        -0.35,
        -3.4,
        1.86
      ],
      "p2": [
        4.23,
        3.88,
        2.7
      ],
      "v1": [
        3.81,
        2.77,
        8.81
      ],
      "v2": [
        -2.65,
        -5.58,
        9.15
      ]
    },
    "answer_json": {
      "will_collide": "true or false",
      "velocity_1": {
        "vel_1_x": "",
        "vel_1_y": "",
        "vel_1_z": ""
      },
      "velocity_2": {
        "vel_2_x": "",
        "vel_2_y": "",
        "vel_2_z": ""
      }
    }
  },
  {
    "type": "3D Collision",
    "question": "Two objects with masses 5.3 kg and 5.09 kg are located at positions [ 4.89 -1.26  2.02] and [4.13 2.57 3.02], moving with velocities [6.51 5.24 3.61] m/s and [1.92 5.75 0.51] m/s. Assuming an elastic collision, will they collide? If they collide, what are their final velocities?",
    "parameters": {
      "m1": 5.3,
      "m2": 5.09,
      "p1": [
        4.89,
        -1.26,
        2.02
      ],
      "p2": [
        4.13,
        2.57,
        3.02
      ],
      "v1": [
        6.51,
        5.24,
        3.61
      ],
      "v2": [
        1.92,
        5.75,
        0.51
      ]
    },
    "answer_json": {
      "will_collide": "true or false",
      "velocity_1": {
        "vel_1_x": "",
        "vel_1_y": "",
        "vel_1_z": ""
      },
      "velocity_2": {
        "vel_2_x": "",
        "vel_2_y": "",
        "vel_2_z": ""
      }
    }
  },
  {
    "type": "3D Collision",
    "question": "Two objects with masses 5.75 kg and 4.26 kg are located at positions [ 4.17 -3.88  3.29] and [ 4.03 -2.98  0.37], moving with velocities [-6.71  7.09 -1.16] m/s and [ 3.61  4.34 -0.22] m/s. Assuming an elastic collision, will they collide? If they collide, what are their final velocities?",
    "parameters": {
      "m1": 5.75,
      "m2": 4.26,
      "p1": [
        4.17,
        -3.88,
        3.29
      ],
      "p2": [
        4.03,
        -2.98,
        0.37
      ],
      "v1": [
        -6.71,
        7.09,
        -1.16
      ],
      "v2": [
        3.61,
        4.34,
        -0.22
      ]
    },
    "answer_json": {
      "will_collide": "true or false",
      "velocity_1": {
        "vel_1_x": "",
        "vel_1_y": "",
        "vel_1_z": ""
      },
      "velocity_2": {
        "vel_2_x": "",
        "vel_2_y": "",
        "vel_2_z": ""
      }
    }
  },
  {
    "type": "3D Collision",
    "question": "Two objects with masses 9.09 kg and 5.01 kg are located at positions [-4.44 -3.68 -0.85] and [0.64 0.59 1.73], moving with velocities [-3.84 -9.56 -4.91] m/s and [-9.94 -5.64 -8.54] m/s. Assuming an elastic collision, will they collide? If they collide, what are their final velocities?",
    "parameters": {
      "m1": 9.09,
      "m2": 5.01,
      "p1": [
        -4.44,
        -3.68,
        -0.85
      ],
      "p2": [
        0.64,
        0.59,
        1.73
      ],
      "v1": [
        -3.84,
        -9.56,
        -4.91
      ],
      "v2": [
        -9.94,
        -5.64,
        -8.54
      ]
    },
    "answer_json": {
      "will_collide": "true or false",
      "velocity_1": {
        "vel_1_x": "",
        "vel_1_y": "",
        "vel_1_z": ""
      },
      "velocity_2": {
        "vel_2_x": "",
        "vel_2_y": "",
        "vel_2_z": ""
      }
    }
  },
  {
    "type": "3D Collision",
    "question": "Two objects with masses 4.81 kg and 7.3 kg are located at positions [ 0.41 -4.4   3.94] and [ 4.86 -0.28 -2.13], moving with velocities [-6.4  -7.29  2.83] m/s and [ 4.59  9.28 -2.51] m/s. Assuming an elastic collision, will they collide? If they collide, what are their final velocities?",
    "parameters": {
      "m1": 4.81,
      "m2": 7.3,
      "p1": [
        0.41,
        -4.4,
        3.94
      ],
      "p2": [
        4.86,
        -0.28,
        -2.13
      ],
      "v1": [
        -6.4,
        -7.29,
        2.83
      ],
      "v2": [
        4.59,
        9.28,
        -2.51
      ]
    },
    "answer_json": {
      "will_collide": "true or false",
      "velocity_1": {
        "vel_1_x": "",
        "vel_1_y": "",
        "vel_1_z": ""
      },
      "velocity_2": {
        "vel_2_x": "",
        "vel_2_y": "",
        "vel_2_z": ""
      }
    }
  },
  {
    "type": "3D Collision",
    "question": "Two objects with masses 9.02 kg and 5.04 kg are located at positions [ 4.17 -1.23 -4.2 ] and [ 4.64  3.75 -3.67], moving with velocities [ 7.21 -7.63  9.86] m/s and [-2.14 -7.45  9.57] m/s. Assuming an elastic collision, will they collide? If they collide, what are their final velocities?",
    "parameters": {
      "m1": 9.02,
      "m2": 5.04,
      "p1": [
        4.17,
        -1.23,
        -4.2
      ],
      "p2": [
        4.64,
        3.75,
        -3.67
      ],
      "v1": [
        7.21,
        -7.63,
        9.86
      ],
      "v2": [
        -2.14,
        -7.45,
        9.57
      ]
    },
    "answer_json": {
      "will_collide": "true or false",
      "velocity_1": {
        "vel_1_x": "",
        "vel_1_y": "",
        "vel_1_z": ""
      },
      "velocity_2": {
        "vel_2_x": "",
        "vel_2_y": "",
        "vel_2_z": ""
      }
    }
  },
  {
    "type": "3D Collision",
    "question": "Two objects with masses 8.51 kg and 7.81 kg are located at positions [ 4.78 -0.37  2.19] and [-0.76 -1.21 -2.7 ], moving with velocities [-0.79 -6.9  -6.23] m/s and [ 7.5   5.31 -9.36] m/s. Assuming an elastic collision, will they collide? If they collide, what are their final velocities?",
    "parameters": {
      "m1": 8.51,
      "m2": 7.81,
      "p1": [
        4.78,
        -0.37,
        2.19
      ],
      "p2": [
        -0.76,
        -1.21,
        -2.7
      ],
      "v1": [
        -0.79,
        -6.9,
        -6.23
      ],
      "v2": [
        7.5,
        5.31,
        -9.36
      ]
    },
    "answer_json": {
      "will_collide": "true or false",
      "velocity_1": {
        "vel_1_x": "",
        "vel_1_y": "",
        "vel_1_z": ""
      },
      "velocity_2": {
        "vel_2_x": "",
        "vel_2_y": "",
        "vel_2_z": ""
      }
    }
  },
  {
    "type": "3D Collision",
    "question": "Two objects with masses 6.94 kg and 6.53 kg are located at positions [ 4.36  3.89 -2.59] and [-4.33  0.94 -0.54], moving with velocities [ 3.44  7.44 -5.11] m/s and [-9.12 -1.22  0.8 ] m/s. Assuming an elastic collision, will they collide? If they collide, what are their final velocities?",
    "parameters": {
      "m1": 6.94,
      "m2": 6.53,
      "p1": [
        4.36,
        3.89,
        -2.59
      ],
      "p2": [
        -4.33,
        0.94,
        -0.54
      ],
      "v1": [
        3.44,
        7.44,
        -5.11
      ],
      "v2": [
        -9.12,
        -1.22,
        0.8
      ]
    },
    "answer_json": {
      "will_collide": "true or false",
      "velocity_1": {
        "vel_1_x": "",
        "vel_1_y": "",
        "vel_1_z": ""
      },
      "velocity_2": {
        "vel_2_x": "",
        "vel_2_y": "",
        "vel_2_z": ""
      }
    }
  },
  {
    "type": "3D Collision",
    "question": "Two objects with masses 7.79 kg and 7.98 kg are located at positions [-3.6   4.93 -2.66] and [4.16 0.76 0.77], moving with velocities [ 5.45  6.37 -5.26] m/s and [7.53 9.71 0.43] m/s. Assuming an elastic collision, will they collide? If they collide, what are their final velocities?",
    "parameters": {
      "m1": 7.79,
      "m2": 7.98,
      "p1": [
        -3.6,
        4.93,
        -2.66
      ],
      "p2": [
        4.16,
        0.76,
        0.77
      ],
      "v1": [
        5.45,
        6.37,
        -5.26
      ],
      "v2": [
        7.53,
        9.71,
        0.43
      ]
    },
    "answer_json": {
      "will_collide": "true or false",
      "velocity_1": {
        "vel_1_x": "",
        "vel_1_y": "",
        "vel_1_z": ""
      },
      "velocity_2": {
        "vel_2_x": "",
        "vel_2_y": "",
        "vel_2_z": ""
      }
    }
  },
  {
    "type": "3D Collision",
    "question": "Two objects with masses 4.72 kg and 3.48 kg are located at positions [0.57 0.92 2.35] and [-3.25  1.79  0.56], moving with velocities [-9.06 -3.11  2.87] m/s and [-2.38  0.49  3.93] m/s. Assuming an elastic collision, will they collide? If they collide, what are their final velocities?",
    "parameters": {
      "m1": 4.72,
      "m2": 3.48,
      "p1": [
        0.57,
        0.92,
        2.35
      ],
      "p2": [
        -3.25,
        1.79,
        0.56
      ],
      "v1": [
        -9.06,
        -3.11,
        2.87
      ],
      "v2": [
        -2.38,
        0.49,
        3.93
      ]
    },
    "answer_json": {
      "will_collide": "true or false",
      "velocity_1": {
        "vel_1_x": "",
        "vel_1_y": "",
        "vel_1_z": ""
      },
      "velocity_2": {
        "vel_2_x": "",
        "vel_2_y": "",
        "vel_2_z": ""
      }
    }
  },
  {
    "type": "3D Collision",
    "question": "Two objects with masses 4.67 kg and 3.7 kg are located at positions [-3.16  0.38 -2.59] and [-2.75  3.58 -3.56], moving with velocities [-0.74 -8.85 -1.75] m/s and [-1.67  0.6  -2.23] m/s. Assuming an elastic collision, will they collide? If they collide, what are their final velocities?",
    "parameters": {
      "m1": 4.67,
      "m2": 3.7,
      "p1": [
        -3.16,
        0.38,
        -2.59
      ],
      "p2": [
        -2.75,
        3.58,
        -3.56
      ],
      "v1": [
        -0.74,
        -8.85,
        -1.75
      ],
      "v2": [
        -1.67,
        0.6,
        -2.23
      ]
    },
    "answer_json": {
      "will_collide": "true or false",
      "velocity_1": {
        "vel_1_x": "",
        "vel_1_y": "",
        "vel_1_z": ""
      },
      "velocity_2": {
        "vel_2_x": "",
        "vel_2_y": "",
        "vel_2_z": ""
      }
    }
  },
  {
    "type": "3D Collision",
    "question": "Two objects with masses 3.29 kg and 3.97 kg are located at positions [-4.21 -0.5  -1.29] and [ 0.36  3.29 -4.48], moving with velocities [-2.46  2.1  -9.21] m/s and [-8.54  6.09  1.75] m/s. Assuming an elastic collision, will they collide? If they collide, what are their final velocities?",
    "parameters": {
      "m1": 3.29,
      "m2": 3.97,
      "p1": [
        -4.21,
        -0.5,
        -1.29
      ],
      "p2": [
        0.36,
        3.29,
        -4.48
      ],
      "v1": [
        -2.46,
        2.1,
        -9.21
      ],
      "v2": [
        -8.54,
        6.09,
        1.75
      ]
    },
    "answer_json": {
      "will_collide": "true or false",
      "velocity_1": {
        "vel_1_x": "",
        "vel_1_y": "",
        "vel_1_z": ""
      },
      "velocity_2": {
        "vel_2_x": "",
        "vel_2_y": "",
        "vel_2_z": ""
      }
    }
  },
  {
    "type": "3D Collision",
    "question": "Two objects with masses 7.04 kg and 2.95 kg are located at positions [-2.91  4.07 -1.97] and [ 4.09 -2.88 -3.1 ], moving with velocities [4.83 4.94 5.09] m/s and [8.29 3.91 4.08] m/s. Assuming an elastic collision, will they collide? If they collide, what are their final velocities?",
    "parameters": {
      "m1": 7.04,
      "m2": 2.95,
      "p1": [
        -2.91,
        4.07,
        -1.97
      ],
      "p2": [
        4.09,
        -2.88,
        -3.1
      ],
      "v1": [
        4.83,
        4.94,
        5.09
      ],
      "v2": [
        8.29,
        3.91,
        4.08
      ]
    },
    "answer_json": {
      "will_collide": "true or false",
      "velocity_1": {
        "vel_1_x": "",
        "vel_1_y": "",
        "vel_1_z": ""
      },
      "velocity_2": {
        "vel_2_x": "",
        "vel_2_y": "",
        "vel_2_z": ""
      }
    }
  },
  {
    "type": "3D Collision",
    "question": "Two objects with masses 4.57 kg and 3.15 kg are located at positions [-1.78 -2.17 -0.34] and [ 1.49 -1.92 -1.4 ], moving with velocities [ 7.66 -0.68  6.06] m/s and [ 4.45  5.23 -3.6 ] m/s. Assuming an elastic collision, will they collide? If they collide, what are their final velocities?",
    "parameters": {
      "m1": 4.57,
      "m2": 3.15,
      "p1": [
        -1.78,
        -2.17,
        -0.34
      ],
      "p2": [
        1.49,
        -1.92,
        -1.4
      ],
      "v1": [
        7.66,
        -0.68,
        6.06
      ],
      "v2": [
        4.45,
        5.23,
        -3.6
      ]
    },
    "answer_json": {
      "will_collide": "true or false",
      "velocity_1": {
        "vel_1_x": "",
        "vel_1_y": "",
        "vel_1_z": ""
      },
      "velocity_2": {
        "vel_2_x": "",
        "vel_2_y": "",
        "vel_2_z": ""
      }
    }
  },
  {
    "type": "3D Collision",
    "question": "Two objects with masses 2.83 kg and 3.82 kg are located at positions [-4.54  3.64  2.41] and [-4.84  0.53  0.84], moving with velocities [ 4.4  -4.1  -6.08] m/s and [-5.4   1.4  -5.09] m/s. Assuming an elastic collision, will they collide? If they collide, what are their final velocities?",
    "parameters": {
      "m1": 2.83,
      "m2": 3.82,
      "p1": [
        -4.54,
        3.64,
        2.41
      ],
      "p2": [
        -4.84,
        0.53,
        0.84
      ],
      "v1": [
        4.4,
        -4.1,
        -6.08
      ],
      "v2": [
        -5.4,
        1.4,
        -5.09
      ]
    },
    "answer_json": {
      "will_collide": "true or false",
      "velocity_1": {
        "vel_1_x": "",
        "vel_1_y": "",
        "vel_1_z": ""
      },
      "velocity_2": {
        "vel_2_x": "",
        "vel_2_y": "",
        "vel_2_z": ""
      }
    }
  },
  {
    "type": "3D Collision",
    "question": "Two objects with masses 5.96 kg and 9.49 kg are located at positions [-1.62  2.63 -0.11] and [ 2.24  2.4  -0.39], moving with velocities [ 4.66 -2.96 -7.2 ] m/s and [ 0.93 -6.32  7.79] m/s. Assuming an elastic collision, will they collide? If they collide, what are their final velocities?",
    "parameters": {
      "m1": 5.96,
      "m2": 9.49,
      "p1": [
        -1.62,
        2.63,
        -0.11
      ],
      "p2": [
        2.24,
        2.4,
        -0.39
      ],
      "v1": [
        4.66,
        -2.96,
        -7.2
      ],
      "v2": [
        0.93,
        -6.32,
        7.79
      ]
    },
    "answer_json": {
      "will_collide": "true or false",
      "velocity_1": {
        "vel_1_x": "",
        "vel_1_y": "",
        "vel_1_z": ""
      },
      "velocity_2": {
        "vel_2_x": "",
        "vel_2_y": "",
        "vel_2_z": ""
      }
    }
  },
  {
    "type": "3D Collision",
    "question": "Two objects with masses 9.91 kg and 9.62 kg are located at positions [ 0.24  3.39 -4.26] and [ 3.18 -4.51 -4.94], moving with velocities [-7.25  2.61 -8.64] m/s and [-6.98 -5.63 -0.88] m/s. Assuming an elastic collision, will they collide? If they collide, what are their final velocities?",
    "parameters": {
      "m1": 9.91,
      "m2": 9.62,
      "p1": [
        0.24,
        3.39,
        -4.26
      ],
      "p2": [
        3.18,
        -4.51,
        -4.94
      ],
      "v1": [
        -7.25,
        2.61,
        -8.64
      ],
      "v2": [
        -6.98,
        -5.63,
        -0.88
      ]
    },
    "answer_json": {
      "will_collide": "true or false",
      "velocity_1": {
        "vel_1_x": "",
        "vel_1_y": "",
        "vel_1_z": ""
      },
      "velocity_2": {
        "vel_2_x": "",
        "vel_2_y": "",
        "vel_2_z": ""
      }
    }
  },
  {
    "type": "3D Collision",
    "question": "Two objects with masses 1.54 kg and 6.74 kg are located at positions [4.34 4.13 1.59] and [-4.84  0.32 -0.89], moving with velocities [-9.67  4.44  0.71] m/s and [-4.27  0.04  3.96] m/s. Assuming an elastic collision, will they collide? If they collide, what are their final velocities?",
    "parameters": {
      "m1": 1.54,
      "m2": 6.74,
      "p1": [
        4.34,
        4.13,
        1.59
      ],
      "p2": [
        -4.84,
        0.32,
        -0.89
      ],
      "v1": [
        -9.67,
        4.44,
        0.71
      ],
      "v2": [
        -4.27,
        0.04,
        3.96
      ]
    },
    "answer_json": {
      "will_collide": "true or false",
      "velocity_1": {
        "vel_1_x": "",
        "vel_1_y": "",
        "vel_1_z": ""
      },
      "velocity_2": {
        "vel_2_x": "",
        "vel_2_y": "",
        "vel_2_z": ""
      }
    }
  },
  {
    "type": "3D Collision",
    "question": "Two objects with masses 4.88 kg and 9.46 kg are located at positions [-3.21  4.18  0.24] and [-2.59  1.2  -2.48], moving with velocities [-2.91  5.9  -8.42] m/s and [ 9.19 -0.82 -5.14] m/s. Assuming an elastic collision, will they collide? If they collide, what are their final velocities?",
    "parameters": {
      "m1": 4.88,
      "m2": 9.46,
      "p1": [
        -3.21,
        4.18,
        0.24
      ],
      "p2": [
        -2.59,
        1.2,
        -2.48
      ],
      "v1": [
        -2.91,
        5.9,
        -8.42
      ],
      "v2": [
        9.19,
        -0.82,
        -5.14
      ]
    },
    "answer_json": {
      "will_collide": "true or false",
      "velocity_1": {
        "vel_1_x": "",
        "vel_1_y": "",
        "vel_1_z": ""
      },
      "velocity_2": {
        "vel_2_x": "",
        "vel_2_y": "",
        "vel_2_z": ""
      }
    }
  },
  {
    "type": "3D Collision",
    "question": "Two objects with masses 7.28 kg and 3.7 kg are located at positions [ 3.28 -4.19  4.92] and [ 1.5  -4.68 -0.95], moving with velocities [-2.46 -0.48  2.73] m/s and [ 4.06 -8.35  6.91] m/s. Assuming an elastic collision, will they collide? If they collide, what are their final velocities?",
    "parameters": {
      "m1": 7.28,
      "m2": 3.7,
      "p1": [
        3.28,
        -4.19,
        4.92
      ],
      "p2": [
        1.5,
        -4.68,
        -0.95
      ],
      "v1": [
        -2.46,
        -0.48,
        2.73
      ],
      "v2": [
        4.06,
        -8.35,
        6.91
      ]
    },
    "answer_json": {
      "will_collide": "true or false",
      "velocity_1": {
        "vel_1_x": "",
        "vel_1_y": "",
        "vel_1_z": ""
      },
      "velocity_2": {
        "vel_2_x": "",
        "vel_2_y": "",
        "vel_2_z": ""
      }
    }
  },
  {
    "type": "3D Collision",
    "question": "Two objects with masses 6.8 kg and 3.98 kg are located at positions [4.77 4.74 3.95] and [ 4.19 -2.7   4.01], moving with velocities [ 3.85  1.34 -4.58] m/s and [ 8.48  3.69 -4.39] m/s. Assuming an elastic collision, will they collide? If they collide, what are their final velocities?",
    "parameters": {
      "m1": 6.8,
      "m2": 3.98,
      "p1": [
        4.77,
        4.74,
        3.95
      ],
      "p2": [
        4.19,
        -2.7,
        4.01
      ],
      "v1": [
        3.85,
        1.34,
        -4.58
      ],
      "v2": [
        8.48,
        3.69,
        -4.39
      ]
    },
    "answer_json": {
      "will_collide": "true or false",
      "velocity_1": {
        "vel_1_x": "",
        "vel_1_y": "",
        "vel_1_z": ""
      },
      "velocity_2": {
        "vel_2_x": "",
        "vel_2_y": "",
        "vel_2_z": ""
      }
    }
  },
  {
    "type": "3D Collision",
    "question": "Two objects with masses 5.89 kg and 6.92 kg are located at positions [-3.21  3.5  -4.84] and [-2.93 -3.56  3.21], moving with velocities [ 6.42  8.58 -4.01] m/s and [1.28 1.33 6.99] m/s. Assuming an elastic collision, will they collide? If they collide, what are their final velocities?",
    "parameters": {
      "m1": 5.89,
      "m2": 6.92,
      "p1": [
        -3.21,
        3.5,
        -4.84
      ],
      "p2": [
        -2.93,
        -3.56,
        3.21
      ],
      "v1": [
        6.42,
        8.58,
        -4.01
      ],
      "v2": [
        1.28,
        1.33,
        6.99
      ]
    },
    "answer_json": {
      "will_collide": "true or false",
      "velocity_1": {
        "vel_1_x": "",
        "vel_1_y": "",
        "vel_1_z": ""
      },
      "velocity_2": {
        "vel_2_x": "",
        "vel_2_y": "",
        "vel_2_z": ""
      }
    }
  },
  {
    "type": "3D Collision",
    "question": "Two objects with masses 7.09 kg and 5.87 kg are located at positions [-1.16  2.4   2.9 ] and [ 1.89 -4.22  2.45], moving with velocities [-3.08 -8.05 -5.36] m/s and [-8.48  2.1   2.28] m/s. Assuming an elastic collision, will they collide? If they collide, what are their final velocities?",
    "parameters": {
      "m1": 7.09,
      "m2": 5.87,
      "p1": [
        -1.16,
        2.4,
        2.9
      ],
      "p2": [
        1.89,
        -4.22,
        2.45
      ],
      "v1": [
        -3.08,
        -8.05,
        -5.36
      ],
      "v2": [
        -8.48,
        2.1,
        2.28
      ]
    },
    "answer_json": {
      "will_collide": "true or false",
      "velocity_1": {
        "vel_1_x": "",
        "vel_1_y": "",
        "vel_1_z": ""
      },
      "velocity_2": {
        "vel_2_x": "",
        "vel_2_y": "",
        "vel_2_z": ""
      }
    }
  },
  {
    "type": "3D Collision",
    "question": "Two objects with masses 6.36 kg and 9.72 kg are located at positions [-1.74  1.34  2.84] and [-0.49 -2.72  0.53], moving with velocities [-2.49 -6.29  1.72] m/s and [-2.4   5.44 -4.09] m/s. Assuming an elastic collision, will they collide? If they collide, what are their final velocities?",
    "parameters": {
      "m1": 6.36,
      "m2": 9.72,
      "p1": [
        -1.74,
        1.34,
        2.84
      ],
      "p2": [
        -0.49,
        -2.72,
        0.53
      ],
      "v1": [
        -2.49,
        -6.29,
        1.72
      ],
      "v2": [
        -2.4,
        5.44,
        -4.09
      ]
    },
    "answer_json": {
      "will_collide": "true or false",
      "velocity_1": {
        "vel_1_x": "",
        "vel_1_y": "",
        "vel_1_z": ""
      },
      "velocity_2": {
        "vel_2_x": "",
        "vel_2_y": "",
        "vel_2_z": ""
      }
    }
  },
  {
    "type": "3D Collision",
    "question": "Two objects with masses 3.22 kg and 1.66 kg are located at positions [-2.32 -1.2   2.84] and [-3.46 -1.1  -1.39], moving with velocities [-8.17  8.86 -1.11] m/s and [ 5.23 -7.96 -8.25] m/s. Assuming an elastic collision, will they collide? If they collide, what are their final velocities?",
    "parameters": {
      "m1": 3.22,
      "m2": 1.66,
      "p1": [
        -2.32,
        -1.2,
        2.84
      ],
      "p2": [
        -3.46,
        -1.1,
        -1.39
      ],
      "v1": [
        -8.17,
        8.86,
        -1.11
      ],
      "v2": [
        5.23,
        -7.96,
        -8.25
      ]
    },
    "answer_json": {
      "will_collide": "true or false",
      "velocity_1": {
        "vel_1_x": "",
        "vel_1_y": "",
        "vel_1_z": ""
      },
      "velocity_2": {
        "vel_2_x": "",
        "vel_2_y": "",
        "vel_2_z": ""
      }
    }
  },
  {
    "type": "3D Collision",
    "question": "Two objects with masses 4.88 kg and 6.01 kg are located at positions [ 0.12 -3.97 -4.1 ] and [0.54 0.97 2.84], moving with velocities [ 7.27 -9.75 -1.72] m/s and [5.58 4.5  1.19] m/s. Assuming an elastic collision, will they collide? If they collide, what are their final velocities?",
    "parameters": {
      "m1": 4.88,
      "m2": 6.01,
      "p1": [
        0.12,
        -3.97,
        -4.1
      ],
      "p2": [
        0.54,
        0.97,
        2.84
      ],
      "v1": [
        7.27,
        -9.75,
        -1.72
      ],
      "v2": [
        5.58,
        4.5,
        1.19
      ]
    },
    "answer_json": {
      "will_collide": "true or false",
      "velocity_1": {
        "vel_1_x": "",
        "vel_1_y": "",
        "vel_1_z": ""
      },
      "velocity_2": {
        "vel_2_x": "",
        "vel_2_y": "",
        "vel_2_z": ""
      }
    }
  },
  {
    "type": "3D Collision",
    "question": "Two objects with masses 9.93 kg and 3.18 kg are located at positions [ 0.21  1.85 -3.3 ] and [-2.31 -2.32 -3.54], moving with velocities [-6.66 -4.48 -4.  ] m/s and [ 5.65 -2.78  8.88] m/s. Assuming an elastic collision, will they collide? If they collide, what are their final velocities?",
    "parameters": {
      "m1": 9.93,
      "m2": 3.18,
      "p1": [
        0.21,
        1.85,
        -3.3
      ],
      "p2": [
        -2.31,
        -2.32,
        -3.54
      ],
      "v1": [
        -6.66,
        -4.48,
        -4.0
      ],
      "v2": [
        5.65,
        -2.78,
        8.88
      ]
    },
    "answer_json": {
      "will_collide": "true or false",
      "velocity_1": {
        "vel_1_x": "",
        "vel_1_y": "",
        "vel_1_z": ""
      },
      "velocity_2": {
        "vel_2_x": "",
        "vel_2_y": "",
        "vel_2_z": ""
      }
    }
  },
  {
    "type": "3D Collision",
    "question": "Two objects with masses 7.49 kg and 5.46 kg are located at positions [ 1.17 -0.42 -3.65] and [-4.93 -1.04  3.42], moving with velocities [-2.4   7.24 -1.2 ] m/s and [-1.39  6.47  3.02] m/s. Assuming an elastic collision, will they collide? If they collide, what are their final velocities?",
    "parameters": {
      "m1": 7.49,
      "m2": 5.46,
      "p1": [
        1.17,
        -0.42,
        -3.65
      ],
      "p2": [
        -4.93,
        -1.04,
        3.42
      ],
      "v1": [
        -2.4,
        7.24,
        -1.2
      ],
      "v2": [
        -1.39,
        6.47,
        3.02
      ]
    },
    "answer_json": {
      "will_collide": "true or false",
      "velocity_1": {
        "vel_1_x": "",
        "vel_1_y": "",
        "vel_1_z": ""
      },
      "velocity_2": {
        "vel_2_x": "",
        "vel_2_y": "",
        "vel_2_z": ""
      }
    }
  }
]