[
  {
    "type": "3D Linear Motion",
    "question": "\nAn object starts at (0,0,0) with an initial velocity of [13.15, 1.48, 6.23] m/s and an acceleration of [-2.77, 2.36, 1.77] m/s\u00b2.\nWhat are its velocity (vx, vy, vz) and displacement (dx, dy, dz) after 9.03 seconds?\n",
    "parameters": {
      "v0": [
        13.15,
        1.48,
        6.23
      ],
      "a": [
        -2.77,
        2.36,
        1.77
      ],
      "t": 9.03
    },
    "answer_json": {
      "velocity_x": -11.86,
      "velocity_y": 22.79,
      "velocity_z": 22.21,
      "displacement_x": 5.81,
      "displacement_y": 109.58,
      "displacement_z": 128.42
    }
  },
  {
    "type": "3D Linear Motion",
    "question": "\nAn object starts at (0,0,0) with an initial velocity of [2.65, 9.02, 1.57] m/s and an acceleration of [-2.81, 0.05, -4.73] m/s\u00b2.\nWhat are its velocity (vx, vy, vz) and displacement (dx, dy, dz) after 2.79 seconds?\n",
    "parameters": {
      "v0": [
        2.65,
        9.02,
        1.57
      ],
      "a": [
        -2.81,
        0.05,
        -4.73
      ],
      "t": 2.79
    },
    "answer_json": {
      "velocity_x": -5.19,
      "velocity_y": 9.16,
      "velocity_z": -11.63,
      "displacement_x": -3.54,
      "displacement_y": 25.36,
      "displacement_z": -14.03
    }
  },
  {
    "type": "3D Linear Motion",
    "question": "\nAn object starts at (0,0,0) with an initial velocity of [13.35, 11.35, 5.19] m/s and an acceleration of [0.89, 3.09, -4.94] m/s\u00b2.\nWhat are its velocity (vx, vy, vz) and displacement (dx, dy, dz) after 8.25 seconds?\n",
    "parameters": {
      "v0": [
        13.35,
        11.35,
        5.19
      ],
      "a": [
        0.89,
        3.09,
        -4.94
      ],
      "t": 8.25
    },
    "answer_json": {
      "velocity_x": 20.69,
      "velocity_y": 36.84,
      "velocity_z": -35.57,
      "displacement_x": 140.43,
      "displacement_y": 198.79,
      "displacement_z": -125.3
    }
  },
  {
    "type": "3D Linear Motion",
    "question": "\nAn object starts at (0,0,0) with an initial velocity of [14.26, 7.46, 3.95] m/s and an acceleration of [4.57, -1.63, -4.07] m/s\u00b2.\nWhat are its velocity (vx, vy, vz) and displacement (dx, dy, dz) after 1.87 seconds?\n",
    "parameters": {
      "v0": [
        14.26,
        7.46,
        3.95
      ],
      "a": [
        4.57,
        -1.63,
        -4.07
      ],
      "t": 1.87
    },
    "answer_json": {
      "velocity_x": 22.81,
      "velocity_y": 4.41,
      "velocity_z": -3.66,
      "displacement_x": 34.66,
      "displacement_y": 11.1,
      "displacement_z": 0.27
    }
  },
  {
    "type": "3D Linear Motion",
    "question": "\nAn object starts at (0,0,0) with an initial velocity of [17.1, 12.47, 16.34] m/s and an acceleration of [2.3, 0.36, 4.73] m/s\u00b2.\nWhat are its velocity (vx, vy, vz) and displacement (dx, dy, dz) after 4.41 seconds?\n",
    "parameters": {
      "v0": [
        17.1,
        12.47,
        16.34
      ],
      "a": [
        2.3,
        0.36,
        4.73
      ],
      "t": 4.41
    },
    "answer_json": {
      "velocity_x": 27.24,
      "velocity_y": 14.06,
      "velocity_z": 37.2,
      "displacement_x": 97.78,
      "displacement_y": 58.49,
      "displacement_z": 118.05
    }
  },
  {
    "type": "3D Linear Motion",
    "question": "\nAn object starts at (0,0,0) with an initial velocity of [11.49, 16.76, 12.75] m/s and an acceleration of [3.62, 0.77, 2.05] m/s\u00b2.\nWhat are its velocity (vx, vy, vz) and displacement (dx, dy, dz) after 1.41 seconds?\n",
    "parameters": {
      "v0": [
        11.49,
        16.76,
        12.75
      ],
      "a": [
        3.62,
        0.77,
        2.05
      ],
      "t": 1.41
    },
    "answer_json": {
      "velocity_x": 16.59,
      "velocity_y": 17.85,
      "velocity_z": 15.64,
      "displacement_x": 19.8,
      "displacement_y": 24.4,
      "displacement_z": 20.02
    }
  },
  {
    "type": "3D Linear Motion",
    "question": "\nAn object starts at (0,0,0) with an initial velocity of [5.33, 6.5, 2.52] m/s and an acceleration of [-2.67, -3.99, -2.22] m/s\u00b2.\nWhat are its velocity (vx, vy, vz) and displacement (dx, dy, dz) after 6.72 seconds?\n",
    "parameters": {
      "v0": [
        5.33,
        6.5,
        2.52
      ],
      "a": [
        -2.67,
        -3.99,
        -2.22
      ],
      "t": 6.72
    },
    "answer_json": {
      "velocity_x": -12.61,
      "velocity_y": -20.31,
      "velocity_z": -12.4,
      "displacement_x": -24.47,
      "displacement_y": -46.41,
      "displacement_z": -33.19
    }
  },
  {
    "type": "3D Linear Motion",
    "question": "\nAn object starts at (0,0,0) with an initial velocity of [7.93, 8.03, 4.98] m/s and an acceleration of [-2.33, 4.37, 1.48] m/s\u00b2.\nWhat are its velocity (vx, vy, vz) and displacement (dx, dy, dz) after 6.48 seconds?\n",
    "parameters": {
      "v0": [
        7.93,
        8.03,
        4.98
      ],
      "a": [
        -2.33,
        4.37,
        1.48
      ],
      "t": 6.48
    },
    "answer_json": {
      "velocity_x": -7.17,
      "velocity_y": 36.35,
      "velocity_z": 14.57,
      "displacement_x": 2.47,
      "displacement_y": 143.78,
      "displacement_z": 63.34
    }
  },
  {
    "type": "3D Linear Motion",
    "question": "\nAn object starts at (0,0,0) with an initial velocity of [4.25, 14.85, 4.1] m/s and an acceleration of [-1.21, 4.9, 1.4] m/s\u00b2.\nWhat are its velocity (vx, vy, vz) and displacement (dx, dy, dz) after 6.01 seconds?\n",
    "parameters": {
      "v0": [
        4.25,
        14.85,
        4.1
      ],
      "a": [
        -1.21,
        4.9,
        1.4
      ],
      "t": 6.01
    },
    "answer_json": {
      "velocity_x": -3.02,
      "velocity_y": 44.3,
      "velocity_z": 12.51,
      "displacement_x": 3.69,
      "displacement_y": 177.74,
      "displacement_z": 49.93
    }
  },
  {
    "type": "3D Linear Motion",
    "question": "\nAn object starts at (0,0,0) with an initial velocity of [14.01, 17.01, 15.74] m/s and an acceleration of [-2.71, -4.68, -1.85] m/s\u00b2.\nWhat are its velocity (vx, vy, vz) and displacement (dx, dy, dz) after 3.41 seconds?\n",
    "parameters": {
      "v0": [
        14.01,
        17.01,
        15.74
      ],
      "a": [
        -2.71,
        -4.68,
        -1.85
      ],
      "t": 3.41
    },
    "answer_json": {
      "velocity_x": 4.77,
      "velocity_y": 1.05,
      "velocity_z": 9.43,
      "displacement_x": 32.02,
      "displacement_y": 30.79,
      "displacement_z": 42.92
    }
  },
  {
    "type": "3D Linear Motion",
    "question": "\nAn object starts at (0,0,0) with an initial velocity of [5.01, 18.92, 17.65] m/s and an acceleration of [-1.85, 1.55, -1.04] m/s\u00b2.\nWhat are its velocity (vx, vy, vz) and displacement (dx, dy, dz) after 9.23 seconds?\n",
    "parameters": {
      "v0": [
        5.01,
        18.92,
        17.65
      ],
      "a": [
        -1.85,
        1.55,
        -1.04
      ],
      "t": 9.23
    },
    "answer_json": {
      "velocity_x": -12.07,
      "velocity_y": 33.23,
      "velocity_z": 8.05,
      "displacement_x": -32.56,
      "displacement_y": 240.66,
      "displacement_z": 118.61
    }
  },
  {
    "type": "3D Linear Motion",
    "question": "\nAn object starts at (0,0,0) with an initial velocity of [9.72, 6.03, 5.69] m/s and an acceleration of [0.61, -2.37, 0.85] m/s\u00b2.\nWhat are its velocity (vx, vy, vz) and displacement (dx, dy, dz) after 9.08 seconds?\n",
    "parameters": {
      "v0": [
        9.72,
        6.03,
        5.69
      ],
      "a": [
        0.61,
        -2.37,
        0.85
      ],
      "t": 9.08
    },
    "answer_json": {
      "velocity_x": 15.26,
      "velocity_y": -15.49,
      "velocity_z": 13.41,
      "displacement_x": 113.4,
      "displacement_y": -42.95,
      "displacement_z": 86.7
    }
  },
  {
    "type": "3D Linear Motion",
    "question": "\nAn object starts at (0,0,0) with an initial velocity of [8.59, 5.17, 19.95] m/s and an acceleration of [0.1, -4.09, -4.53] m/s\u00b2.\nWhat are its velocity (vx, vy, vz) and displacement (dx, dy, dz) after 1.99 seconds?\n",
    "parameters": {
      "v0": [
        8.59,
        5.17,
        19.95
      ],
      "a": [
        0.1,
        -4.09,
        -4.53
      ],
      "t": 1.99
    },
    "answer_json": {
      "velocity_x": 8.79,
      "velocity_y": -2.97,
      "velocity_z": 10.94,
      "displacement_x": 17.29,
      "displacement_y": 2.19,
      "displacement_z": 30.73
    }
  },
  {
    "type": "3D Linear Motion",
    "question": "\nAn object starts at (0,0,0) with an initial velocity of [12.92, 16.05, 9.02] m/s and an acceleration of [-4.36, -1.18, 4.96] m/s\u00b2.\nWhat are its velocity (vx, vy, vz) and displacement (dx, dy, dz) after 5.76 seconds?\n",
    "parameters": {
      "v0": [
        12.92,
        16.05,
        9.02
      ],
      "a": [
        -4.36,
        -1.18,
        4.96
      ],
      "t": 5.76
    },
    "answer_json": {
      "velocity_x": -12.19,
      "velocity_y": 9.25,
      "velocity_z": 37.59,
      "displacement_x": 2.09,
      "displacement_y": 72.87,
      "displacement_z": 134.24
    }
  },
  {
    "type": "3D Linear Motion",
    "question": "\nAn object starts at (0,0,0) with an initial velocity of [19.45, 17.35, 1.22] m/s and an acceleration of [2.21, 1.82, 0.37] m/s\u00b2.\nWhat are its velocity (vx, vy, vz) and displacement (dx, dy, dz) after 3.4 seconds?\n",
    "parameters": {
      "v0": [
        19.45,
        17.35,
        1.22
      ],
      "a": [
        2.21,
        1.82,
        0.37
      ],
      "t": 3.4
    },
    "answer_json": {
      "velocity_x": 26.96,
      "velocity_y": 23.54,
      "velocity_z": 2.48,
      "displacement_x": 78.9,
      "displacement_y": 69.51,
      "displacement_z": 6.29
    }
  },
  {
    "type": "3D Linear Motion",
    "question": "\nAn object starts at (0,0,0) with an initial velocity of [13.18, 3.12, 9.26] m/s and an acceleration of [-0.46, 4.54, 3.76] m/s\u00b2.\nWhat are its velocity (vx, vy, vz) and displacement (dx, dy, dz) after 3.37 seconds?\n",
    "parameters": {
      "v0": [
        13.18,
        3.12,
        9.26
      ],
      "a": [
        -0.46,
        4.54,
        3.76
      ],
      "t": 3.37
    },
    "answer_json": {
      "velocity_x": 11.63,
      "velocity_y": 18.42,
      "velocity_z": 21.93,
      "displacement_x": 41.8,
      "displacement_y": 36.29,
      "displacement_z": 52.56
    }
  },
  {
    "type": "3D Linear Motion",
    "question": "\nAn object starts at (0,0,0) with an initial velocity of [10.51, 4.39, 18.34] m/s and an acceleration of [3.71, -2.02, 1.39] m/s\u00b2.\nWhat are its velocity (vx, vy, vz) and displacement (dx, dy, dz) after 6.48 seconds?\n",
    "parameters": {
      "v0": [
        10.51,
        4.39,
        18.34
      ],
      "a": [
        3.71,
        -2.02,
        1.39
      ],
      "t": 6.48
    },
    "answer_json": {
      "velocity_x": 34.55,
      "velocity_y": -8.7,
      "velocity_z": 27.35,
      "displacement_x": 146.0,
      "displacement_y": -13.96,
      "displacement_z": 148.03
    }
  },
  {
    "type": "3D Linear Motion",
    "question": "\nAn object starts at (0,0,0) with an initial velocity of [3.9, 15.49, 11.25] m/s and an acceleration of [2.79, 0.3, -4.99] m/s\u00b2.\nWhat are its velocity (vx, vy, vz) and displacement (dx, dy, dz) after 3.92 seconds?\n",
    "parameters": {
      "v0": [
        3.9,
        15.49,
        11.25
      ],
      "a": [
        2.79,
        0.3,
        -4.99
      ],
      "t": 3.92
    },
    "answer_json": {
      "velocity_x": 14.84,
      "velocity_y": 16.67,
      "velocity_z": -8.31,
      "displacement_x": 36.72,
      "displacement_y": 63.03,
      "displacement_z": 5.76
    }
  },
  {
    "type": "3D Linear Motion",
    "question": "\nAn object starts at (0,0,0) with an initial velocity of [1.37, 18.65, 17.7] m/s and an acceleration of [3.32, -1.92, -4.42] m/s\u00b2.\nWhat are its velocity (vx, vy, vz) and displacement (dx, dy, dz) after 8.9 seconds?\n",
    "parameters": {
      "v0": [
        1.37,
        18.65,
        17.7
      ],
      "a": [
        3.32,
        -1.92,
        -4.42
      ],
      "t": 8.9
    },
    "answer_json": {
      "velocity_x": 30.92,
      "velocity_y": 1.56,
      "velocity_z": -21.64,
      "displacement_x": 143.68,
      "displacement_y": 89.94,
      "displacement_z": -17.52
    }
  },
  {
    "type": "3D Linear Motion",
    "question": "\nAn object starts at (0,0,0) with an initial velocity of [18.99, 2.63, 10.23] m/s and an acceleration of [-4.31, 2.61, 2.66] m/s\u00b2.\nWhat are its velocity (vx, vy, vz) and displacement (dx, dy, dz) after 2.16 seconds?\n",
    "parameters": {
      "v0": [
        18.99,
        2.63,
        10.23
      ],
      "a": [
        -4.31,
        2.61,
        2.66
      ],
      "t": 2.16
    },
    "answer_json": {
      "velocity_x": 9.68,
      "velocity_y": 8.27,
      "velocity_z": 15.98,
      "displacement_x": 30.96,
      "displacement_y": 11.77,
      "displacement_z": 28.3
    }
  },
  {
    "type": "3D Linear Motion",
    "question": "\nAn object starts at (0,0,0) with an initial velocity of [10.03, 11.45, 6.04] m/s and an acceleration of [3.72, -0.77, -2.88] m/s\u00b2.\nWhat are its velocity (vx, vy, vz) and displacement (dx, dy, dz) after 5.85 seconds?\n",
    "parameters": {
      "v0": [
        10.03,
        11.45,
        6.04
      ],
      "a": [
        3.72,
        -0.77,
        -2.88
      ],
      "t": 5.85
    },
    "answer_json": {
      "velocity_x": 31.79,
      "velocity_y": 6.95,
      "velocity_z": -10.81,
      "displacement_x": 122.33,
      "displacement_y": 53.81,
      "displacement_z": -13.95
    }
  },
  {
    "type": "3D Linear Motion",
    "question": "\nAn object starts at (0,0,0) with an initial velocity of [14.87, 4.82, 6.92] m/s and an acceleration of [4.95, 1.5, -0.62] m/s\u00b2.\nWhat are its velocity (vx, vy, vz) and displacement (dx, dy, dz) after 5.66 seconds?\n",
    "parameters": {
      "v0": [
        14.87,
        4.82,
        6.92
      ],
      "a": [
        4.95,
        1.5,
        -0.62
      ],
      "t": 5.66
    },
    "answer_json": {
      "velocity_x": 42.89,
      "velocity_y": 13.31,
      "velocity_z": 3.41,
      "displacement_x": 163.45,
      "displacement_y": 51.31,
      "displacement_z": 29.24
    }
  },
  {
    "type": "3D Linear Motion",
    "question": "\nAn object starts at (0,0,0) with an initial velocity of [3.3, 5.27, 7.42] m/s and an acceleration of [0.88, -2.7, -2.8] m/s\u00b2.\nWhat are its velocity (vx, vy, vz) and displacement (dx, dy, dz) after 1.64 seconds?\n",
    "parameters": {
      "v0": [
        3.3,
        5.27,
        7.42
      ],
      "a": [
        0.88,
        -2.7,
        -2.8
      ],
      "t": 1.64
    },
    "answer_json": {
      "velocity_x": 4.74,
      "velocity_y": 0.84,
      "velocity_z": 2.83,
      "displacement_x": 6.6,
      "displacement_y": 5.01,
      "displacement_z": 8.4
    }
  },
  {
    "type": "3D Linear Motion",
    "question": "\nAn object starts at (0,0,0) with an initial velocity of [12.99, 5.35, 18.2] m/s and an acceleration of [3.6, -4.29, -2.62] m/s\u00b2.\nWhat are its velocity (vx, vy, vz) and displacement (dx, dy, dz) after 7.02 seconds?\n",
    "parameters": {
      "v0": [
        12.99,
        5.35,
        18.2
      ],
      "a": [
        3.6,
        -4.29,
        -2.62
      ],
      "t": 7.02
    },
    "answer_json": {
      "velocity_x": 38.26,
      "velocity_y": -24.77,
      "velocity_z": -0.19,
      "displacement_x": 179.89,
      "displacement_y": -68.15,
      "displacement_z": 63.21
    }
  },
  {
    "type": "3D Linear Motion",
    "question": "\nAn object starts at (0,0,0) with an initial velocity of [5.07, 3.51, 18.77] m/s and an acceleration of [0.71, -0.27, 2.85] m/s\u00b2.\nWhat are its velocity (vx, vy, vz) and displacement (dx, dy, dz) after 8.27 seconds?\n",
    "parameters": {
      "v0": [
        5.07,
        3.51,
        18.77
      ],
      "a": [
        0.71,
        -0.27,
        2.85
      ],
      "t": 8.27
    },
    "answer_json": {
      "velocity_x": 10.94,
      "velocity_y": 1.28,
      "velocity_z": 42.34,
      "displacement_x": 66.21,
      "displacement_y": 19.79,
      "displacement_z": 252.69
    }
  },
  {
    "type": "3D Circular Motion",
    "question": "\n        Object  (Circular Motion)  \n           - Radius: 3.38 meters  \n           - Speed: 1.23 m/s  \n           - Angular velocity: 0.36 rad/s  \n           - Time: 3.48 s  \n           - Rotating in the xy-plane  \n           - Compute its position (x_B, y_B, z_B), assuming it starts at (r, 0, 0).\n        ",
    "parameters": {
      "r": 3.38,
      "v": 1.23,
      "omega": 0.36,
      "t": 3.48,
      "rotation_plane": "xy-plane"
    },
    "answer_json": {
      "x_B": 1.0568,
      "y_B": 3.2105,
      "z_B": 0.0
    }
  },
  {
    "type": "3D Circular Motion",
    "question": "\n        Object  (Circular Motion)  \n           - Radius: 1.13 meters  \n           - Speed: 1.92 m/s  \n           - Angular velocity: 1.7 rad/s  \n           - Time: 7.67 s  \n           - Rotating in the yz-plane  \n           - Compute its position (x_B, y_B, z_B), assuming it starts at (r, 0, 0).\n        ",
    "parameters": {
      "r": 1.13,
      "v": 1.92,
      "omega": 1.7,
      "t": 7.67,
      "rotation_plane": "yz-plane"
    },
    "answer_json": {
      "x_B": 0.0,
      "y_B": 1.0061,
      "z_B": 0.5144
    }
  },
  {
    "type": "3D Circular Motion",
    "question": "\n        Object  (Circular Motion)  \n           - Radius: 0.89 meters  \n           - Speed: 4.8 m/s  \n           - Angular velocity: 5.39 rad/s  \n           - Time: 1.27 s  \n           - Rotating in the xy-plane  \n           - Compute its position (x_B, y_B, z_B), assuming it starts at (r, 0, 0).\n        ",
    "parameters": {
      "r": 0.89,
      "v": 4.8,
      "omega": 5.39,
      "t": 1.27,
      "rotation_plane": "xy-plane"
    },
    "answer_json": {
      "x_B": 0.7531,
      "y_B": 0.4743,
      "z_B": 0.0
    }
  },
  {
    "type": "3D Circular Motion",
    "question": "\n        Object  (Circular Motion)  \n           - Radius: 1.55 meters  \n           - Speed: 6.42 m/s  \n           - Angular velocity: 4.14 rad/s  \n           - Time: 6.05 s  \n           - Rotating in the yz-plane  \n           - Compute its position (x_B, y_B, z_B), assuming it starts at (r, 0, 0).\n        ",
    "parameters": {
      "r": 1.55,
      "v": 6.42,
      "omega": 4.14,
      "t": 6.05,
      "rotation_plane": "yz-plane"
    },
    "answer_json": {
      "x_B": 0.0,
      "y_B": 1.5443,
      "z_B": -0.1327
    }
  },
  {
    "type": "3D Circular Motion",
    "question": "\n        Object  (Circular Motion)  \n           - Radius: 3.42 meters  \n           - Speed: 5.9 m/s  \n           - Angular velocity: 1.73 rad/s  \n           - Time: 2.98 s  \n           - Rotating in the yz-plane  \n           - Compute its position (x_B, y_B, z_B), assuming it starts at (r, 0, 0).\n        ",
    "parameters": {
      "r": 3.42,
      "v": 5.9,
      "omega": 1.73,
      "t": 2.98,
      "rotation_plane": "yz-plane"
    },
    "answer_json": {
      "x_B": 0.0,
      "y_B": 1.466,
      "z_B": -3.0899
    }
  },
  {
    "type": "3D Circular Motion",
    "question": "\n        Object  (Circular Motion)  \n           - Radius: 1.75 meters  \n           - Speed: 8.82 m/s  \n           - Angular velocity: 5.04 rad/s  \n           - Time: 7.83 s  \n           - Rotating in the xy-plane  \n           - Compute its position (x_B, y_B, z_B), assuming it starts at (r, 0, 0).\n        ",
    "parameters": {
      "r": 1.75,
      "v": 8.82,
      "omega": 5.04,
      "t": 7.83,
      "rotation_plane": "xy-plane"
    },
    "answer_json": {
      "x_B": -0.3362,
      "y_B": 1.7174,
      "z_B": 0.0
    }
  },
  {
    "type": "3D Circular Motion",
    "question": "\n        Object  (Circular Motion)  \n           - Radius: 3.64 meters  \n           - Speed: 4.06 m/s  \n           - Angular velocity: 1.12 rad/s  \n           - Time: 2.4 s  \n           - Rotating in the xz-plane  \n           - Compute its position (x_B, y_B, z_B), assuming it starts at (r, 0, 0).\n        ",
    "parameters": {
      "r": 3.64,
      "v": 4.06,
      "omega": 1.12,
      "t": 2.4,
      "rotation_plane": "xz-plane"
    },
    "answer_json": {
      "x_B": -3.2719,
      "y_B": 0.0,
      "z_B": 1.595
    }
  },
  {
    "type": "3D Circular Motion",
    "question": "\n        Object  (Circular Motion)  \n           - Radius: 0.96 meters  \n           - Speed: 4.42 m/s  \n           - Angular velocity: 4.6 rad/s  \n           - Time: 4.23 s  \n           - Rotating in the xz-plane  \n           - Compute its position (x_B, y_B, z_B), assuming it starts at (r, 0, 0).\n        ",
    "parameters": {
      "r": 0.96,
      "v": 4.42,
      "omega": 4.6,
      "t": 4.23,
      "rotation_plane": "xz-plane"
    },
    "answer_json": {
      "x_B": 0.7877,
      "y_B": 0.0,
      "z_B": 0.5487
    }
  },
  {
    "type": "3D Circular Motion",
    "question": "\n        Object  (Circular Motion)  \n           - Radius: 3.22 meters  \n           - Speed: 8.26 m/s  \n           - Angular velocity: 2.57 rad/s  \n           - Time: 7.57 s  \n           - Rotating in the yz-plane  \n           - Compute its position (x_B, y_B, z_B), assuming it starts at (r, 0, 0).\n        ",
    "parameters": {
      "r": 3.22,
      "v": 8.26,
      "omega": 2.57,
      "t": 7.57,
      "rotation_plane": "yz-plane"
    },
    "answer_json": {
      "x_B": 0.0,
      "y_B": 2.6478,
      "z_B": 1.8323
    }
  },
  {
    "type": "3D Circular Motion",
    "question": "\n        Object  (Circular Motion)  \n           - Radius: 1.06 meters  \n           - Speed: 9.3 m/s  \n           - Angular velocity: 8.77 rad/s  \n           - Time: 1.71 s  \n           - Rotating in the xz-plane  \n           - Compute its position (x_B, y_B, z_B), assuming it starts at (r, 0, 0).\n        ",
    "parameters": {
      "r": 1.06,
      "v": 9.3,
      "omega": 8.77,
      "t": 1.71,
      "rotation_plane": "xz-plane"
    },
    "answer_json": {
      "x_B": -0.803,
      "y_B": 0.0,
      "z_B": 0.692
    }
  },
  {
    "type": "3D Circular Motion",
    "question": "\n        Object  (Circular Motion)  \n           - Radius: 4.23 meters  \n           - Speed: 6.57 m/s  \n           - Angular velocity: 1.55 rad/s  \n           - Time: 8.76 s  \n           - Rotating in the yz-plane  \n           - Compute its position (x_B, y_B, z_B), assuming it starts at (r, 0, 0).\n        ",
    "parameters": {
      "r": 4.23,
      "v": 6.57,
      "omega": 1.55,
      "t": 8.76,
      "rotation_plane": "yz-plane"
    },
    "answer_json": {
      "x_B": 0.0,
      "y_B": 2.2439,
      "z_B": 3.5858
    }
  },
  {
    "type": "3D Circular Motion",
    "question": "\n        Object  (Circular Motion)  \n           - Radius: 1.37 meters  \n           - Speed: 1.63 m/s  \n           - Angular velocity: 1.19 rad/s  \n           - Time: 6.95 s  \n           - Rotating in the xz-plane  \n           - Compute its position (x_B, y_B, z_B), assuming it starts at (r, 0, 0).\n        ",
    "parameters": {
      "r": 1.37,
      "v": 1.63,
      "omega": 1.19,
      "t": 6.95,
      "rotation_plane": "xz-plane"
    },
    "answer_json": {
      "x_B": -0.5543,
      "y_B": 0.0,
      "z_B": 1.2529
    }
  },
  {
    "type": "3D Circular Motion",
    "question": "\n        Object  (Circular Motion)  \n           - Radius: 4.93 meters  \n           - Speed: 8.7 m/s  \n           - Angular velocity: 1.76 rad/s  \n           - Time: 8.8 s  \n           - Rotating in the xz-plane  \n           - Compute its position (x_B, y_B, z_B), assuming it starts at (r, 0, 0).\n        ",
    "parameters": {
      "r": 4.93,
      "v": 8.7,
      "omega": 1.76,
      "t": 8.8,
      "rotation_plane": "xz-plane"
    },
    "answer_json": {
      "x_B": -4.8112,
      "y_B": 0.0,
      "z_B": 1.0757
    }
  },
  {
    "type": "3D Circular Motion",
    "question": "\n        Object  (Circular Motion)  \n           - Radius: 1.75 meters  \n           - Speed: 6.72 m/s  \n           - Angular velocity: 3.84 rad/s  \n           - Time: 4.28 s  \n           - Rotating in the xz-plane  \n           - Compute its position (x_B, y_B, z_B), assuming it starts at (r, 0, 0).\n        ",
    "parameters": {
      "r": 1.75,
      "v": 6.72,
      "omega": 3.84,
      "t": 4.28,
      "rotation_plane": "xz-plane"
    },
    "answer_json": {
      "x_B": -1.3073,
      "y_B": 0.0,
      "z_B": -1.1634
    }
  },
  {
    "type": "3D Circular Motion",
    "question": "\n        Object  (Circular Motion)  \n           - Radius: 2.1 meters  \n           - Speed: 7.03 m/s  \n           - Angular velocity: 3.35 rad/s  \n           - Time: 7.32 s  \n           - Rotating in the yz-plane  \n           - Compute its position (x_B, y_B, z_B), assuming it starts at (r, 0, 0).\n        ",
    "parameters": {
      "r": 2.1,
      "v": 7.03,
      "omega": 3.35,
      "t": 7.32,
      "rotation_plane": "yz-plane"
    },
    "answer_json": {
      "x_B": 0.0,
      "y_B": 1.7204,
      "z_B": -1.2043
    }
  },
  {
    "type": "3D Circular Motion",
    "question": "\n        Object  (Circular Motion)  \n           - Radius: 3.42 meters  \n           - Speed: 6.48 m/s  \n           - Angular velocity: 1.89 rad/s  \n           - Time: 2.54 s  \n           - Rotating in the yz-plane  \n           - Compute its position (x_B, y_B, z_B), assuming it starts at (r, 0, 0).\n        ",
    "parameters": {
      "r": 3.42,
      "v": 6.48,
      "omega": 1.89,
      "t": 2.54,
      "rotation_plane": "yz-plane"
    },
    "answer_json": {
      "x_B": 0.0,
      "y_B": 0.3013,
      "z_B": -3.4067
    }
  },
  {
    "type": "3D Circular Motion",
    "question": "\n        Object  (Circular Motion)  \n           - Radius: 1.6 meters  \n           - Speed: 5.16 m/s  \n           - Angular velocity: 3.23 rad/s  \n           - Time: 3.43 s  \n           - Rotating in the yz-plane  \n           - Compute its position (x_B, y_B, z_B), assuming it starts at (r, 0, 0).\n        ",
    "parameters": {
      "r": 1.6,
      "v": 5.16,
      "omega": 3.23,
      "t": 3.43,
      "rotation_plane": "yz-plane"
    },
    "answer_json": {
      "x_B": 0.0,
      "y_B": 0.1332,
      "z_B": -1.5944
    }
  },
  {
    "type": "3D Circular Motion",
    "question": "\n        Object  (Circular Motion)  \n           - Radius: 3.6 meters  \n           - Speed: 2.98 m/s  \n           - Angular velocity: 0.83 rad/s  \n           - Time: 3.92 s  \n           - Rotating in the xy-plane  \n           - Compute its position (x_B, y_B, z_B), assuming it starts at (r, 0, 0).\n        ",
    "parameters": {
      "r": 3.6,
      "v": 2.98,
      "omega": 0.83,
      "t": 3.92,
      "rotation_plane": "xy-plane"
    },
    "answer_json": {
      "x_B": -3.5774,
      "y_B": -0.4024,
      "z_B": 0.0
    }
  },
  {
    "type": "3D Circular Motion",
    "question": "\n        Object  (Circular Motion)  \n           - Radius: 1.53 meters  \n           - Speed: 1.29 m/s  \n           - Angular velocity: 0.84 rad/s  \n           - Time: 3.84 s  \n           - Rotating in the xz-plane  \n           - Compute its position (x_B, y_B, z_B), assuming it starts at (r, 0, 0).\n        ",
    "parameters": {
      "r": 1.53,
      "v": 1.29,
      "omega": 0.84,
      "t": 3.84,
      "rotation_plane": "xz-plane"
    },
    "answer_json": {
      "x_B": -1.5246,
      "y_B": 0.0,
      "z_B": -0.1284
    }
  },
  {
    "type": "3D Circular Motion",
    "question": "\n        Object  (Circular Motion)  \n           - Radius: 0.8 meters  \n           - Speed: 9.22 m/s  \n           - Angular velocity: 11.53 rad/s  \n           - Time: 6.1 s  \n           - Rotating in the yz-plane  \n           - Compute its position (x_B, y_B, z_B), assuming it starts at (r, 0, 0).\n        ",
    "parameters": {
      "r": 0.8,
      "v": 9.22,
      "omega": 11.53,
      "t": 6.1,
      "rotation_plane": "yz-plane"
    },
    "answer_json": {
      "x_B": 0.0,
      "y_B": 0.2764,
      "z_B": 0.7507
    }
  },
  {
    "type": "3D Circular Motion",
    "question": "\n        Object  (Circular Motion)  \n           - Radius: 1.92 meters  \n           - Speed: 6.9 m/s  \n           - Angular velocity: 3.59 rad/s  \n           - Time: 4.56 s  \n           - Rotating in the yz-plane  \n           - Compute its position (x_B, y_B, z_B), assuming it starts at (r, 0, 0).\n        ",
    "parameters": {
      "r": 1.92,
      "v": 6.9,
      "omega": 3.59,
      "t": 4.56,
      "rotation_plane": "yz-plane"
    },
    "answer_json": {
      "x_B": 0.0,
      "y_B": -1.5139,
      "z_B": -1.1809
    }
  },
  {
    "type": "3D Circular Motion",
    "question": "\n        Object  (Circular Motion)  \n           - Radius: 2.56 meters  \n           - Speed: 3.38 m/s  \n           - Angular velocity: 1.32 rad/s  \n           - Time: 3.22 s  \n           - Rotating in the yz-plane  \n           - Compute its position (x_B, y_B, z_B), assuming it starts at (r, 0, 0).\n        ",
    "parameters": {
      "r": 2.56,
      "v": 3.38,
      "omega": 1.32,
      "t": 3.22,
      "rotation_plane": "yz-plane"
    },
    "answer_json": {
      "x_B": 0.0,
      "y_B": -1.1411,
      "z_B": -2.2916
    }
  },
  {
    "type": "3D Circular Motion",
    "question": "\n        Object  (Circular Motion)  \n           - Radius: 2.93 meters  \n           - Speed: 7.72 m/s  \n           - Angular velocity: 2.63 rad/s  \n           - Time: 4.86 s  \n           - Rotating in the yz-plane  \n           - Compute its position (x_B, y_B, z_B), assuming it starts at (r, 0, 0).\n        ",
    "parameters": {
      "r": 2.93,
      "v": 7.72,
      "omega": 2.63,
      "t": 4.86,
      "rotation_plane": "yz-plane"
    },
    "answer_json": {
      "x_B": 0.0,
      "y_B": 2.8623,
      "z_B": 0.6263
    }
  },
  {
    "type": "3D Circular Motion",
    "question": "\n        Object  (Circular Motion)  \n           - Radius: 2.3 meters  \n           - Speed: 2.97 m/s  \n           - Angular velocity: 1.29 rad/s  \n           - Time: 9.98 s  \n           - Rotating in the yz-plane  \n           - Compute its position (x_B, y_B, z_B), assuming it starts at (r, 0, 0).\n        ",
    "parameters": {
      "r": 2.3,
      "v": 2.97,
      "omega": 1.29,
      "t": 9.98,
      "rotation_plane": "yz-plane"
    },
    "answer_json": {
      "x_B": 0.0,
      "y_B": 2.1919,
      "z_B": 0.6969
    }
  },
  {
    "type": "3D Circular Motion",
    "question": "\n        Object  (Circular Motion)  \n           - Radius: 2.72 meters  \n           - Speed: 7.8 m/s  \n           - Angular velocity: 2.87 rad/s  \n           - Time: 8.75 s  \n           - Rotating in the xy-plane  \n           - Compute its position (x_B, y_B, z_B), assuming it starts at (r, 0, 0).\n        ",
    "parameters": {
      "r": 2.72,
      "v": 7.8,
      "omega": 2.87,
      "t": 8.75,
      "rotation_plane": "xy-plane"
    },
    "answer_json": {
      "x_B": 2.7194,
      "y_B": -0.0551,
      "z_B": 0.0
    }
  },
  {
    "type": "3D Projectile Motion",
    "question": "\nA projectile is launched from (0,0,0) with an initial velocity of [6.1, 13.34, 8.27] m/s at an angle of 73.79 degrees.\nCalculate its flight time, maximum height (h), and range (dx, dy, dz).\n",
    "parameters": {
      "v0": [
        6.1,
        13.34,
        8.27
      ],
      "angle": 73.79
    },
    "answer_json": {
      "flight_time": 1.69,
      "maximum_height": 3.49,
      "range_x": 10.28,
      "range_y": 22.49,
      "range_z": 0
    }
  },
  {
    "type": "3D Projectile Motion",
    "question": "\nA projectile is launched from (0,0,0) with an initial velocity of [9.04, 16.05, 22.64] m/s at an angle of 48.65 degrees.\nCalculate its flight time, maximum height (h), and range (dx, dy, dz).\n",
    "parameters": {
      "v0": [
        9.04,
        16.05,
        22.64
      ],
      "angle": 48.65
    },
    "answer_json": {
      "flight_time": 4.62,
      "maximum_height": 26.12,
      "range_x": 41.73,
      "range_y": 74.08,
      "range_z": 0
    }
  },
  {
    "type": "3D Projectile Motion",
    "question": "\nA projectile is launched from (0,0,0) with an initial velocity of [7.8, 28.63, 22.28] m/s at an angle of 23.94 degrees.\nCalculate its flight time, maximum height (h), and range (dx, dy, dz).\n",
    "parameters": {
      "v0": [
        7.8,
        28.63,
        22.28
      ],
      "angle": 23.94
    },
    "answer_json": {
      "flight_time": 4.54,
      "maximum_height": 25.3,
      "range_x": 35.43,
      "range_y": 130.05,
      "range_z": 0
    }
  },
  {
    "type": "3D Projectile Motion",
    "question": "\nA projectile is launched from (0,0,0) with an initial velocity of [5.9, 14.23, 18.81] m/s at an angle of 40.79 degrees.\nCalculate its flight time, maximum height (h), and range (dx, dy, dz).\n",
    "parameters": {
      "v0": [
        5.9,
        14.23,
        18.81
      ],
      "angle": 40.79
    },
    "answer_json": {
      "flight_time": 3.83,
      "maximum_height": 18.03,
      "range_x": 22.63,
      "range_y": 54.57,
      "range_z": 0
    }
  },
  {
    "type": "3D Projectile Motion",
    "question": "\nA projectile is launched from (0,0,0) with an initial velocity of [6.05, 14.12, 28.33] m/s at an angle of 73.33 degrees.\nCalculate its flight time, maximum height (h), and range (dx, dy, dz).\n",
    "parameters": {
      "v0": [
        6.05,
        14.12,
        28.33
      ],
      "angle": 73.33
    },
    "answer_json": {
      "flight_time": 5.78,
      "maximum_height": 40.91,
      "range_x": 34.94,
      "range_y": 81.55,
      "range_z": 0
    }
  },
  {
    "type": "3D Projectile Motion",
    "question": "\nA projectile is launched from (0,0,0) with an initial velocity of [6.0, 13.95, 22.05] m/s at an angle of 55.02 degrees.\nCalculate its flight time, maximum height (h), and range (dx, dy, dz).\n",
    "parameters": {
      "v0": [
        6.0,
        13.95,
        22.05
      ],
      "angle": 55.02
    },
    "answer_json": {
      "flight_time": 4.5,
      "maximum_height": 24.78,
      "range_x": 26.97,
      "range_y": 62.71,
      "range_z": 0
    }
  },
  {
    "type": "3D Projectile Motion",
    "question": "\nA projectile is launched from (0,0,0) with an initial velocity of [13.84, 19.0, 26.87] m/s at an angle of 73.43 degrees.\nCalculate its flight time, maximum height (h), and range (dx, dy, dz).\n",
    "parameters": {
      "v0": [
        13.84,
        19.0,
        26.87
      ],
      "angle": 73.43
    },
    "answer_json": {
      "flight_time": 5.48,
      "maximum_height": 36.8,
      "range_x": 75.82,
      "range_y": 104.08,
      "range_z": 0
    }
  },
  {
    "type": "3D Projectile Motion",
    "question": "\nA projectile is launched from (0,0,0) with an initial velocity of [23.74, 28.14, 10.92] m/s at an angle of 24.75 degrees.\nCalculate its flight time, maximum height (h), and range (dx, dy, dz).\n",
    "parameters": {
      "v0": [
        23.74,
        28.14,
        10.92
      ],
      "angle": 24.75
    },
    "answer_json": {
      "flight_time": 2.23,
      "maximum_height": 6.08,
      "range_x": 52.85,
      "range_y": 62.65,
      "range_z": 0
    }
  },
  {
    "type": "3D Projectile Motion",
    "question": "\nA projectile is launched from (0,0,0) with an initial velocity of [25.0, 9.43, 15.31] m/s at an angle of 25.76 degrees.\nCalculate its flight time, maximum height (h), and range (dx, dy, dz).\n",
    "parameters": {
      "v0": [
        25.0,
        9.43,
        15.31
      ],
      "angle": 25.76
    },
    "answer_json": {
      "flight_time": 3.12,
      "maximum_height": 11.95,
      "range_x": 78.03,
      "range_y": 29.43,
      "range_z": 0
    }
  },
  {
    "type": "3D Projectile Motion",
    "question": "\nA projectile is launched from (0,0,0) with an initial velocity of [28.11, 24.56, 15.29] m/s at an angle of 55.19 degrees.\nCalculate its flight time, maximum height (h), and range (dx, dy, dz).\n",
    "parameters": {
      "v0": [
        28.11,
        24.56,
        15.29
      ],
      "angle": 55.19
    },
    "answer_json": {
      "flight_time": 3.12,
      "maximum_height": 11.92,
      "range_x": 87.63,
      "range_y": 76.56,
      "range_z": 0
    }
  },
  {
    "type": "3D Projectile Motion",
    "question": "\nA projectile is launched from (0,0,0) with an initial velocity of [23.38, 11.2, 8.98] m/s at an angle of 57.08 degrees.\nCalculate its flight time, maximum height (h), and range (dx, dy, dz).\n",
    "parameters": {
      "v0": [
        23.38,
        11.2,
        8.98
      ],
      "angle": 57.08
    },
    "answer_json": {
      "flight_time": 1.83,
      "maximum_height": 4.11,
      "range_x": 42.8,
      "range_y": 20.5,
      "range_z": 0
    }
  },
  {
    "type": "3D Projectile Motion",
    "question": "\nA projectile is launched from (0,0,0) with an initial velocity of [14.56, 5.97, 16.77] m/s at an angle of 26.97 degrees.\nCalculate its flight time, maximum height (h), and range (dx, dy, dz).\n",
    "parameters": {
      "v0": [
        14.56,
        5.97,
        16.77
      ],
      "angle": 26.97
    },
    "answer_json": {
      "flight_time": 3.42,
      "maximum_height": 14.33,
      "range_x": 49.78,
      "range_y": 20.41,
      "range_z": 0
    }
  },
  {
    "type": "3D Projectile Motion",
    "question": "\nA projectile is launched from (0,0,0) with an initial velocity of [27.96, 13.74, 25.51] m/s at an angle of 67.28 degrees.\nCalculate its flight time, maximum height (h), and range (dx, dy, dz).\n",
    "parameters": {
      "v0": [
        27.96,
        13.74,
        25.51
      ],
      "angle": 67.28
    },
    "answer_json": {
      "flight_time": 5.2,
      "maximum_height": 33.17,
      "range_x": 145.41,
      "range_y": 71.46,
      "range_z": 0
    }
  },
  {
    "type": "3D Projectile Motion",
    "question": "\nA projectile is launched from (0,0,0) with an initial velocity of [10.57, 21.5, 14.96] m/s at an angle of 31.72 degrees.\nCalculate its flight time, maximum height (h), and range (dx, dy, dz).\n",
    "parameters": {
      "v0": [
        10.57,
        21.5,
        14.96
      ],
      "angle": 31.72
    },
    "answer_json": {
      "flight_time": 3.05,
      "maximum_height": 11.41,
      "range_x": 32.24,
      "range_y": 65.57,
      "range_z": 0
    }
  },
  {
    "type": "3D Projectile Motion",
    "question": "\nA projectile is launched from (0,0,0) with an initial velocity of [6.74, 24.33, 13.78] m/s at an angle of 45.56 degrees.\nCalculate its flight time, maximum height (h), and range (dx, dy, dz).\n",
    "parameters": {
      "v0": [
        6.74,
        24.33,
        13.78
      ],
      "angle": 45.56
    },
    "answer_json": {
      "flight_time": 2.81,
      "maximum_height": 9.68,
      "range_x": 18.94,
      "range_y": 68.35,
      "range_z": 0
    }
  },
  {
    "type": "3D Projectile Motion",
    "question": "\nA projectile is launched from (0,0,0) with an initial velocity of [21.99, 26.09, 13.28] m/s at an angle of 16.66 degrees.\nCalculate its flight time, maximum height (h), and range (dx, dy, dz).\n",
    "parameters": {
      "v0": [
        21.99,
        26.09,
        13.28
      ],
      "angle": 16.66
    },
    "answer_json": {
      "flight_time": 2.71,
      "maximum_height": 8.99,
      "range_x": 59.54,
      "range_y": 70.64,
      "range_z": 0
    }
  },
  {
    "type": "3D Projectile Motion",
    "question": "\nA projectile is launched from (0,0,0) with an initial velocity of [26.93, 11.53, 19.51] m/s at an angle of 74.01 degrees.\nCalculate its flight time, maximum height (h), and range (dx, dy, dz).\n",
    "parameters": {
      "v0": [
        26.93,
        11.53,
        19.51
      ],
      "angle": 74.01
    },
    "answer_json": {
      "flight_time": 3.98,
      "maximum_height": 19.4,
      "range_x": 107.12,
      "range_y": 45.86,
      "range_z": 0
    }
  },
  {
    "type": "3D Projectile Motion",
    "question": "\nA projectile is launched from (0,0,0) with an initial velocity of [5.96, 19.91, 13.64] m/s at an angle of 62.19 degrees.\nCalculate its flight time, maximum height (h), and range (dx, dy, dz).\n",
    "parameters": {
      "v0": [
        5.96,
        19.91,
        13.64
      ],
      "angle": 62.19
    },
    "answer_json": {
      "flight_time": 2.78,
      "maximum_height": 9.48,
      "range_x": 16.57,
      "range_y": 55.37,
      "range_z": 0
    }
  },
  {
    "type": "3D Projectile Motion",
    "question": "\nA projectile is launched from (0,0,0) with an initial velocity of [15.91, 29.61, 7.89] m/s at an angle of 68.97 degrees.\nCalculate its flight time, maximum height (h), and range (dx, dy, dz).\n",
    "parameters": {
      "v0": [
        15.91,
        29.61,
        7.89
      ],
      "angle": 68.97
    },
    "answer_json": {
      "flight_time": 1.61,
      "maximum_height": 3.17,
      "range_x": 25.59,
      "range_y": 47.63,
      "range_z": 0
    }
  },
  {
    "type": "3D Projectile Motion",
    "question": "\nA projectile is launched from (0,0,0) with an initial velocity of [9.75, 6.11, 15.9] m/s at an angle of 46.2 degrees.\nCalculate its flight time, maximum height (h), and range (dx, dy, dz).\n",
    "parameters": {
      "v0": [
        9.75,
        6.11,
        15.9
      ],
      "angle": 46.2
    },
    "answer_json": {
      "flight_time": 3.24,
      "maximum_height": 12.89,
      "range_x": 31.61,
      "range_y": 19.81,
      "range_z": 0
    }
  },
  {
    "type": "3D Projectile Motion",
    "question": "\nA projectile is launched from (0,0,0) with an initial velocity of [25.16, 22.17, 28.51] m/s at an angle of 59.22 degrees.\nCalculate its flight time, maximum height (h), and range (dx, dy, dz).\n",
    "parameters": {
      "v0": [
        25.16,
        22.17,
        28.51
      ],
      "angle": 59.22
    },
    "answer_json": {
      "flight_time": 5.81,
      "maximum_height": 41.43,
      "range_x": 146.24,
      "range_y": 128.86,
      "range_z": 0
    }
  },
  {
    "type": "3D Projectile Motion",
    "question": "\nA projectile is launched from (0,0,0) with an initial velocity of [9.93, 15.78, 28.72] m/s at an angle of 70.25 degrees.\nCalculate its flight time, maximum height (h), and range (dx, dy, dz).\n",
    "parameters": {
      "v0": [
        9.93,
        15.78,
        28.72
      ],
      "angle": 70.25
    },
    "answer_json": {
      "flight_time": 5.86,
      "maximum_height": 42.04,
      "range_x": 58.14,
      "range_y": 92.4,
      "range_z": 0
    }
  },
  {
    "type": "3D Projectile Motion",
    "question": "\nA projectile is launched from (0,0,0) with an initial velocity of [20.58, 21.58, 8.12] m/s at an angle of 69.0 degrees.\nCalculate its flight time, maximum height (h), and range (dx, dy, dz).\n",
    "parameters": {
      "v0": [
        20.58,
        21.58,
        8.12
      ],
      "angle": 69.0
    },
    "answer_json": {
      "flight_time": 1.66,
      "maximum_height": 3.36,
      "range_x": 34.07,
      "range_y": 35.72,
      "range_z": 0
    }
  },
  {
    "type": "3D Projectile Motion",
    "question": "\nA projectile is launched from (0,0,0) with an initial velocity of [17.68, 21.67, 13.15] m/s at an angle of 56.83 degrees.\nCalculate its flight time, maximum height (h), and range (dx, dy, dz).\n",
    "parameters": {
      "v0": [
        17.68,
        21.67,
        13.15
      ],
      "angle": 56.83
    },
    "answer_json": {
      "flight_time": 2.68,
      "maximum_height": 8.81,
      "range_x": 47.4,
      "range_y": 58.1,
      "range_z": 0
    }
  },
  {
    "type": "3D Projectile Motion",
    "question": "\nA projectile is launched from (0,0,0) with an initial velocity of [18.86, 9.8, 21.62] m/s at an angle of 37.75 degrees.\nCalculate its flight time, maximum height (h), and range (dx, dy, dz).\n",
    "parameters": {
      "v0": [
        18.86,
        9.8,
        21.62
      ],
      "angle": 37.75
    },
    "answer_json": {
      "flight_time": 4.41,
      "maximum_height": 23.82,
      "range_x": 83.13,
      "range_y": 43.2,
      "range_z": 0
    }
  },
  {
    "type": "3D Multi-Object Motion",
    "question": "\nThree objects move in different types of motion in 3D space:\n1. Object A (Linear Motion)  \n   - Initial velocity: [15.21, 4.31, 11.81] m/s  \n   - Acceleration: [-0.94, 3.34, -1.96] m/s\u00b2  \n   - Time: 2.89 s  \n   - Compute its final position (x_A, y_A, z_A). Assume it starts at (0, 0, 0).\n\n2. Object B (Circular Motion)  \n   - Radius: 4.04 meters  \n   - Speed: 6.46 m/s  \n   - Angular velocity: 1.6 rad/s  \n   - Time: 3.9 s  \n   - Rotating in the xz-plane  \n   - Compute its position (x_B, y_B, z_B), assuming it starts at (r_B, 0, 0).\n\n3. Object C (Projectile Motion)  \n   - Initial speed: [16.05, 10.34, 16.83] m/s  \n   - Launch angle: 69.07 degrees  \n   - Time: 8.16 s  \n   - Compute its position (x_C, y_C, z_C), assuming it starts from (0,0,0).\n",
    "parameters": {
      "object_A": {
        "v0": [
          15.21,
          4.31,
          11.81
        ],
        "a": [
          -0.94,
          3.34,
          -1.96
        ],
        "t": 2.89
      },
      "object_B": {
        "r": 4.04,
        "v": 6.46,
        "omega": 1.6,
        "t": 3.9,
        "rotation_plane": "xz-plane"
      },
      "object_C": {
        "v0": [
          16.05,
          10.34,
          16.83
        ],
        "angle": 69.07,
        "t": 8.16
      }
    },
    "answer_json": {
      "pos_A": {
        "x_A": 40.03,
        "y_A": 26.4,
        "z_A": 25.95
      },
      "pos_B": {
        "x_B": 4.04,
        "y_B": 0,
        "z_B": -0.17
      },
      "pos_C": {
        "x_C": 130.97,
        "y_C": 84.37,
        "z_C": -189.27
      }
    }
  },
  {
    "type": "3D Multi-Object Motion",
    "question": "\nThree objects move in different types of motion in 3D space:\n1. Object A (Linear Motion)  \n   - Initial velocity: [4.22, 2.61, 10.79] m/s  \n   - Acceleration: [1.33, -1.65, 3.18] m/s\u00b2  \n   - Time: 7.76 s  \n   - Compute its final position (x_A, y_A, z_A). Assume it starts at (0, 0, 0).\n\n2. Object B (Circular Motion)  \n   - Radius: 3.53 meters  \n   - Speed: 3.02 m/s  \n   - Angular velocity: 0.86 rad/s  \n   - Time: 2.79 s  \n   - Rotating in the xy-plane  \n   - Compute its position (x_B, y_B, z_B), assuming it starts at (r_B, 0, 0).\n\n3. Object C (Projectile Motion)  \n   - Initial speed: [6.16, 29.6, 20.28] m/s  \n   - Launch angle: 61.11 degrees  \n   - Time: 5.1 s  \n   - Compute its position (x_C, y_C, z_C), assuming it starts from (0,0,0).\n",
    "parameters": {
      "object_A": {
        "v0": [
          4.22,
          2.61,
          10.79
        ],
        "a": [
          1.33,
          -1.65,
          3.18
        ],
        "t": 7.76
      },
      "object_B": {
        "r": 3.53,
        "v": 3.02,
        "omega": 0.86,
        "t": 2.79,
        "rotation_plane": "xy-plane"
      },
      "object_C": {
        "v0": [
          6.16,
          29.6,
          20.28
        ],
        "angle": 61.11,
        "t": 5.1
      }
    },
    "answer_json": {
      "pos_A": {
        "x_A": 72.79,
        "y_A": -29.43,
        "z_A": 179.48
      },
      "pos_B": {
        "x_B": -2.6,
        "y_B": 2.39,
        "z_B": 0
      },
      "pos_C": {
        "x_C": 31.42,
        "y_C": 150.96,
        "z_C": -24.15
      }
    }
  },
  {
    "type": "3D Multi-Object Motion",
    "question": "\nThree objects move in different types of motion in 3D space:\n1. Object A (Linear Motion)  \n   - Initial velocity: [17.84, 11.94, 14.65] m/s  \n   - Acceleration: [-1.16, -1.0, -3.52] m/s\u00b2  \n   - Time: 7.19 s  \n   - Compute its final position (x_A, y_A, z_A). Assume it starts at (0, 0, 0).\n\n2. Object B (Circular Motion)  \n   - Radius: 4.52 meters  \n   - Speed: 8.74 m/s  \n   - Angular velocity: 1.93 rad/s  \n   - Time: 8.97 s  \n   - Rotating in the xz-plane  \n   - Compute its position (x_B, y_B, z_B), assuming it starts at (r_B, 0, 0).\n\n3. Object C (Projectile Motion)  \n   - Initial speed: [10.47, 25.1, 22.4] m/s  \n   - Launch angle: 42.87 degrees  \n   - Time: 6.02 s  \n   - Compute its position (x_C, y_C, z_C), assuming it starts from (0,0,0).\n",
    "parameters": {
      "object_A": {
        "v0": [
          17.84,
          11.94,
          14.65
        ],
        "a": [
          -1.16,
          -1.0,
          -3.52
        ],
        "t": 7.19
      },
      "object_B": {
        "r": 4.52,
        "v": 8.74,
        "omega": 1.93,
        "t": 8.97,
        "rotation_plane": "xz-plane"
      },
      "object_C": {
        "v0": [
          10.47,
          25.1,
          22.4
        ],
        "angle": 42.87,
        "t": 6.02
      }
    },
    "answer_json": {
      "pos_A": {
        "x_A": 98.29,
        "y_A": 60.0,
        "z_A": 14.35
      },
      "pos_B": {
        "x_B": 0.15,
        "y_B": 0,
        "z_B": -4.52
      },
      "pos_C": {
        "x_C": 63.03,
        "y_C": 151.1,
        "z_C": -42.91
      }
    }
  },
  {
    "type": "3D Multi-Object Motion",
    "question": "\nThree objects move in different types of motion in 3D space:\n1. Object A (Linear Motion)  \n   - Initial velocity: [18.43, 3.31, 3.53] m/s  \n   - Acceleration: [-0.35, 0.31, 0.59] m/s\u00b2  \n   - Time: 3.86 s  \n   - Compute its final position (x_A, y_A, z_A). Assume it starts at (0, 0, 0).\n\n2. Object B (Circular Motion)  \n   - Radius: 3.9 meters  \n   - Speed: 4.98 m/s  \n   - Angular velocity: 1.28 rad/s  \n   - Time: 8.34 s  \n   - Rotating in the yz-plane  \n   - Compute its position (x_B, y_B, z_B), assuming it starts at (r_B, 0, 0).\n\n3. Object C (Projectile Motion)  \n   - Initial speed: [15.67, 27.67, 16.15] m/s  \n   - Launch angle: 24.55 degrees  \n   - Time: 8.75 s  \n   - Compute its position (x_C, y_C, z_C), assuming it starts from (0,0,0).\n",
    "parameters": {
      "object_A": {
        "v0": [
          18.43,
          3.31,
          3.53
        ],
        "a": [
          -0.35,
          0.31,
          0.59
        ],
        "t": 3.86
      },
      "object_B": {
        "r": 3.9,
        "v": 4.98,
        "omega": 1.28,
        "t": 8.34,
        "rotation_plane": "yz-plane"
      },
      "object_C": {
        "v0": [
          15.67,
          27.67,
          16.15
        ],
        "angle": 24.55,
        "t": 8.75
      }
    },
    "answer_json": {
      "pos_A": {
        "x_A": 68.53,
        "y_A": 15.09,
        "z_A": 18.02
      },
      "pos_B": {
        "x_B": 0,
        "y_B": -1.23,
        "z_B": -3.7
      },
      "pos_C": {
        "x_C": 137.11,
        "y_C": 242.11,
        "z_C": -234.23
      }
    }
  },
  {
    "type": "3D Multi-Object Motion",
    "question": "\nThree objects move in different types of motion in 3D space:\n1. Object A (Linear Motion)  \n   - Initial velocity: [9.55, 15.28, 16.96] m/s  \n   - Acceleration: [-2.23, 2.78, -0.15] m/s\u00b2  \n   - Time: 3.15 s  \n   - Compute its final position (x_A, y_A, z_A). Assume it starts at (0, 0, 0).\n\n2. Object B (Circular Motion)  \n   - Radius: 2.48 meters  \n   - Speed: 7.42 m/s  \n   - Angular velocity: 2.99 rad/s  \n   - Time: 3.11 s  \n   - Rotating in the xz-plane  \n   - Compute its position (x_B, y_B, z_B), assuming it starts at (r_B, 0, 0).\n\n3. Object C (Projectile Motion)  \n   - Initial speed: [12.99, 18.5, 8.46] m/s  \n   - Launch angle: 28.88 degrees  \n   - Time: 7.25 s  \n   - Compute its position (x_C, y_C, z_C), assuming it starts from (0,0,0).\n",
    "parameters": {
      "object_A": {
        "v0": [
          9.55,
          15.28,
          16.96
        ],
        "a": [
          -2.23,
          2.78,
          -0.15
        ],
        "t": 3.15
      },
      "object_B": {
        "r": 2.48,
        "v": 7.42,
        "omega": 2.99,
        "t": 3.11,
        "rotation_plane": "xz-plane"
      },
      "object_C": {
        "v0": [
          12.99,
          18.5,
          8.46
        ],
        "angle": 28.88,
        "t": 7.25
      }
    },
    "answer_json": {
      "pos_A": {
        "x_A": 19.02,
        "y_A": 61.92,
        "z_A": 52.68
      },
      "pos_B": {
        "x_B": -2.46,
        "y_B": 0,
        "z_B": 0.31
      },
      "pos_C": {
        "x_C": 94.18,
        "y_C": 134.12,
        "z_C": -196.48
      }
    }
  },
  {
    "type": "3D Multi-Object Motion",
    "question": "\nThree objects move in different types of motion in 3D space:\n1. Object A (Linear Motion)  \n   - Initial velocity: [14.42, 2.22, 8.74] m/s  \n   - Acceleration: [0.43, -0.84, -2.93] m/s\u00b2  \n   - Time: 4.78 s  \n   - Compute its final position (x_A, y_A, z_A). Assume it starts at (0, 0, 0).\n\n2. Object B (Circular Motion)  \n   - Radius: 4.57 meters  \n   - Speed: 6.26 m/s  \n   - Angular velocity: 1.37 rad/s  \n   - Time: 7.26 s  \n   - Rotating in the yz-plane  \n   - Compute its position (x_B, y_B, z_B), assuming it starts at (r_B, 0, 0).\n\n3. Object C (Projectile Motion)  \n   - Initial speed: [14.51, 5.15, 13.79] m/s  \n   - Launch angle: 60.21 degrees  \n   - Time: 8.68 s  \n   - Compute its position (x_C, y_C, z_C), assuming it starts from (0,0,0).\n",
    "parameters": {
      "object_A": {
        "v0": [
          14.42,
          2.22,
          8.74
        ],
        "a": [
          0.43,
          -0.84,
          -2.93
        ],
        "t": 4.78
      },
      "object_B": {
        "r": 4.57,
        "v": 6.26,
        "omega": 1.37,
        "t": 7.26,
        "rotation_plane": "yz-plane"
      },
      "object_C": {
        "v0": [
          14.51,
          5.15,
          13.79
        ],
        "angle": 60.21,
        "t": 8.68
      }
    },
    "answer_json": {
      "pos_A": {
        "x_A": 73.84,
        "y_A": 1.02,
        "z_A": 8.3
      },
      "pos_B": {
        "x_B": 0,
        "y_B": -3.96,
        "z_B": -2.28
      },
      "pos_C": {
        "x_C": 125.95,
        "y_C": 44.7,
        "z_C": -249.86
      }
    }
  },
  {
    "type": "3D Multi-Object Motion",
    "question": "\nThree objects move in different types of motion in 3D space:\n1. Object A (Linear Motion)  \n   - Initial velocity: [19.12, 8.96, 15.2] m/s  \n   - Acceleration: [0.46, 1.03, -2.79] m/s\u00b2  \n   - Time: 2.97 s  \n   - Compute its final position (x_A, y_A, z_A). Assume it starts at (0, 0, 0).\n\n2. Object B (Circular Motion)  \n   - Radius: 2.46 meters  \n   - Speed: 1.26 m/s  \n   - Angular velocity: 0.51 rad/s  \n   - Time: 4.03 s  \n   - Rotating in the yz-plane  \n   - Compute its position (x_B, y_B, z_B), assuming it starts at (r_B, 0, 0).\n\n3. Object C (Projectile Motion)  \n   - Initial speed: [24.95, 23.1, 26.01] m/s  \n   - Launch angle: 70.17 degrees  \n   - Time: 9.83 s  \n   - Compute its position (x_C, y_C, z_C), assuming it starts from (0,0,0).\n",
    "parameters": {
      "object_A": {
        "v0": [
          19.12,
          8.96,
          15.2
        ],
        "a": [
          0.46,
          1.03,
          -2.79
        ],
        "t": 2.97
      },
      "object_B": {
        "r": 2.46,
        "v": 1.26,
        "omega": 0.51,
        "t": 4.03,
        "rotation_plane": "yz-plane"
      },
      "object_C": {
        "v0": [
          24.95,
          23.1,
          26.01
        ],
        "angle": 70.17,
        "t": 9.83
      }
    },
    "answer_json": {
      "pos_A": {
        "x_A": 58.82,
        "y_A": 31.15,
        "z_A": 32.84
      },
      "pos_B": {
        "x_B": 0,
        "y_B": -1.15,
        "z_B": 2.18
      },
      "pos_C": {
        "x_C": 245.26,
        "y_C": 227.07,
        "z_C": -218.29
      }
    }
  },
  {
    "type": "3D Multi-Object Motion",
    "question": "\nThree objects move in different types of motion in 3D space:\n1. Object A (Linear Motion)  \n   - Initial velocity: [11.15, 18.23, 12.25] m/s  \n   - Acceleration: [1.63, -4.16, -0.71] m/s\u00b2  \n   - Time: 8.8 s  \n   - Compute its final position (x_A, y_A, z_A). Assume it starts at (0, 0, 0).\n\n2. Object B (Circular Motion)  \n   - Radius: 1.32 meters  \n   - Speed: 3.34 m/s  \n   - Angular velocity: 2.53 rad/s  \n   - Time: 3.95 s  \n   - Rotating in the xz-plane  \n   - Compute its position (x_B, y_B, z_B), assuming it starts at (r_B, 0, 0).\n\n3. Object C (Projectile Motion)  \n   - Initial speed: [13.17, 24.03, 14.48] m/s  \n   - Launch angle: 60.12 degrees  \n   - Time: 8.49 s  \n   - Compute its position (x_C, y_C, z_C), assuming it starts from (0,0,0).\n",
    "parameters": {
      "object_A": {
        "v0": [
          11.15,
          18.23,
          12.25
        ],
        "a": [
          1.63,
          -4.16,
          -0.71
        ],
        "t": 8.8
      },
      "object_B": {
        "r": 1.32,
        "v": 3.34,
        "omega": 2.53,
        "t": 3.95,
        "rotation_plane": "xz-plane"
      },
      "object_C": {
        "v0": [
          13.17,
          24.03,
          14.48
        ],
        "angle": 60.12,
        "t": 8.49
      }
    },
    "answer_json": {
      "pos_A": {
        "x_A": 161.23,
        "y_A": -0.65,
        "z_A": 80.31
      },
      "pos_B": {
        "x_B": -1.11,
        "y_B": 0,
        "z_B": -0.71
      },
      "pos_C": {
        "x_C": 111.81,
        "y_C": 204.01,
        "z_C": -230.62
      }
    }
  },
  {
    "type": "3D Multi-Object Motion",
    "question": "\nThree objects move in different types of motion in 3D space:\n1. Object A (Linear Motion)  \n   - Initial velocity: [5.79, 2.56, 1.37] m/s  \n   - Acceleration: [0.39, 5.0, -1.5] m/s\u00b2  \n   - Time: 6.85 s  \n   - Compute its final position (x_A, y_A, z_A). Assume it starts at (0, 0, 0).\n\n2. Object B (Circular Motion)  \n   - Radius: 4.02 meters  \n   - Speed: 6.87 m/s  \n   - Angular velocity: 1.71 rad/s  \n   - Time: 7.79 s  \n   - Rotating in the xy-plane  \n   - Compute its position (x_B, y_B, z_B), assuming it starts at (r_B, 0, 0).\n\n3. Object C (Projectile Motion)  \n   - Initial speed: [9.98, 5.51, 8.81] m/s  \n   - Launch angle: 22.57 degrees  \n   - Time: 7.03 s  \n   - Compute its position (x_C, y_C, z_C), assuming it starts from (0,0,0).\n",
    "parameters": {
      "object_A": {
        "v0": [
          5.79,
          2.56,
          1.37
        ],
        "a": [
          0.39,
          5.0,
          -1.5
        ],
        "t": 6.85
      },
      "object_B": {
        "r": 4.02,
        "v": 6.87,
        "omega": 1.71,
        "t": 7.79,
        "rotation_plane": "xy-plane"
      },
      "object_C": {
        "v0": [
          9.98,
          5.51,
          8.81
        ],
        "angle": 22.57,
        "t": 7.03
      }
    },
    "answer_json": {
      "pos_A": {
        "x_A": 48.81,
        "y_A": 134.84,
        "z_A": -25.81
      },
      "pos_B": {
        "x_B": 2.93,
        "y_B": 2.75,
        "z_B": 0
      },
      "pos_C": {
        "x_C": 70.16,
        "y_C": 38.74,
        "z_C": -180.48
      }
    }
  },
  {
    "type": "3D Multi-Object Motion",
    "question": "\nThree objects move in different types of motion in 3D space:\n1. Object A (Linear Motion)  \n   - Initial velocity: [11.72, 5.14, 14.29] m/s  \n   - Acceleration: [2.67, -3.32, 1.07] m/s\u00b2  \n   - Time: 7.73 s  \n   - Compute its final position (x_A, y_A, z_A). Assume it starts at (0, 0, 0).\n\n2. Object B (Circular Motion)  \n   - Radius: 1.02 meters  \n   - Speed: 8.37 m/s  \n   - Angular velocity: 8.21 rad/s  \n   - Time: 9.68 s  \n   - Rotating in the xy-plane  \n   - Compute its position (x_B, y_B, z_B), assuming it starts at (r_B, 0, 0).\n\n3. Object C (Projectile Motion)  \n   - Initial speed: [19.47, 28.22, 19.39] m/s  \n   - Launch angle: 69.48 degrees  \n   - Time: 4.38 s  \n   - Compute its position (x_C, y_C, z_C), assuming it starts from (0,0,0).\n",
    "parameters": {
      "object_A": {
        "v0": [
          11.72,
          5.14,
          14.29
        ],
        "a": [
          2.67,
          -3.32,
          1.07
        ],
        "t": 7.73
      },
      "object_B": {
        "r": 1.02,
        "v": 8.37,
        "omega": 8.21,
        "t": 9.68,
        "rotation_plane": "xy-plane"
      },
      "object_C": {
        "v0": [
          19.47,
          28.22,
          19.39
        ],
        "angle": 69.48,
        "t": 4.38
      }
    },
    "answer_json": {
      "pos_A": {
        "x_A": 170.37,
        "y_A": -59.46,
        "z_A": 142.43
      },
      "pos_B": {
        "x_B": -0.61,
        "y_B": -0.82,
        "z_B": 0
      },
      "pos_C": {
        "x_C": 85.28,
        "y_C": 123.6,
        "z_C": -9.17
      }
    }
  },
  {
    "type": "3D Multi-Object Motion",
    "question": "\nThree objects move in different types of motion in 3D space:\n1. Object A (Linear Motion)  \n   - Initial velocity: [18.89, 4.77, 12.25] m/s  \n   - Acceleration: [3.31, -2.57, 1.97] m/s\u00b2  \n   - Time: 3.71 s  \n   - Compute its final position (x_A, y_A, z_A). Assume it starts at (0, 0, 0).\n\n2. Object B (Circular Motion)  \n   - Radius: 3.58 meters  \n   - Speed: 8.25 m/s  \n   - Angular velocity: 2.3 rad/s  \n   - Time: 8.17 s  \n   - Rotating in the yz-plane  \n   - Compute its position (x_B, y_B, z_B), assuming it starts at (r_B, 0, 0).\n\n3. Object C (Projectile Motion)  \n   - Initial speed: [24.57, 13.68, 15.71] m/s  \n   - Launch angle: 37.23 degrees  \n   - Time: 5.55 s  \n   - Compute its position (x_C, y_C, z_C), assuming it starts from (0,0,0).\n",
    "parameters": {
      "object_A": {
        "v0": [
          18.89,
          4.77,
          12.25
        ],
        "a": [
          3.31,
          -2.57,
          1.97
        ],
        "t": 3.71
      },
      "object_B": {
        "r": 3.58,
        "v": 8.25,
        "omega": 2.3,
        "t": 8.17,
        "rotation_plane": "yz-plane"
      },
      "object_C": {
        "v0": [
          24.57,
          13.68,
          15.71
        ],
        "angle": 37.23,
        "t": 5.55
      }
    },
    "answer_json": {
      "pos_A": {
        "x_A": 92.86,
        "y_A": 0.01,
        "z_A": 59.01
      },
      "pos_B": {
        "x_B": 0,
        "y_B": 3.57,
        "z_B": -0.21
      },
      "pos_C": {
        "x_C": 136.36,
        "y_C": 75.92,
        "z_C": -63.9
      }
    }
  },
  {
    "type": "3D Multi-Object Motion",
    "question": "\nThree objects move in different types of motion in 3D space:\n1. Object A (Linear Motion)  \n   - Initial velocity: [7.48, 17.14, 16.62] m/s  \n   - Acceleration: [-3.94, 4.61, 1.36] m/s\u00b2  \n   - Time: 8.46 s  \n   - Compute its final position (x_A, y_A, z_A). Assume it starts at (0, 0, 0).\n\n2. Object B (Circular Motion)  \n   - Radius: 3.68 meters  \n   - Speed: 4.92 m/s  \n   - Angular velocity: 1.34 rad/s  \n   - Time: 7.6 s  \n   - Rotating in the yz-plane  \n   - Compute its position (x_B, y_B, z_B), assuming it starts at (r_B, 0, 0).\n\n3. Object C (Projectile Motion)  \n   - Initial speed: [11.75, 25.2, 18.45] m/s  \n   - Launch angle: 44.01 degrees  \n   - Time: 4.92 s  \n   - Compute its position (x_C, y_C, z_C), assuming it starts from (0,0,0).\n",
    "parameters": {
      "object_A": {
        "v0": [
          7.48,
          17.14,
          16.62
        ],
        "a": [
          -3.94,
          4.61,
          1.36
        ],
        "t": 8.46
      },
      "object_B": {
        "r": 3.68,
        "v": 4.92,
        "omega": 1.34,
        "t": 7.6,
        "rotation_plane": "yz-plane"
      },
      "object_C": {
        "v0": [
          11.75,
          25.2,
          18.45
        ],
        "angle": 44.01,
        "t": 4.92
      }
    },
    "answer_json": {
      "pos_A": {
        "x_A": -77.72,
        "y_A": 309.98,
        "z_A": 189.27
      },
      "pos_B": {
        "x_B": 0,
        "y_B": -2.67,
        "z_B": -2.53
      },
      "pos_C": {
        "x_C": 57.81,
        "y_C": 123.98,
        "z_C": -27.96
      }
    }
  },
  {
    "type": "3D Multi-Object Motion",
    "question": "\nThree objects move in different types of motion in 3D space:\n1. Object A (Linear Motion)  \n   - Initial velocity: [14.89, 6.1, 17.18] m/s  \n   - Acceleration: [3.31, -4.13, 3.82] m/s\u00b2  \n   - Time: 3.19 s  \n   - Compute its final position (x_A, y_A, z_A). Assume it starts at (0, 0, 0).\n\n2. Object B (Circular Motion)  \n   - Radius: 2.59 meters  \n   - Speed: 6.49 m/s  \n   - Angular velocity: 2.51 rad/s  \n   - Time: 4.41 s  \n   - Rotating in the xy-plane  \n   - Compute its position (x_B, y_B, z_B), assuming it starts at (r_B, 0, 0).\n\n3. Object C (Projectile Motion)  \n   - Initial speed: [17.36, 13.13, 17.19] m/s  \n   - Launch angle: 36.29 degrees  \n   - Time: 3.33 s  \n   - Compute its position (x_C, y_C, z_C), assuming it starts from (0,0,0).\n",
    "parameters": {
      "object_A": {
        "v0": [
          14.89,
          6.1,
          17.18
        ],
        "a": [
          3.31,
          -4.13,
          3.82
        ],
        "t": 3.19
      },
      "object_B": {
        "r": 2.59,
        "v": 6.49,
        "omega": 2.51,
        "t": 4.41,
        "rotation_plane": "xy-plane"
      },
      "object_C": {
        "v0": [
          17.36,
          13.13,
          17.19
        ],
        "angle": 36.29,
        "t": 3.33
      }
    },
    "answer_json": {
      "pos_A": {
        "x_A": 64.34,
        "y_A": -1.55,
        "z_A": 74.24
      },
      "pos_B": {
        "x_B": 0.19,
        "y_B": -2.58,
        "z_B": 0
      },
      "pos_C": {
        "x_C": 57.81,
        "y_C": 43.72,
        "z_C": 2.85
      }
    }
  },
  {
    "type": "3D Multi-Object Motion",
    "question": "\nThree objects move in different types of motion in 3D space:\n1. Object A (Linear Motion)  \n   - Initial velocity: [6.31, 12.33, 17.72] m/s  \n   - Acceleration: [0.56, 0.17, -3.09] m/s\u00b2  \n   - Time: 3.17 s  \n   - Compute its final position (x_A, y_A, z_A). Assume it starts at (0, 0, 0).\n\n2. Object B (Circular Motion)  \n   - Radius: 2.33 meters  \n   - Speed: 6.0 m/s  \n   - Angular velocity: 2.58 rad/s  \n   - Time: 3.16 s  \n   - Rotating in the xz-plane  \n   - Compute its position (x_B, y_B, z_B), assuming it starts at (r_B, 0, 0).\n\n3. Object C (Projectile Motion)  \n   - Initial speed: [21.15, 17.27, 24.82] m/s  \n   - Launch angle: 20.58 degrees  \n   - Time: 2.99 s  \n   - Compute its position (x_C, y_C, z_C), assuming it starts from (0,0,0).\n",
    "parameters": {
      "object_A": {
        "v0": [
          6.31,
          12.33,
          17.72
        ],
        "a": [
          0.56,
          0.17,
          -3.09
        ],
        "t": 3.17
      },
      "object_B": {
        "r": 2.33,
        "v": 6.0,
        "omega": 2.58,
        "t": 3.16,
        "rotation_plane": "xz-plane"
      },
      "object_C": {
        "v0": [
          21.15,
          17.27,
          24.82
        ],
        "angle": 20.58,
        "t": 2.99
      }
    },
    "answer_json": {
      "pos_A": {
        "x_A": 22.82,
        "y_A": 39.94,
        "z_A": 40.65
      },
      "pos_B": {
        "x_B": -0.69,
        "y_B": 0,
        "z_B": 2.23
      },
      "pos_C": {
        "x_C": 63.24,
        "y_C": 51.64,
        "z_C": 30.36
      }
    }
  },
  {
    "type": "3D Multi-Object Motion",
    "question": "\nThree objects move in different types of motion in 3D space:\n1. Object A (Linear Motion)  \n   - Initial velocity: [14.14, 6.82, 12.05] m/s  \n   - Acceleration: [-0.27, 0.31, -0.74] m/s\u00b2  \n   - Time: 7.71 s  \n   - Compute its final position (x_A, y_A, z_A). Assume it starts at (0, 0, 0).\n\n2. Object B (Circular Motion)  \n   - Radius: 1.99 meters  \n   - Speed: 7.33 m/s  \n   - Angular velocity: 3.68 rad/s  \n   - Time: 3.44 s  \n   - Rotating in the xz-plane  \n   - Compute its position (x_B, y_B, z_B), assuming it starts at (r_B, 0, 0).\n\n3. Object C (Projectile Motion)  \n   - Initial speed: [10.76, 23.03, 12.89] m/s  \n   - Launch angle: 59.57 degrees  \n   - Time: 9.56 s  \n   - Compute its position (x_C, y_C, z_C), assuming it starts from (0,0,0).\n",
    "parameters": {
      "object_A": {
        "v0": [
          14.14,
          6.82,
          12.05
        ],
        "a": [
          -0.27,
          0.31,
          -0.74
        ],
        "t": 7.71
      },
      "object_B": {
        "r": 1.99,
        "v": 7.33,
        "omega": 3.68,
        "t": 3.44,
        "rotation_plane": "xz-plane"
      },
      "object_C": {
        "v0": [
          10.76,
          23.03,
          12.89
        ],
        "angle": 59.57,
        "t": 9.56
      }
    },
    "answer_json": {
      "pos_A": {
        "x_A": 100.99,
        "y_A": 61.8,
        "z_A": 70.91
      },
      "pos_B": {
        "x_B": 1.98,
        "y_B": 0,
        "z_B": 0.18
      },
      "pos_C": {
        "x_C": 102.87,
        "y_C": 220.17,
        "z_C": -325.06
      }
    }
  },
  {
    "type": "3D Multi-Object Motion",
    "question": "\nThree objects move in different types of motion in 3D space:\n1. Object A (Linear Motion)  \n   - Initial velocity: [14.11, 4.64, 15.03] m/s  \n   - Acceleration: [-2.24, 0.9, 2.6] m/s\u00b2  \n   - Time: 6.37 s  \n   - Compute its final position (x_A, y_A, z_A). Assume it starts at (0, 0, 0).\n\n2. Object B (Circular Motion)  \n   - Radius: 4.91 meters  \n   - Speed: 8.49 m/s  \n   - Angular velocity: 1.73 rad/s  \n   - Time: 3.67 s  \n   - Rotating in the xz-plane  \n   - Compute its position (x_B, y_B, z_B), assuming it starts at (r_B, 0, 0).\n\n3. Object C (Projectile Motion)  \n   - Initial speed: [9.49, 5.35, 18.35] m/s  \n   - Launch angle: 31.46 degrees  \n   - Time: 9.77 s  \n   - Compute its position (x_C, y_C, z_C), assuming it starts from (0,0,0).\n",
    "parameters": {
      "object_A": {
        "v0": [
          14.11,
          4.64,
          15.03
        ],
        "a": [
          -2.24,
          0.9,
          2.6
        ],
        "t": 6.37
      },
      "object_B": {
        "r": 4.91,
        "v": 8.49,
        "omega": 1.73,
        "t": 3.67,
        "rotation_plane": "xz-plane"
      },
      "object_C": {
        "v0": [
          9.49,
          5.35,
          18.35
        ],
        "angle": 31.46,
        "t": 9.77
      }
    },
    "answer_json": {
      "pos_A": {
        "x_A": 44.43,
        "y_A": 47.82,
        "z_A": 148.49
      },
      "pos_B": {
        "x_B": 4.9,
        "y_B": 0,
        "z_B": 0.32
      },
      "pos_C": {
        "x_C": 92.72,
        "y_C": 52.27,
        "z_C": -288.92
      }
    }
  },
  {
    "type": "3D Multi-Object Motion",
    "question": "\nThree objects move in different types of motion in 3D space:\n1. Object A (Linear Motion)  \n   - Initial velocity: [11.51, 14.25, 3.4] m/s  \n   - Acceleration: [3.68, -0.09, 3.73] m/s\u00b2  \n   - Time: 6.17 s  \n   - Compute its final position (x_A, y_A, z_A). Assume it starts at (0, 0, 0).\n\n2. Object B (Circular Motion)  \n   - Radius: 2.61 meters  \n   - Speed: 4.96 m/s  \n   - Angular velocity: 1.9 rad/s  \n   - Time: 2.66 s  \n   - Rotating in the xy-plane  \n   - Compute its position (x_B, y_B, z_B), assuming it starts at (r_B, 0, 0).\n\n3. Object C (Projectile Motion)  \n   - Initial speed: [11.31, 26.54, 7.85] m/s  \n   - Launch angle: 18.92 degrees  \n   - Time: 5.43 s  \n   - Compute its position (x_C, y_C, z_C), assuming it starts from (0,0,0).\n",
    "parameters": {
      "object_A": {
        "v0": [
          11.51,
          14.25,
          3.4
        ],
        "a": [
          3.68,
          -0.09,
          3.73
        ],
        "t": 6.17
      },
      "object_B": {
        "r": 2.61,
        "v": 4.96,
        "omega": 1.9,
        "t": 2.66,
        "rotation_plane": "xy-plane"
      },
      "object_C": {
        "v0": [
          11.31,
          26.54,
          7.85
        ],
        "angle": 18.92,
        "t": 5.43
      }
    },
    "answer_json": {
      "pos_A": {
        "x_A": 141.06,
        "y_A": 86.21,
        "z_A": 91.98
      },
      "pos_B": {
        "x_B": 0.87,
        "y_B": -2.46,
        "z_B": 0
      },
      "pos_C": {
        "x_C": 61.41,
        "y_C": 144.11,
        "z_C": -102.0
      }
    }
  },
  {
    "type": "3D Multi-Object Motion",
    "question": "\nThree objects move in different types of motion in 3D space:\n1. Object A (Linear Motion)  \n   - Initial velocity: [11.96, 14.04, 3.88] m/s  \n   - Acceleration: [3.11, 4.49, -4.15] m/s\u00b2  \n   - Time: 3.23 s  \n   - Compute its final position (x_A, y_A, z_A). Assume it starts at (0, 0, 0).\n\n2. Object B (Circular Motion)  \n   - Radius: 3.01 meters  \n   - Speed: 4.75 m/s  \n   - Angular velocity: 1.58 rad/s  \n   - Time: 6.37 s  \n   - Rotating in the yz-plane  \n   - Compute its position (x_B, y_B, z_B), assuming it starts at (r_B, 0, 0).\n\n3. Object C (Projectile Motion)  \n   - Initial speed: [10.64, 18.06, 16.26] m/s  \n   - Launch angle: 41.56 degrees  \n   - Time: 8.74 s  \n   - Compute its position (x_C, y_C, z_C), assuming it starts from (0,0,0).\n",
    "parameters": {
      "object_A": {
        "v0": [
          11.96,
          14.04,
          3.88
        ],
        "a": [
          3.11,
          4.49,
          -4.15
        ],
        "t": 3.23
      },
      "object_B": {
        "r": 3.01,
        "v": 4.75,
        "omega": 1.58,
        "t": 6.37,
        "rotation_plane": "yz-plane"
      },
      "object_C": {
        "v0": [
          10.64,
          18.06,
          16.26
        ],
        "angle": 41.56,
        "t": 8.74
      }
    },
    "answer_json": {
      "pos_A": {
        "x_A": 54.85,
        "y_A": 68.77,
        "z_A": -9.12
      },
      "pos_B": {
        "x_B": 0,
        "y_B": -2.41,
        "z_B": -1.8
      },
      "pos_C": {
        "x_C": 92.99,
        "y_C": 157.84,
        "z_C": -232.57
      }
    }
  },
  {
    "type": "3D Multi-Object Motion",
    "question": "\nThree objects move in different types of motion in 3D space:\n1. Object A (Linear Motion)  \n   - Initial velocity: [19.81, 6.8, 12.8] m/s  \n   - Acceleration: [1.1, 2.4, 4.48] m/s\u00b2  \n   - Time: 2.87 s  \n   - Compute its final position (x_A, y_A, z_A). Assume it starts at (0, 0, 0).\n\n2. Object B (Circular Motion)  \n   - Radius: 1.45 meters  \n   - Speed: 6.94 m/s  \n   - Angular velocity: 4.79 rad/s  \n   - Time: 2.41 s  \n   - Rotating in the xy-plane  \n   - Compute its position (x_B, y_B, z_B), assuming it starts at (r_B, 0, 0).\n\n3. Object C (Projectile Motion)  \n   - Initial speed: [18.8, 8.91, 15.21] m/s  \n   - Launch angle: 56.36 degrees  \n   - Time: 5.23 s  \n   - Compute its position (x_C, y_C, z_C), assuming it starts from (0,0,0).\n",
    "parameters": {
      "object_A": {
        "v0": [
          19.81,
          6.8,
          12.8
        ],
        "a": [
          1.1,
          2.4,
          4.48
        ],
        "t": 2.87
      },
      "object_B": {
        "r": 1.45,
        "v": 6.94,
        "omega": 4.79,
        "t": 2.41,
        "rotation_plane": "xy-plane"
      },
      "object_C": {
        "v0": [
          18.8,
          8.91,
          15.21
        ],
        "angle": 56.36,
        "t": 5.23
      }
    },
    "answer_json": {
      "pos_A": {
        "x_A": 61.38,
        "y_A": 29.4,
        "z_A": 55.19
      },
      "pos_B": {
        "x_B": 0.76,
        "y_B": -1.24,
        "z_B": 0
      },
      "pos_C": {
        "x_C": 98.32,
        "y_C": 46.6,
        "z_C": -54.62
      }
    }
  },
  {
    "type": "3D Multi-Object Motion",
    "question": "\nThree objects move in different types of motion in 3D space:\n1. Object A (Linear Motion)  \n   - Initial velocity: [1.62, 6.47, 6.37] m/s  \n   - Acceleration: [3.6, -4.29, -2.67] m/s\u00b2  \n   - Time: 3.38 s  \n   - Compute its final position (x_A, y_A, z_A). Assume it starts at (0, 0, 0).\n\n2. Object B (Circular Motion)  \n   - Radius: 4.06 meters  \n   - Speed: 6.31 m/s  \n   - Angular velocity: 1.55 rad/s  \n   - Time: 8.24 s  \n   - Rotating in the xy-plane  \n   - Compute its position (x_B, y_B, z_B), assuming it starts at (r_B, 0, 0).\n\n3. Object C (Projectile Motion)  \n   - Initial speed: [15.63, 18.61, 21.19] m/s  \n   - Launch angle: 69.5 degrees  \n   - Time: 8.44 s  \n   - Compute its position (x_C, y_C, z_C), assuming it starts from (0,0,0).\n",
    "parameters": {
      "object_A": {
        "v0": [
          1.62,
          6.47,
          6.37
        ],
        "a": [
          3.6,
          -4.29,
          -2.67
        ],
        "t": 3.38
      },
      "object_B": {
        "r": 4.06,
        "v": 6.31,
        "omega": 1.55,
        "t": 8.24,
        "rotation_plane": "xy-plane"
      },
      "object_C": {
        "v0": [
          15.63,
          18.61,
          21.19
        ],
        "angle": 69.5,
        "t": 8.44
      }
    },
    "answer_json": {
      "pos_A": {
        "x_A": 26.04,
        "y_A": -2.64,
        "z_A": 6.28
      },
      "pos_B": {
        "x_B": 3.97,
        "y_B": 0.83,
        "z_B": 0
      },
      "pos_C": {
        "x_C": 131.92,
        "y_C": 157.07,
        "z_C": -170.56
      }
    }
  },
  {
    "type": "3D Multi-Object Motion",
    "question": "\nThree objects move in different types of motion in 3D space:\n1. Object A (Linear Motion)  \n   - Initial velocity: [2.36, 4.15, 6.84] m/s  \n   - Acceleration: [2.49, 0.69, -2.11] m/s\u00b2  \n   - Time: 2.12 s  \n   - Compute its final position (x_A, y_A, z_A). Assume it starts at (0, 0, 0).\n\n2. Object B (Circular Motion)  \n   - Radius: 3.6 meters  \n   - Speed: 7.3 m/s  \n   - Angular velocity: 2.03 rad/s  \n   - Time: 9.48 s  \n   - Rotating in the yz-plane  \n   - Compute its position (x_B, y_B, z_B), assuming it starts at (r_B, 0, 0).\n\n3. Object C (Projectile Motion)  \n   - Initial speed: [18.5, 15.94, 19.95] m/s  \n   - Launch angle: 68.37 degrees  \n   - Time: 7.61 s  \n   - Compute its position (x_C, y_C, z_C), assuming it starts from (0,0,0).\n",
    "parameters": {
      "object_A": {
        "v0": [
          2.36,
          4.15,
          6.84
        ],
        "a": [
          2.49,
          0.69,
          -2.11
        ],
        "t": 2.12
      },
      "object_B": {
        "r": 3.6,
        "v": 7.3,
        "omega": 2.03,
        "t": 9.48,
        "rotation_plane": "yz-plane"
      },
      "object_C": {
        "v0": [
          18.5,
          15.94,
          19.95
        ],
        "angle": 68.37,
        "t": 7.61
      }
    },
    "answer_json": {
      "pos_A": {
        "x_A": 10.6,
        "y_A": 10.35,
        "z_A": 9.76
      },
      "pos_B": {
        "x_B": 0,
        "y_B": 3.32,
        "z_B": 1.38
      },
      "pos_C": {
        "x_C": 140.78,
        "y_C": 121.3,
        "z_C": -132.24
      }
    }
  },
  {
    "type": "3D Multi-Object Motion",
    "question": "\nThree objects move in different types of motion in 3D space:\n1. Object A (Linear Motion)  \n   - Initial velocity: [12.47, 1.49, 5.35] m/s  \n   - Acceleration: [1.74, 3.61, 0.87] m/s\u00b2  \n   - Time: 1.19 s  \n   - Compute its final position (x_A, y_A, z_A). Assume it starts at (0, 0, 0).\n\n2. Object B (Circular Motion)  \n   - Radius: 3.94 meters  \n   - Speed: 8.39 m/s  \n   - Angular velocity: 2.13 rad/s  \n   - Time: 6.19 s  \n   - Rotating in the xy-plane  \n   - Compute its position (x_B, y_B, z_B), assuming it starts at (r_B, 0, 0).\n\n3. Object C (Projectile Motion)  \n   - Initial speed: [16.76, 21.29, 27.9] m/s  \n   - Launch angle: 25.89 degrees  \n   - Time: 6.27 s  \n   - Compute its position (x_C, y_C, z_C), assuming it starts from (0,0,0).\n",
    "parameters": {
      "object_A": {
        "v0": [
          12.47,
          1.49,
          5.35
        ],
        "a": [
          1.74,
          3.61,
          0.87
        ],
        "t": 1.19
      },
      "object_B": {
        "r": 3.94,
        "v": 8.39,
        "omega": 2.13,
        "t": 6.19,
        "rotation_plane": "xy-plane"
      },
      "object_C": {
        "v0": [
          16.76,
          21.29,
          27.9
        ],
        "angle": 25.89,
        "t": 6.27
      }
    },
    "answer_json": {
      "pos_A": {
        "x_A": 16.07,
        "y_A": 4.33,
        "z_A": 6.98
      },
      "pos_B": {
        "x_B": 3.21,
        "y_B": 2.28,
        "z_B": 0
      },
      "pos_C": {
        "x_C": 105.09,
        "y_C": 133.49,
        "z_C": -17.9
      }
    }
  },
  {
    "type": "3D Multi-Object Motion",
    "question": "\nThree objects move in different types of motion in 3D space:\n1. Object A (Linear Motion)  \n   - Initial velocity: [13.06, 10.34, 2.73] m/s  \n   - Acceleration: [-1.52, -1.67, 1.7] m/s\u00b2  \n   - Time: 8.72 s  \n   - Compute its final position (x_A, y_A, z_A). Assume it starts at (0, 0, 0).\n\n2. Object B (Circular Motion)  \n   - Radius: 1.98 meters  \n   - Speed: 7.24 m/s  \n   - Angular velocity: 3.66 rad/s  \n   - Time: 3.59 s  \n   - Rotating in the xz-plane  \n   - Compute its position (x_B, y_B, z_B), assuming it starts at (r_B, 0, 0).\n\n3. Object C (Projectile Motion)  \n   - Initial speed: [25.34, 18.75, 16.37] m/s  \n   - Launch angle: 33.87 degrees  \n   - Time: 3.91 s  \n   - Compute its position (x_C, y_C, z_C), assuming it starts from (0,0,0).\n",
    "parameters": {
      "object_A": {
        "v0": [
          13.06,
          10.34,
          2.73
        ],
        "a": [
          -1.52,
          -1.67,
          1.7
        ],
        "t": 8.72
      },
      "object_B": {
        "r": 1.98,
        "v": 7.24,
        "omega": 3.66,
        "t": 3.59,
        "rotation_plane": "xz-plane"
      },
      "object_C": {
        "v0": [
          25.34,
          18.75,
          16.37
        ],
        "angle": 33.87,
        "t": 3.91
      }
    },
    "answer_json": {
      "pos_A": {
        "x_A": 56.09,
        "y_A": 26.67,
        "z_A": 88.44
      },
      "pos_B": {
        "x_B": 1.66,
        "y_B": 0,
        "z_B": 1.07
      },
      "pos_C": {
        "x_C": 99.08,
        "y_C": 73.31,
        "z_C": -10.98
      }
    }
  },
  {
    "type": "3D Multi-Object Motion",
    "question": "\nThree objects move in different types of motion in 3D space:\n1. Object A (Linear Motion)  \n   - Initial velocity: [19.43, 8.68, 10.78] m/s  \n   - Acceleration: [4.88, 1.58, 0.43] m/s\u00b2  \n   - Time: 4.72 s  \n   - Compute its final position (x_A, y_A, z_A). Assume it starts at (0, 0, 0).\n\n2. Object B (Circular Motion)  \n   - Radius: 1.34 meters  \n   - Speed: 4.26 m/s  \n   - Angular velocity: 3.18 rad/s  \n   - Time: 7.81 s  \n   - Rotating in the yz-plane  \n   - Compute its position (x_B, y_B, z_B), assuming it starts at (r_B, 0, 0).\n\n3. Object C (Projectile Motion)  \n   - Initial speed: [16.05, 6.29, 11.68] m/s  \n   - Launch angle: 22.86 degrees  \n   - Time: 3.59 s  \n   - Compute its position (x_C, y_C, z_C), assuming it starts from (0,0,0).\n",
    "parameters": {
      "object_A": {
        "v0": [
          19.43,
          8.68,
          10.78
        ],
        "a": [
          4.88,
          1.58,
          0.43
        ],
        "t": 4.72
      },
      "object_B": {
        "r": 1.34,
        "v": 4.26,
        "omega": 3.18,
        "t": 7.81,
        "rotation_plane": "yz-plane"
      },
      "object_C": {
        "v0": [
          16.05,
          6.29,
          11.68
        ],
        "angle": 22.86,
        "t": 3.59
      }
    },
    "answer_json": {
      "pos_A": {
        "x_A": 146.07,
        "y_A": 58.57,
        "z_A": 55.67
      },
      "pos_B": {
        "x_B": 0,
        "y_B": 1.28,
        "z_B": -0.39
      },
      "pos_C": {
        "x_C": 57.62,
        "y_C": 22.58,
        "z_C": -21.28
      }
    }
  },
  {
    "type": "3D Multi-Object Motion",
    "question": "\nThree objects move in different types of motion in 3D space:\n1. Object A (Linear Motion)  \n   - Initial velocity: [17.74, 10.21, 1.55] m/s  \n   - Acceleration: [1.3, 2.99, 2.1] m/s\u00b2  \n   - Time: 3.8 s  \n   - Compute its final position (x_A, y_A, z_A). Assume it starts at (0, 0, 0).\n\n2. Object B (Circular Motion)  \n   - Radius: 0.56 meters  \n   - Speed: 4.67 m/s  \n   - Angular velocity: 8.34 rad/s  \n   - Time: 3.02 s  \n   - Rotating in the xy-plane  \n   - Compute its position (x_B, y_B, z_B), assuming it starts at (r_B, 0, 0).\n\n3. Object C (Projectile Motion)  \n   - Initial speed: [16.54, 7.94, 25.8] m/s  \n   - Launch angle: 44.9 degrees  \n   - Time: 7.45 s  \n   - Compute its position (x_C, y_C, z_C), assuming it starts from (0,0,0).\n",
    "parameters": {
      "object_A": {
        "v0": [
          17.74,
          10.21,
          1.55
        ],
        "a": [
          1.3,
          2.99,
          2.1
        ],
        "t": 3.8
      },
      "object_B": {
        "r": 0.56,
        "v": 4.67,
        "omega": 8.34,
        "t": 3.02,
        "rotation_plane": "xy-plane"
      },
      "object_C": {
        "v0": [
          16.54,
          7.94,
          25.8
        ],
        "angle": 44.9,
        "t": 7.45
      }
    },
    "answer_json": {
      "pos_A": {
        "x_A": 76.8,
        "y_A": 60.39,
        "z_A": 21.05
      },
      "pos_B": {
        "x_B": 0.56,
        "y_B": 0.03,
        "z_B": 0
      },
      "pos_C": {
        "x_C": 123.22,
        "y_C": 59.15,
        "z_C": -80.03
      }
    }
  },
  {
    "type": "3D Multi-Object Motion",
    "question": "\nThree objects move in different types of motion in 3D space:\n1. Object A (Linear Motion)  \n   - Initial velocity: [10.67, 6.2, 16.86] m/s  \n   - Acceleration: [4.8, -2.56, 0.51] m/s\u00b2  \n   - Time: 4.45 s  \n   - Compute its final position (x_A, y_A, z_A). Assume it starts at (0, 0, 0).\n\n2. Object B (Circular Motion)  \n   - Radius: 4.65 meters  \n   - Speed: 5.57 m/s  \n   - Angular velocity: 1.2 rad/s  \n   - Time: 8.91 s  \n   - Rotating in the xy-plane  \n   - Compute its position (x_B, y_B, z_B), assuming it starts at (r_B, 0, 0).\n\n3. Object C (Projectile Motion)  \n   - Initial speed: [11.91, 24.75, 15.37] m/s  \n   - Launch angle: 71.05 degrees  \n   - Time: 5.57 s  \n   - Compute its position (x_C, y_C, z_C), assuming it starts from (0,0,0).\n",
    "parameters": {
      "object_A": {
        "v0": [
          10.67,
          6.2,
          16.86
        ],
        "a": [
          4.8,
          -2.56,
          0.51
        ],
        "t": 4.45
      },
      "object_B": {
        "r": 4.65,
        "v": 5.57,
        "omega": 1.2,
        "t": 8.91,
        "rotation_plane": "xy-plane"
      },
      "object_C": {
        "v0": [
          11.91,
          24.75,
          15.37
        ],
        "angle": 71.05,
        "t": 5.57
      }
    },
    "answer_json": {
      "pos_A": {
        "x_A": 95.01,
        "y_A": 2.24,
        "z_A": 80.08
      },
      "pos_B": {
        "x_B": -1.39,
        "y_B": -4.44,
        "z_B": 0
      },
      "pos_C": {
        "x_C": 66.34,
        "y_C": 137.86,
        "z_C": -66.57
      }
    }
  },
  {
    "type": "3D Multi-Object Motion",
    "question": "\nThree objects move in different types of motion in 3D space:\n1. Object A (Linear Motion)  \n   - Initial velocity: [16.59, 6.37, 6.67] m/s  \n   - Acceleration: [0.87, 4.99, -0.1] m/s\u00b2  \n   - Time: 2.34 s  \n   - Compute its final position (x_A, y_A, z_A). Assume it starts at (0, 0, 0).\n\n2. Object B (Circular Motion)  \n   - Radius: 2.92 meters  \n   - Speed: 4.11 m/s  \n   - Angular velocity: 1.41 rad/s  \n   - Time: 5.97 s  \n   - Rotating in the yz-plane  \n   - Compute its position (x_B, y_B, z_B), assuming it starts at (r_B, 0, 0).\n\n3. Object C (Projectile Motion)  \n   - Initial speed: [14.43, 28.32, 26.74] m/s  \n   - Launch angle: 73.85 degrees  \n   - Time: 3.15 s  \n   - Compute its position (x_C, y_C, z_C), assuming it starts from (0,0,0).\n",
    "parameters": {
      "object_A": {
        "v0": [
          16.59,
          6.37,
          6.67
        ],
        "a": [
          0.87,
          4.99,
          -0.1
        ],
        "t": 2.34
      },
      "object_B": {
        "r": 2.92,
        "v": 4.11,
        "omega": 1.41,
        "t": 5.97,
        "rotation_plane": "yz-plane"
      },
      "object_C": {
        "v0": [
          14.43,
          28.32,
          26.74
        ],
        "angle": 73.85,
        "t": 3.15
      }
    },
    "answer_json": {
      "pos_A": {
        "x_A": 41.2,
        "y_A": 28.57,
        "z_A": 15.33
      },
      "pos_B": {
        "x_B": 0,
        "y_B": -1.56,
        "z_B": 2.47
      },
      "pos_C": {
        "x_C": 45.45,
        "y_C": 89.21,
        "z_C": 35.56
      }
    }
  },
  {
    "type": "3D Multi-Object Motion",
    "question": "\nThree objects move in different types of motion in 3D space:\n1. Object A (Linear Motion)  \n   - Initial velocity: [8.28, 17.26, 8.8] m/s  \n   - Acceleration: [-1.82, -0.27, 4.13] m/s\u00b2  \n   - Time: 4.43 s  \n   - Compute its final position (x_A, y_A, z_A). Assume it starts at (0, 0, 0).\n\n2. Object B (Circular Motion)  \n   - Radius: 4.95 meters  \n   - Speed: 8.13 m/s  \n   - Angular velocity: 1.64 rad/s  \n   - Time: 6.87 s  \n   - Rotating in the xy-plane  \n   - Compute its position (x_B, y_B, z_B), assuming it starts at (r_B, 0, 0).\n\n3. Object C (Projectile Motion)  \n   - Initial speed: [17.38, 5.93, 17.56] m/s  \n   - Launch angle: 50.41 degrees  \n   - Time: 8.83 s  \n   - Compute its position (x_C, y_C, z_C), assuming it starts from (0,0,0).\n",
    "parameters": {
      "object_A": {
        "v0": [
          8.28,
          17.26,
          8.8
        ],
        "a": [
          -1.82,
          -0.27,
          4.13
        ],
        "t": 4.43
      },
      "object_B": {
        "r": 4.95,
        "v": 8.13,
        "omega": 1.64,
        "t": 6.87,
        "rotation_plane": "xy-plane"
      },
      "object_C": {
        "v0": [
          17.38,
          5.93,
          17.56
        ],
        "angle": 50.41,
        "t": 8.83
      }
    },
    "answer_json": {
      "pos_A": {
        "x_A": 18.82,
        "y_A": 73.81,
        "z_A": 79.51
      },
      "pos_B": {
        "x_B": 1.33,
        "y_B": -4.77,
        "z_B": 0
      },
      "pos_C": {
        "x_C": 153.47,
        "y_C": 52.36,
        "z_C": -227.38
      }
    }
  },
  {
    "type": "3D Multi-Object Motion",
    "question": "\nThree objects move in different types of motion in 3D space:\n1. Object A (Linear Motion)  \n   - Initial velocity: [17.61, 9.37, 10.99] m/s  \n   - Acceleration: [-0.43, 2.22, -0.9] m/s\u00b2  \n   - Time: 6.89 s  \n   - Compute its final position (x_A, y_A, z_A). Assume it starts at (0, 0, 0).\n\n2. Object B (Circular Motion)  \n   - Radius: 1.19 meters  \n   - Speed: 5.23 m/s  \n   - Angular velocity: 4.39 rad/s  \n   - Time: 9.72 s  \n   - Rotating in the xz-plane  \n   - Compute its position (x_B, y_B, z_B), assuming it starts at (r_B, 0, 0).\n\n3. Object C (Projectile Motion)  \n   - Initial speed: [20.58, 14.94, 7.01] m/s  \n   - Launch angle: 34.71 degrees  \n   - Time: 7.07 s  \n   - Compute its position (x_C, y_C, z_C), assuming it starts from (0,0,0).\n",
    "parameters": {
      "object_A": {
        "v0": [
          17.61,
          9.37,
          10.99
        ],
        "a": [
          -0.43,
          2.22,
          -0.9
        ],
        "t": 6.89
      },
      "object_B": {
        "r": 1.19,
        "v": 5.23,
        "omega": 4.39,
        "t": 9.72,
        "rotation_plane": "xz-plane"
      },
      "object_C": {
        "v0": [
          20.58,
          14.94,
          7.01
        ],
        "angle": 34.71,
        "t": 7.07
      }
    },
    "answer_json": {
      "pos_A": {
        "x_A": 111.13,
        "y_A": 117.25,
        "z_A": 54.36
      },
      "pos_B": {
        "x_B": 0.31,
        "y_B": 0,
        "z_B": -1.15
      },
      "pos_C": {
        "x_C": 145.5,
        "y_C": 105.63,
        "z_C": -195.62
      }
    }
  },
  {
    "type": "3D Multi-Object Motion",
    "question": "\nThree objects move in different types of motion in 3D space:\n1. Object A (Linear Motion)  \n   - Initial velocity: [11.14, 19.13, 12.91] m/s  \n   - Acceleration: [3.87, -0.12, 0.41] m/s\u00b2  \n   - Time: 6.56 s  \n   - Compute its final position (x_A, y_A, z_A). Assume it starts at (0, 0, 0).\n\n2. Object B (Circular Motion)  \n   - Radius: 1.56 meters  \n   - Speed: 7.16 m/s  \n   - Angular velocity: 4.59 rad/s  \n   - Time: 3.59 s  \n   - Rotating in the xy-plane  \n   - Compute its position (x_B, y_B, z_B), assuming it starts at (r_B, 0, 0).\n\n3. Object C (Projectile Motion)  \n   - Initial speed: [23.67, 15.85, 7.46] m/s  \n   - Launch angle: 53.02 degrees  \n   - Time: 8.85 s  \n   - Compute its position (x_C, y_C, z_C), assuming it starts from (0,0,0).\n",
    "parameters": {
      "object_A": {
        "v0": [
          11.14,
          19.13,
          12.91
        ],
        "a": [
          3.87,
          -0.12,
          0.41
        ],
        "t": 6.56
      },
      "object_B": {
        "r": 1.56,
        "v": 7.16,
        "omega": 4.59,
        "t": 3.59,
        "rotation_plane": "xy-plane"
      },
      "object_C": {
        "v0": [
          23.67,
          15.85,
          7.46
        ],
        "angle": 53.02,
        "t": 8.85
      }
    },
    "answer_json": {
      "pos_A": {
        "x_A": 156.35,
        "y_A": 122.91,
        "z_A": 93.51
      },
      "pos_B": {
        "x_B": -1.12,
        "y_B": -1.09,
        "z_B": 0
      },
      "pos_C": {
        "x_C": 209.48,
        "y_C": 140.27,
        "z_C": -318.15
      }
    }
  },
  {
    "type": "3D Multi-Object Motion",
    "question": "\nThree objects move in different types of motion in 3D space:\n1. Object A (Linear Motion)  \n   - Initial velocity: [9.43, 14.19, 18.17] m/s  \n   - Acceleration: [-4.54, 2.96, -2.07] m/s\u00b2  \n   - Time: 4.37 s  \n   - Compute its final position (x_A, y_A, z_A). Assume it starts at (0, 0, 0).\n\n2. Object B (Circular Motion)  \n   - Radius: 1.16 meters  \n   - Speed: 5.78 m/s  \n   - Angular velocity: 4.98 rad/s  \n   - Time: 6.09 s  \n   - Rotating in the xy-plane  \n   - Compute its position (x_B, y_B, z_B), assuming it starts at (r_B, 0, 0).\n\n3. Object C (Projectile Motion)  \n   - Initial speed: [9.25, 6.97, 26.77] m/s  \n   - Launch angle: 52.18 degrees  \n   - Time: 3.17 s  \n   - Compute its position (x_C, y_C, z_C), assuming it starts from (0,0,0).\n",
    "parameters": {
      "object_A": {
        "v0": [
          9.43,
          14.19,
          18.17
        ],
        "a": [
          -4.54,
          2.96,
          -2.07
        ],
        "t": 4.37
      },
      "object_B": {
        "r": 1.16,
        "v": 5.78,
        "omega": 4.98,
        "t": 6.09,
        "rotation_plane": "xy-plane"
      },
      "object_C": {
        "v0": [
          9.25,
          6.97,
          26.77
        ],
        "angle": 52.18,
        "t": 3.17
      }
    },
    "answer_json": {
      "pos_A": {
        "x_A": -2.14,
        "y_A": 90.27,
        "z_A": 59.64
      },
      "pos_B": {
        "x_B": 0.54,
        "y_B": -1.03,
        "z_B": 0
      },
      "pos_C": {
        "x_C": 29.32,
        "y_C": 22.09,
        "z_C": 35.57
      }
    }
  },
  {
    "type": "3D Multi-Object Motion",
    "question": "\nThree objects move in different types of motion in 3D space:\n1. Object A (Linear Motion)  \n   - Initial velocity: [18.34, 3.72, 9.76] m/s  \n   - Acceleration: [-2.46, -2.45, -4.91] m/s\u00b2  \n   - Time: 8.24 s  \n   - Compute its final position (x_A, y_A, z_A). Assume it starts at (0, 0, 0).\n\n2. Object B (Circular Motion)  \n   - Radius: 4.56 meters  \n   - Speed: 7.1 m/s  \n   - Angular velocity: 1.56 rad/s  \n   - Time: 2.42 s  \n   - Rotating in the xz-plane  \n   - Compute its position (x_B, y_B, z_B), assuming it starts at (r_B, 0, 0).\n\n3. Object C (Projectile Motion)  \n   - Initial speed: [28.63, 29.69, 12.48] m/s  \n   - Launch angle: 72.72 degrees  \n   - Time: 7.21 s  \n   - Compute its position (x_C, y_C, z_C), assuming it starts from (0,0,0).\n",
    "parameters": {
      "object_A": {
        "v0": [
          18.34,
          3.72,
          9.76
        ],
        "a": [
          -2.46,
          -2.45,
          -4.91
        ],
        "t": 8.24
      },
      "object_B": {
        "r": 4.56,
        "v": 7.1,
        "omega": 1.56,
        "t": 2.42,
        "rotation_plane": "xz-plane"
      },
      "object_C": {
        "v0": [
          28.63,
          29.69,
          12.48
        ],
        "angle": 72.72,
        "t": 7.21
      }
    },
    "answer_json": {
      "pos_A": {
        "x_A": 67.61,
        "y_A": -52.52,
        "z_A": -86.27
      },
      "pos_B": {
        "x_B": -3.67,
        "y_B": 0,
        "z_B": -2.7
      },
      "pos_C": {
        "x_C": 206.42,
        "y_C": 214.06,
        "z_C": -165.0
      }
    }
  },
  {
    "type": "3D Multi-Object Motion",
    "question": "\nThree objects move in different types of motion in 3D space:\n1. Object A (Linear Motion)  \n   - Initial velocity: [9.68, 6.74, 19.99] m/s  \n   - Acceleration: [3.53, -3.93, -1.19] m/s\u00b2  \n   - Time: 4.23 s  \n   - Compute its final position (x_A, y_A, z_A). Assume it starts at (0, 0, 0).\n\n2. Object B (Circular Motion)  \n   - Radius: 1.83 meters  \n   - Speed: 7.29 m/s  \n   - Angular velocity: 3.98 rad/s  \n   - Time: 1.2 s  \n   - Rotating in the yz-plane  \n   - Compute its position (x_B, y_B, z_B), assuming it starts at (r_B, 0, 0).\n\n3. Object C (Projectile Motion)  \n   - Initial speed: [14.9, 5.2, 26.63] m/s  \n   - Launch angle: 61.7 degrees  \n   - Time: 9.76 s  \n   - Compute its position (x_C, y_C, z_C), assuming it starts from (0,0,0).\n",
    "parameters": {
      "object_A": {
        "v0": [
          9.68,
          6.74,
          19.99
        ],
        "a": [
          3.53,
          -3.93,
          -1.19
        ],
        "t": 4.23
      },
      "object_B": {
        "r": 1.83,
        "v": 7.29,
        "omega": 3.98,
        "t": 1.2,
        "rotation_plane": "yz-plane"
      },
      "object_C": {
        "v0": [
          14.9,
          5.2,
          26.63
        ],
        "angle": 61.7,
        "t": 9.76
      }
    },
    "answer_json": {
      "pos_A": {
        "x_A": 72.53,
        "y_A": -6.65,
        "z_A": 73.91
      },
      "pos_B": {
        "x_B": 0,
        "y_B": 0.12,
        "z_B": -1.83
      },
      "pos_C": {
        "x_C": 145.42,
        "y_C": 50.75,
        "z_C": -207.33
      }
    }
  },
  {
    "type": "3D Multi-Object Motion",
    "question": "\nThree objects move in different types of motion in 3D space:\n1. Object A (Linear Motion)  \n   - Initial velocity: [18.3, 15.16, 16.82] m/s  \n   - Acceleration: [4.03, 2.76, -2.7] m/s\u00b2  \n   - Time: 8.22 s  \n   - Compute its final position (x_A, y_A, z_A). Assume it starts at (0, 0, 0).\n\n2. Object B (Circular Motion)  \n   - Radius: 1.49 meters  \n   - Speed: 2.71 m/s  \n   - Angular velocity: 1.82 rad/s  \n   - Time: 3.26 s  \n   - Rotating in the yz-plane  \n   - Compute its position (x_B, y_B, z_B), assuming it starts at (r_B, 0, 0).\n\n3. Object C (Projectile Motion)  \n   - Initial speed: [24.19, 22.02, 8.42] m/s  \n   - Launch angle: 20.83 degrees  \n   - Time: 6.65 s  \n   - Compute its position (x_C, y_C, z_C), assuming it starts from (0,0,0).\n",
    "parameters": {
      "object_A": {
        "v0": [
          18.3,
          15.16,
          16.82
        ],
        "a": [
          4.03,
          2.76,
          -2.7
        ],
        "t": 8.22
      },
      "object_B": {
        "r": 1.49,
        "v": 2.71,
        "omega": 1.82,
        "t": 3.26,
        "rotation_plane": "yz-plane"
      },
      "object_C": {
        "v0": [
          24.19,
          22.02,
          8.42
        ],
        "angle": 20.83,
        "t": 6.65
      }
    },
    "answer_json": {
      "pos_A": {
        "x_A": 286.58,
        "y_A": 217.86,
        "z_A": 47.04
      },
      "pos_B": {
        "x_B": 0,
        "y_B": 1.4,
        "z_B": -0.51
      },
      "pos_C": {
        "x_C": 160.86,
        "y_C": 146.43,
        "z_C": -160.92
      }
    }
  },
  {
    "type": "3D Multi-Object Motion",
    "question": "\nThree objects move in different types of motion in 3D space:\n1. Object A (Linear Motion)  \n   - Initial velocity: [1.75, 15.98, 1.63] m/s  \n   - Acceleration: [-1.35, -3.69, 4.1] m/s\u00b2  \n   - Time: 3.94 s  \n   - Compute its final position (x_A, y_A, z_A). Assume it starts at (0, 0, 0).\n\n2. Object B (Circular Motion)  \n   - Radius: 2.37 meters  \n   - Speed: 2.81 m/s  \n   - Angular velocity: 1.19 rad/s  \n   - Time: 8.08 s  \n   - Rotating in the xz-plane  \n   - Compute its position (x_B, y_B, z_B), assuming it starts at (r_B, 0, 0).\n\n3. Object C (Projectile Motion)  \n   - Initial speed: [18.27, 27.84, 25.76] m/s  \n   - Launch angle: 30.42 degrees  \n   - Time: 8.42 s  \n   - Compute its position (x_C, y_C, z_C), assuming it starts from (0,0,0).\n",
    "parameters": {
      "object_A": {
        "v0": [
          1.75,
          15.98,
          1.63
        ],
        "a": [
          -1.35,
          -3.69,
          4.1
        ],
        "t": 3.94
      },
      "object_B": {
        "r": 2.37,
        "v": 2.81,
        "omega": 1.19,
        "t": 8.08,
        "rotation_plane": "xz-plane"
      },
      "object_C": {
        "v0": [
          18.27,
          27.84,
          25.76
        ],
        "angle": 30.42,
        "t": 8.42
      }
    },
    "answer_json": {
      "pos_A": {
        "x_A": -3.58,
        "y_A": 34.32,
        "z_A": 38.25
      },
      "pos_B": {
        "x_B": -2.33,
        "y_B": 0,
        "z_B": -0.45
      },
      "pos_C": {
        "x_C": 153.83,
        "y_C": 234.41,
        "z_C": -130.85
      }
    }
  },
  {
    "type": "3D Multi-Object Motion",
    "question": "\nThree objects move in different types of motion in 3D space:\n1. Object A (Linear Motion)  \n   - Initial velocity: [10.16, 16.32, 15.18] m/s  \n   - Acceleration: [-1.61, -3.85, 4.63] m/s\u00b2  \n   - Time: 2.27 s  \n   - Compute its final position (x_A, y_A, z_A). Assume it starts at (0, 0, 0).\n\n2. Object B (Circular Motion)  \n   - Radius: 4.85 meters  \n   - Speed: 8.74 m/s  \n   - Angular velocity: 1.8 rad/s  \n   - Time: 7.52 s  \n   - Rotating in the xz-plane  \n   - Compute its position (x_B, y_B, z_B), assuming it starts at (r_B, 0, 0).\n\n3. Object C (Projectile Motion)  \n   - Initial speed: [29.18, 25.11, 14.14] m/s  \n   - Launch angle: 62.44 degrees  \n   - Time: 1.13 s  \n   - Compute its position (x_C, y_C, z_C), assuming it starts from (0,0,0).\n",
    "parameters": {
      "object_A": {
        "v0": [
          10.16,
          16.32,
          15.18
        ],
        "a": [
          -1.61,
          -3.85,
          4.63
        ],
        "t": 2.27
      },
      "object_B": {
        "r": 4.85,
        "v": 8.74,
        "omega": 1.8,
        "t": 7.52,
        "rotation_plane": "xz-plane"
      },
      "object_C": {
        "v0": [
          29.18,
          25.11,
          14.14
        ],
        "angle": 62.44,
        "t": 1.13
      }
    },
    "answer_json": {
      "pos_A": {
        "x_A": 18.92,
        "y_A": 27.13,
        "z_A": 46.39
      },
      "pos_B": {
        "x_B": 2.74,
        "y_B": 0,
        "z_B": 4.0
      },
      "pos_C": {
        "x_C": 32.97,
        "y_C": 28.37,
        "z_C": 9.72
      }
    }
  },
  {
    "type": "3D Multi-Object Motion",
    "question": "\nThree objects move in different types of motion in 3D space:\n1. Object A (Linear Motion)  \n   - Initial velocity: [11.19, 9.64, 13.78] m/s  \n   - Acceleration: [1.72, 0.85, 3.22] m/s\u00b2  \n   - Time: 9.46 s  \n   - Compute its final position (x_A, y_A, z_A). Assume it starts at (0, 0, 0).\n\n2. Object B (Circular Motion)  \n   - Radius: 0.99 meters  \n   - Speed: 3.1 m/s  \n   - Angular velocity: 3.13 rad/s  \n   - Time: 1.23 s  \n   - Rotating in the yz-plane  \n   - Compute its position (x_B, y_B, z_B), assuming it starts at (r_B, 0, 0).\n\n3. Object C (Projectile Motion)  \n   - Initial speed: [13.2, 20.25, 21.19] m/s  \n   - Launch angle: 53.12 degrees  \n   - Time: 5.18 s  \n   - Compute its position (x_C, y_C, z_C), assuming it starts from (0,0,0).\n",
    "parameters": {
      "object_A": {
        "v0": [
          11.19,
          9.64,
          13.78
        ],
        "a": [
          1.72,
          0.85,
          3.22
        ],
        "t": 9.46
      },
      "object_B": {
        "r": 0.99,
        "v": 3.1,
        "omega": 3.13,
        "t": 1.23,
        "rotation_plane": "yz-plane"
      },
      "object_C": {
        "v0": [
          13.2,
          20.25,
          21.19
        ],
        "angle": 53.12,
        "t": 5.18
      }
    },
    "answer_json": {
      "pos_A": {
        "x_A": 182.82,
        "y_A": 129.23,
        "z_A": 274.44
      },
      "pos_B": {
        "x_B": 0,
        "y_B": -0.75,
        "z_B": -0.64
      },
      "pos_C": {
        "x_C": 68.38,
        "y_C": 104.9,
        "z_C": -21.85
      }
    }
  },
  {
    "type": "3D Multi-Object Motion",
    "question": "\nThree objects move in different types of motion in 3D space:\n1. Object A (Linear Motion)  \n   - Initial velocity: [14.32, 13.34, 3.22] m/s  \n   - Acceleration: [-4.55, -4.63, 4.96] m/s\u00b2  \n   - Time: 2.05 s  \n   - Compute its final position (x_A, y_A, z_A). Assume it starts at (0, 0, 0).\n\n2. Object B (Circular Motion)  \n   - Radius: 1.56 meters  \n   - Speed: 5.84 m/s  \n   - Angular velocity: 3.74 rad/s  \n   - Time: 4.5 s  \n   - Rotating in the xz-plane  \n   - Compute its position (x_B, y_B, z_B), assuming it starts at (r_B, 0, 0).\n\n3. Object C (Projectile Motion)  \n   - Initial speed: [21.76, 23.58, 28.65] m/s  \n   - Launch angle: 40.15 degrees  \n   - Time: 7.68 s  \n   - Compute its position (x_C, y_C, z_C), assuming it starts from (0,0,0).\n",
    "parameters": {
      "object_A": {
        "v0": [
          14.32,
          13.34,
          3.22
        ],
        "a": [
          -4.55,
          -4.63,
          4.96
        ],
        "t": 2.05
      },
      "object_B": {
        "r": 1.56,
        "v": 5.84,
        "omega": 3.74,
        "t": 4.5,
        "rotation_plane": "xz-plane"
      },
      "object_C": {
        "v0": [
          21.76,
          23.58,
          28.65
        ],
        "angle": 40.15,
        "t": 7.68
      }
    },
    "answer_json": {
      "pos_A": {
        "x_A": 19.8,
        "y_A": 17.62,
        "z_A": 17.02
      },
      "pos_B": {
        "x_B": -0.68,
        "y_B": 0,
        "z_B": -1.41
      },
      "pos_C": {
        "x_C": 167.12,
        "y_C": 181.09,
        "z_C": -69.28
      }
    }
  },
  {
    "type": "3D Multi-Object Motion",
    "question": "\nThree objects move in different types of motion in 3D space:\n1. Object A (Linear Motion)  \n   - Initial velocity: [3.94, 8.88, 2.88] m/s  \n   - Acceleration: [-0.11, -0.92, 4.52] m/s\u00b2  \n   - Time: 1.29 s  \n   - Compute its final position (x_A, y_A, z_A). Assume it starts at (0, 0, 0).\n\n2. Object B (Circular Motion)  \n   - Radius: 2.17 meters  \n   - Speed: 4.99 m/s  \n   - Angular velocity: 2.3 rad/s  \n   - Time: 9.55 s  \n   - Rotating in the xz-plane  \n   - Compute its position (x_B, y_B, z_B), assuming it starts at (r_B, 0, 0).\n\n3. Object C (Projectile Motion)  \n   - Initial speed: [7.48, 22.14, 18.61] m/s  \n   - Launch angle: 73.67 degrees  \n   - Time: 4.23 s  \n   - Compute its position (x_C, y_C, z_C), assuming it starts from (0,0,0).\n",
    "parameters": {
      "object_A": {
        "v0": [
          3.94,
          8.88,
          2.88
        ],
        "a": [
          -0.11,
          -0.92,
          4.52
        ],
        "t": 1.29
      },
      "object_B": {
        "r": 2.17,
        "v": 4.99,
        "omega": 2.3,
        "t": 9.55,
        "rotation_plane": "xz-plane"
      },
      "object_C": {
        "v0": [
          7.48,
          22.14,
          18.61
        ],
        "angle": 73.67,
        "t": 4.23
      }
    },
    "answer_json": {
      "pos_A": {
        "x_A": 4.99,
        "y_A": 10.69,
        "z_A": 7.48
      },
      "pos_B": {
        "x_B": -2.17,
        "y_B": 0,
        "z_B": 0.06
      },
      "pos_C": {
        "x_C": 31.64,
        "y_C": 93.65,
        "z_C": -9.04
      }
    }
  },
  {
    "type": "3D Multi-Object Motion",
    "question": "\nThree objects move in different types of motion in 3D space:\n1. Object A (Linear Motion)  \n   - Initial velocity: [8.56, 4.61, 3.32] m/s  \n   - Acceleration: [3.48, -0.45, 1.63] m/s\u00b2  \n   - Time: 6.78 s  \n   - Compute its final position (x_A, y_A, z_A). Assume it starts at (0, 0, 0).\n\n2. Object B (Circular Motion)  \n   - Radius: 3.19 meters  \n   - Speed: 1.19 m/s  \n   - Angular velocity: 0.37 rad/s  \n   - Time: 8.08 s  \n   - Rotating in the xy-plane  \n   - Compute its position (x_B, y_B, z_B), assuming it starts at (r_B, 0, 0).\n\n3. Object C (Projectile Motion)  \n   - Initial speed: [29.72, 24.67, 10.13] m/s  \n   - Launch angle: 64.79 degrees  \n   - Time: 5.99 s  \n   - Compute its position (x_C, y_C, z_C), assuming it starts from (0,0,0).\n",
    "parameters": {
      "object_A": {
        "v0": [
          8.56,
          4.61,
          3.32
        ],
        "a": [
          3.48,
          -0.45,
          1.63
        ],
        "t": 6.78
      },
      "object_B": {
        "r": 3.19,
        "v": 1.19,
        "omega": 0.37,
        "t": 8.08,
        "rotation_plane": "xy-plane"
      },
      "object_C": {
        "v0": [
          29.72,
          24.67,
          10.13
        ],
        "angle": 64.79,
        "t": 5.99
      }
    },
    "answer_json": {
      "pos_A": {
        "x_A": 138.02,
        "y_A": 20.91,
        "z_A": 59.97
      },
      "pos_B": {
        "x_B": -3.15,
        "y_B": 0.48,
        "z_B": 0
      },
      "pos_C": {
        "x_C": 178.02,
        "y_C": 147.77,
        "z_C": -115.31
      }
    }
  },
  {
    "type": "3D Multi-Object Motion",
    "question": "\nThree objects move in different types of motion in 3D space:\n1. Object A (Linear Motion)  \n   - Initial velocity: [12.14, 16.45, 5.43] m/s  \n   - Acceleration: [2.74, 2.89, 0.96] m/s\u00b2  \n   - Time: 3.5 s  \n   - Compute its final position (x_A, y_A, z_A). Assume it starts at (0, 0, 0).\n\n2. Object B (Circular Motion)  \n   - Radius: 4.93 meters  \n   - Speed: 9.89 m/s  \n   - Angular velocity: 2.01 rad/s  \n   - Time: 5.86 s  \n   - Rotating in the xy-plane  \n   - Compute its position (x_B, y_B, z_B), assuming it starts at (r_B, 0, 0).\n\n3. Object C (Projectile Motion)  \n   - Initial speed: [7.75, 26.66, 8.3] m/s  \n   - Launch angle: 36.49 degrees  \n   - Time: 8.1 s  \n   - Compute its position (x_C, y_C, z_C), assuming it starts from (0,0,0).\n",
    "parameters": {
      "object_A": {
        "v0": [
          12.14,
          16.45,
          5.43
        ],
        "a": [
          2.74,
          2.89,
          0.96
        ],
        "t": 3.5
      },
      "object_B": {
        "r": 4.93,
        "v": 9.89,
        "omega": 2.01,
        "t": 5.86,
        "rotation_plane": "xy-plane"
      },
      "object_C": {
        "v0": [
          7.75,
          26.66,
          8.3
        ],
        "angle": 36.49,
        "t": 8.1
      }
    },
    "answer_json": {
      "pos_A": {
        "x_A": 59.27,
        "y_A": 75.28,
        "z_A": 24.88
      },
      "pos_B": {
        "x_B": 3.48,
        "y_B": -3.49,
        "z_B": 0
      },
      "pos_C": {
        "x_C": 62.78,
        "y_C": 215.95,
        "z_C": -254.59
      }
    }
  },
  {
    "type": "3D Multi-Object Motion",
    "question": "\nThree objects move in different types of motion in 3D space:\n1. Object A (Linear Motion)  \n   - Initial velocity: [12.19, 1.3, 6.04] m/s  \n   - Acceleration: [-3.73, -0.79, -3.86] m/s\u00b2  \n   - Time: 1.57 s  \n   - Compute its final position (x_A, y_A, z_A). Assume it starts at (0, 0, 0).\n\n2. Object B (Circular Motion)  \n   - Radius: 2.52 meters  \n   - Speed: 4.26 m/s  \n   - Angular velocity: 1.69 rad/s  \n   - Time: 6.34 s  \n   - Rotating in the xz-plane  \n   - Compute its position (x_B, y_B, z_B), assuming it starts at (r_B, 0, 0).\n\n3. Object C (Projectile Motion)  \n   - Initial speed: [17.6, 28.64, 6.08] m/s  \n   - Launch angle: 61.99 degrees  \n   - Time: 8.8 s  \n   - Compute its position (x_C, y_C, z_C), assuming it starts from (0,0,0).\n",
    "parameters": {
      "object_A": {
        "v0": [
          12.19,
          1.3,
          6.04
        ],
        "a": [
          -3.73,
          -0.79,
          -3.86
        ],
        "t": 1.57
      },
      "object_B": {
        "r": 2.52,
        "v": 4.26,
        "omega": 1.69,
        "t": 6.34,
        "rotation_plane": "xz-plane"
      },
      "object_C": {
        "v0": [
          17.6,
          28.64,
          6.08
        ],
        "angle": 61.99,
        "t": 8.8
      }
    },
    "answer_json": {
      "pos_A": {
        "x_A": 14.54,
        "y_A": 1.07,
        "z_A": 4.73
      },
      "pos_B": {
        "x_B": -0.7,
        "y_B": 0,
        "z_B": -2.42
      },
      "pos_C": {
        "x_C": 154.88,
        "y_C": 252.03,
        "z_C": -326.34
      }
    }
  },
  {
    "type": "3D Multi-Object Motion",
    "question": "\nThree objects move in different types of motion in 3D space:\n1. Object A (Linear Motion)  \n   - Initial velocity: [10.91, 9.7, 19.32] m/s  \n   - Acceleration: [-4.39, -0.21, -0.98] m/s\u00b2  \n   - Time: 7.17 s  \n   - Compute its final position (x_A, y_A, z_A). Assume it starts at (0, 0, 0).\n\n2. Object B (Circular Motion)  \n   - Radius: 2.71 meters  \n   - Speed: 9.19 m/s  \n   - Angular velocity: 3.39 rad/s  \n   - Time: 1.66 s  \n   - Rotating in the xy-plane  \n   - Compute its position (x_B, y_B, z_B), assuming it starts at (r_B, 0, 0).\n\n3. Object C (Projectile Motion)  \n   - Initial speed: [13.05, 8.71, 8.15] m/s  \n   - Launch angle: 52.46 degrees  \n   - Time: 6.27 s  \n   - Compute its position (x_C, y_C, z_C), assuming it starts from (0,0,0).\n",
    "parameters": {
      "object_A": {
        "v0": [
          10.91,
          9.7,
          19.32
        ],
        "a": [
          -4.39,
          -0.21,
          -0.98
        ],
        "t": 7.17
      },
      "object_B": {
        "r": 2.71,
        "v": 9.19,
        "omega": 3.39,
        "t": 1.66,
        "rotation_plane": "xy-plane"
      },
      "object_C": {
        "v0": [
          13.05,
          8.71,
          8.15
        ],
        "angle": 52.46,
        "t": 6.27
      }
    },
    "answer_json": {
      "pos_A": {
        "x_A": -34.62,
        "y_A": 64.15,
        "z_A": 113.33
      },
      "pos_B": {
        "x_B": 2.15,
        "y_B": -1.65,
        "z_B": 0
      },
      "pos_C": {
        "x_C": 81.82,
        "y_C": 54.61,
        "z_C": -141.73
      }
    }
  },
  {
    "type": "3D Multi-Object Motion",
    "question": "\nThree objects move in different types of motion in 3D space:\n1. Object A (Linear Motion)  \n   - Initial velocity: [14.53, 8.24, 12.35] m/s  \n   - Acceleration: [-2.05, 0.06, -0.7] m/s\u00b2  \n   - Time: 8.14 s  \n   - Compute its final position (x_A, y_A, z_A). Assume it starts at (0, 0, 0).\n\n2. Object B (Circular Motion)  \n   - Radius: 1.01 meters  \n   - Speed: 6.89 m/s  \n   - Angular velocity: 6.82 rad/s  \n   - Time: 8.9 s  \n   - Rotating in the yz-plane  \n   - Compute its position (x_B, y_B, z_B), assuming it starts at (r_B, 0, 0).\n\n3. Object C (Projectile Motion)  \n   - Initial speed: [23.02, 10.38, 16.29] m/s  \n   - Launch angle: 28.71 degrees  \n   - Time: 4.05 s  \n   - Compute its position (x_C, y_C, z_C), assuming it starts from (0,0,0).\n",
    "parameters": {
      "object_A": {
        "v0": [
          14.53,
          8.24,
          12.35
        ],
        "a": [
          -2.05,
          0.06,
          -0.7
        ],
        "t": 8.14
      },
      "object_B": {
        "r": 1.01,
        "v": 6.89,
        "omega": 6.82,
        "t": 8.9,
        "rotation_plane": "yz-plane"
      },
      "object_C": {
        "v0": [
          23.02,
          10.38,
          16.29
        ],
        "angle": 28.71,
        "t": 4.05
      }
    },
    "answer_json": {
      "pos_A": {
        "x_A": 50.36,
        "y_A": 69.06,
        "z_A": 77.34
      },
      "pos_B": {
        "x_B": 0,
        "y_B": -0.54,
        "z_B": -0.85
      },
      "pos_C": {
        "x_C": 93.23,
        "y_C": 42.04,
        "z_C": -14.48
      }
    }
  },
  {
    "type": "3D Multi-Object Motion",
    "question": "\nThree objects move in different types of motion in 3D space:\n1. Object A (Linear Motion)  \n   - Initial velocity: [9.62, 8.9, 2.81] m/s  \n   - Acceleration: [-0.73, 1.65, -1.26] m/s\u00b2  \n   - Time: 2.37 s  \n   - Compute its final position (x_A, y_A, z_A). Assume it starts at (0, 0, 0).\n\n2. Object B (Circular Motion)  \n   - Radius: 4.65 meters  \n   - Speed: 1.6 m/s  \n   - Angular velocity: 0.34 rad/s  \n   - Time: 8.49 s  \n   - Rotating in the xy-plane  \n   - Compute its position (x_B, y_B, z_B), assuming it starts at (r_B, 0, 0).\n\n3. Object C (Projectile Motion)  \n   - Initial speed: [15.8, 23.61, 14.32] m/s  \n   - Launch angle: 22.81 degrees  \n   - Time: 1.54 s  \n   - Compute its position (x_C, y_C, z_C), assuming it starts from (0,0,0).\n",
    "parameters": {
      "object_A": {
        "v0": [
          9.62,
          8.9,
          2.81
        ],
        "a": [
          -0.73,
          1.65,
          -1.26
        ],
        "t": 2.37
      },
      "object_B": {
        "r": 4.65,
        "v": 1.6,
        "omega": 0.34,
        "t": 8.49,
        "rotation_plane": "xy-plane"
      },
      "object_C": {
        "v0": [
          15.8,
          23.61,
          14.32
        ],
        "angle": 22.81,
        "t": 1.54
      }
    },
    "answer_json": {
      "pos_A": {
        "x_A": 20.75,
        "y_A": 25.73,
        "z_A": 3.12
      },
      "pos_B": {
        "x_B": -4.5,
        "y_B": 1.17,
        "z_B": 0
      },
      "pos_C": {
        "x_C": 24.33,
        "y_C": 36.36,
        "z_C": 10.42
      }
    }
  },
  {
    "type": "3D Multi-Object Motion",
    "question": "\nThree objects move in different types of motion in 3D space:\n1. Object A (Linear Motion)  \n   - Initial velocity: [19.18, 11.67, 13.73] m/s  \n   - Acceleration: [-0.89, 3.74, 4.41] m/s\u00b2  \n   - Time: 4.81 s  \n   - Compute its final position (x_A, y_A, z_A). Assume it starts at (0, 0, 0).\n\n2. Object B (Circular Motion)  \n   - Radius: 4.62 meters  \n   - Speed: 1.46 m/s  \n   - Angular velocity: 0.32 rad/s  \n   - Time: 3.59 s  \n   - Rotating in the xz-plane  \n   - Compute its position (x_B, y_B, z_B), assuming it starts at (r_B, 0, 0).\n\n3. Object C (Projectile Motion)  \n   - Initial speed: [13.79, 19.45, 10.32] m/s  \n   - Launch angle: 54.4 degrees  \n   - Time: 3.02 s  \n   - Compute its position (x_C, y_C, z_C), assuming it starts from (0,0,0).\n",
    "parameters": {
      "object_A": {
        "v0": [
          19.18,
          11.67,
          13.73
        ],
        "a": [
          -0.89,
          3.74,
          4.41
        ],
        "t": 4.81
      },
      "object_B": {
        "r": 4.62,
        "v": 1.46,
        "omega": 0.32,
        "t": 3.59,
        "rotation_plane": "xz-plane"
      },
      "object_C": {
        "v0": [
          13.79,
          19.45,
          10.32
        ],
        "angle": 54.4,
        "t": 3.02
      }
    },
    "answer_json": {
      "pos_A": {
        "x_A": 81.96,
        "y_A": 99.4,
        "z_A": 117.06
      },
      "pos_B": {
        "x_B": 1.89,
        "y_B": 0,
        "z_B": 4.21
      },
      "pos_C": {
        "x_C": 41.65,
        "y_C": 58.74,
        "z_C": -13.57
      }
    }
  },
  {
    "type": "3D Multi-Object Motion",
    "question": "\nThree objects move in different types of motion in 3D space:\n1. Object A (Linear Motion)  \n   - Initial velocity: [3.06, 17.06, 7.98] m/s  \n   - Acceleration: [2.63, 0.74, 3.07] m/s\u00b2  \n   - Time: 8.61 s  \n   - Compute its final position (x_A, y_A, z_A). Assume it starts at (0, 0, 0).\n\n2. Object B (Circular Motion)  \n   - Radius: 4.89 meters  \n   - Speed: 8.37 m/s  \n   - Angular velocity: 1.71 rad/s  \n   - Time: 6.52 s  \n   - Rotating in the yz-plane  \n   - Compute its position (x_B, y_B, z_B), assuming it starts at (r_B, 0, 0).\n\n3. Object C (Projectile Motion)  \n   - Initial speed: [18.92, 20.22, 21.45] m/s  \n   - Launch angle: 56.61 degrees  \n   - Time: 1.26 s  \n   - Compute its position (x_C, y_C, z_C), assuming it starts from (0,0,0).\n",
    "parameters": {
      "object_A": {
        "v0": [
          3.06,
          17.06,
          7.98
        ],
        "a": [
          2.63,
          0.74,
          3.07
        ],
        "t": 8.61
      },
      "object_B": {
        "r": 4.89,
        "v": 8.37,
        "omega": 1.71,
        "t": 6.52,
        "rotation_plane": "yz-plane"
      },
      "object_C": {
        "v0": [
          18.92,
          20.22,
          21.45
        ],
        "angle": 56.61,
        "t": 1.26
      }
    },
    "answer_json": {
      "pos_A": {
        "x_A": 123.83,
        "y_A": 174.32,
        "z_A": 182.5
      },
      "pos_B": {
        "x_B": 0,
        "y_B": 0.75,
        "z_B": -4.83
      },
      "pos_C": {
        "x_C": 23.84,
        "y_C": 25.48,
        "z_C": 19.24
      }
    }
  },
  {
    "type": "3D Multi-Object Motion",
    "question": "\nThree objects move in different types of motion in 3D space:\n1. Object A (Linear Motion)  \n   - Initial velocity: [6.19, 15.49, 18.51] m/s  \n   - Acceleration: [-1.49, -3.19, -3.57] m/s\u00b2  \n   - Time: 6.92 s  \n   - Compute its final position (x_A, y_A, z_A). Assume it starts at (0, 0, 0).\n\n2. Object B (Circular Motion)  \n   - Radius: 0.81 meters  \n   - Speed: 7.67 m/s  \n   - Angular velocity: 9.47 rad/s  \n   - Time: 9.75 s  \n   - Rotating in the xy-plane  \n   - Compute its position (x_B, y_B, z_B), assuming it starts at (r_B, 0, 0).\n\n3. Object C (Projectile Motion)  \n   - Initial speed: [23.65, 10.38, 15.5] m/s  \n   - Launch angle: 35.45 degrees  \n   - Time: 4.33 s  \n   - Compute its position (x_C, y_C, z_C), assuming it starts from (0,0,0).\n",
    "parameters": {
      "object_A": {
        "v0": [
          6.19,
          15.49,
          18.51
        ],
        "a": [
          -1.49,
          -3.19,
          -3.57
        ],
        "t": 6.92
      },
      "object_B": {
        "r": 0.81,
        "v": 7.67,
        "omega": 9.47,
        "t": 9.75,
        "rotation_plane": "xy-plane"
      },
      "object_C": {
        "v0": [
          23.65,
          10.38,
          15.5
        ],
        "angle": 35.45,
        "t": 4.33
      }
    },
    "answer_json": {
      "pos_A": {
        "x_A": 7.16,
        "y_A": 30.81,
        "z_A": 42.61
      },
      "pos_B": {
        "x_B": -0.27,
        "y_B": -0.76,
        "z_B": 0
      },
      "pos_C": {
        "x_C": 102.4,
        "y_C": 44.95,
        "z_C": -24.85
      }
    }
  },
  {
    "type": "3D Multi-Object Motion",
    "question": "\nThree objects move in different types of motion in 3D space:\n1. Object A (Linear Motion)  \n   - Initial velocity: [14.71, 15.76, 11.78] m/s  \n   - Acceleration: [-4.15, -4.47, -3.43] m/s\u00b2  \n   - Time: 6.56 s  \n   - Compute its final position (x_A, y_A, z_A). Assume it starts at (0, 0, 0).\n\n2. Object B (Circular Motion)  \n   - Radius: 3.53 meters  \n   - Speed: 3.45 m/s  \n   - Angular velocity: 0.98 rad/s  \n   - Time: 6.96 s  \n   - Rotating in the xz-plane  \n   - Compute its position (x_B, y_B, z_B), assuming it starts at (r_B, 0, 0).\n\n3. Object C (Projectile Motion)  \n   - Initial speed: [20.18, 15.35, 10.39] m/s  \n   - Launch angle: 45.74 degrees  \n   - Time: 4.11 s  \n   - Compute its position (x_C, y_C, z_C), assuming it starts from (0,0,0).\n",
    "parameters": {
      "object_A": {
        "v0": [
          14.71,
          15.76,
          11.78
        ],
        "a": [
          -4.15,
          -4.47,
          -3.43
        ],
        "t": 6.56
      },
      "object_B": {
        "r": 3.53,
        "v": 3.45,
        "omega": 0.98,
        "t": 6.96,
        "rotation_plane": "xz-plane"
      },
      "object_C": {
        "v0": [
          20.18,
          15.35,
          10.39
        ],
        "angle": 45.74,
        "t": 4.11
      }
    },
    "answer_json": {
      "pos_A": {
        "x_A": 7.2,
        "y_A": 7.21,
        "z_A": 3.47
      },
      "pos_B": {
        "x_B": 3.03,
        "y_B": 0,
        "z_B": 1.81
      },
      "pos_C": {
        "x_C": 82.94,
        "y_C": 63.09,
        "z_C": -40.15
      }
    }
  },
  {
    "type": "3D Multi-Object Motion",
    "question": "\nThree objects move in different types of motion in 3D space:\n1. Object A (Linear Motion)  \n   - Initial velocity: [3.11, 13.89, 12.27] m/s  \n   - Acceleration: [0.27, -1.92, -2.79] m/s\u00b2  \n   - Time: 9.86 s  \n   - Compute its final position (x_A, y_A, z_A). Assume it starts at (0, 0, 0).\n\n2. Object B (Circular Motion)  \n   - Radius: 0.75 meters  \n   - Speed: 2.84 m/s  \n   - Angular velocity: 3.79 rad/s  \n   - Time: 9.51 s  \n   - Rotating in the xy-plane  \n   - Compute its position (x_B, y_B, z_B), assuming it starts at (r_B, 0, 0).\n\n3. Object C (Projectile Motion)  \n   - Initial speed: [24.1, 12.24, 8.0] m/s  \n   - Launch angle: 44.84 degrees  \n   - Time: 4.88 s  \n   - Compute its position (x_C, y_C, z_C), assuming it starts from (0,0,0).\n",
    "parameters": {
      "object_A": {
        "v0": [
          3.11,
          13.89,
          12.27
        ],
        "a": [
          0.27,
          -1.92,
          -2.79
        ],
        "t": 9.86
      },
      "object_B": {
        "r": 0.75,
        "v": 2.84,
        "omega": 3.79,
        "t": 9.51,
        "rotation_plane": "xy-plane"
      },
      "object_C": {
        "v0": [
          24.1,
          12.24,
          8.0
        ],
        "angle": 44.84,
        "t": 4.88
      }
    },
    "answer_json": {
      "pos_A": {
        "x_A": 43.79,
        "y_A": 43.62,
        "z_A": -14.64
      },
      "pos_B": {
        "x_B": -0.06,
        "y_B": -0.75,
        "z_B": 0
      },
      "pos_C": {
        "x_C": 117.61,
        "y_C": 59.73,
        "z_C": -77.77
      }
    }
  },
  {
    "type": "3D Multi-Object Motion",
    "question": "\nThree objects move in different types of motion in 3D space:\n1. Object A (Linear Motion)  \n   - Initial velocity: [3.45, 11.12, 5.37] m/s  \n   - Acceleration: [0.59, 1.68, -1.46] m/s\u00b2  \n   - Time: 4.57 s  \n   - Compute its final position (x_A, y_A, z_A). Assume it starts at (0, 0, 0).\n\n2. Object B (Circular Motion)  \n   - Radius: 3.84 meters  \n   - Speed: 4.93 m/s  \n   - Angular velocity: 1.28 rad/s  \n   - Time: 5.14 s  \n   - Rotating in the xy-plane  \n   - Compute its position (x_B, y_B, z_B), assuming it starts at (r_B, 0, 0).\n\n3. Object C (Projectile Motion)  \n   - Initial speed: [26.55, 19.39, 19.33] m/s  \n   - Launch angle: 57.57 degrees  \n   - Time: 4.76 s  \n   - Compute its position (x_C, y_C, z_C), assuming it starts from (0,0,0).\n",
    "parameters": {
      "object_A": {
        "v0": [
          3.45,
          11.12,
          5.37
        ],
        "a": [
          0.59,
          1.68,
          -1.46
        ],
        "t": 4.57
      },
      "object_B": {
        "r": 3.84,
        "v": 4.93,
        "omega": 1.28,
        "t": 5.14,
        "rotation_plane": "xy-plane"
      },
      "object_C": {
        "v0": [
          26.55,
          19.39,
          19.33
        ],
        "angle": 57.57,
        "t": 4.76
      }
    },
    "answer_json": {
      "pos_A": {
        "x_A": 21.93,
        "y_A": 68.36,
        "z_A": 9.29
      },
      "pos_B": {
        "x_B": 3.67,
        "y_B": 1.12,
        "z_B": 0
      },
      "pos_C": {
        "x_C": 126.38,
        "y_C": 92.3,
        "z_C": -19.12
      }
    }
  },
  {
    "type": "3D Multi-Object Motion",
    "question": "\nThree objects move in different types of motion in 3D space:\n1. Object A (Linear Motion)  \n   - Initial velocity: [3.19, 1.4, 7.17] m/s  \n   - Acceleration: [3.01, 1.18, 3.32] m/s\u00b2  \n   - Time: 9.28 s  \n   - Compute its final position (x_A, y_A, z_A). Assume it starts at (0, 0, 0).\n\n2. Object B (Circular Motion)  \n   - Radius: 0.9 meters  \n   - Speed: 8.6 m/s  \n   - Angular velocity: 9.56 rad/s  \n   - Time: 3.19 s  \n   - Rotating in the yz-plane  \n   - Compute its position (x_B, y_B, z_B), assuming it starts at (r_B, 0, 0).\n\n3. Object C (Projectile Motion)  \n   - Initial speed: [15.01, 6.97, 26.76] m/s  \n   - Launch angle: 59.75 degrees  \n   - Time: 2.99 s  \n   - Compute its position (x_C, y_C, z_C), assuming it starts from (0,0,0).\n",
    "parameters": {
      "object_A": {
        "v0": [
          3.19,
          1.4,
          7.17
        ],
        "a": [
          3.01,
          1.18,
          3.32
        ],
        "t": 9.28
      },
      "object_B": {
        "r": 0.9,
        "v": 8.6,
        "omega": 9.56,
        "t": 3.19,
        "rotation_plane": "yz-plane"
      },
      "object_C": {
        "v0": [
          15.01,
          6.97,
          26.76
        ],
        "angle": 59.75,
        "t": 2.99
      }
    },
    "answer_json": {
      "pos_A": {
        "x_A": 159.21,
        "y_A": 63.8,
        "z_A": 209.49
      },
      "pos_B": {
        "x_B": 0,
        "y_B": 0.55,
        "z_B": -0.72
      },
      "pos_C": {
        "x_C": 44.88,
        "y_C": 20.84,
        "z_C": 36.16
      }
    }
  },
  {
    "type": "3D Multi-Object Motion",
    "question": "\nThree objects move in different types of motion in 3D space:\n1. Object A (Linear Motion)  \n   - Initial velocity: [15.8, 2.45, 13.03] m/s  \n   - Acceleration: [0.31, -3.06, 2.76] m/s\u00b2  \n   - Time: 4.16 s  \n   - Compute its final position (x_A, y_A, z_A). Assume it starts at (0, 0, 0).\n\n2. Object B (Circular Motion)  \n   - Radius: 4.81 meters  \n   - Speed: 6.81 m/s  \n   - Angular velocity: 1.42 rad/s  \n   - Time: 2.33 s  \n   - Rotating in the xy-plane  \n   - Compute its position (x_B, y_B, z_B), assuming it starts at (r_B, 0, 0).\n\n3. Object C (Projectile Motion)  \n   - Initial speed: [8.66, 9.93, 20.06] m/s  \n   - Launch angle: 60.61 degrees  \n   - Time: 6.9 s  \n   - Compute its position (x_C, y_C, z_C), assuming it starts from (0,0,0).\n",
    "parameters": {
      "object_A": {
        "v0": [
          15.8,
          2.45,
          13.03
        ],
        "a": [
          0.31,
          -3.06,
          2.76
        ],
        "t": 4.16
      },
      "object_B": {
        "r": 4.81,
        "v": 6.81,
        "omega": 1.42,
        "t": 2.33,
        "rotation_plane": "xy-plane"
      },
      "object_C": {
        "v0": [
          8.66,
          9.93,
          20.06
        ],
        "angle": 60.61,
        "t": 6.9
      }
    },
    "answer_json": {
      "pos_A": {
        "x_A": 68.41,
        "y_A": -16.29,
        "z_A": 78.09
      },
      "pos_B": {
        "x_B": -4.74,
        "y_B": -0.8,
        "z_B": 0
      },
      "pos_C": {
        "x_C": 59.75,
        "y_C": 68.52,
        "z_C": -95.11
      }
    }
  },
  {
    "type": "3D Multi-Object Motion",
    "question": "\nThree objects move in different types of motion in 3D space:\n1. Object A (Linear Motion)  \n   - Initial velocity: [4.37, 15.68, 10.39] m/s  \n   - Acceleration: [2.54, 2.6, -0.51] m/s\u00b2  \n   - Time: 9.32 s  \n   - Compute its final position (x_A, y_A, z_A). Assume it starts at (0, 0, 0).\n\n2. Object B (Circular Motion)  \n   - Radius: 3.04 meters  \n   - Speed: 6.72 m/s  \n   - Angular velocity: 2.21 rad/s  \n   - Time: 6.62 s  \n   - Rotating in the yz-plane  \n   - Compute its position (x_B, y_B, z_B), assuming it starts at (r_B, 0, 0).\n\n3. Object C (Projectile Motion)  \n   - Initial speed: [12.9, 15.99, 16.72] m/s  \n   - Launch angle: 52.88 degrees  \n   - Time: 8.17 s  \n   - Compute its position (x_C, y_C, z_C), assuming it starts from (0,0,0).\n",
    "parameters": {
      "object_A": {
        "v0": [
          4.37,
          15.68,
          10.39
        ],
        "a": [
          2.54,
          2.6,
          -0.51
        ],
        "t": 9.32
      },
      "object_B": {
        "r": 3.04,
        "v": 6.72,
        "omega": 2.21,
        "t": 6.62,
        "rotation_plane": "yz-plane"
      },
      "object_C": {
        "v0": [
          12.9,
          15.99,
          16.72
        ],
        "angle": 52.88,
        "t": 8.17
      }
    },
    "answer_json": {
      "pos_A": {
        "x_A": 151.04,
        "y_A": 259.06,
        "z_A": 74.68
      },
      "pos_B": {
        "x_B": 0,
        "y_B": -1.44,
        "z_B": 2.68
      },
      "pos_C": {
        "x_C": 105.39,
        "y_C": 130.64,
        "z_C": -190.8
      }
    }
  },
  {
    "type": "3D Multi-Object Motion",
    "question": "\nThree objects move in different types of motion in 3D space:\n1. Object A (Linear Motion)  \n   - Initial velocity: [12.24, 7.69, 2.41] m/s  \n   - Acceleration: [-0.38, -4.62, -1.31] m/s\u00b2  \n   - Time: 3.58 s  \n   - Compute its final position (x_A, y_A, z_A). Assume it starts at (0, 0, 0).\n\n2. Object B (Circular Motion)  \n   - Radius: 3.4 meters  \n   - Speed: 9.8 m/s  \n   - Angular velocity: 2.88 rad/s  \n   - Time: 1.81 s  \n   - Rotating in the yz-plane  \n   - Compute its position (x_B, y_B, z_B), assuming it starts at (r_B, 0, 0).\n\n3. Object C (Projectile Motion)  \n   - Initial speed: [17.68, 16.57, 18.86] m/s  \n   - Launch angle: 62.51 degrees  \n   - Time: 9.06 s  \n   - Compute its position (x_C, y_C, z_C), assuming it starts from (0,0,0).\n",
    "parameters": {
      "object_A": {
        "v0": [
          12.24,
          7.69,
          2.41
        ],
        "a": [
          -0.38,
          -4.62,
          -1.31
        ],
        "t": 3.58
      },
      "object_B": {
        "r": 3.4,
        "v": 9.8,
        "omega": 2.88,
        "t": 1.81,
        "rotation_plane": "yz-plane"
      },
      "object_C": {
        "v0": [
          17.68,
          16.57,
          18.86
        ],
        "angle": 62.51,
        "t": 9.06
      }
    },
    "answer_json": {
      "pos_A": {
        "x_A": 41.38,
        "y_A": -2.08,
        "z_A": 0.23
      },
      "pos_B": {
        "x_B": 0,
        "y_B": 1.63,
        "z_B": -2.98
      },
      "pos_C": {
        "x_C": 160.18,
        "y_C": 150.12,
        "z_C": -231.75
      }
    }
  },
  {
    "type": "3D Multi-Object Motion",
    "question": "\nThree objects move in different types of motion in 3D space:\n1. Object A (Linear Motion)  \n   - Initial velocity: [9.54, 16.39, 13.38] m/s  \n   - Acceleration: [-1.78, -0.24, -3.49] m/s\u00b2  \n   - Time: 1.56 s  \n   - Compute its final position (x_A, y_A, z_A). Assume it starts at (0, 0, 0).\n\n2. Object B (Circular Motion)  \n   - Radius: 0.97 meters  \n   - Speed: 9.09 m/s  \n   - Angular velocity: 9.37 rad/s  \n   - Time: 4.09 s  \n   - Rotating in the yz-plane  \n   - Compute its position (x_B, y_B, z_B), assuming it starts at (r_B, 0, 0).\n\n3. Object C (Projectile Motion)  \n   - Initial speed: [7.11, 21.15, 5.98] m/s  \n   - Launch angle: 57.46 degrees  \n   - Time: 9.92 s  \n   - Compute its position (x_C, y_C, z_C), assuming it starts from (0,0,0).\n",
    "parameters": {
      "object_A": {
        "v0": [
          9.54,
          16.39,
          13.38
        ],
        "a": [
          -1.78,
          -0.24,
          -3.49
        ],
        "t": 1.56
      },
      "object_B": {
        "r": 0.97,
        "v": 9.09,
        "omega": 9.37,
        "t": 4.09,
        "rotation_plane": "yz-plane"
      },
      "object_C": {
        "v0": [
          7.11,
          21.15,
          5.98
        ],
        "angle": 57.46,
        "t": 9.92
      }
    },
    "answer_json": {
      "pos_A": {
        "x_A": 12.72,
        "y_A": 25.28,
        "z_A": 16.63
      },
      "pos_B": {
        "x_B": 0,
        "y_B": 0.79,
        "z_B": 0.57
      },
      "pos_C": {
        "x_C": 70.53,
        "y_C": 209.81,
        "z_C": -423.36
      }
    }
  },
  {
    "type": "3D Multi-Object Motion",
    "question": "\nThree objects move in different types of motion in 3D space:\n1. Object A (Linear Motion)  \n   - Initial velocity: [10.96, 12.59, 7.91] m/s  \n   - Acceleration: [4.18, -1.13, 2.74] m/s\u00b2  \n   - Time: 7.11 s  \n   - Compute its final position (x_A, y_A, z_A). Assume it starts at (0, 0, 0).\n\n2. Object B (Circular Motion)  \n   - Radius: 0.74 meters  \n   - Speed: 6.68 m/s  \n   - Angular velocity: 9.03 rad/s  \n   - Time: 4.01 s  \n   - Rotating in the xz-plane  \n   - Compute its position (x_B, y_B, z_B), assuming it starts at (r_B, 0, 0).\n\n3. Object C (Projectile Motion)  \n   - Initial speed: [7.36, 21.96, 12.1] m/s  \n   - Launch angle: 58.42 degrees  \n   - Time: 6.91 s  \n   - Compute its position (x_C, y_C, z_C), assuming it starts from (0,0,0).\n",
    "parameters": {
      "object_A": {
        "v0": [
          10.96,
          12.59,
          7.91
        ],
        "a": [
          4.18,
          -1.13,
          2.74
        ],
        "t": 7.11
      },
      "object_B": {
        "r": 0.74,
        "v": 6.68,
        "omega": 9.03,
        "t": 4.01,
        "rotation_plane": "xz-plane"
      },
      "object_C": {
        "v0": [
          7.36,
          21.96,
          12.1
        ],
        "angle": 58.42,
        "t": 6.91
      }
    },
    "answer_json": {
      "pos_A": {
        "x_A": 183.58,
        "y_A": 60.95,
        "z_A": 125.5
      },
      "pos_B": {
        "x_B": 0.06,
        "y_B": 0,
        "z_B": -0.74
      },
      "pos_C": {
        "x_C": 50.86,
        "y_C": 151.74,
        "z_C": -150.59
      }
    }
  },
  {
    "type": "3D Multi-Object Motion",
    "question": "\nThree objects move in different types of motion in 3D space:\n1. Object A (Linear Motion)  \n   - Initial velocity: [18.22, 17.59, 7.33] m/s  \n   - Acceleration: [0.83, -3.59, -1.5] m/s\u00b2  \n   - Time: 9.71 s  \n   - Compute its final position (x_A, y_A, z_A). Assume it starts at (0, 0, 0).\n\n2. Object B (Circular Motion)  \n   - Radius: 3.64 meters  \n   - Speed: 4.53 m/s  \n   - Angular velocity: 1.24 rad/s  \n   - Time: 6.36 s  \n   - Rotating in the xy-plane  \n   - Compute its position (x_B, y_B, z_B), assuming it starts at (r_B, 0, 0).\n\n3. Object C (Projectile Motion)  \n   - Initial speed: [12.74, 14.42, 24.79] m/s  \n   - Launch angle: 63.79 degrees  \n   - Time: 7.03 s  \n   - Compute its position (x_C, y_C, z_C), assuming it starts from (0,0,0).\n",
    "parameters": {
      "object_A": {
        "v0": [
          18.22,
          17.59,
          7.33
        ],
        "a": [
          0.83,
          -3.59,
          -1.5
        ],
        "t": 9.71
      },
      "object_B": {
        "r": 3.64,
        "v": 4.53,
        "omega": 1.24,
        "t": 6.36,
        "rotation_plane": "xy-plane"
      },
      "object_C": {
        "v0": [
          12.74,
          14.42,
          24.79
        ],
        "angle": 63.79,
        "t": 7.03
      }
    },
    "answer_json": {
      "pos_A": {
        "x_A": 216.04,
        "y_A": 1.56,
        "z_A": 0.46
      },
      "pos_B": {
        "x_B": -0.12,
        "y_B": 3.64,
        "z_B": 0
      },
      "pos_C": {
        "x_C": 89.56,
        "y_C": 101.37,
        "z_C": -68.14
      }
    }
  },
  {
    "type": "3D Multi-Object Motion",
    "question": "\nThree objects move in different types of motion in 3D space:\n1. Object A (Linear Motion)  \n   - Initial velocity: [16.75, 15.04, 14.02] m/s  \n   - Acceleration: [0.26, 1.46, -0.77] m/s\u00b2  \n   - Time: 4.26 s  \n   - Compute its final position (x_A, y_A, z_A). Assume it starts at (0, 0, 0).\n\n2. Object B (Circular Motion)  \n   - Radius: 2.13 meters  \n   - Speed: 2.62 m/s  \n   - Angular velocity: 1.23 rad/s  \n   - Time: 2.93 s  \n   - Rotating in the xz-plane  \n   - Compute its position (x_B, y_B, z_B), assuming it starts at (r_B, 0, 0).\n\n3. Object C (Projectile Motion)  \n   - Initial speed: [9.8, 30.0, 8.87] m/s  \n   - Launch angle: 32.75 degrees  \n   - Time: 8.09 s  \n   - Compute its position (x_C, y_C, z_C), assuming it starts from (0,0,0).\n",
    "parameters": {
      "object_A": {
        "v0": [
          16.75,
          15.04,
          14.02
        ],
        "a": [
          0.26,
          1.46,
          -0.77
        ],
        "t": 4.26
      },
      "object_B": {
        "r": 2.13,
        "v": 2.62,
        "omega": 1.23,
        "t": 2.93,
        "rotation_plane": "xz-plane"
      },
      "object_C": {
        "v0": [
          9.8,
          30.0,
          8.87
        ],
        "angle": 32.75,
        "t": 8.09
      }
    },
    "answer_json": {
      "pos_A": {
        "x_A": 73.71,
        "y_A": 77.32,
        "z_A": 52.74
      },
      "pos_B": {
        "x_B": -1.91,
        "y_B": 0,
        "z_B": -0.95
      },
      "pos_C": {
        "x_C": 79.28,
        "y_C": 242.7,
        "z_C": -249.26
      }
    }
  },
  {
    "type": "3D Multi-Object Motion",
    "question": "\nThree objects move in different types of motion in 3D space:\n1. Object A (Linear Motion)  \n   - Initial velocity: [10.65, 11.26, 15.03] m/s  \n   - Acceleration: [0.27, 1.62, 3.76] m/s\u00b2  \n   - Time: 6.56 s  \n   - Compute its final position (x_A, y_A, z_A). Assume it starts at (0, 0, 0).\n\n2. Object B (Circular Motion)  \n   - Radius: 3.19 meters  \n   - Speed: 2.39 m/s  \n   - Angular velocity: 0.75 rad/s  \n   - Time: 2.63 s  \n   - Rotating in the yz-plane  \n   - Compute its position (x_B, y_B, z_B), assuming it starts at (r_B, 0, 0).\n\n3. Object C (Projectile Motion)  \n   - Initial speed: [24.28, 25.23, 9.14] m/s  \n   - Launch angle: 41.26 degrees  \n   - Time: 4.7 s  \n   - Compute its position (x_C, y_C, z_C), assuming it starts from (0,0,0).\n",
    "parameters": {
      "object_A": {
        "v0": [
          10.65,
          11.26,
          15.03
        ],
        "a": [
          0.27,
          1.62,
          3.76
        ],
        "t": 6.56
      },
      "object_B": {
        "r": 3.19,
        "v": 2.39,
        "omega": 0.75,
        "t": 2.63,
        "rotation_plane": "yz-plane"
      },
      "object_C": {
        "v0": [
          24.28,
          25.23,
          9.14
        ],
        "angle": 41.26,
        "t": 4.7
      }
    },
    "answer_json": {
      "pos_A": {
        "x_A": 75.67,
        "y_A": 108.72,
        "z_A": 179.5
      },
      "pos_B": {
        "x_B": 0,
        "y_B": -1.25,
        "z_B": 2.94
      },
      "pos_C": {
        "x_C": 114.12,
        "y_C": 118.58,
        "z_C": -65.39
      }
    }
  },
  {
    "type": "3D Multi-Object Motion",
    "question": "\nThree objects move in different types of motion in 3D space:\n1. Object A (Linear Motion)  \n   - Initial velocity: [13.85, 5.51, 9.44] m/s  \n   - Acceleration: [-2.15, 2.49, -0.51] m/s\u00b2  \n   - Time: 5.81 s  \n   - Compute its final position (x_A, y_A, z_A). Assume it starts at (0, 0, 0).\n\n2. Object B (Circular Motion)  \n   - Radius: 1.89 meters  \n   - Speed: 8.28 m/s  \n   - Angular velocity: 4.38 rad/s  \n   - Time: 5.22 s  \n   - Rotating in the xy-plane  \n   - Compute its position (x_B, y_B, z_B), assuming it starts at (r_B, 0, 0).\n\n3. Object C (Projectile Motion)  \n   - Initial speed: [14.2, 28.68, 29.61] m/s  \n   - Launch angle: 42.7 degrees  \n   - Time: 3.54 s  \n   - Compute its position (x_C, y_C, z_C), assuming it starts from (0,0,0).\n",
    "parameters": {
      "object_A": {
        "v0": [
          13.85,
          5.51,
          9.44
        ],
        "a": [
          -2.15,
          2.49,
          -0.51
        ],
        "t": 5.81
      },
      "object_B": {
        "r": 1.89,
        "v": 8.28,
        "omega": 4.38,
        "t": 5.22,
        "rotation_plane": "xy-plane"
      },
      "object_C": {
        "v0": [
          14.2,
          28.68,
          29.61
        ],
        "angle": 42.7,
        "t": 3.54
      }
    },
    "answer_json": {
      "pos_A": {
        "x_A": 44.18,
        "y_A": 74.04,
        "z_A": 46.24
      },
      "pos_B": {
        "x_B": -1.22,
        "y_B": -1.45,
        "z_B": 0
      },
      "pos_C": {
        "x_C": 50.27,
        "y_C": 101.53,
        "z_C": 43.35
      }
    }
  },
  {
    "type": "3D Multi-Object Motion",
    "question": "\nThree objects move in different types of motion in 3D space:\n1. Object A (Linear Motion)  \n   - Initial velocity: [8.26, 11.02, 19.36] m/s  \n   - Acceleration: [3.17, 3.01, -3.62] m/s\u00b2  \n   - Time: 3.25 s  \n   - Compute its final position (x_A, y_A, z_A). Assume it starts at (0, 0, 0).\n\n2. Object B (Circular Motion)  \n   - Radius: 3.39 meters  \n   - Speed: 8.87 m/s  \n   - Angular velocity: 2.62 rad/s  \n   - Time: 5.99 s  \n   - Rotating in the xy-plane  \n   - Compute its position (x_B, y_B, z_B), assuming it starts at (r_B, 0, 0).\n\n3. Object C (Projectile Motion)  \n   - Initial speed: [22.79, 17.9, 8.12] m/s  \n   - Launch angle: 20.03 degrees  \n   - Time: 2.44 s  \n   - Compute its position (x_C, y_C, z_C), assuming it starts from (0,0,0).\n",
    "parameters": {
      "object_A": {
        "v0": [
          8.26,
          11.02,
          19.36
        ],
        "a": [
          3.17,
          3.01,
          -3.62
        ],
        "t": 3.25
      },
      "object_B": {
        "r": 3.39,
        "v": 8.87,
        "omega": 2.62,
        "t": 5.99,
        "rotation_plane": "xy-plane"
      },
      "object_C": {
        "v0": [
          22.79,
          17.9,
          8.12
        ],
        "angle": 20.03,
        "t": 2.44
      }
    },
    "answer_json": {
      "pos_A": {
        "x_A": 43.59,
        "y_A": 51.71,
        "z_A": 43.8
      },
      "pos_B": {
        "x_B": -3.39,
        "y_B": 0.05,
        "z_B": 0
      },
      "pos_C": {
        "x_C": 55.61,
        "y_C": 43.68,
        "z_C": -9.39
      }
    }
  },
  {
    "type": "3D Multi-Object Motion",
    "question": "\nThree objects move in different types of motion in 3D space:\n1. Object A (Linear Motion)  \n   - Initial velocity: [9.54, 10.75, 16.79] m/s  \n   - Acceleration: [-4.08, 4.11, 3.17] m/s\u00b2  \n   - Time: 8.96 s  \n   - Compute its final position (x_A, y_A, z_A). Assume it starts at (0, 0, 0).\n\n2. Object B (Circular Motion)  \n   - Radius: 4.69 meters  \n   - Speed: 4.73 m/s  \n   - Angular velocity: 1.01 rad/s  \n   - Time: 4.57 s  \n   - Rotating in the xz-plane  \n   - Compute its position (x_B, y_B, z_B), assuming it starts at (r_B, 0, 0).\n\n3. Object C (Projectile Motion)  \n   - Initial speed: [10.89, 29.86, 14.37] m/s  \n   - Launch angle: 16.69 degrees  \n   - Time: 9.38 s  \n   - Compute its position (x_C, y_C, z_C), assuming it starts from (0,0,0).\n",
    "parameters": {
      "object_A": {
        "v0": [
          9.54,
          10.75,
          16.79
        ],
        "a": [
          -4.08,
          4.11,
          3.17
        ],
        "t": 8.96
      },
      "object_B": {
        "r": 4.69,
        "v": 4.73,
        "omega": 1.01,
        "t": 4.57,
        "rotation_plane": "xz-plane"
      },
      "object_C": {
        "v0": [
          10.89,
          29.86,
          14.37
        ],
        "angle": 16.69,
        "t": 9.38
      }
    },
    "answer_json": {
      "pos_A": {
        "x_A": -78.3,
        "y_A": 261.3,
        "z_A": 277.68
      },
      "pos_B": {
        "x_B": -0.45,
        "y_B": 0,
        "z_B": -4.67
      },
      "pos_C": {
        "x_C": 102.15,
        "y_C": 280.09,
        "z_C": -296.77
      }
    }
  },
  {
    "type": "3D Multi-Object Motion",
    "question": "\nThree objects move in different types of motion in 3D space:\n1. Object A (Linear Motion)  \n   - Initial velocity: [16.94, 13.35, 16.04] m/s  \n   - Acceleration: [-3.62, -2.13, 3.3] m/s\u00b2  \n   - Time: 7.26 s  \n   - Compute its final position (x_A, y_A, z_A). Assume it starts at (0, 0, 0).\n\n2. Object B (Circular Motion)  \n   - Radius: 1.12 meters  \n   - Speed: 7.35 m/s  \n   - Angular velocity: 6.56 rad/s  \n   - Time: 5.04 s  \n   - Rotating in the xy-plane  \n   - Compute its position (x_B, y_B, z_B), assuming it starts at (r_B, 0, 0).\n\n3. Object C (Projectile Motion)  \n   - Initial speed: [27.65, 5.48, 10.39] m/s  \n   - Launch angle: 23.97 degrees  \n   - Time: 9.46 s  \n   - Compute its position (x_C, y_C, z_C), assuming it starts from (0,0,0).\n",
    "parameters": {
      "object_A": {
        "v0": [
          16.94,
          13.35,
          16.04
        ],
        "a": [
          -3.62,
          -2.13,
          3.3
        ],
        "t": 7.26
      },
      "object_B": {
        "r": 1.12,
        "v": 7.35,
        "omega": 6.56,
        "t": 5.04,
        "rotation_plane": "xy-plane"
      },
      "object_C": {
        "v0": [
          27.65,
          5.48,
          10.39
        ],
        "angle": 23.97,
        "t": 9.46
      }
    },
    "answer_json": {
      "pos_A": {
        "x_A": 27.58,
        "y_A": 40.79,
        "z_A": 203.42
      },
      "pos_B": {
        "x_B": -0.08,
        "y_B": 1.12,
        "z_B": 0
      },
      "pos_C": {
        "x_C": 261.57,
        "y_C": 51.84,
        "z_C": -340.67
      }
    }
  },
  {
    "type": "3D Multi-Object Motion",
    "question": "\nThree objects move in different types of motion in 3D space:\n1. Object A (Linear Motion)  \n   - Initial velocity: [12.57, 9.04, 15.75] m/s  \n   - Acceleration: [-2.62, -3.78, -2.62] m/s\u00b2  \n   - Time: 6.75 s  \n   - Compute its final position (x_A, y_A, z_A). Assume it starts at (0, 0, 0).\n\n2. Object B (Circular Motion)  \n   - Radius: 3.3 meters  \n   - Speed: 1.57 m/s  \n   - Angular velocity: 0.48 rad/s  \n   - Time: 8.53 s  \n   - Rotating in the xz-plane  \n   - Compute its position (x_B, y_B, z_B), assuming it starts at (r_B, 0, 0).\n\n3. Object C (Projectile Motion)  \n   - Initial speed: [19.92, 5.41, 17.88] m/s  \n   - Launch angle: 29.52 degrees  \n   - Time: 2.29 s  \n   - Compute its position (x_C, y_C, z_C), assuming it starts from (0,0,0).\n",
    "parameters": {
      "object_A": {
        "v0": [
          12.57,
          9.04,
          15.75
        ],
        "a": [
          -2.62,
          -3.78,
          -2.62
        ],
        "t": 6.75
      },
      "object_B": {
        "r": 3.3,
        "v": 1.57,
        "omega": 0.48,
        "t": 8.53,
        "rotation_plane": "xz-plane"
      },
      "object_C": {
        "v0": [
          19.92,
          5.41,
          17.88
        ],
        "angle": 29.52,
        "t": 2.29
      }
    },
    "answer_json": {
      "pos_A": {
        "x_A": 25.16,
        "y_A": -25.09,
        "z_A": 46.63
      },
      "pos_B": {
        "x_B": -1.91,
        "y_B": 0,
        "z_B": -2.69
      },
      "pos_C": {
        "x_C": 45.62,
        "y_C": 12.39,
        "z_C": 15.22
      }
    }
  },
  {
    "type": "3D Multi-Object Motion",
    "question": "\nThree objects move in different types of motion in 3D space:\n1. Object A (Linear Motion)  \n   - Initial velocity: [9.16, 12.68, 5.57] m/s  \n   - Acceleration: [-0.83, 1.64, -4.14] m/s\u00b2  \n   - Time: 9.77 s  \n   - Compute its final position (x_A, y_A, z_A). Assume it starts at (0, 0, 0).\n\n2. Object B (Circular Motion)  \n   - Radius: 0.8 meters  \n   - Speed: 5.73 m/s  \n   - Angular velocity: 7.16 rad/s  \n   - Time: 5.57 s  \n   - Rotating in the yz-plane  \n   - Compute its position (x_B, y_B, z_B), assuming it starts at (r_B, 0, 0).\n\n3. Object C (Projectile Motion)  \n   - Initial speed: [18.85, 14.76, 16.75] m/s  \n   - Launch angle: 53.14 degrees  \n   - Time: 9.83 s  \n   - Compute its position (x_C, y_C, z_C), assuming it starts from (0,0,0).\n",
    "parameters": {
      "object_A": {
        "v0": [
          9.16,
          12.68,
          5.57
        ],
        "a": [
          -0.83,
          1.64,
          -4.14
        ],
        "t": 9.77
      },
      "object_B": {
        "r": 0.8,
        "v": 5.73,
        "omega": 7.16,
        "t": 5.57,
        "rotation_plane": "yz-plane"
      },
      "object_C": {
        "v0": [
          18.85,
          14.76,
          16.75
        ],
        "angle": 53.14,
        "t": 9.83
      }
    },
    "answer_json": {
      "pos_A": {
        "x_A": 49.88,
        "y_A": 202.15,
        "z_A": -143.17
      },
      "pos_B": {
        "x_B": 0,
        "y_B": -0.46,
        "z_B": 0.66
      },
      "pos_C": {
        "x_C": 185.3,
        "y_C": 145.09,
        "z_C": -309.31
      }
    }
  },
  {
    "type": "3D Multi-Object Motion",
    "question": "\nThree objects move in different types of motion in 3D space:\n1. Object A (Linear Motion)  \n   - Initial velocity: [5.82, 1.31, 15.98] m/s  \n   - Acceleration: [-1.55, 2.33, 1.28] m/s\u00b2  \n   - Time: 7.94 s  \n   - Compute its final position (x_A, y_A, z_A). Assume it starts at (0, 0, 0).\n\n2. Object B (Circular Motion)  \n   - Radius: 3.81 meters  \n   - Speed: 3.99 m/s  \n   - Angular velocity: 1.05 rad/s  \n   - Time: 1.4 s  \n   - Rotating in the yz-plane  \n   - Compute its position (x_B, y_B, z_B), assuming it starts at (r_B, 0, 0).\n\n3. Object C (Projectile Motion)  \n   - Initial speed: [13.46, 21.07, 25.76] m/s  \n   - Launch angle: 56.08 degrees  \n   - Time: 9.83 s  \n   - Compute its position (x_C, y_C, z_C), assuming it starts from (0,0,0).\n",
    "parameters": {
      "object_A": {
        "v0": [
          5.82,
          1.31,
          15.98
        ],
        "a": [
          -1.55,
          2.33,
          1.28
        ],
        "t": 7.94
      },
      "object_B": {
        "r": 3.81,
        "v": 3.99,
        "omega": 1.05,
        "t": 1.4,
        "rotation_plane": "yz-plane"
      },
      "object_C": {
        "v0": [
          13.46,
          21.07,
          25.76
        ],
        "angle": 56.08,
        "t": 9.83
      }
    },
    "answer_json": {
      "pos_A": {
        "x_A": -2.65,
        "y_A": 83.85,
        "z_A": 167.23
      },
      "pos_B": {
        "x_B": 0,
        "y_B": 0.38,
        "z_B": 3.79
      },
      "pos_C": {
        "x_C": 132.31,
        "y_C": 207.12,
        "z_C": -220.74
      }
    }
  },
  {
    "type": "3D Multi-Object Motion",
    "question": "\nThree objects move in different types of motion in 3D space:\n1. Object A (Linear Motion)  \n   - Initial velocity: [10.09, 4.46, 3.56] m/s  \n   - Acceleration: [2.16, 4.44, -4.63] m/s\u00b2  \n   - Time: 2.81 s  \n   - Compute its final position (x_A, y_A, z_A). Assume it starts at (0, 0, 0).\n\n2. Object B (Circular Motion)  \n   - Radius: 4.06 meters  \n   - Speed: 8.97 m/s  \n   - Angular velocity: 2.21 rad/s  \n   - Time: 3.84 s  \n   - Rotating in the xz-plane  \n   - Compute its position (x_B, y_B, z_B), assuming it starts at (r_B, 0, 0).\n\n3. Object C (Projectile Motion)  \n   - Initial speed: [17.88, 29.73, 18.58] m/s  \n   - Launch angle: 30.2 degrees  \n   - Time: 7.78 s  \n   - Compute its position (x_C, y_C, z_C), assuming it starts from (0,0,0).\n",
    "parameters": {
      "object_A": {
        "v0": [
          10.09,
          4.46,
          3.56
        ],
        "a": [
          2.16,
          4.44,
          -4.63
        ],
        "t": 2.81
      },
      "object_B": {
        "r": 4.06,
        "v": 8.97,
        "omega": 2.21,
        "t": 3.84,
        "rotation_plane": "xz-plane"
      },
      "object_C": {
        "v0": [
          17.88,
          29.73,
          18.58
        ],
        "angle": 30.2,
        "t": 7.78
      }
    },
    "answer_json": {
      "pos_A": {
        "x_A": 36.88,
        "y_A": 30.06,
        "z_A": -8.28
      },
      "pos_B": {
        "x_B": -2.4,
        "y_B": 0,
        "z_B": 3.27
      },
      "pos_C": {
        "x_C": 139.11,
        "y_C": 231.3,
        "z_C": -152.34
      }
    }
  },
  {
    "type": "3D Multi-Object Motion",
    "question": "\nThree objects move in different types of motion in 3D space:\n1. Object A (Linear Motion)  \n   - Initial velocity: [4.63, 7.78, 15.84] m/s  \n   - Acceleration: [3.66, -1.68, -3.76] m/s\u00b2  \n   - Time: 4.31 s  \n   - Compute its final position (x_A, y_A, z_A). Assume it starts at (0, 0, 0).\n\n2. Object B (Circular Motion)  \n   - Radius: 4.5 meters  \n   - Speed: 7.69 m/s  \n   - Angular velocity: 1.71 rad/s  \n   - Time: 9.05 s  \n   - Rotating in the xz-plane  \n   - Compute its position (x_B, y_B, z_B), assuming it starts at (r_B, 0, 0).\n\n3. Object C (Projectile Motion)  \n   - Initial speed: [13.48, 9.67, 22.3] m/s  \n   - Launch angle: 37.04 degrees  \n   - Time: 8.18 s  \n   - Compute its position (x_C, y_C, z_C), assuming it starts from (0,0,0).\n",
    "parameters": {
      "object_A": {
        "v0": [
          4.63,
          7.78,
          15.84
        ],
        "a": [
          3.66,
          -1.68,
          -3.76
        ],
        "t": 4.31
      },
      "object_B": {
        "r": 4.5,
        "v": 7.69,
        "omega": 1.71,
        "t": 9.05,
        "rotation_plane": "xz-plane"
      },
      "object_C": {
        "v0": [
          13.48,
          9.67,
          22.3
        ],
        "angle": 37.04,
        "t": 8.18
      }
    },
    "answer_json": {
      "pos_A": {
        "x_A": 53.95,
        "y_A": 17.93,
        "z_A": 33.35
      },
      "pos_B": {
        "x_B": -4.38,
        "y_B": 0,
        "z_B": 1.04
      },
      "pos_C": {
        "x_C": 110.27,
        "y_C": 79.1,
        "z_C": -145.79
      }
    }
  },
  {
    "type": "3D Multi-Object Motion",
    "question": "\nThree objects move in different types of motion in 3D space:\n1. Object A (Linear Motion)  \n   - Initial velocity: [6.07, 2.57, 9.07] m/s  \n   - Acceleration: [-0.69, 4.95, -3.2] m/s\u00b2  \n   - Time: 3.64 s  \n   - Compute its final position (x_A, y_A, z_A). Assume it starts at (0, 0, 0).\n\n2. Object B (Circular Motion)  \n   - Radius: 0.96 meters  \n   - Speed: 3.95 m/s  \n   - Angular velocity: 4.11 rad/s  \n   - Time: 3.66 s  \n   - Rotating in the xz-plane  \n   - Compute its position (x_B, y_B, z_B), assuming it starts at (r_B, 0, 0).\n\n3. Object C (Projectile Motion)  \n   - Initial speed: [20.07, 15.65, 22.24] m/s  \n   - Launch angle: 36.09 degrees  \n   - Time: 1.38 s  \n   - Compute its position (x_C, y_C, z_C), assuming it starts from (0,0,0).\n",
    "parameters": {
      "object_A": {
        "v0": [
          6.07,
          2.57,
          9.07
        ],
        "a": [
          -0.69,
          4.95,
          -3.2
        ],
        "t": 3.64
      },
      "object_B": {
        "r": 0.96,
        "v": 3.95,
        "omega": 4.11,
        "t": 3.66,
        "rotation_plane": "xz-plane"
      },
      "object_C": {
        "v0": [
          20.07,
          15.65,
          22.24
        ],
        "angle": 36.09,
        "t": 1.38
      }
    },
    "answer_json": {
      "pos_A": {
        "x_A": 17.52,
        "y_A": 42.15,
        "z_A": 11.82
      },
      "pos_B": {
        "x_B": -0.76,
        "y_B": 0,
        "z_B": 0.59
      },
      "pos_C": {
        "x_C": 27.7,
        "y_C": 21.6,
        "z_C": 21.35
      }
    }
  },
  {
    "type": "3D Multi-Object Motion",
    "question": "\nThree objects move in different types of motion in 3D space:\n1. Object A (Linear Motion)  \n   - Initial velocity: [17.53, 7.7, 19.96] m/s  \n   - Acceleration: [-2.25, 4.8, 4.48] m/s\u00b2  \n   - Time: 1.68 s  \n   - Compute its final position (x_A, y_A, z_A). Assume it starts at (0, 0, 0).\n\n2. Object B (Circular Motion)  \n   - Radius: 3.37 meters  \n   - Speed: 4.27 m/s  \n   - Angular velocity: 1.27 rad/s  \n   - Time: 8.21 s  \n   - Rotating in the yz-plane  \n   - Compute its position (x_B, y_B, z_B), assuming it starts at (r_B, 0, 0).\n\n3. Object C (Projectile Motion)  \n   - Initial speed: [9.0, 5.78, 26.22] m/s  \n   - Launch angle: 55.69 degrees  \n   - Time: 4.94 s  \n   - Compute its position (x_C, y_C, z_C), assuming it starts from (0,0,0).\n",
    "parameters": {
      "object_A": {
        "v0": [
          17.53,
          7.7,
          19.96
        ],
        "a": [
          -2.25,
          4.8,
          4.48
        ],
        "t": 1.68
      },
      "object_B": {
        "r": 3.37,
        "v": 4.27,
        "omega": 1.27,
        "t": 8.21,
        "rotation_plane": "yz-plane"
      },
      "object_C": {
        "v0": [
          9.0,
          5.78,
          26.22
        ],
        "angle": 55.69,
        "t": 4.94
      }
    },
    "answer_json": {
      "pos_A": {
        "x_A": 26.28,
        "y_A": 19.71,
        "z_A": 39.85
      },
      "pos_B": {
        "x_B": 0,
        "y_B": -1.82,
        "z_B": -2.84
      },
      "pos_C": {
        "x_C": 44.46,
        "y_C": 28.55,
        "z_C": 9.83
      }
    }
  },
  {
    "type": "3D Multi-Object Motion",
    "question": "\nThree objects move in different types of motion in 3D space:\n1. Object A (Linear Motion)  \n   - Initial velocity: [3.4, 5.48, 13.26] m/s  \n   - Acceleration: [-1.38, 4.49, -4.68] m/s\u00b2  \n   - Time: 2.38 s  \n   - Compute its final position (x_A, y_A, z_A). Assume it starts at (0, 0, 0).\n\n2. Object B (Circular Motion)  \n   - Radius: 2.52 meters  \n   - Speed: 4.34 m/s  \n   - Angular velocity: 1.72 rad/s  \n   - Time: 5.0 s  \n   - Rotating in the xy-plane  \n   - Compute its position (x_B, y_B, z_B), assuming it starts at (r_B, 0, 0).\n\n3. Object C (Projectile Motion)  \n   - Initial speed: [19.35, 18.24, 14.95] m/s  \n   - Launch angle: 53.97 degrees  \n   - Time: 3.25 s  \n   - Compute its position (x_C, y_C, z_C), assuming it starts from (0,0,0).\n",
    "parameters": {
      "object_A": {
        "v0": [
          3.4,
          5.48,
          13.26
        ],
        "a": [
          -1.38,
          4.49,
          -4.68
        ],
        "t": 2.38
      },
      "object_B": {
        "r": 2.52,
        "v": 4.34,
        "omega": 1.72,
        "t": 5.0,
        "rotation_plane": "xy-plane"
      },
      "object_C": {
        "v0": [
          19.35,
          18.24,
          14.95
        ],
        "angle": 53.97,
        "t": 3.25
      }
    },
    "answer_json": {
      "pos_A": {
        "x_A": 4.18,
        "y_A": 25.76,
        "z_A": 18.3
      },
      "pos_B": {
        "x_B": -1.71,
        "y_B": 1.85,
        "z_B": 0
      },
      "pos_C": {
        "x_C": 62.89,
        "y_C": 59.28,
        "z_C": -3.22
      }
    }
  },
  {
    "type": "3D Multi-Object Motion",
    "question": "\nThree objects move in different types of motion in 3D space:\n1. Object A (Linear Motion)  \n   - Initial velocity: [3.16, 14.98, 10.48] m/s  \n   - Acceleration: [-1.13, 0.62, -2.38] m/s\u00b2  \n   - Time: 3.34 s  \n   - Compute its final position (x_A, y_A, z_A). Assume it starts at (0, 0, 0).\n\n2. Object B (Circular Motion)  \n   - Radius: 2.51 meters  \n   - Speed: 9.97 m/s  \n   - Angular velocity: 3.97 rad/s  \n   - Time: 3.57 s  \n   - Rotating in the xz-plane  \n   - Compute its position (x_B, y_B, z_B), assuming it starts at (r_B, 0, 0).\n\n3. Object C (Projectile Motion)  \n   - Initial speed: [10.0, 8.39, 6.85] m/s  \n   - Launch angle: 25.36 degrees  \n   - Time: 7.42 s  \n   - Compute its position (x_C, y_C, z_C), assuming it starts from (0,0,0).\n",
    "parameters": {
      "object_A": {
        "v0": [
          3.16,
          14.98,
          10.48
        ],
        "a": [
          -1.13,
          0.62,
          -2.38
        ],
        "t": 3.34
      },
      "object_B": {
        "r": 2.51,
        "v": 9.97,
        "omega": 3.97,
        "t": 3.57,
        "rotation_plane": "xz-plane"
      },
      "object_C": {
        "v0": [
          10.0,
          8.39,
          6.85
        ],
        "angle": 25.36,
        "t": 7.42
      }
    },
    "answer_json": {
      "pos_A": {
        "x_A": 4.25,
        "y_A": 53.49,
        "z_A": 21.73
      },
      "pos_B": {
        "x_B": -0.09,
        "y_B": 0,
        "z_B": 2.51
      },
      "pos_C": {
        "x_C": 74.2,
        "y_C": 62.25,
        "z_C": -219.22
      }
    }
  },
  {
    "type": "3D Multi-Object Motion",
    "question": "\nThree objects move in different types of motion in 3D space:\n1. Object A (Linear Motion)  \n   - Initial velocity: [19.95, 16.4, 19.38] m/s  \n   - Acceleration: [4.87, 1.68, 2.1] m/s\u00b2  \n   - Time: 5.95 s  \n   - Compute its final position (x_A, y_A, z_A). Assume it starts at (0, 0, 0).\n\n2. Object B (Circular Motion)  \n   - Radius: 1.81 meters  \n   - Speed: 3.7 m/s  \n   - Angular velocity: 2.04 rad/s  \n   - Time: 2.42 s  \n   - Rotating in the yz-plane  \n   - Compute its position (x_B, y_B, z_B), assuming it starts at (r_B, 0, 0).\n\n3. Object C (Projectile Motion)  \n   - Initial speed: [28.18, 20.94, 24.84] m/s  \n   - Launch angle: 45.53 degrees  \n   - Time: 2.09 s  \n   - Compute its position (x_C, y_C, z_C), assuming it starts from (0,0,0).\n",
    "parameters": {
      "object_A": {
        "v0": [
          19.95,
          16.4,
          19.38
        ],
        "a": [
          4.87,
          1.68,
          2.1
        ],
        "t": 5.95
      },
      "object_B": {
        "r": 1.81,
        "v": 3.7,
        "omega": 2.04,
        "t": 2.42,
        "rotation_plane": "yz-plane"
      },
      "object_C": {
        "v0": [
          28.18,
          20.94,
          24.84
        ],
        "angle": 45.53,
        "t": 2.09
      }
    },
    "answer_json": {
      "pos_A": {
        "x_A": 204.91,
        "y_A": 127.32,
        "z_A": 152.48
      },
      "pos_B": {
        "x_B": 0,
        "y_B": 0.4,
        "z_B": -1.76
      },
      "pos_C": {
        "x_C": 58.9,
        "y_C": 43.76,
        "z_C": 30.49
      }
    }
  },
  {
    "type": "3D Multi-Object Motion",
    "question": "\nThree objects move in different types of motion in 3D space:\n1. Object A (Linear Motion)  \n   - Initial velocity: [4.82, 3.64, 16.02] m/s  \n   - Acceleration: [-4.74, 0.54, -1.31] m/s\u00b2  \n   - Time: 8.23 s  \n   - Compute its final position (x_A, y_A, z_A). Assume it starts at (0, 0, 0).\n\n2. Object B (Circular Motion)  \n   - Radius: 2.98 meters  \n   - Speed: 6.51 m/s  \n   - Angular velocity: 2.18 rad/s  \n   - Time: 1.78 s  \n   - Rotating in the xz-plane  \n   - Compute its position (x_B, y_B, z_B), assuming it starts at (r_B, 0, 0).\n\n3. Object C (Projectile Motion)  \n   - Initial speed: [14.95, 22.92, 16.97] m/s  \n   - Launch angle: 39.65 degrees  \n   - Time: 4.68 s  \n   - Compute its position (x_C, y_C, z_C), assuming it starts from (0,0,0).\n",
    "parameters": {
      "object_A": {
        "v0": [
          4.82,
          3.64,
          16.02
        ],
        "a": [
          -4.74,
          0.54,
          -1.31
        ],
        "t": 8.23
      },
      "object_B": {
        "r": 2.98,
        "v": 6.51,
        "omega": 2.18,
        "t": 1.78,
        "rotation_plane": "xz-plane"
      },
      "object_C": {
        "v0": [
          14.95,
          22.92,
          16.97
        ],
        "angle": 39.65,
        "t": 4.68
      }
    },
    "answer_json": {
      "pos_A": {
        "x_A": -120.86,
        "y_A": 48.25,
        "z_A": 87.48
      },
      "pos_B": {
        "x_B": -2.2,
        "y_B": 0,
        "z_B": -2.01
      },
      "pos_C": {
        "x_C": 69.97,
        "y_C": 107.27,
        "z_C": -28.01
      }
    }
  },
  {
    "type": "3D Collision",
    "question": "Two objects with masses 6.75 kg and 1.23 kg are located at positions [-2.526291723183343, 0.13068073218398746, -0.35964341507230757] and [0.31197762837392506, 1.7610889811281116, 1.773239314455598], the radius of both spheres is 0.5. They are moving with velocities [1.5395740410776761, 0.8843890080608635, 1.1569482935939053] m/s and [-2.088339331251607, -1.1996203497736906, -1.5693305818831256] m/s. Assuming an elastic collision, will they collide? If they collide, what are their final velocities?",
    "parameters": {
      "m1": 6.75,
      "m2": 1.23,
      "p1": [
        -2.526291723183343,
        0.13068073218398746,
        -0.35964341507230757
      ],
      "p2": [
        0.31197762837392506,
        1.7610889811281116,
        1.773239314455598
      ],
      "v1": [
        1.5395740410776761,
        0.8843890080608635,
        1.1569482935939053
      ],
      "v2": [
        -2.088339331251607,
        -1.1996203497736906,
        -1.5693305818831256
      ],
      "r": 0.5
    },
    "answer_json": {
      "will_collide": "true",
      "velocity_1": {
        "vel_1_x": 0.42,
        "vel_1_y": 0.24,
        "vel_1_z": 0.32
      },
      "velocity_2": {
        "vel_2_x": 4.05,
        "vel_2_y": 2.33,
        "vel_2_z": 3.04
      }
    }
  },
  {
    "type": "3D Collision",
    "question": "Two objects with masses 5.55 kg and 1.24 kg are located at positions [-0.5924115117888387, -1.1773069200955033, -1.8731115815957589] and [1.7914870140250243, 1.5368387649212367, -0.36336344207866744], the radius of both spheres is 0.5. They are moving with velocities [3.1803531729140975, 3.6209350975403414, 2.014151287825934] m/s and [-2.918096375969242, -3.322347239841499, -1.848061285682058] m/s. Assuming an elastic collision, will they collide? If they collide, what are their final velocities?",
    "parameters": {
      "m1": 5.55,
      "m2": 1.24,
      "p1": [
        -0.5924115117888387,
        -1.1773069200955033,
        -1.8731115815957589
      ],
      "p2": [
        1.7914870140250243,
        1.5368387649212367,
        -0.36336344207866744
      ],
      "v1": [
        3.1803531729140975,
        3.6209350975403414,
        2.014151287825934
      ],
      "v2": [
        -2.918096375969242,
        -3.322347239841499,
        -1.848061285682058
      ],
      "r": 0.5
    },
    "answer_json": {
      "will_collide": "true",
      "velocity_1": {
        "vel_1_x": 0.95,
        "vel_1_y": 1.08,
        "vel_1_z": 0.6
      },
      "velocity_2": {
        "vel_2_x": 7.05,
        "vel_2_y": 8.03,
        "vel_2_z": 4.47
      }
    }
  },
  {
    "type": "3D Collision",
    "question": "Two objects with masses 4.06 kg and 2.4 kg are located at positions [-3.317027274436866, -4.53627078309926, -4.51641811583268] and [4.237471831737299, 3.0186301568344556, 4.035641366371901], the radius of both spheres is 0.5. They are moving with velocities [3.8559508414160155, 3.249200048643219, 4.619106402779957] m/s and [4.496049308857261, 3.788576212158514, 5.3858907968158825] m/s. Assuming an elastic collision, will they collide? If they collide, what are their final velocities?",
    "parameters": {
      "m1": 4.06,
      "m2": 2.4,
      "p1": [
        -3.317027274436866,
        -4.53627078309926,
        -4.51641811583268
      ],
      "p2": [
        4.237471831737299,
        3.0186301568344556,
        4.035641366371901
      ],
      "v1": [
        3.8559508414160155,
        3.249200048643219,
        4.619106402779957
      ],
      "v2": [
        4.496049308857261,
        3.788576212158514,
        5.3858907968158825
      ],
      "r": 0.5
    },
    "answer_json": {
      "will_collide": "false",
      "velocity_1": {
        "vel_1_x": "",
        "vel_1_y": "",
        "vel_1_z": ""
      },
      "velocity_2": {
        "vel_2_x": "",
        "vel_2_y": "",
        "vel_2_z": ""
      }
    }
  },
  {
    "type": "3D Collision",
    "question": "Two objects with masses 8.46 kg and 6.57 kg are located at positions [-2.11323927371619, -1.4771408189253825, -4.770878081721689] and [1.1394913782577343, 1.4469398180105357, 0.3989598846181375], the radius of both spheres is 0.5. They are moving with velocities [2.8630530747973464, 2.3481446377887596, 3.0395843588564198] m/s and [2.2676188601236023, 1.8597968419865183, 2.4074366206317714] m/s. Assuming an elastic collision, will they collide? If they collide, what are their final velocities?",
    "parameters": {
      "m1": 8.46,
      "m2": 6.57,
      "p1": [
        -2.11323927371619,
        -1.4771408189253825,
        -4.770878081721689
      ],
      "p2": [
        1.1394913782577343,
        1.4469398180105357,
        0.3989598846181375
      ],
      "v1": [
        2.8630530747973464,
        2.3481446377887596,
        3.0395843588564198
      ],
      "v2": [
        2.2676188601236023,
        1.8597968419865183,
        2.4074366206317714
      ],
      "r": 0.5
    },
    "answer_json": {
      "will_collide": "false",
      "velocity_1": {
        "vel_1_x": "",
        "vel_1_y": "",
        "vel_1_z": ""
      },
      "velocity_2": {
        "vel_2_x": "",
        "vel_2_y": "",
        "vel_2_z": ""
      }
    }
  },
  {
    "type": "3D Collision",
    "question": "Two objects with masses 4.33 kg and 2.89 kg are located at positions [0.8682643647014032, -0.7047035574763876, -0.43602784765349356] and [2.6249723369985487, 1.888986639449136, 1.309075892989399], the radius of both spheres is 0.5. They are moving with velocities [1.7233595908361161, 2.5444530035827393, 1.7119756475564085] m/s and [-2.9188338944877543, -4.309510162174117, -2.8995530434834578] m/s. Assuming an elastic collision, will they collide? If they collide, what are their final velocities?",
    "parameters": {
      "m1": 4.33,
      "m2": 2.89,
      "p1": [
        0.8682643647014032,
        -0.7047035574763876,
        -0.43602784765349356
      ],
      "p2": [
        2.6249723369985487,
        1.888986639449136,
        1.309075892989399
      ],
      "v1": [
        1.7233595908361161,
        2.5444530035827393,
        1.7119756475564085
      ],
      "v2": [
        -2.9188338944877543,
        -4.309510162174117,
        -2.8995530434834578
      ],
      "r": 0.5
    },
    "answer_json": {
      "will_collide": "true",
      "velocity_1": {
        "vel_1_x": -1.99,
        "vel_1_y": -2.94,
        "vel_1_z": -1.98
      },
      "velocity_2": {
        "vel_2_x": 2.65,
        "vel_2_y": 3.91,
        "vel_2_z": 2.63
      }
    }
  },
  {
    "type": "3D Collision",
    "question": "Two objects with masses 6.76 kg and 6.01 kg are located at positions [-0.7857403990509519, -1.120000442268776, -3.854759640179478] and [0.1605012195201888, 1.5772652402954095, 1.3387043798785137], the radius of both spheres is 0.5. They are moving with velocities [2.0931574106841158, 4.247974741941586, 4.05207259663949] m/s and [2.819982625315994, 5.723035880584463, 5.4591089330963225] m/s. Assuming an elastic collision, will they collide? If they collide, what are their final velocities?",
    "parameters": {
      "m1": 6.76,
      "m2": 6.01,
      "p1": [
        -0.7857403990509519,
        -1.120000442268776,
        -3.854759640179478
      ],
      "p2": [
        0.1605012195201888,
        1.5772652402954095,
        1.3387043798785137
      ],
      "v1": [
        2.0931574106841158,
        4.247974741941586,
        4.05207259663949
      ],
      "v2": [
        2.819982625315994,
        5.723035880584463,
        5.4591089330963225
      ],
      "r": 0.5
    },
    "answer_json": {
      "will_collide": "false",
      "velocity_1": {
        "vel_1_x": "",
        "vel_1_y": "",
        "vel_1_z": ""
      },
      "velocity_2": {
        "vel_2_x": "",
        "vel_2_y": "",
        "vel_2_z": ""
      }
    }
  },
  {
    "type": "3D Collision",
    "question": "Two objects with masses 4.56 kg and 9.23 kg are located at positions [-1.8875355403999916, -2.2019294618917216, -1.1778946260492544] and [0.006576872384411292, 0.17494952344358916, 1.6688396993544607], the radius of both spheres is 0.5. They are moving with velocities [1.6363658173004045, 2.0534385906614547, 2.459357063279325] m/s and [-1.3087294205775584, -1.6422950592927295, -1.9669397333958112] m/s. Assuming an elastic collision, will they collide? If they collide, what are their final velocities?",
    "parameters": {
      "m1": 4.56,
      "m2": 9.23,
      "p1": [
        -1.8875355403999916,
        -2.2019294618917216,
        -1.1778946260492544
      ],
      "p2": [
        0.006576872384411292,
        0.17494952344358916,
        1.6688396993544607
      ],
      "v1": [
        1.6363658173004045,
        2.0534385906614547,
        2.459357063279325
      ],
      "v2": [
        -1.3087294205775584,
        -1.6422950592927295,
        -1.9669397333958112
      ],
      "r": 0.5
    },
    "answer_json": {
      "will_collide": "true",
      "velocity_1": {
        "vel_1_x": -2.31,
        "vel_1_y": -2.89,
        "vel_1_z": -3.47
      },
      "velocity_2": {
        "vel_2_x": 0.64,
        "vel_2_y": 0.8,
        "vel_2_z": 0.96
      }
    }
  },
  {
    "type": "3D Collision",
    "question": "Two objects with masses 9.98 kg and 5.59 kg are located at positions [-3.1555940215732847, -2.6280234536971263, -0.2878616128016077] and [-0.4674749750288387, -0.4947835034976005, 1.307429946426328], the radius of both spheres is 0.5. They are moving with velocities [2.5049151281437183, 1.9878528185291786, 1.4865673325171185] m/s and [-4.2508791904416805, -3.3734165621046563, -2.5227274441311347] m/s. Assuming an elastic collision, will they collide? If they collide, what are their final velocities?",
    "parameters": {
      "m1": 9.98,
      "m2": 5.59,
      "p1": [
        -3.1555940215732847,
        -2.6280234536971263,
        -0.2878616128016077
      ],
      "p2": [
        -0.4674749750288387,
        -0.4947835034976005,
        1.307429946426328
      ],
      "v1": [
        2.5049151281437183,
        1.9878528185291786,
        1.4865673325171185
      ],
      "v2": [
        -4.2508791904416805,
        -3.3734165621046563,
        -2.5227274441311347
      ],
      "r": 0.5
    },
    "answer_json": {
      "will_collide": "true",
      "velocity_1": {
        "vel_1_x": -2.35,
        "vel_1_y": -1.86,
        "vel_1_z": -1.39
      },
      "velocity_2": {
        "vel_2_x": 4.41,
        "vel_2_y": 3.5,
        "vel_2_z": 2.62
      }
    }
  },
  {
    "type": "3D Collision",
    "question": "Two objects with masses 5.76 kg and 9.74 kg are located at positions [-4.942594890285902, -1.396390903199027, -1.591448154867126] and [2.684851652043976, 1.334125949762714, 3.20480899289904], the radius of both spheres is 0.5. They are moving with velocities [2.9730289582494036, 4.544312455082492, 4.636477997312117] m/s and [2.8299936555076255, 4.325681181423896, 4.4134125501488874] m/s. Assuming an elastic collision, will they collide? If they collide, what are their final velocities?",
    "parameters": {
      "m1": 5.76,
      "m2": 9.74,
      "p1": [
        -4.942594890285902,
        -1.396390903199027,
        -1.591448154867126
      ],
      "p2": [
        2.684851652043976,
        1.334125949762714,
        3.20480899289904
      ],
      "v1": [
        2.9730289582494036,
        4.544312455082492,
        4.636477997312117
      ],
      "v2": [
        2.8299936555076255,
        4.325681181423896,
        4.4134125501488874
      ],
      "r": 0.5
    },
    "answer_json": {
      "will_collide": "false",
      "velocity_1": {
        "vel_1_x": "",
        "vel_1_y": "",
        "vel_1_z": ""
      },
      "velocity_2": {
        "vel_2_x": "",
        "vel_2_y": "",
        "vel_2_z": ""
      }
    }
  },
  {
    "type": "3D Collision",
    "question": "Two objects with masses 3.37 kg and 5.51 kg are located at positions [0.4212992362297783, 0.2753466207684383, -1.6708502856176946] and [2.8797234785287857, 2.688801937925697, 0.05840861720675772], the radius of both spheres is 0.5. They are moving with velocities [3.220755991142356, 3.1618426707424243, 2.265484075400976] m/s and [-2.6515307735397196, -2.6030295885876678, -1.865090295387223] m/s. Assuming an elastic collision, will they collide? If they collide, what are their final velocities?",
    "parameters": {
      "m1": 3.37,
      "m2": 5.51,
      "p1": [
        0.4212992362297783,
        0.2753466207684383,
        -1.6708502856176946
      ],
      "p2": [
        2.8797234785287857,
        2.688801937925697,
        0.05840861720675772
      ],
      "v1": [
        3.220755991142356,
        3.1618426707424243,
        2.265484075400976
      ],
      "v2": [
        -2.6515307735397196,
        -2.6030295885876678,
        -1.865090295387223
      ],
      "r": 0.5
    },
    "answer_json": {
      "will_collide": "true",
      "velocity_1": {
        "vel_1_x": -4.07,
        "vel_1_y": -3.99,
        "vel_1_z": -2.86
      },
      "velocity_2": {
        "vel_2_x": 1.81,
        "vel_2_y": 1.77,
        "vel_2_z": 1.27
      }
    }
  },
  {
    "type": "3D Collision",
    "question": "Two objects with masses 8.01 kg and 5.77 kg are located at positions [-2.1124171803486957, -3.2958421774775553, 0.7357588710064723] and [0.7056656363860805, -0.5483438834357863, 2.6970300591104643], the radius of both spheres is 0.5. They are moving with velocities [1.430197513568429, 1.3943753552370708, 0.9953593840474139] m/s and [-3.532419795362607, -3.4439432737620472, -2.45842071346937] m/s. Assuming an elastic collision, will they collide? If they collide, what are their final velocities?",
    "parameters": {
      "m1": 8.01,
      "m2": 5.77,
      "p1": [
        -2.1124171803486957,
        -3.2958421774775553,
        0.7357588710064723
      ],
      "p2": [
        0.7056656363860805,
        -0.5483438834357863,
        2.6970300591104643
      ],
      "v1": [
        1.430197513568429,
        1.3943753552370708,
        0.9953593840474139
      ],
      "v2": [
        -3.532419795362607,
        -3.4439432737620472,
        -2.45842071346937
      ],
      "r": 0.5
    },
    "answer_json": {
      "will_collide": "true",
      "velocity_1": {
        "vel_1_x": -2.73,
        "vel_1_y": -2.66,
        "vel_1_z": -1.9
      },
      "velocity_2": {
        "vel_2_x": 2.24,
        "vel_2_y": 2.18,
        "vel_2_z": 1.56
      }
    }
  },
  {
    "type": "3D Collision",
    "question": "Two objects with masses 9.52 kg and 1.77 kg are located at positions [-2.5694435245012874, -0.06405312254512219, -0.09901497789325697] and [-0.8768563277516435, 2.1488704446029745, 2.225690412349159], the radius of both spheres is 0.5. They are moving with velocities [1.4274977607269421, 1.8663401465106522, 1.9606149362901937] m/s and [-2.5607844161956383, -3.348022598698119, -3.5171418920164004] m/s. Assuming an elastic collision, will they collide? If they collide, what are their final velocities?",
    "parameters": {
      "m1": 9.52,
      "m2": 1.77,
      "p1": [
        -2.5694435245012874,
        -0.06405312254512219,
        -0.09901497789325697
      ],
      "p2": [
        -0.8768563277516435,
        2.1488704446029745,
        2.225690412349159
      ],
      "v1": [
        1.4274977607269421,
        1.8663401465106522,
        1.9606149362901937
      ],
      "v2": [
        -2.5607844161956383,
        -3.348022598698119,
        -3.5171418920164004
      ],
      "r": 0.5
    },
    "answer_json": {
      "will_collide": "true",
      "velocity_1": {
        "vel_1_x": 0.18,
        "vel_1_y": 0.23,
        "vel_1_z": 0.24
      },
      "velocity_2": {
        "vel_2_x": 4.17,
        "vel_2_y": 5.45,
        "vel_2_z": 5.72
      }
    }
  },
  {
    "type": "3D Collision",
    "question": "Two objects with masses 4.81 kg and 2.91 kg are located at positions [-1.3503446545501192, -3.9942446830515204, -3.441418543495525] and [4.975746783304473, 3.2493902881972674, 2.1905004195725204], the radius of both spheres is 0.5. They are moving with velocities [3.067234782803743, 1.8718660497046846, 2.1844237937943487] m/s and [3.8310978989892503, 2.338034939620004, 2.72843195891833] m/s. Assuming an elastic collision, will they collide? If they collide, what are their final velocities?",
    "parameters": {
      "m1": 4.81,
      "m2": 2.91,
      "p1": [
        -1.3503446545501192,
        -3.9942446830515204,
        -3.441418543495525
      ],
      "p2": [
        4.975746783304473,
        3.2493902881972674,
        2.1905004195725204
      ],
      "v1": [
        3.067234782803743,
        1.8718660497046846,
        2.1844237937943487
      ],
      "v2": [
        3.8310978989892503,
        2.338034939620004,
        2.72843195891833
      ],
      "r": 0.5
    },
    "answer_json": {
      "will_collide": "false",
      "velocity_1": {
        "vel_1_x": "",
        "vel_1_y": "",
        "vel_1_z": ""
      },
      "velocity_2": {
        "vel_2_x": "",
        "vel_2_y": "",
        "vel_2_z": ""
      }
    }
  },
  {
    "type": "3D Collision",
    "question": "Two objects with masses 3.07 kg and 2.98 kg are located at positions [-0.8703147211099143, -1.8873758771718725, 0.6931765762477654] and [1.9191383792707055, -0.2810898523388924, 2.5501835278012583], the radius of both spheres is 0.5. They are moving with velocities [3.5098902055904744, 2.021144426184777, 2.336619500819593] m/s and [-2.144517048318376, -1.234904348906189, -1.4276572945100987] m/s. Assuming an elastic collision, will they collide? If they collide, what are their final velocities?",
    "parameters": {
      "m1": 3.07,
      "m2": 2.98,
      "p1": [
        -0.8703147211099143,
        -1.8873758771718725,
        0.6931765762477654
      ],
      "p2": [
        1.9191383792707055,
        -0.2810898523388924,
        2.5501835278012583
      ],
      "v1": [
        3.5098902055904744,
        2.021144426184777,
        2.336619500819593
      ],
      "v2": [
        -2.144517048318376,
        -1.234904348906189,
        -1.4276572945100987
      ],
      "r": 0.5
    },
    "answer_json": {
      "will_collide": "true",
      "velocity_1": {
        "vel_1_x": -2.06,
        "vel_1_y": -1.19,
        "vel_1_z": -1.37
      },
      "velocity_2": {
        "vel_2_x": 3.59,
        "vel_2_y": 2.07,
        "vel_2_z": 2.39
      }
    }
  },
  {
    "type": "3D Collision",
    "question": "Two objects with masses 2.19 kg and 9.42 kg are located at positions [-2.6366448684410293, -1.0769028785462331, -0.9625150111667828] and [0.9520495718093885, 0.4846540711441166, 2.1552559120318877], the radius of both spheres is 0.5. They are moving with velocities [3.7128725501785813, 3.8875297195152627, 4.941000007801689] m/s and [4.574019098252307, 4.789185446516602, 6.086992778425076] m/s. Assuming an elastic collision, will they collide? If they collide, what are their final velocities?",
    "parameters": {
      "m1": 2.19,
      "m2": 9.42,
      "p1": [
        -2.6366448684410293,
        -1.0769028785462331,
        -0.9625150111667828
      ],
      "p2": [
        0.9520495718093885,
        0.4846540711441166,
        2.1552559120318877
      ],
      "v1": [
        3.7128725501785813,
        3.8875297195152627,
        4.941000007801689
      ],
      "v2": [
        4.574019098252307,
        4.789185446516602,
        6.086992778425076
      ],
      "r": 0.5
    },
    "answer_json": {
      "will_collide": "false",
      "velocity_1": {
        "vel_1_x": "",
        "vel_1_y": "",
        "vel_1_z": ""
      },
      "velocity_2": {
        "vel_2_x": "",
        "vel_2_y": "",
        "vel_2_z": ""
      }
    }
  },
  {
    "type": "3D Collision",
    "question": "Two objects with masses 1.89 kg and 4.62 kg are located at positions [0.3602299845363153, -2.0717858941946607, -2.198073224736959] and [2.5331503062860135, 0.06103656555694581, -0.2802555077365486], the radius of both spheres is 0.5. They are moving with velocities [1.8111006077861762, 1.7776795653720698, 1.5984759303487435] m/s and [-3.4377901112624962, -3.374351046295397, -3.0341907693141312] m/s. Assuming an elastic collision, will they collide? If they collide, what are their final velocities?",
    "parameters": {
      "m1": 1.89,
      "m2": 4.62,
      "p1": [
        0.3602299845363153,
        -2.0717858941946607,
        -2.198073224736959
      ],
      "p2": [
        2.5331503062860135,
        0.06103656555694581,
        -0.2802555077365486
      ],
      "v1": [
        1.8111006077861762,
        1.7776795653720698,
        1.5984759303487435
      ],
      "v2": [
        -3.4377901112624962,
        -3.374351046295397,
        -3.0341907693141312
      ],
      "r": 0.5
    },
    "answer_json": {
      "will_collide": "true",
      "velocity_1": {
        "vel_1_x": -5.64,
        "vel_1_y": -5.53,
        "vel_1_z": -4.98
      },
      "velocity_2": {
        "vel_2_x": -0.39,
        "vel_2_y": -0.38,
        "vel_2_z": -0.34
      }
    }
  },
  {
    "type": "3D Collision",
    "question": "Two objects with masses 4.99 kg and 8.75 kg are located at positions [-4.747058352375594, -0.0035876579363671723, -0.8198620746002403] and [4.8449812864237565, 4.631834915040638, 4.243478672071527], the radius of both spheres is 0.5. They are moving with velocities [2.1342750293844612, 3.1571276668000205, 2.286218875430028] m/s and [1.44983047663633, 2.1446626357609317, 1.553047173501183] m/s. Assuming an elastic collision, will they collide? If they collide, what are their final velocities?",
    "parameters": {
      "m1": 4.99,
      "m2": 8.75,
      "p1": [
        -4.747058352375594,
        -0.0035876579363671723,
        -0.8198620746002403
      ],
      "p2": [
        4.8449812864237565,
        4.631834915040638,
        4.243478672071527
      ],
      "v1": [
        2.1342750293844612,
        3.1571276668000205,
        2.286218875430028
      ],
      "v2": [
        1.44983047663633,
        2.1446626357609317,
        1.553047173501183
      ],
      "r": 0.5
    },
    "answer_json": {
      "will_collide": "false",
      "velocity_1": {
        "vel_1_x": "",
        "vel_1_y": "",
        "vel_1_z": ""
      },
      "velocity_2": {
        "vel_2_x": "",
        "vel_2_y": "",
        "vel_2_z": ""
      }
    }
  },
  {
    "type": "3D Collision",
    "question": "Two objects with masses 4.41 kg and 9.87 kg are located at positions [-0.33170582285047745, -1.6765335477629622, -1.4747962985935619] and [2.6042706384390324, 1.3166004864761085, 0.8588561865148652], the radius of both spheres is 0.5. They are moving with velocities [2.9820025094021196, 3.040056117192989, 2.3702361576868296] m/s and [-1.6025874213969142, -1.6337865841471195, -1.2738120239914397] m/s. Assuming an elastic collision, will they collide? If they collide, what are their final velocities?",
    "parameters": {
      "m1": 4.41,
      "m2": 9.87,
      "p1": [
        -0.33170582285047745,
        -1.6765335477629622,
        -1.4747962985935619
      ],
      "p2": [
        2.6042706384390324,
        1.3166004864761085,
        0.8588561865148652
      ],
      "v1": [
        2.9820025094021196,
        3.040056117192989,
        2.3702361576868296
      ],
      "v2": [
        -1.6025874213969142,
        -1.6337865841471195,
        -1.2738120239914397
      ],
      "r": 0.5
    },
    "answer_json": {
      "will_collide": "true",
      "velocity_1": {
        "vel_1_x": -3.36,
        "vel_1_y": -3.42,
        "vel_1_z": -2.67
      },
      "velocity_2": {
        "vel_2_x": 1.23,
        "vel_2_y": 1.25,
        "vel_2_z": 0.98
      }
    }
  },
  {
    "type": "3D Collision",
    "question": "Two objects with masses 3.67 kg and 9.72 kg are located at positions [-2.289023993128629, -1.2601221981046793, -4.7141736354625845] and [2.920887972294856, 2.5142519145975677, 4.263599460241426], the radius of both spheres is 0.5. They are moving with velocities [1.6813676889293812, 3.7359053546562158, 1.4836205016595805] m/s and [2.488452115638574, 5.529201997178502, 2.195782992898116] m/s. Assuming an elastic collision, will they collide? If they collide, what are their final velocities?",
    "parameters": {
      "m1": 3.67,
      "m2": 9.72,
      "p1": [
        -2.289023993128629,
        -1.2601221981046793,
        -4.7141736354625845
      ],
      "p2": [
        2.920887972294856,
        2.5142519145975677,
        4.263599460241426
      ],
      "v1": [
        1.6813676889293812,
        3.7359053546562158,
        1.4836205016595805
      ],
      "v2": [
        2.488452115638574,
        5.529201997178502,
        2.195782992898116
      ],
      "r": 0.5
    },
    "answer_json": {
      "will_collide": "false",
      "velocity_1": {
        "vel_1_x": "",
        "vel_1_y": "",
        "vel_1_z": ""
      },
      "velocity_2": {
        "vel_2_x": "",
        "vel_2_y": "",
        "vel_2_z": ""
      }
    }
  },
  {
    "type": "3D Collision",
    "question": "Two objects with masses 7.08 kg and 3.12 kg are located at positions [0.3466131237686727, -2.0795572953474046, -0.8096776028346537] and [2.7756853892668274, 0.04928007765640374, 1.5658308311021834], the radius of both spheres is 0.5. They are moving with velocities [2.4785813069528744, 2.172227065129245, 2.423925744200637] m/s and [-3.476824605453264, -3.0470868506459228, -3.4001566321780636] m/s. Assuming an elastic collision, will they collide? If they collide, what are their final velocities?",
    "parameters": {
      "m1": 7.08,
      "m2": 3.12,
      "p1": [
        0.3466131237686727,
        -2.0795572953474046,
        -0.8096776028346537
      ],
      "p2": [
        2.7756853892668274,
        0.04928007765640374,
        1.5658308311021834
      ],
      "v1": [
        2.4785813069528744,
        2.172227065129245,
        2.423925744200637
      ],
      "v2": [
        -3.476824605453264,
        -3.0470868506459228,
        -3.4001566321780636
      ],
      "r": 0.5
    },
    "answer_json": {
      "will_collide": "true",
      "velocity_1": {
        "vel_1_x": -1.16,
        "vel_1_y": -1.02,
        "vel_1_z": -1.14
      },
      "velocity_2": {
        "vel_2_x": 4.79,
        "vel_2_y": 4.2,
        "vel_2_z": 4.69
      }
    }
  },
  {
    "type": "3D Collision",
    "question": "Two objects with masses 2.84 kg and 7.45 kg are located at positions [-1.4039895100388726, -0.6271374774709164, -1.6044190166748191] and [0.5702762843689085, 2.0006592611506866, 0.0043956550649169035], the radius of both spheres is 0.5. They are moving with velocities [2.0679915116966177, 2.7525479929431897, 1.6851910692444305] m/s and [-3.233682437237925, -4.30411152661476, -2.635104028804814] m/s. Assuming an elastic collision, will they collide? If they collide, what are their final velocities?",
    "parameters": {
      "m1": 2.84,
      "m2": 7.45,
      "p1": [
        -1.4039895100388726,
        -0.6271374774709164,
        -1.6044190166748191
      ],
      "p2": [
        0.5702762843689085,
        2.0006592611506866,
        0.0043956550649169035
      ],
      "v1": [
        2.0679915116966177,
        2.7525479929431897,
        1.6851910692444305
      ],
      "v2": [
        -3.233682437237925,
        -4.30411152661476,
        -2.635104028804814
      ],
      "r": 0.5
    },
    "answer_json": {
      "will_collide": "true",
      "velocity_1": {
        "vel_1_x": -5.61,
        "vel_1_y": -7.47,
        "vel_1_z": -4.57
      },
      "velocity_2": {
        "vel_2_x": -0.31,
        "vel_2_y": -0.41,
        "vel_2_z": -0.25
      }
    }
  },
  {
    "type": "3D Collision",
    "question": "Two objects with masses 9.96 kg and 1.66 kg are located at positions [-2.3486510228618016, 0.7058921954206734, 0.6551465704778342] and [0.4702543408650124, 2.760182828528999, 2.3917668190136823], the radius of both spheres is 0.5. They are moving with velocities [3.85963382489802, 2.8127264276916186, 2.377773421733551] m/s and [-3.4828423442748404, -2.5381378518424897, -2.1456465390272355] m/s. Assuming an elastic collision, will they collide? If they collide, what are their final velocities?",
    "parameters": {
      "m1": 9.96,
      "m2": 1.66,
      "p1": [
        -2.3486510228618016,
        0.7058921954206734,
        0.6551465704778342
      ],
      "p2": [
        0.4702543408650124,
        2.760182828528999,
        2.3917668190136823
      ],
      "v1": [
        3.85963382489802,
        2.8127264276916186,
        2.377773421733551
      ],
      "v2": [
        -3.4828423442748404,
        -2.5381378518424897,
        -2.1456465390272355
      ],
      "r": 0.5
    },
    "answer_json": {
      "will_collide": "true",
      "velocity_1": {
        "vel_1_x": 1.76,
        "vel_1_y": 1.28,
        "vel_1_z": 1.09
      },
      "velocity_2": {
        "vel_2_x": 9.1,
        "vel_2_y": 6.63,
        "vel_2_z": 5.61
      }
    }
  },
  {
    "type": "3D Collision",
    "question": "Two objects with masses 6.51 kg and 9.89 kg are located at positions [-4.960884464239211, -0.9144793244226914, -3.5031062390001106] and [3.3169435748303866, 4.694650019635519, 0.6714555719668386], the radius of both spheres is 0.5. They are moving with velocities [1.7336900354259845, 1.710047445438645, 2.966978009057677] m/s and [2.3475461896752834, 2.315532351616165, 4.0175104993911495] m/s. Assuming an elastic collision, will they collide? If they collide, what are their final velocities?",
    "parameters": {
      "m1": 6.51,
      "m2": 9.89,
      "p1": [
        -4.960884464239211,
        -0.9144793244226914,
        -3.5031062390001106
      ],
      "p2": [
        3.3169435748303866,
        4.694650019635519,
        0.6714555719668386
      ],
      "v1": [
        1.7336900354259845,
        1.710047445438645,
        2.966978009057677
      ],
      "v2": [
        2.3475461896752834,
        2.315532351616165,
        4.0175104993911495
      ],
      "r": 0.5
    },
    "answer_json": {
      "will_collide": "false",
      "velocity_1": {
        "vel_1_x": "",
        "vel_1_y": "",
        "vel_1_z": ""
      },
      "velocity_2": {
        "vel_2_x": "",
        "vel_2_y": "",
        "vel_2_z": ""
      }
    }
  },
  {
    "type": "3D Collision",
    "question": "Two objects with masses 7.46 kg and 2.83 kg are located at positions [-3.680080491847953, -2.5573407392531173, -0.4733175446033835] and [4.230518566474277, 0.4614923385636671, 2.117878862818632], the radius of both spheres is 0.5. They are moving with velocities [3.0378605296789627, 1.969538461976367, 4.971779629431475] m/s and [2.1637268636391616, 1.4028107075735887, 3.5411675549936072] m/s. Assuming an elastic collision, will they collide? If they collide, what are their final velocities?",
    "parameters": {
      "m1": 7.46,
      "m2": 2.83,
      "p1": [
        -3.680080491847953,
        -2.5573407392531173,
        -0.4733175446033835
      ],
      "p2": [
        4.230518566474277,
        0.4614923385636671,
        2.117878862818632
      ],
      "v1": [
        3.0378605296789627,
        1.969538461976367,
        4.971779629431475
      ],
      "v2": [
        2.1637268636391616,
        1.4028107075735887,
        3.5411675549936072
      ],
      "r": 0.5
    },
    "answer_json": {
      "will_collide": "false",
      "velocity_1": {
        "vel_1_x": "",
        "vel_1_y": "",
        "vel_1_z": ""
      },
      "velocity_2": {
        "vel_2_x": "",
        "vel_2_y": "",
        "vel_2_z": ""
      }
    }
  },
  {
    "type": "3D Collision",
    "question": "Two objects with masses 7.67 kg and 5.97 kg are located at positions [-3.38926763023656, -2.8582172766090737, 0.15647930828605938] and [-0.5333747728967202, -0.53983184280079, 2.9083718381150843], the radius of both spheres is 0.5. They are moving with velocities [2.691855824711372, 2.1852218012603837, 2.593829077432538] m/s and [-1.6116024150217234, -1.3082828210708357, -1.552914226300386] m/s. Assuming an elastic collision, will they collide? If they collide, what are their final velocities?",
    "parameters": {
      "m1": 7.67,
      "m2": 5.97,
      "p1": [
        -3.38926763023656,
        -2.8582172766090737,
        0.15647930828605938
      ],
      "p2": [
        -0.5333747728967202,
        -0.53983184280079,
        2.9083718381150843
      ],
      "v1": [
        2.691855824711372,
        2.1852218012603837,
        2.593829077432538
      ],
      "v2": [
        -1.6116024150217234,
        -1.3082828210708357,
        -1.552914226300386
      ],
      "r": 0.5
    },
    "answer_json": {
      "will_collide": "true",
      "velocity_1": {
        "vel_1_x": -1.08,
        "vel_1_y": -0.87,
        "vel_1_z": -1.04
      },
      "velocity_2": {
        "vel_2_x": 3.23,
        "vel_2_y": 2.62,
        "vel_2_z": 3.11
      }
    }
  },
  {
    "type": "3D Collision",
    "question": "Two objects with masses 2.15 kg and 3.77 kg are located at positions [-1.0193884755597917, -0.696487089995486, -0.505376817367627] and [1.0503826916987702, 1.2476486961146223, 0.5139681083589281], the radius of both spheres is 0.5. They are moving with velocities [4.943789123288039, 5.345506805065785, 3.5004154582832223] m/s and [3.1537711996464073, 3.410037319334126, 2.2330057338263845] m/s. Assuming an elastic collision, will they collide? If they collide, what are their final velocities?",
    "parameters": {
      "m1": 2.15,
      "m2": 3.77,
      "p1": [
        -1.0193884755597917,
        -0.696487089995486,
        -0.505376817367627
      ],
      "p2": [
        1.0503826916987702,
        1.2476486961146223,
        0.5139681083589281
      ],
      "v1": [
        4.943789123288039,
        5.345506805065785,
        3.5004154582832223
      ],
      "v2": [
        3.1537711996464073,
        3.410037319334126,
        2.2330057338263845
      ],
      "r": 0.5
    },
    "answer_json": {
      "will_collide": "true",
      "velocity_1": {
        "vel_1_x": 2.41,
        "vel_1_y": 2.96,
        "vel_1_z": 2.25
      },
      "velocity_2": {
        "vel_2_x": 4.6,
        "vel_2_y": 4.77,
        "vel_2_z": 2.95
      }
    }
  },
  {
    "type": "3D Collision",
    "question": "Two objects with masses 9.37 kg and 8.78 kg are located at positions [-0.946141400298016, -0.5929189766833778, -4.876068190509057] and [3.6828223587754105, 1.6609273397321433, 4.6540794302416275], the radius of both spheres is 0.5. They are moving with velocities [3.646801588783216, 3.8199482698194402, 3.6706448376760754] m/s and [5.680510537773053, 5.950215791064576, 5.717650432361019] m/s. Assuming an elastic collision, will they collide? If they collide, what are their final velocities?",
    "parameters": {
      "m1": 9.37,
      "m2": 8.78,
      "p1": [
        -0.946141400298016,
        -0.5929189766833778,
        -4.876068190509057
      ],
      "p2": [
        3.6828223587754105,
        1.6609273397321433,
        4.6540794302416275
      ],
      "v1": [
        3.646801588783216,
        3.8199482698194402,
        3.6706448376760754
      ],
      "v2": [
        5.680510537773053,
        5.950215791064576,
        5.717650432361019
      ],
      "r": 0.5
    },
    "answer_json": {
      "will_collide": "false",
      "velocity_1": {
        "vel_1_x": "",
        "vel_1_y": "",
        "vel_1_z": ""
      },
      "velocity_2": {
        "vel_2_x": "",
        "vel_2_y": "",
        "vel_2_z": ""
      }
    }
  },
  {
    "type": "3D Collision",
    "question": "Two objects with masses 1.97 kg and 8.85 kg are located at positions [-3.887831412271678, -0.9170669720153555, -2.6984838266052895] and [1.5259543366930028, 3.976727495764309, 1.1379774370388518], the radius of both spheres is 0.5. They are moving with velocities [2.405221553715382, 3.183585891905071, 3.8042558652638623] m/s and [2.566305177674337, 3.3967984967316425, 4.059036270128106] m/s. Assuming an elastic collision, will they collide? If they collide, what are their final velocities?",
    "parameters": {
      "m1": 1.97,
      "m2": 8.85,
      "p1": [
        -3.887831412271678,
        -0.9170669720153555,
        -2.6984838266052895
      ],
      "p2": [
        1.5259543366930028,
        3.976727495764309,
        1.1379774370388518
      ],
      "v1": [
        2.405221553715382,
        3.183585891905071,
        3.8042558652638623
      ],
      "v2": [
        2.566305177674337,
        3.3967984967316425,
        4.059036270128106
      ],
      "r": 0.5
    },
    "answer_json": {
      "will_collide": "false",
      "velocity_1": {
        "vel_1_x": "",
        "vel_1_y": "",
        "vel_1_z": ""
      },
      "velocity_2": {
        "vel_2_x": "",
        "vel_2_y": "",
        "vel_2_z": ""
      }
    }
  },
  {
    "type": "3D Collision",
    "question": "Two objects with masses 3.51 kg and 6.77 kg are located at positions [1.0880924349044698, -1.3329375283517835, 0.8730226991695151] and [2.761105062681611, 1.6226633881815586, 2.640874423428211], the radius of both spheres is 0.5. They are moving with velocities [2.5562336359750644, 4.515929139996707, 2.701140425324133] m/s and [-1.337890565712858, -2.363562902388908, -1.4137323916122766] m/s. Assuming an elastic collision, will they collide? If they collide, what are their final velocities?",
    "parameters": {
      "m1": 3.51,
      "m2": 6.77,
      "p1": [
        1.0880924349044698,
        -1.3329375283517835,
        0.8730226991695151
      ],
      "p2": [
        2.761105062681611,
        1.6226633881815586,
        2.640874423428211
      ],
      "v1": [
        2.5562336359750644,
        4.515929139996707,
        2.701140425324133
      ],
      "v2": [
        -1.337890565712858,
        -2.363562902388908,
        -1.4137323916122766
      ],
      "r": 0.5
    },
    "answer_json": {
      "will_collide": "true",
      "velocity_1": {
        "vel_1_x": -2.57,
        "vel_1_y": -4.55,
        "vel_1_z": -2.72
      },
      "velocity_2": {
        "vel_2_x": 1.32,
        "vel_2_y": 2.33,
        "vel_2_z": 1.4
      }
    }
  },
  {
    "type": "3D Collision",
    "question": "Two objects with masses 1.98 kg and 4.91 kg are located at positions [-3.431613429025044, -1.9689557334692838, -2.4428847016526096] and [1.9259771667236358, 2.8829402174829974, 1.2736125306929096], the radius of both spheres is 0.5. They are moving with velocities [4.370189118079001, 1.8137925684798286, 5.153961715604771] m/s and [5.026479754813699, 2.086177824016674, 5.92795495128592] m/s. Assuming an elastic collision, will they collide? If they collide, what are their final velocities?",
    "parameters": {
      "m1": 1.98,
      "m2": 4.91,
      "p1": [
        -3.431613429025044,
        -1.9689557334692838,
        -2.4428847016526096
      ],
      "p2": [
        1.9259771667236358,
        2.8829402174829974,
        1.2736125306929096
      ],
      "v1": [
        4.370189118079001,
        1.8137925684798286,
        5.153961715604771
      ],
      "v2": [
        5.026479754813699,
        2.086177824016674,
        5.92795495128592
      ],
      "r": 0.5
    },
    "answer_json": {
      "will_collide": "false",
      "velocity_1": {
        "vel_1_x": "",
        "vel_1_y": "",
        "vel_1_z": ""
      },
      "velocity_2": {
        "vel_2_x": "",
        "vel_2_y": "",
        "vel_2_z": ""
      }
    }
  },
  {
    "type": "3D Collision",
    "question": "Two objects with masses 7.68 kg and 7.04 kg are located at positions [-2.705541489288529, -0.7290607199846622, -1.969015553090077] and [-0.7346680217009895, 2.042962199274841, 0.6106158414308482], the radius of both spheres is 0.5. They are moving with velocities [1.4779994636437241, 2.0787982867762054, 1.9345198361046447] m/s and [-1.4945508130778848, -2.1020776706284456, -1.9561835204173217] m/s. Assuming an elastic collision, will they collide? If they collide, what are their final velocities?",
    "parameters": {
      "m1": 7.68,
      "m2": 7.04,
      "p1": [
        -2.705541489288529,
        -0.7290607199846622,
        -1.969015553090077
      ],
      "p2": [
        -0.7346680217009895,
        2.042962199274841,
        0.6106158414308482
      ],
      "v1": [
        1.4779994636437241,
        2.0787982867762054,
        1.9345198361046447
      ],
      "v2": [
        -1.4945508130778848,
        -2.1020776706284456,
        -1.9561835204173217
      ],
      "r": 0.5
    },
    "answer_json": {
      "will_collide": "true",
      "velocity_1": {
        "vel_1_x": -1.37,
        "vel_1_y": -1.92,
        "vel_1_z": -1.79
      },
      "velocity_2": {
        "vel_2_x": 1.61,
        "vel_2_y": 2.26,
        "vel_2_z": 2.1
      }
    }
  },
  {
    "type": "3D Collision",
    "question": "Two objects with masses 4.68 kg and 4.62 kg are located at positions [-2.7488372627179367, -1.745318824207804, 0.5498184959571968] and [-0.23286034480883755, 1.1088894943910703, 2.9730908698842673], the radius of both spheres is 0.5. They are moving with velocities [1.786905464865888, 2.027125291200415, 1.72106453640576] m/s and [-2.337929990942549, -2.6522259329769824, -2.2517858247820914] m/s. Assuming an elastic collision, will they collide? If they collide, what are their final velocities?",
    "parameters": {
      "m1": 4.68,
      "m2": 4.62,
      "p1": [
        -2.7488372627179367,
        -1.745318824207804,
        0.5498184959571968
      ],
      "p2": [
        -0.23286034480883755,
        1.1088894943910703,
        2.9730908698842673
      ],
      "v1": [
        1.786905464865888,
        2.027125291200415,
        1.72106453640576
      ],
      "v2": [
        -2.337929990942549,
        -2.6522259329769824,
        -2.2517858247820914
      ],
      "r": 0.5
    },
    "answer_json": {
      "will_collide": "true",
      "velocity_1": {
        "vel_1_x": -2.31,
        "vel_1_y": -2.62,
        "vel_1_z": -2.23
      },
      "velocity_2": {
        "vel_2_x": 1.81,
        "vel_2_y": 2.06,
        "vel_2_z": 1.75
      }
    }
  },
  {
    "type": "3D Collision",
    "question": "Two objects with masses 1.0 kg and 3.58 kg are located at positions [-0.7616807246958777, -0.2914535559295388, -1.2449368784439379] and [1.4015589742613335, 1.5290985455541117, 0.9648424004200515], the radius of both spheres is 0.5. They are moving with velocities [3.3786959073139293, 2.8434629492514003, 3.4513846103896637] m/s and [-3.1251309410614194, -2.6300662404187336, -3.192364489530775] m/s. Assuming an elastic collision, will they collide? If they collide, what are their final velocities?",
    "parameters": {
      "m1": 1.0,
      "m2": 3.58,
      "p1": [
        -0.7616807246958777,
        -0.2914535559295388,
        -1.2449368784439379
      ],
      "p2": [
        1.4015589742613335,
        1.5290985455541117,
        0.9648424004200515
      ],
      "v1": [
        3.3786959073139293,
        2.8434629492514003,
        3.4513846103896637
      ],
      "v2": [
        -3.1251309410614194,
        -2.6300662404187336,
        -3.192364489530775
      ],
      "r": 0.5
    },
    "answer_json": {
      "will_collide": "true",
      "velocity_1": {
        "vel_1_x": -6.79,
        "vel_1_y": -5.71,
        "vel_1_z": -6.93
      },
      "velocity_2": {
        "vel_2_x": -0.29,
        "vel_2_y": -0.24,
        "vel_2_z": -0.29
      }
    }
  },
  {
    "type": "3D Collision",
    "question": "Two objects with masses 2.53 kg and 1.76 kg are located at positions [-1.8352957211710215, -3.3240587229509955, -0.907882677316679] and [3.755690687703661, 3.363978352785835, 1.1232033299864415], the radius of both spheres is 0.5. They are moving with velocities [2.394805986562088, 1.7963714600738139, 2.5513903783927647] m/s and [3.180491037287829, 2.3857228353626763, 3.3884474469473727] m/s. Assuming an elastic collision, will they collide? If they collide, what are their final velocities?",
    "parameters": {
      "m1": 2.53,
      "m2": 1.76,
      "p1": [
        -1.8352957211710215,
        -3.3240587229509955,
        -0.907882677316679
      ],
      "p2": [
        3.755690687703661,
        3.363978352785835,
        1.1232033299864415
      ],
      "v1": [
        2.394805986562088,
        1.7963714600738139,
        2.5513903783927647
      ],
      "v2": [
        3.180491037287829,
        2.3857228353626763,
        3.3884474469473727
      ],
      "r": 0.5
    },
    "answer_json": {
      "will_collide": "false",
      "velocity_1": {
        "vel_1_x": "",
        "vel_1_y": "",
        "vel_1_z": ""
      },
      "velocity_2": {
        "vel_2_x": "",
        "vel_2_y": "",
        "vel_2_z": ""
      }
    }
  },
  {
    "type": "3D Collision",
    "question": "Two objects with masses 1.66 kg and 4.73 kg are located at positions [-4.027823816301454, -1.5182287475474752, -2.5281141549478154] and [1.2199221978921941, 3.2802900555589205, 0.027724090690158798], the radius of both spheres is 0.5. They are moving with velocities [4.09745731121267, 4.159958286759219, 1.9868394344110811] m/s and [3.16201292541246, 3.2102450063149903, 1.533246473400768] m/s. Assuming an elastic collision, will they collide? If they collide, what are their final velocities?",
    "parameters": {
      "m1": 1.66,
      "m2": 4.73,
      "p1": [
        -4.027823816301454,
        -1.5182287475474752,
        -2.5281141549478154
      ],
      "p2": [
        1.2199221978921941,
        3.2802900555589205,
        0.027724090690158798
      ],
      "v1": [
        4.09745731121267,
        4.159958286759219,
        1.9868394344110811
      ],
      "v2": [
        3.16201292541246,
        3.2102450063149903,
        1.533246473400768
      ],
      "r": 0.5
    },
    "answer_json": {
      "will_collide": "true",
      "velocity_1": {
        "vel_1_x": 2.65,
        "vel_1_y": 2.84,
        "vel_1_z": 1.28
      },
      "velocity_2": {
        "vel_2_x": 3.67,
        "vel_2_y": 3.67,
        "vel_2_z": 1.78
      }
    }
  },
  {
    "type": "3D Collision",
    "question": "Two objects with masses 9.62 kg and 5.66 kg are located at positions [-2.354269332651812, 0.14266208996687402, -1.665072037919146] and [0.34785556993158506, 2.644028688846404, 1.3167666416805264], the radius of both spheres is 0.5. They are moving with velocities [2.4989286350830833, 2.3132670939098157, 2.7576083009804453] m/s and [-3.307807595501856, -3.0620492143045888, -3.6502193601454382] m/s. Assuming an elastic collision, will they collide? If they collide, what are their final velocities?",
    "parameters": {
      "m1": 9.62,
      "m2": 5.66,
      "p1": [
        -2.354269332651812,
        0.14266208996687402,
        -1.665072037919146
      ],
      "p2": [
        0.34785556993158506,
        2.644028688846404,
        1.3167666416805264
      ],
      "v1": [
        2.4989286350830833,
        2.3132670939098157,
        2.7576083009804453
      ],
      "v2": [
        -3.307807595501856,
        -3.0620492143045888,
        -3.6502193601454382
      ],
      "r": 0.5
    },
    "answer_json": {
      "will_collide": "true",
      "velocity_1": {
        "vel_1_x": -1.8,
        "vel_1_y": -1.67,
        "vel_1_z": -1.99
      },
      "velocity_2": {
        "vel_2_x": 4.0,
        "vel_2_y": 3.71,
        "vel_2_z": 4.42
      }
    }
  },
  {
    "type": "3D Collision",
    "question": "Two objects with masses 9.02 kg and 6.51 kg are located at positions [-2.47610917587799, -0.8471541513929246, -2.260640246945858] and [4.486040516166311, 3.7182772107979245, 2.373372184115267], the radius of both spheres is 0.5. They are moving with velocities [3.2625809273818382, 3.2112187243258767, 4.889032962693378] m/s and [2.7056823332762403, 2.663087280923567, 4.0545109557113825] m/s. Assuming an elastic collision, will they collide? If they collide, what are their final velocities?",
    "parameters": {
      "m1": 9.02,
      "m2": 6.51,
      "p1": [
        -2.47610917587799,
        -0.8471541513929246,
        -2.260640246945858
      ],
      "p2": [
        4.486040516166311,
        3.7182772107979245,
        2.373372184115267
      ],
      "v1": [
        3.2625809273818382,
        3.2112187243258767,
        4.889032962693378
      ],
      "v2": [
        2.7056823332762403,
        2.663087280923567,
        4.0545109557113825
      ],
      "r": 0.5
    },
    "answer_json": {
      "will_collide": "false",
      "velocity_1": {
        "vel_1_x": "",
        "vel_1_y": "",
        "vel_1_z": ""
      },
      "velocity_2": {
        "vel_2_x": "",
        "vel_2_y": "",
        "vel_2_z": ""
      }
    }
  },
  {
    "type": "3D Collision",
    "question": "Two objects with masses 6.64 kg and 3.47 kg are located at positions [-2.012201563436232, -1.7669201178083784, -1.6446078361210907] and [0.2980267703414523, -0.05935902553414474, 0.20228438347118927], the radius of both spheres is 0.5. They are moving with velocities [3.23056514710285, 2.387810447389682, 2.5826475884804925] m/s and [-3.264304405267545, -2.4127481748350132, -2.6096201489361492] m/s. Assuming an elastic collision, will they collide? If they collide, what are their final velocities?",
    "parameters": {
      "m1": 6.64,
      "m2": 3.47,
      "p1": [
        -2.012201563436232,
        -1.7669201178083784,
        -1.6446078361210907
      ],
      "p2": [
        0.2980267703414523,
        -0.05935902553414474,
        0.20228438347118927
      ],
      "v1": [
        3.23056514710285,
        2.387810447389682,
        2.5826475884804925
      ],
      "v2": [
        -3.264304405267545,
        -2.4127481748350132,
        -2.6096201489361492
      ],
      "r": 0.5
    },
    "answer_json": {
      "will_collide": "true",
      "velocity_1": {
        "vel_1_x": -1.23,
        "vel_1_y": -0.91,
        "vel_1_z": -0.98
      },
      "velocity_2": {
        "vel_2_x": 5.27,
        "vel_2_y": 3.89,
        "vel_2_z": 4.21
      }
    }
  },
  {
    "type": "3D Collision",
    "question": "Two objects with masses 1.58 kg and 4.67 kg are located at positions [-2.9211288294842204, -3.965828052427949, -2.899282411132872] and [4.524192391700884, 2.920397071021126, 3.4776149324898404], the radius of both spheres is 0.5. They are moving with velocities [2.737462280998503, 2.55357530644886, 1.7763344582523821] m/s and [4.145191370297098, 3.866741250525881, 2.689807387747226] m/s. Assuming an elastic collision, will they collide? If they collide, what are their final velocities?",
    "parameters": {
      "m1": 1.58,
      "m2": 4.67,
      "p1": [
        -2.9211288294842204,
        -3.965828052427949,
        -2.899282411132872
      ],
      "p2": [
        4.524192391700884,
        2.920397071021126,
        3.4776149324898404
      ],
      "v1": [
        2.737462280998503,
        2.55357530644886,
        1.7763344582523821
      ],
      "v2": [
        4.145191370297098,
        3.866741250525881,
        2.689807387747226
      ],
      "r": 0.5
    },
    "answer_json": {
      "will_collide": "false",
      "velocity_1": {
        "vel_1_x": "",
        "vel_1_y": "",
        "vel_1_z": ""
      },
      "velocity_2": {
        "vel_2_x": "",
        "vel_2_y": "",
        "vel_2_z": ""
      }
    }
  },
  {
    "type": "3D Collision",
    "question": "Two objects with masses 7.78 kg and 8.68 kg are located at positions [-2.904893586850891, -1.2624216551097462, -2.2693384513308046] and [3.016262944706207, 1.1026934716190944, 1.0971081731071808], the radius of both spheres is 0.5. They are moving with velocities [3.778368178642248, 2.1358983802296168, 3.375810870702405] m/s and [3.00679420617631, 1.6997302991694128, 2.686442423623872] m/s. Assuming an elastic collision, will they collide? If they collide, what are their final velocities?",
    "parameters": {
      "m1": 7.78,
      "m2": 8.68,
      "p1": [
        -2.904893586850891,
        -1.2624216551097462,
        -2.2693384513308046
      ],
      "p2": [
        3.016262944706207,
        1.1026934716190944,
        1.0971081731071808
      ],
      "v1": [
        3.778368178642248,
        2.1358983802296168,
        3.375810870702405
      ],
      "v2": [
        3.00679420617631,
        1.6997302991694128,
        2.686442423623872
      ],
      "r": 0.5
    },
    "answer_json": {
      "will_collide": "false",
      "velocity_1": {
        "vel_1_x": "",
        "vel_1_y": "",
        "vel_1_z": ""
      },
      "velocity_2": {
        "vel_2_x": "",
        "vel_2_y": "",
        "vel_2_z": ""
      }
    }
  },
  {
    "type": "3D Collision",
    "question": "Two objects with masses 2.49 kg and 5.21 kg are located at positions [-0.6842661433723218, -2.6624607271346834, -1.655981210648183] and [1.6623218311648393, -1.1218076576242149, 0.8081432613658208], the radius of both spheres is 0.5. They are moving with velocities [1.5974619230707334, 1.048814125833255, 1.6774760036540064] m/s and [-2.4166712050397834, -1.5866662364433517, -2.53771804925603] m/s. Assuming an elastic collision, will they collide? If they collide, what are their final velocities?",
    "parameters": {
      "m1": 2.49,
      "m2": 5.21,
      "p1": [
        -0.6842661433723218,
        -2.6624607271346834,
        -1.655981210648183
      ],
      "p2": [
        1.6623218311648393,
        -1.1218076576242149,
        0.8081432613658208
      ],
      "v1": [
        1.5974619230707334,
        1.048814125833255,
        1.6774760036540064
      ],
      "v2": [
        -2.4166712050397834,
        -1.5866662364433517,
        -2.53771804925603
      ],
      "r": 0.5
    },
    "answer_json": {
      "will_collide": "true",
      "velocity_1": {
        "vel_1_x": -3.83,
        "vel_1_y": -2.52,
        "vel_1_z": -4.03
      },
      "velocity_2": {
        "vel_2_x": 0.18,
        "vel_2_y": 0.12,
        "vel_2_z": 0.19
      }
    }
  },
  {
    "type": "3D Collision",
    "question": "Two objects with masses 1.45 kg and 4.41 kg are located at positions [-2.0066241481408547, -0.32902438229034603, -1.4226987865802403] and [0.6213905871913228, 2.418862045442563, 0.45570851109333055], the radius of both spheres is 0.5. They are moving with velocities [1.4423692554205003, 1.5081600751558335, 1.0309519573448676] m/s and [-1.2873938150908857, -1.3461157367477188, -0.9201812701940104] m/s. Assuming an elastic collision, will they collide? If they collide, what are their final velocities?",
    "parameters": {
      "m1": 1.45,
      "m2": 4.41,
      "p1": [
        -2.0066241481408547,
        -0.32902438229034603,
        -1.4226987865802403
      ],
      "p2": [
        0.6213905871913228,
        2.418862045442563,
        0.45570851109333055
      ],
      "v1": [
        1.4423692554205003,
        1.5081600751558335,
        1.0309519573448676
      ],
      "v2": [
        -1.2873938150908857,
        -1.3461157367477188,
        -0.9201812701940104
      ],
      "r": 0.5
    },
    "answer_json": {
      "will_collide": "true",
      "velocity_1": {
        "vel_1_x": -2.67,
        "vel_1_y": -2.79,
        "vel_1_z": -1.91
      },
      "velocity_2": {
        "vel_2_x": 0.06,
        "vel_2_y": 0.07,
        "vel_2_z": 0.05
      }
    }
  },
  {
    "type": "3D Collision",
    "question": "Two objects with masses 5.85 kg and 10.0 kg are located at positions [-0.7150985300451447, -0.33727660109341207, -0.2925018907963419] and [1.9162512760441446, 2.5871409979805713, 1.5065391327474573], the radius of both spheres is 0.5. They are moving with velocities [1.266164590558915, 1.4071842532627334, 0.8656705526960754] m/s and [-1.5873465510686302, -1.764138002112887, -1.0852610919858543] m/s. Assuming an elastic collision, will they collide? If they collide, what are their final velocities?",
    "parameters": {
      "m1": 5.85,
      "m2": 10.0,
      "p1": [
        -0.7150985300451447,
        -0.33727660109341207,
        -0.2925018907963419
      ],
      "p2": [
        1.9162512760441446,
        2.5871409979805713,
        1.5065391327474573
      ],
      "v1": [
        1.266164590558915,
        1.4071842532627334,
        0.8656705526960754
      ],
      "v2": [
        -1.5873465510686302,
        -1.764138002112887,
        -1.0852610919858543
      ],
      "r": 0.5
    },
    "answer_json": {
      "will_collide": "true",
      "velocity_1": {
        "vel_1_x": -2.33,
        "vel_1_y": -2.59,
        "vel_1_z": -1.6
      },
      "velocity_2": {
        "vel_2_x": 0.52,
        "vel_2_y": 0.58,
        "vel_2_z": 0.35
      }
    }
  },
  {
    "type": "3D Collision",
    "question": "Two objects with masses 2.14 kg and 7.03 kg are located at positions [-3.9101772954674816, -1.5026751437692458, -1.165509508218796] and [0.8389457168390113, 3.0362374694546586, 3.739628259776429], the radius of both spheres is 0.5. They are moving with velocities [1.428356447816468, 3.066446770716691, 3.404444998555699] m/s and [1.2764064524181362, 2.74023507936197, 3.0422767158030157] m/s. Assuming an elastic collision, will they collide? If they collide, what are their final velocities?",
    "parameters": {
      "m1": 2.14,
      "m2": 7.03,
      "p1": [
        -3.9101772954674816,
        -1.5026751437692458,
        -1.165509508218796
      ],
      "p2": [
        0.8389457168390113,
        3.0362374694546586,
        3.739628259776429
      ],
      "v1": [
        1.428356447816468,
        3.066446770716691,
        3.404444998555699
      ],
      "v2": [
        1.2764064524181362,
        2.74023507936197,
        3.0422767158030157
      ],
      "r": 0.5
    },
    "answer_json": {
      "will_collide": "false",
      "velocity_1": {
        "vel_1_x": "",
        "vel_1_y": "",
        "vel_1_z": ""
      },
      "velocity_2": {
        "vel_2_x": "",
        "vel_2_y": "",
        "vel_2_z": ""
      }
    }
  },
  {
    "type": "3D Collision",
    "question": "Two objects with masses 3.81 kg and 7.1 kg are located at positions [-3.016727792416863, -1.4249264747526578, -4.6200176107847] and [3.453072079664902, 3.136211978005222, 0.5095065272298827], the radius of both spheres is 0.5. They are moving with velocities [3.0070825388765035, 3.1909659859311423, 2.600454428531135] m/s and [6.300731163111405, 6.686021606675478, 5.44872448436976] m/s. Assuming an elastic collision, will they collide? If they collide, what are their final velocities?",
    "parameters": {
      "m1": 3.81,
      "m2": 7.1,
      "p1": [
        -3.016727792416863,
        -1.4249264747526578,
        -4.6200176107847
      ],
      "p2": [
        3.453072079664902,
        3.136211978005222,
        0.5095065272298827
      ],
      "v1": [
        3.0070825388765035,
        3.1909659859311423,
        2.600454428531135
      ],
      "v2": [
        6.300731163111405,
        6.686021606675478,
        5.44872448436976
      ],
      "r": 0.5
    },
    "answer_json": {
      "will_collide": "false",
      "velocity_1": {
        "vel_1_x": "",
        "vel_1_y": "",
        "vel_1_z": ""
      },
      "velocity_2": {
        "vel_2_x": "",
        "vel_2_y": "",
        "vel_2_z": ""
      }
    }
  },
  {
    "type": "3D Collision",
    "question": "Two objects with masses 8.04 kg and 4.12 kg are located at positions [-1.9048982153774583, -1.342905029859232, -1.4642294535378662] and [0.8694652251219077, 1.3905913472758553, 0.1940788524281316], the radius of both spheres is 0.5. They are moving with velocities [3.8295922640572937, 3.7731814177240497, 2.2890456842259534] m/s and [-2.9770433669538265, -2.9331907778735693, -1.7794553051607078] m/s. Assuming an elastic collision, will they collide? If they collide, what are their final velocities?",
    "parameters": {
      "m1": 8.04,
      "m2": 4.12,
      "p1": [
        -1.9048982153774583,
        -1.342905029859232,
        -1.4642294535378662
      ],
      "p2": [
        0.8694652251219077,
        1.3905913472758553,
        0.1940788524281316
      ],
      "v1": [
        3.8295922640572937,
        3.7731814177240497,
        2.2890456842259534
      ],
      "v2": [
        -2.9770433669538265,
        -2.9331907778735693,
        -1.7794553051607078
      ],
      "r": 0.5
    },
    "answer_json": {
      "will_collide": "true",
      "velocity_1": {
        "vel_1_x": -0.78,
        "vel_1_y": -0.77,
        "vel_1_z": -0.47
      },
      "velocity_2": {
        "vel_2_x": 6.02,
        "vel_2_y": 5.94,
        "vel_2_z": 3.6
      }
    }
  },
  {
    "type": "3D Collision",
    "question": "Two objects with masses 8.46 kg and 7.37 kg are located at positions [-0.42096819805149943, 0.7082652451161189, -2.032293542362794] and [2.2913306301586345, 3.0155246047885025, 0.19295271346200038], the radius of both spheres is 0.5. They are moving with velocities [2.4172881201635983, 2.0563038933113544, 1.9832111722709718] m/s and [-3.180660723119301, -2.705678720586308, -2.6095035294620796] m/s. Assuming an elastic collision, will they collide? If they collide, what are their final velocities?",
    "parameters": {
      "m1": 8.46,
      "m2": 7.37,
      "p1": [
        -0.42096819805149943,
        0.7082652451161189,
        -2.032293542362794
      ],
      "p2": [
        2.2913306301586345,
        3.0155246047885025,
        0.19295271346200038
      ],
      "v1": [
        2.4172881201635983,
        2.0563038933113544,
        1.9832111722709718
      ],
      "v2": [
        -3.180660723119301,
        -2.705678720586308,
        -2.6095035294620796
      ],
      "r": 0.5
    },
    "answer_json": {
      "will_collide": "true",
      "velocity_1": {
        "vel_1_x": -2.8,
        "vel_1_y": -2.38,
        "vel_1_z": -2.29
      },
      "velocity_2": {
        "vel_2_x": 2.8,
        "vel_2_y": 2.38,
        "vel_2_z": 2.3
      }
    }
  },
  {
    "type": "3D Collision",
    "question": "Two objects with masses 3.42 kg and 8.67 kg are located at positions [-4.566685509721628, -0.5918440799861404, -3.7806828040452203] and [2.3235423330161584, 3.051658521152603, 1.8949465206413203], the radius of both spheres is 0.5. They are moving with velocities [1.3938432884912384, 3.5615974123403955, 1.7975750193559763] m/s and [2.322841891367939, 5.935407328701231, 2.9956614149617455] m/s. Assuming an elastic collision, will they collide? If they collide, what are their final velocities?",
    "parameters": {
      "m1": 3.42,
      "m2": 8.67,
      "p1": [
        -4.566685509721628,
        -0.5918440799861404,
        -3.7806828040452203
      ],
      "p2": [
        2.3235423330161584,
        3.051658521152603,
        1.8949465206413203
      ],
      "v1": [
        1.3938432884912384,
        3.5615974123403955,
        1.7975750193559763
      ],
      "v2": [
        2.322841891367939,
        5.935407328701231,
        2.9956614149617455
      ],
      "r": 0.5
    },
    "answer_json": {
      "will_collide": "false",
      "velocity_1": {
        "vel_1_x": "",
        "vel_1_y": "",
        "vel_1_z": ""
      },
      "velocity_2": {
        "vel_2_x": "",
        "vel_2_y": "",
        "vel_2_z": ""
      }
    }
  },
  {
    "type": "3D Collision",
    "question": "Two objects with masses 4.06 kg and 8.92 kg are located at positions [-3.6186571212190755, -4.949244427806614, -0.259687111114844] and [0.4280648097901063, 3.6003733205209714, 2.442889234243937], the radius of both spheres is 0.5. They are moving with velocities [4.368931471877786, 4.134348075525574, 3.9791065728457373] m/s and [5.509249628770599, 5.213438513950412, 5.017678018160103] m/s. Assuming an elastic collision, will they collide? If they collide, what are their final velocities?",
    "parameters": {
      "m1": 4.06,
      "m2": 8.92,
      "p1": [
        -3.6186571212190755,
        -4.949244427806614,
        -0.259687111114844
      ],
      "p2": [
        0.4280648097901063,
        3.6003733205209714,
        2.442889234243937
      ],
      "v1": [
        4.368931471877786,
        4.134348075525574,
        3.9791065728457373
      ],
      "v2": [
        5.509249628770599,
        5.213438513950412,
        5.017678018160103
      ],
      "r": 0.5
    },
    "answer_json": {
      "will_collide": "false",
      "velocity_1": {
        "vel_1_x": "",
        "vel_1_y": "",
        "vel_1_z": ""
      },
      "velocity_2": {
        "vel_2_x": "",
        "vel_2_y": "",
        "vel_2_z": ""
      }
    }
  },
  {
    "type": "3D Collision",
    "question": "Two objects with masses 1.84 kg and 2.99 kg are located at positions [-3.468969849349558, -2.092222073338164, -2.6336975562023763] and [2.654609655728839, 2.1275190635260737, 3.729677183568048], the radius of both spheres is 0.5. They are moving with velocities [2.2881745532042777, 3.3129163475774575, 2.123266525308924] m/s and [1.9623021714149327, 2.8411044662058607, 1.8208796646530907] m/s. Assuming an elastic collision, will they collide? If they collide, what are their final velocities?",
    "parameters": {
      "m1": 1.84,
      "m2": 2.99,
      "p1": [
        -3.468969849349558,
        -2.092222073338164,
        -2.6336975562023763
      ],
      "p2": [
        2.654609655728839,
        2.1275190635260737,
        3.729677183568048
      ],
      "v1": [
        2.2881745532042777,
        3.3129163475774575,
        2.123266525308924
      ],
      "v2": [
        1.9623021714149327,
        2.8411044662058607,
        1.8208796646530907
      ],
      "r": 0.5
    },
    "answer_json": {
      "will_collide": "false",
      "velocity_1": {
        "vel_1_x": "",
        "vel_1_y": "",
        "vel_1_z": ""
      },
      "velocity_2": {
        "vel_2_x": "",
        "vel_2_y": "",
        "vel_2_z": ""
      }
    }
  }
]